username	date	retweets	favorites	text	geo	mentions	hashtags	tweetid	conversationid	replyto	permalink	imagelink
auntyinmaking	2018-06-21 05:51	0	0	She is not responsible for his actions. She is doing the best she can for her son and her own family and still has enough balls to walk away from the ideal happy wife he wants her to play in public. The most powerful man in USA. Who divorces or separates when husband is president				1009735600960729088	1009529451108020224	ArshiWithOneA	https://twitter.com/auntyinmaking/status/1009735600960729088	
kweenmari	2018-06-20 06:33	0	0	the blog is literally about a man who cant contain his lust to women and put the blame on wives who did nothing wrong so they keep wondering as to why their husband divorce them https://twitter.com/ImanAbdulRahim/status/1008371093957033984 …				1009383715628244993			https://twitter.com/kweenmari/status/1009383715628244993	https://pbs.twimg.com/media/Df50HN_UwAAJr02.jpg
WytchesThyme	2018-06-19 08:17	0	0	Don't be too judgmental of this man who kept his wife in chains for over two decades, lots more to this divorce than the information revealed in news. Husband will receive his own children and none other, they will be allowed to re-marry.				1009047526165696512			https://twitter.com/WytchesThyme/status/1009047526165696512	
NishasKhan	2018-06-16 22:32	0	0	@ iamsrk Ths is nt how a marriage works.When d wife who is disobedient D man kicks out She is nt supposed 2 expose herself for other men 2 see..Allah will punish her since she has tried 2 attract other men by showing her body parts Not allowed at all D husband has right 2 divorce		@ iamsrk		1008175462143676416			https://twitter.com/NishasKhan/status/1008175462143676416	
PhilosophyOfKJB	2018-06-16 20:07	1	2	Marriage [is] honourable in all, and the bed undefiled: but whoremongers and adulterers God will judge The wife is bound by the law as long as her husband is [in the lord] but if her husband be an adulterer she is at liberty to divorce him to marry a man of God				1008139010588504065			https://twitter.com/PhilosophyOfKJB/status/1008139010588504065	
SWHTown30	2018-06-16 13:04	1	0	According to God once you divorce, that man & woman must never get married again or it's sin. Luke 16:18 - Whosoever putteth away his wife, and marrieth another, committeth adultery: and whosoever marrieth her that is put away from [her] husband committeth adultery. https://twitter.com/PlayzWorld/status/1008030610814832640 …				1008032537308991489			https://twitter.com/SWHTown30/status/1008032537308991489	
ATweets_	2018-06-13 15:05	0	1	So according to you if a wife slaps her husband it gives him the right to beat her as much as he wants? If your wife isn't good and she hits you etc, be a man and divorce her, instead of resorting to domestic abuse. Domestic abuse is NEVER justified.				1006975825034571778	1006626558205988864	InsomniacAli IsaAik2411	https://twitter.com/ATweets_/status/1006975825034571778	
jarunasax	2018-06-13 11:44	0	0	Increase in divorces, increase in the reporting of domestic abuse, laws that protect the wife within the marriage and laws that allow women to inherit and own property without the permission of a man/husband.				1006925389112008704	1004833480897957889	findingyour100 JesterBlkwd theslumflower	https://twitter.com/jarunasax/status/1006925389112008704	
FaithJay01	2018-06-13 11:22	0	0	The husband to a reasonable extent, he should have been more open. The wife too should either have discussed or even divorce the man rather then making such decisions alone. https://twitter.com/Healthertainer/status/1006907902198763521 …				1006919796297031680			https://twitter.com/FaithJay01/status/1006919796297031680	
laurelgwyn	2018-06-12 15:44	0	1	Ex wife of man suspected of killing six in Phoenix metro to speak at 1 along with current husband/detective who linked murders to Dwight Lamon Jones and divorce lawyer Elizabeth Feldman. @ CoconinoSheriff More to come.		@ CoconinoSheriff		1006623394433937408			https://twitter.com/laurelgwyn/status/1006623394433937408	
ZachMcAlexander	2018-06-12 12:14	0	2	Mark 10:11-12, He answered, “Anyone who divorces his wife and marries another woman commits adultery against her. And if she divorces her husband and marries another man, she commits adultery.”				1006570331614695429			https://twitter.com/ZachMcAlexander/status/1006570331614695429	
Gatekee81725698	2018-06-12 02:05	0	0	To fear God is to hate evil. A woman must submit to the husband. The man has to love the wife. God hates divorce. Only on one ground because our bodies are the temples of God. Period.				1006417067543756800	1006407922321100800	ItsMainaKageni	https://twitter.com/Gatekee81725698/status/1006417067543756800	
BethShepherdUK	2018-06-11 10:06	3	7	http://accuratepsychicreadingsonline.com/psychic-email-reading … FREE PSYCHIC COLOUR READINGS # psychic # tarot # monday # weekend # man # lover # wife # husband # relationship # divorce # marriage # sex # red # blue # green # white # black # grey # pink # orange # purple # lilac # mauve # crimson # yellow # lime # brown # tuesdaypic.twitter.com/uFhXzCsgg3			# psychic # tarot # monday # weekend # man # lover # wife # husband # relationship # divorce # marriage # sex # red # blue # green # white # black # grey # pink # orange # purple # lilac # mauve # crimson # yellow # lime # brown # tuesdaypic	1006175876231417858			https://twitter.com/BethShepherdUK/status/1006175876231417858	https://pbs.twimg.com/media/DfanmwlXUAEHbvK.jpg
eRepublicUSA	2018-06-10 23:19	2	1	This is the equivalent of a stranger telling another man's wife that she should divorce her husband and follow the stranger because he can take better care of her. Israel can't even provide potable water to Palestinians next door. Another PR stunt that 'bombed' https://twitter.com/Farberyanki/status/1005880972376756224 …				1006013029547311105			https://twitter.com/eRepublicUSA/status/1006013029547311105	https://pbs.twimg.com/amplify_video_thumb/1005782704640741377/img/2o7XRsOLC2zfzDVB.jpg
natelawrence	2018-06-10 14:44	0	0	A divorce may be due to a man not being faithful or fulfilling his obligation to love his wife. A divorce may be due to a woman not being faithful or fulfilling her obligation to respect her husband. Or both may be true at the same time. In all cases, both parties are sinners.				1005883453701644288	1004795748540698624	1stamend310 Ennaaseret7	https://twitter.com/natelawrence/status/1005883453701644288	
JChar777	2018-06-09 20:41	0	0	husband is not your taxi driver, husband is not your body guard, husband is not your wage slave... and you think looking after him = maid? how sad.... no wonder divorce is so high. Man who works to provide for his wife asks wife for dinner or ironed clothes- " am I your maid?!"				1005610892736598016	1005265123227758592	BrittneyGers JustinPetersMin	https://twitter.com/JChar777/status/1005610892736598016	
ziggmasster	2018-06-08 15:40	1	7	“your husband was staring at me” she turns back to him & says “really Donnie!? Again!?” why that man said “you know what I like” his wife said “that’s it, I’ve had ENOUGH! I want a divorce!” & walked out.				1005172684991467521	1005170500589539331		https://twitter.com/ziggmasster/status/1005172684991467521	https://abs.twimg.com/emoji/v2/72x72/1f937-1f3fe-200d-2640-fe0f.png
AnweshKumar13	2018-06-08 14:25	0	1	In India, a man cannot file a divorce case against his wife. If he files, then his wife has the right to reject it & divorce will get cancelled. But if the wife files a divorce case on her husband, then he has no other choice. After it he suffers paying alimony & maintenance.				1005153913522216960	1005152104422432768	MGTOW_Finland	https://twitter.com/AnweshKumar13/status/1005153913522216960	
ZachMcAlexander	2018-06-08 11:34	0	1	Mark 10:11-12, He answered, “Anyone who divorces his wife and marries another woman commits adultery against her. And if she divorces her husband and marries another man, she commits adultery.”				1005110855275606017			https://twitter.com/ZachMcAlexander/status/1005110855275606017	
ElenaBjxrn	2018-06-08 07:33	0	1	Your wife can dive into every muff in a five-mile radius or your husband could trombone every man he meets called David, still not legal grounds for divorce in the UK.				1005050207686610944	1005048568187637760		https://twitter.com/ElenaBjxrn/status/1005050207686610944	https://pbs.twimg.com/profile_images/993136075467120641/qLhvo5sD_normal.jpg
DeliaCabe	2018-06-07 22:05	0	1	I so agree. Important distinction. I’m my husband’s 4th wife. His first ran off with another man, second died from brain tumor in her late 20s, 3rd divorce. We’ve been together 20 years.				1004907321951170561	1004876560195833856	aswinn	https://twitter.com/DeliaCabe/status/1004907321951170561	
bindrim3	2018-06-07 20:19	0	0	Giuliani on Stormy Daniels: Melania Trump 'believes her husband' @ CNNPolitics https://cnn.it/2JfZgqb . From the man who ‘respects’ women so much he announced his divorce publicly b4 discussing w/ his wife!		@ CNNPolitics		1004880616230400000			https://twitter.com/bindrim3/status/1004880616230400000	
sheikhimaan	2018-06-07 16:55	63	266	Wife [after being handed divorce papers]: Do you— do you seriously want to end our relationship...? Husband: lol what?? where did u get that from lmao you read too much into everything babe, chill, haha women think tooooo much man it's crazy, relax lol				1004829105001381888			https://twitter.com/sheikhimaan/status/1004829105001381888	
NOfNews_Texas	2018-06-07 06:17	0	0	Man charged with bigamy after wife discovers marriage to woman in another state Deputies say on April 30, a woman called to report her husband was still married to several other women and had not finalized a divorce... https://is.gd/sRLXWw				1004668702946557952			https://twitter.com/NOfNews_Texas/status/1004668702946557952	
Kthlongwane	2018-06-07 04:42	0	0	The lady must just divorce the husband, the man has no respect for the wife and their kids https://twitter.com/METROFMSA/status/1004641702932549633 …				1004644638035202048			https://twitter.com/Kthlongwane/status/1004644638035202048	https://abs.twimg.com/emoji/v2/72x72/1f914.png
imanusttsunami	2018-06-07 00:08	2	2	# AirIndiaSale Why can't the govt just sell off the airline instead of putting so many terms and conditions? Its like a man wanting to divorce his spend-thrift wife (or a wife wanting divorce her gambling addicted husband) but insists they live together forever. What the heck...			# AirIndiaSale	1004575843572596736	1004572948160700416	ani_digital ANI	https://twitter.com/imanusttsunami/status/1004575843572596736	
KashifRawish	2018-06-06 16:56	0	0	After divorce a man should keep the secret of her ex wife. Like that y not a woman can not keep secrets of his ex husband. Shame reham if u r not loyal to ur marriages then how can be loyal to Pakistan. How would I believe on u. U r not "Ameen and Sadiq "				1004467009541861377			https://twitter.com/KashifRawish/status/1004467009541861377	
NOfNews_Texas	2018-06-06 16:52	0	0	Man charged with bigamy after wife discovers marriage to woman in another state Deputies say on April 30, a woman called to report her husband was still married to several other women and had not finalized a divorce... https://is.gd/qXvb2Z				1004466116335300608			https://twitter.com/NOfNews_Texas/status/1004466116335300608	
For_Butlers	2018-06-06 09:47	0	1	I know both "the cheating wife" and "a guy cheating with the wife" and I got rid of them in a speed of light. The husband is in another country, fighting for us, risking his own life and YOU FU*C WITH ANOTHER MAN!? Do him a favor and divorce him, slut!!!				1004359028850425857	1004357605135962112		https://twitter.com/For_Butlers/status/1004359028850425857	https://pbs.twimg.com/profile_images/2397111014/Butler_Title_normal.jpg
NOfNews_Texas	2018-06-06 09:22	0	0	Man charged with bigamy after wife discovers marriage to woman in another state Deputies say on April 30, a woman called to report her husband was still married to several other women and had not finalized a divorce... https://is.gd/Pzjf80				1004352840788148224			https://twitter.com/NOfNews_Texas/status/1004352840788148224	
FaladeBoluwati3	2018-06-06 02:21	0	0	Zambian pastor Prophet T L Kelvin who has been feasting on another's man wife has been http://exposed.In the intimate chats he had with the lady,he even asked her to divorce her husband https://obakoko.blogspot.com/2018/06/zambian-pastor-prophet-t-l-kelvin-who.html?spref=tw …				1004246859551051776			https://twitter.com/FaladeBoluwati3/status/1004246859551051776	
Leksyddami	2018-06-06 00:03	0	0	A woman 'claims' she was married to an impotent man for 16years, she divorces him and marries a new Husband. Three years into her new marriage she's still not pregnant. Her new Husband is now phoning her Ex-husband everyday blaming him for failing to impregnate his wife.				1004212226838974464			https://twitter.com/Leksyddami/status/1004212226838974464	https://abs.twimg.com/emoji/v2/72x72/1f615.png
mckellogs	2018-06-04 16:17	0	1	Occasionally consensual, like the wife wanting to leave an abusive husband or join with a new lover (divorce laws in many states would bar these things completely), & sometimes coercively, like she was sold as chattel to a new man.				1003732547409457152	1003729072550268928	mckellogs knit1write2	https://twitter.com/mckellogs/status/1003732547409457152	
swayinthewoods	2018-06-04 07:23	0	0	2) if a man divorces a woman he has to give his wife Mehr. 3) if a woman divorces her husband then she has no right over Mehr.				1003598052924542976	998465993860108289	swayinthewoods Spectator_Suraj	https://twitter.com/swayinthewoods/status/1003598052924542976	
rev5n9	2018-06-03 21:00	0	5	God hates divorce…well and good. But he hates it no less than a husband’s abuse of his wife or a man’s abuse of a woman/girl/boy. I won’t counsel divorce, but neither will I shame those who need an escape from danger where there should be absolute safety. # SBCAM18 # SBC18			# SBCAM18 # SBC18	1003441231844823040			https://twitter.com/rev5n9/status/1003441231844823040	
RaceSexPolitics	2018-06-03 04:32	0	3	How quickly people forget that divorce is a thing lol. I’m happily married, but I won’t sit here and act better than a woman who thought her man or husband was the one and ended up being left. Your current status as a wife isn’t necessarily permanent. Just remember to be humble. https://twitter.com/pettymamii/status/1001135918324084738 …				1003192643394736130			https://twitter.com/RaceSexPolitics/status/1003192643394736130	
DonsWifeLeftHim	2018-07-23 14:27	1	0	Stormy Daniels’ Husband Files For Divorce, Seeks Restraining Order http://dlvr.it/QcWG9X				1021461717472038912			https://twitter.com/DonsWifeLeftHim/status/1021461717472038912	
KerriSheragy	2018-07-23 14:22	0	0	Chappelle: My wife just told me we are getting a divorce if I ever mention Idaho, lesbians or mushrooms ever again. Sorry, I am out of this game. You can keep the Gandalf job, Bob. Galadriel: My fairy husband, are you mad we are letting the hobbits stay? pic.twitter.com/HO4btKZLfo				1021460655189028864			https://twitter.com/KerriSheragy/status/1021460655189028864	
elisabethsneade	2018-07-23 14:13	0	0	Saying that someone is a common law wife or husband and/or someone being granted a quickie divorce are pretty high on my list of pet hates!				1021458310023852033	1021000954458632194	BarristerSecret	https://twitter.com/elisabethsneade/status/1021458310023852033	
Ken_Maggs	2018-07-23 12:59	0	0	The German wife of a millionaire banker raced to file a divorce petition in England after she discovered that her husband had taken his mistress to the office party. http://ow.ly/KS3f30l51sb pic.twitter.com/XxtweOvMLL				1021439612001095683			https://twitter.com/Ken_Maggs/status/1021439612001095683	https://pbs.twimg.com/media/Dizh6dyV4AA7tqb.jpg
bizeebi7	2018-07-23 11:48	0	0	Let shahbaz's haram members or thr ex husband's write a book on how CT forced dmg officers to divorce thr wives, but wait, they wudnt write coz CT has Punjab police aka gullu butt force ready to kill anyone in fake encounters				1021421892660547585	1021281344658321408	betterpakistan	https://twitter.com/bizeebi7/status/1021421892660547585	
WrkforceMillion	2018-07-23 11:16	0	0	You and your (very valuable) wife have different money archetypes. There is a free download on my site that covers the main archetypes. I talk about finances, and I wasn't wiped out financially in my divorce; neither was my husband.				1021413739365449728	1021411419185713152	HalfLifeTheory	https://twitter.com/WrkforceMillion/status/1021413739365449728	
LongLiveRome	2018-07-23 10:57	0	0	I liked a @ YouTube video http://youtu.be/cfWM1kdTuMk?a Husband Demands Divorce In Letter, His Wife Brilliant Reply Makes Him Regret Every		@ YouTube		1021409022665162752			https://twitter.com/LongLiveRome/status/1021409022665162752	
Bristol_Jane	2018-07-23 10:16	0	0	Also in 1930, a conservative MP claimed that if a husband should catch sight of his wife looking like 'a wet dog' after swimming, this would be a guaranteed route to divorce. Guaranteed! Therefore, women must not be allowed to swim. Ever.				1021398547416133633			https://twitter.com/Bristol_Jane/status/1021398547416133633	
shulmanlawfirm	2018-07-23 10:05	0	0	Wife has husband arrested – can he deduct his criminal defence fees in the divorce? http://bit.ly/2mDEJhw				1021395773651595267			https://twitter.com/shulmanlawfirm/status/1021395773651595267	
zohebahmedsyed	2018-07-23 09:25	0	0	No compassion towards the victims of mob lynchings.. Triple talaq is a form of divorce where husband leaves his wife by giving away her share of property.. It's better to make woman independent rather killing her to get rid of her... Woman too can leave husband by taking QULA				1021385806093606914	1021093252156542976	zohebahmedsyed sanjivbhatt	https://twitter.com/zohebahmedsyed/status/1021385806093606914	
Pujarai31256670	2018-07-23 09:16	0	1	Lol, in hindu law, it is crime to marry another woman if u r married. Woman can always file fir divorce even if husband disagrees. Husband has to pay alimony and maintenance of divorced wife unlike your religion.				1021383432834707456	1021304229468700673	AzrBegum ZeeNews	https://twitter.com/Pujarai31256670/status/1021383432834707456	
Culerly	2018-07-23 08:54	0	1	let her not divorce him. For the unbelieving husband is sanctified by the wife, and the unbelieving wife is sanctified by the husband; otherwise your children would be unclean, but now they are holy. [2/2]				1021378031619723264	1020487611289423873	Culerly Karan_naraK	https://twitter.com/Culerly/status/1021378031619723264	
Culerly	2018-07-23 08:53	0	1	This is what Corinthians says, "But to the rest I, not the Lord, say: If any brother has a wife who does not believe, and she is willing to live with him, let him not divorce her. And a woman who has a husband who does not believe, if he is willing to live with her, [1/2]				1021377855291252736	1020487611289423873	Culerly Karan_naraK	https://twitter.com/Culerly/status/1021377855291252736	
KenedyKaunda	2018-07-23 08:18	2	25	Before you divorce your wife/husband think about the children.				1021368973886095360			https://twitter.com/KenedyKaunda/status/1021368973886095360	
Memphis_Divorce	2018-07-23 08:01	0	0	Tennessee child custody case summary on maximum participation in divorce. Wafa Badawi Hindiyeh v. Waleed Fawzi Abed The husband and wife in this Rutherford County, Tennessee,... https://memphisdivorce.com/tennessee-child-custody/dad-entitled-to-more-than-80-days-parenting-time/ …				1021364581183238145			https://twitter.com/Memphis_Divorce/status/1021364581183238145	
akkudhanya	2018-07-23 07:30	0	0	Husband Can Seek Divorce Against Wife If Wife Had Filed False Case Against Him http://www.pathlegal.in/Husband-Can-Seek-Divorce-Against-Wife-If-Wife-Had-Filed-Fals-blog-1022815 …http://www.pathlegal.in/Husband-Can-Seek-Divorce-Against-Wife-If-Wife-Had-Filed-Fals-blog-1022815 …				1021356770185424896			https://twitter.com/akkudhanya/status/1021356770185424896	
ShoneeKapoor	2018-07-23 06:39	9	12	# In1Case of # Divorce Delhi HC held that if wife threatens to consume acid to hurt herself and unborn baby, it creates terror in the mind of husband and is fit case for grant of Divorce on grounds of cruelty https://www.shoneekapoor.com/geeta-pandey-vs-shekhar-pandey/ …			# In1Case # Divorce	1021344088791150592			https://twitter.com/ShoneeKapoor/status/1021344088791150592	
sibasisnanda	2018-07-23 06:25	0	0	If ur wife finds her husband in same situation....can she divorce u in single sitting ?				1021340505081200641	1021290365767176192	ANINewsUP	https://twitter.com/sibasisnanda/status/1021340505081200641	
groupiemet	2018-07-23 05:51	0	0	WTF AFRICA- HUSBAND SEH WIFE FIND A RICHER MAN - http://www.jamaicanmateyangroupie.com/wtf-africa/wtf-africa-husband-seh-wife-find-a-richer-man/ … A businesswoman, Halimat Yaya, has approached an Agege Customary Court in Lagos State, seeking divorce from her husband because of his temperament. According to the News Agency of Nigeria (NAN), Hal... pic.twitter.com/hW9YMERJlu				1021332033690357760			https://twitter.com/groupiemet/status/1021332033690357760	https://pbs.twimg.com/media/DiyAElXUwAEAYPV.jpg
PreuveneersLLP	2018-07-23 05:08	0	3	Wow! What a major shift in Divorce Maintenance payments and its not on every news channel?? So, the shift means that a wife (or husband) cannot expect an endless maintenance package after divorce https://www.lawgazette.co.uk/law/supreme-court-rules-in-mills-v-mills-the-end-of-a-meal-ticket-for-life/5066921.article?utm_source=dispatch&utm_medium=email&utm_campaign=%20GAZ141016 …https://www.lawgazette.co.uk/law/supreme-court-rules-in-mills-v-mills-the-end-of-a-meal-ticket-for-life/5066921.article?utm_source=dispatch&utm_medium=email&utm_campaign=%20GAZ141016 …				1021321142848585728			https://twitter.com/PreuveneersLLP/status/1021321142848585728	
PreuveneersLLP	2018-07-23 05:08	1	2	Wow! What a major shift in Divorce Maintenance payments and its not on every news channel?? So, the shift means that a wife (or husband) cannot expect an endless maintenance package after divorce https://www.lawgazette.co.uk/law/supreme-court-rules-in-mills-v-mills-the-end-of-a-meal-ticket-for-life/5066921.article?utm_source=dispatch&utm_medium=email&utm_campaign=%20GAZ141016 …				1021321121554141185			https://twitter.com/PreuveneersLLP/status/1021321121554141185	
Dhanesh003	2018-07-23 05:02	0	2	So he wants to say that,wife is being killed by husband for not giving Divorce.What a bullshit statement.				1021319677438439424	1021304229468700673	ZeeNews	https://twitter.com/Dhanesh003/status/1021319677438439424	
mansoorfarookh	2018-07-23 04:48	0	0	Movis who do nikkah halala intentionally will be burnt in hell they should be punished. Naturally if wife is divorced again by new husband(willing by husband) or he dies then only she can marry 1st husband if they agree. if 2nd marries to divorce then he will also burn in hell.				1021316207843127296	1021290365767176192	Karanveer937615 jaiswal4907	https://twitter.com/mansoorfarookh/status/1021316207843127296	
Nisha360	2018-07-23 04:21	0	0	If my future husband wanted another wife he would have to divorce me first. i have self-respect and i'm terrible at sharing. Public officials who want extra spouses must pay for it themselves				1021309273345847296	1021296467187814400	ThuliMadonsela3 JJTabane	https://twitter.com/Nisha360/status/1021309273345847296	
hardogamb	2018-07-23 01:45	0	0	This is a new kind of Sufism invented by Ms Manika& # IK:level-1 ex-husband to get arrange the meeting to develop affair;level-2 sitting in same room husband cannot see subjects to go in mysticism;level-3 husband divorces wife to set all the levels in Order for pupil to marry her https://twitter.com/ayeshaijazkhan/status/1021014921209933825 …			# IK	1021269944770748416			https://twitter.com/hardogamb/status/1021269944770748416	https://abs.twimg.com/emoji/v2/72x72/1f44c-1f3fc.png
samtheaustinP1	2018-07-23 01:27	0	0	Seen it both ways. 1. Everyone behaves like adults & remains friends. 2. The wife was cheated on & her husband was instantly shunned by the friends. Ironically most of whom he grew up with and she didn’t. It was like she got all his friends in the divorce				1021265523638751232	1021236205260861440	nicole_419 Frank_is_Fun	https://twitter.com/samtheaustinP1/status/1021265523638751232	
_LiveBig365	2018-07-23 01:20	0	0	I uploaded a new episode, "How to Find the Right One", on # spreaker # christian # communication # counseling # dating # divorce # evans # husband # intimacy # jimmy # karen # love # marriage # marriagetoday # mouth # relationship_help # say # sex # wife # word # wordshttps://www.spreaker.com/user/dominionpreneur/how-to-find-the-right-one_1?autoplay=1 …			# spreaker # christian # communication # counseling # dating # divorce # evans # husband # intimacy # jimmy # karen # love # marriage # marriagetoday # mouth # relationship_help # say # sex # wife # word # wordshttps	1021263874073546752			https://twitter.com/_LiveBig365/status/1021263874073546752	
soundirarajanr	2018-07-23 00:17	0	0	HUSBAND AND WIFE LIFE HUSBAND AND WIFE JOIN AND LIVE THE LIFE EGO IS THE FIRST THING THAT THEY HAVE BEEN SEPERATED EACH OTHER DAUGTHER OR SON NOT GOOD FAMILY TO ROAD RICH GIRL AND BOY MARRIAGE END WITH DIVORCE BECAUSE OF MONEY AND JOB EGO 90% OF COUPLE ENDED				1021247894098268161			https://twitter.com/soundirarajanr/status/1021247894098268161	
