username	date	retweets	favorites	text	geo	mentions	hashtags	tweetid	conversationid	replyto	permalink	imagelink
Evie_Calling	2018-07-23 00:11	0	0	men have the right to unilaterally divorce their wives, whereas a woman must apply for a court order to obtain a divorce; a woman can lose her right to maintenance if, for example, she refuses to have sexual relations with her husband without a lawful excuse; and women				1021246459327533056	1021246458220171264		https://twitter.com/Evie_Calling/status/1021246459327533056	https://pbs.twimg.com/profile_images/995688569883807745/zjNOGBJ3_normal.jpg
blair966	2018-07-23 00:02	0	0	“Everyone who divorces his wife and marries another is guilty of adultery, and the man who marries a woman divorced by her husband commits adultery.” https://txf.ro/m/jm33 # jesuspic.twitter.com/5jLAMoMIik			# jesuspic	1021244242612707328			https://twitter.com/blair966/status/1021244242612707328	https://pbs.twimg.com/media/DiwwOgNW0AAmSSe.jpg
onacloudmeg	2018-07-22 23:06	0	0	I added a video to a @ YouTube playlist http://youtu.be/cfWM1kdTuMk?a Husband Demands Divorce In Letter, His Wife Brilliant Reply Makes Him		@ YouTube		1021230122588954624			https://twitter.com/onacloudmeg/status/1021230122588954624	
nicolabeer1	2018-07-22 20:31	0	0	#93 What to do when your husband or wife threatens divorce and save your marriage: http://youtu.be/NUvy_sYVTCo?a via @ YouTube		@ YouTube		1021191151611719681			https://twitter.com/nicolabeer1/status/1021191151611719681	
nicolabeer1	2018-07-22 20:24	0	0	I uploaded a new episode, "#93 What to do when your husband or wife threatens divorce and save your marriage", on # spreaker # abuse # addiction_obsessive_compulsiv # alcoholism # bi_polar # compulsive_lying # couple_therapy # emotional_abuse # family_counsellinghttps://www.spreaker.com/user/nicolabeer/93-what-to-do-when-your-husband-or-wife-?autoplay=1 …			# spreaker # abuse # addiction_obsessive_compulsiv # alcoholism # bi_polar # compulsive_lying # couple_therapy # emotional_abuse # family_counsellinghttps	1021189205077254144			https://twitter.com/nicolabeer1/status/1021189205077254144	
japanideas	2018-07-22 19:53	0	0	Body of missing husband found in concrete after # Japanese wife files false divorce papers in Tokyo			# Japanese	1021181373061578752			https://twitter.com/japanideas/status/1021181373061578752	
vintagexpast	2018-07-22 17:22	0	8	Just a few days after Frank’s divorce, Ava and Frank were made husband and wife pic.twitter.com/KI1TUL3UMJ				1021143390690430977	1020141734641176576		https://twitter.com/vintagexpast/status/1021143390690430977	https://pbs.twimg.com/media/DivUfjXU0AAM21u.jpg
earlworthington	2018-07-22 17:01	0	0	cuz d # HolySpirit & God immediately made # AdamandEve husband/wife? Likewise d # HolySpirit immediately made my @ BrookeBCNN& my @ CherylScottWXmy 2 wives 2 expose Satan d human flesh tired 2 divorce my @ BrookeBCNN& my marriage 100% of "heavenly" nature from # heaven		@ BrookeBCNN @ CherylScottWXmy @ BrookeBCNN	# HolySpirit # AdamandEve # HolySpirit # heaven	1021138109944287233	1021096552847347712	DrBillWinston	https://twitter.com/earlworthington/status/1021138109944287233	https://abs.twimg.com/emoji/v2/72x72/2764.png
DailyNationZM	2018-07-22 17:00	0	0	TOWN-LIFE LOVER WIFE DIVORCES ...HERE was drama in a local court in Lusaka when a woman said that her husband abandoned her for refusing to go to the village because she wanted to live town life. READ STORY: https://www.dailynation.info/town-life-lover-wife-divorces/ …pic.twitter.com/2C63PH2RJG				1021137911239016449			https://twitter.com/DailyNationZM/status/1021137911239016449	https://pbs.twimg.com/media/DivPhLFUYAAxIEU.jpg
Lecron	2018-07-22 16:45	1	4	After the divorce the ex husband moved on, the ex wife should have done the same...I mean he even gave her $10 million dollars...her not wanting to move on proves she was not an adult emotionally, I mean you got the money and you're still beautiful pic.twitter.com/7sydqj5Uwj				1021134066949804038	1021083472574771202		https://twitter.com/Lecron/status/1021134066949804038	https://pbs.twimg.com/media/DivLxQTXkAEZuQZ.jpg
Lecron	2018-07-22 16:40	4	7	The boyfriend now husband was wrong for not speaking to his wife first before going for a meeting with his ex side chick. Side chick was doing was sides do leaving the purse there... Him not telling his wife about the meeting ultimately led to divorce. pic.twitter.com/pjcwetUMgN				1021132807375147008	1021083472574771202		https://twitter.com/Lecron/status/1021132807375147008	https://pbs.twimg.com/media/DivK3gNXkAIuPET.jpg
Sara59703838	2018-07-22 16:10	0	0	@ Teresa159Harris (0001) @ Sara59703838, Some people don't want to wait on God. Boys don't think they have to wait for a wife, men know you do. God don't like divorce, he will forgive it. Marriage is to be one wife, one husband, the model of One God, one people.		@ Teresa159Harris @ Sara59703838		1021125268335923204			https://twitter.com/Sara59703838/status/1021125268335923204	https://abs.twimg.com/emoji/v2/72x72/1f388.png
kendallsfunfair	2018-07-22 16:00	0	4	There was this guy who was with his wife and four preteen daughters + a baby and he was super chill while waiting for his wife to pick out a feminine product for that time of the month. If my future husband isn’t as chill + as patient as he was then I’ll divorce him idc.				1021122718790545411			https://twitter.com/kendallsfunfair/status/1021122718790545411	
teachermjm	2018-07-22 15:06	0	8	I was busy being a wife, mother and a 4th generation member. In one month I dealt with my “eternal” husband leaving me, having to leave my home with my 3-month-old baby and my 3-year-old, move to CA and get a divorce. God was with me the whole time. He was and is real in my life.				1021109195439931392	1021056158235283456	ByCommonConsent	https://twitter.com/teachermjm/status/1021109195439931392	
AlainBao	2018-07-22 14:48	0	0	Husband Demands Divorce In Letter, His Wife Brilliant Reply Makes Him Re... https://youtu.be/cfWM1kdTuMk via @ YouTube		@ YouTube		1021104649271750656			https://twitter.com/AlainBao/status/1021104649271750656	
EmilyJoanneHall	2018-07-22 14:07	1	4	For Family law I have found it’s definitely a ‘quickie divorce’ and common law husband and wife!				1021094272404271104	1021000954458632194	BarristerSecret	https://twitter.com/EmilyJoanneHall/status/1021094272404271104	
0GArjun	2018-07-22 13:45	0	0	I found some cool stuff that I might watch/read soon 1. Wandering Son (anime/manga) 2. Aligarh (Bollywood) 3. Divorce: Not Between Husband and Wife (Bollywood) 4. Patch Adams (Hollywood movie, my teacher recommended it, I have seen a remake but not the original.)				1021088787378593792			https://twitter.com/0GArjun/status/1021088787378593792	https://pbs.twimg.com/profile_images/1006391786137272321/rw-Am9NK_normal.jpg
ArrrrrrMa	2018-07-22 13:17	0	0	@ TarekFatah Listen to the bullshit this Islamic cleric vomits to justify male ownership of women and why a wife cannot divorce her husband. How did these medieval monsters end up running Sharia courts in the West? pic.twitter.com/bHeSzADD4c		@ TarekFatah		1021081936020697088	1020905578338500608	ShekharGupta ShashiTharoor	https://twitter.com/ArrrrrrMa/status/1021081936020697088	
Lunakurinikku	2018-07-22 12:00	0	0	Watch "Husband Demands Divorce In Letter, His Wife Brilliant Reply Makes Him Regret Every Word" on YouTube https://youtu.be/cfWM1kdTuMk				1021062420733878272			https://twitter.com/Lunakurinikku/status/1021062420733878272	
yelloflash29	2018-07-22 11:58	0	0	A wife can divorce her husband. This is what happens when you drool over things you don't know.				1021061971414855680	1020809878896627712	TarekFatah	https://twitter.com/yelloflash29/status/1021061971414855680	
RestoreEarth1	2018-07-22 11:28	0	0	A woman can have 1 husband, but a man can have up to 4 wives; Muhammad can have more.A man can unilaterally divorce his wife but a woman needs her husband's consent to divorce. A man can beat his wife for insubordination.				1021054450708828160			https://twitter.com/RestoreEarth1/status/1021054450708828160	
JrShines	2018-07-22 11:04	0	0	“But even if she does depart, let her remain unmarried or be reconciled to her husband. And a husband is not to divorce his wife.” I Corinthians 7:11 NKJV Why would God bind you with someone that’ll inevitably end in divorce when there are much better options for you?				1021048354766315523	1016472746279260163		https://twitter.com/JrShines/status/1021048354766315523	https://pbs.twimg.com/profile_images/1019412436087173120/GmXE_8Uu_normal.jpg
TracyCampanell	2018-07-22 09:27	0	0	The wife that “chose” to stay in a marriage that SHE was fully AWARE was not working is JUST as guilty as the cheating husband that was too much a coward & too scared to ask for a divorce. It takes TWO to play the game people! Get it straight! pic.twitter.com/KNVMK4Ihtd				1021024022124023808			https://twitter.com/TracyCampanell/status/1021024022124023808	https://pbs.twimg.com/media/Ditn72LXUAAf9Ae.jpg
Venkataramanaia	2018-07-22 09:11	0	0	Retweeted Tarek Fatah ( @ TarekFatah): Listen to the bullshit this Islamic cleric vomits to justify male ownership of women and why a wife cannot divorce her husband. How did these medieval monsters end up running Sharia courts in the West? pic.twitter.com/VfIayfjfcT		@ TarekFatah		1021020005264060417			https://twitter.com/Venkataramanaia/status/1021020005264060417	
davious_kondowe	2018-07-22 09:05	0	1	One only according to the bible that each man must have one wife so the applies to woman to have one husband, culture is the reason men go for polygamy, hence so many divorces.				1021018409092485120	1021017066499866625	City_Press ThuliMadonsela3	https://twitter.com/davious_kondowe/status/1021018409092485120	
joyadawson	2018-07-22 07:39	0	0	Here's a message to Jennifer Gulley (Aka) Keith's wife, because she's mad that her husband wants a divorce and thinks he cheated so she tried to set me up with a fake contract, if I'm contacted about modeling by... https://www.facebook.com/1550417341/posts/10217121511340489/ …				1020996842400755712			https://twitter.com/joyadawson/status/1020996842400755712	
TheHaryanavi	2018-07-22 07:33	0	0	# DigitalDivorce the husband took divorce from his estranged wife through video conferencing app Skype and presented at the court. https://www.indiatimes.com/trending/husband-records-wife-s-consent-on-skype-and-they-successfully-get-divorced-349801.html …			# DigitalDivorce	1020995124099272704			https://twitter.com/TheHaryanavi/status/1020995124099272704	
TheHaryanavi	2018-07-22 07:32	0	0	# DigitalDivorce the husband took divorce from his estranged wife through video conferencing app Skype and presented at the court. https://www.indiatimes.com/trending/husband-records-wife-s-consent-on-skype-and-they-successfully-get-divorced-349801.html …			# DigitalDivorce	1020995022617890816	1012284622997094400	ImplicatedH VikramArora20	https://twitter.com/TheHaryanavi/status/1020995022617890816	
SmritiKanaNag	2018-07-22 07:32	0	11	Husband Loves His Wife and Wants a # Divorce in # Texas 'On Paper' for Strategic Financial Reasons? http://BryanFagan.com/Family-Law-Blog/2016/March/Husband-Loves-His-Wife-and-Wants-a-Divorce-in-Te.aspx … @ bryanjfagan @ Family_Law_Info @ FamilyLawBlog_ @ LawInformation_ @ LawInformationB @ HoustonTexasLaw @ TexasLawInfo @ SocialMediaCom_ @ SuparnaNag_ @ SmritiKanaNag		@ bryanjfagan @ Family_Law_Info @ FamilyLawBlog_ @ LawInformation_ @ LawInformationB @ HoustonTexasLaw @ TexasLawInfo @ SocialMediaCom_ @ SuparnaNag_ @ SmritiKanaNag	# Divorce # Texas	1020994873015513089			https://twitter.com/SmritiKanaNag/status/1020994873015513089	
4shade17	2018-07-22 07:27	0	1	When marrying (at nikkah) the husband has to give a gift/mahr to the wife according to Islamic law. So the wife cannot just divorce without giving this back. So such a divorce from her side has to go through a court. If the judge sees that she has a valid reason ( violence or				1020993832664498176	1020978115453964289	4shade17 Beeblebrroxx	https://twitter.com/4shade17/status/1020993832664498176	
4shade17	2018-07-22 07:25	0	1	If you consider just one thing without the entire system => then obviously it would look oppressive to the women. According to our laws, the husband can divorce (talaq) his wife verbally (3 different occasions after a period) but the wife has to go through khul				1020993310951759872	1020978115453964289	4shade17 Beeblebrroxx	https://twitter.com/4shade17/status/1020993310951759872	
ShoneeKapoor	2018-07-22 07:20	10	13	# In1Case of # Divorce MP HC granted divorce to the husband when it was proved by way of witness statements that the wife was subjecting husband to mental agony owing to her own mental illness and husband was apprehensive to stay with her anymore https://www.shoneekapoor.com/smt-kamalshri-priya-jain-vs-pramod-kumar/ …			# In1Case # Divorce	1020992042489602048			https://twitter.com/ShoneeKapoor/status/1020992042489602048	
bholenathbabaj1	2018-07-22 07:06	0	0	+919878377317 Husband wife divorce dispute problem solution tantrik in Hyderabad: http://youtu.be/t1cdyuPrAEU?a via @ YouTube		@ YouTube		1020988574219612160			https://twitter.com/bholenathbabaj1/status/1020988574219612160	
allynsays	2018-07-22 06:10	0	1	situation 1: wife is sick but need to go work and do houseworks too but husband won't help other ppl answer: go to clinic, divorce me: talk to him, tell the problems (men don't have same mind like women)				1020974356208369665	1020973320894754818		https://twitter.com/allynsays/status/1020974356208369665	https://pbs.twimg.com/profile_images/995553945417207815/pZJupzRA_normal.jpg
rajshri_mahtani	2018-07-22 04:45	0	0	Retweeted Tarek Fatah ( @ TarekFatah): Listen to the bullshit this Islamic cleric vomits to justify male ownership of women and why a wife cannot divorce her husband. How did these medieval monsters end up running Sharia courts in the West? pic.twitter.com/lTkaNI5nC2		@ TarekFatah		1020952924489428992			https://twitter.com/rajshri_mahtani/status/1020952924489428992	
babaj9215	2018-07-22 04:32	0	0	No.1 Husband wife dispute divorce problem solutions 8699719284 https://locan.to/2665980270				1020949600641998848			https://twitter.com/babaj9215/status/1020949600641998848	
kasius11	2018-07-22 04:16	0	0	@ nra is like the husband caught by his wife (American FBI) in bed with a Russian mistress (think Tony Soprano). Bye-bye tax exempt status, hello criminal court. America's 2nd Amendment loving @ NRA members are about to file for divorce. Bye @ DLoesch		@ nra @ NRA @ DLoesch		1020945746906972162			https://twitter.com/kasius11/status/1020945746906972162	
HalelujahImBack	2018-07-22 03:49	0	0	if your wife/husband/boyfriend/girlfriend/whatever threatens to break up with you or divorce you over something stupid, then you might as well cause they dont really love you				1020938901970567168			https://twitter.com/HalelujahImBack/status/1020938901970567168	
MalikaA24963063	2018-07-22 03:19	3	19	In UK same muslim imams still teach that husbands can control their wives. While a husband is allowed to divorce his wife at any time, without cause, often imams will not grant a woman divorce without her husband's consent. # I'm not his property			# I	1020931436432560128	1020809878896627712	TarekFatah DogsRNicePeople	https://twitter.com/MalikaA24963063/status/1020931436432560128	
shriparv	2018-07-22 03:02	0	0	RT @( TarekFatah ) - Listen to the bullshit this Islamic cleric vomits to justify male ownership of women and why a wife cannot divorce her husband. How did these medieval monsters end up running Sharia courts in the West? pic.twitter.com/EbrOc4x1KT —… https://twitter.com/TarekFatah/status/1020896165687103490 …				1020926926708531200			https://twitter.com/shriparv/status/1020926926708531200	
ra7uca	2018-07-22 02:43	0	0	Am apreciat un videoclip pe @ YouTube, http://youtu.be/cfWM1kdTuMk?a Husband Demands Divorce In Letter, His Wife Brilliant Reply Makes Him		@ YouTube		1020922271580475393			https://twitter.com/ra7uca/status/1020922271580475393	
dottmanga	2018-07-22 02:30	0	0	It's like if you say to your wife/husband and kids: I won't give you a penny unless you buy a prostitute for me. # wtf Brexit: no 'divorce' payment without trade deal, says Dominic Raab https://www.theguardian.com/politics/2018/jul/22/brexit-no-divorce-payment-without-trade-deal-says-dominic-raab?CMP=Share_AndroidApp_Tweet …			# wtf	1020918871426060288			https://twitter.com/dottmanga/status/1020918871426060288	
RealYogeshDhami	2018-07-22 01:44	3	7	Listen to the bullshit this Islamic cleric vomits to justify male ownership of women and why a wife cannot divorce her husband. How did these medieval monsters end up running Sharia courts in the West? pic.twitter.com/A8GZZyuYfq				1020907458921762816	1020905905406193664	Imamofpeace	https://twitter.com/RealYogeshDhami/status/1020907458921762816	
KrTasleem	2018-07-22 01:34	0	5	Listen to the bullshit this Islamic cleric vomits to justify male ownership of # women and why a wife cannot # Divorce her husband. How did these medieval monsters end up running # Sharia courts in the West? # زوجه_تضرب_زوجها_بالمكنسه # وش_اسم_ديرتك # HappyBirthdaySelenaGomezpic.twitter.com/UuIwfuPZRe			# women # Divorce # Sharia # زوجه_تضرب_زوجها_بالمكنسه # وش_اسم_ديرتك # HappyBirthdaySelenaGomezpic	1020904991639339008			https://twitter.com/KrTasleem/status/1020904991639339008	