username	date	retweets	favorites	text	geo	mentions	hashtags	tweetid	conversationid	replyto	permalink	imagelink
groupiemet	2018-07-23 05:51	0	0	WTF AFRICA- HUSBAND SEH WIFE FIND A RICHER MAN - http://www.jamaicanmateyangroupie.com/wtf-africa/wtf-africa-husband-seh-wife-find-a-richer-man/ … A businesswoman, Halimat Yaya, has approached an Agege Customary Court in Lagos State, seeking divorce from her husband because of his temperament. According to the News Agency of Nigeria (NAN), Hal... pic.twitter.com/hW9YMERJlu				1021332033690357760			https://twitter.com/groupiemet/status/1021332033690357760	https://pbs.twimg.com/media/DiyAElXUwAEAYPV.jpg
blair966	2018-07-23 00:02	0	0	“Everyone who divorces his wife and marries another is guilty of adultery, and the man who marries a woman divorced by her husband commits adultery.” https://txf.ro/m/jm33 # jesuspic.twitter.com/5jLAMoMIik			# jesuspic	1021244242612707328			https://twitter.com/blair966/status/1021244242612707328	https://pbs.twimg.com/media/DiwwOgNW0AAmSSe.jpg
RestoreEarth1	2018-07-22 11:28	0	0	A woman can have 1 husband, but a man can have up to 4 wives; Muhammad can have more.A man can unilaterally divorce his wife but a woman needs her husband's consent to divorce. A man can beat his wife for insubordination.				1021054450708828160			https://twitter.com/RestoreEarth1/status/1021054450708828160	
davious_kondowe	2018-07-22 09:05	0	1	One only according to the bible that each man must have one wife so the applies to woman to have one husband, culture is the reason men go for polygamy, hence so many divorces.				1021018409092485120	1021017066499866625	City_Press ThuliMadonsela3	https://twitter.com/davious_kondowe/status/1021018409092485120	
Bruchagher	2018-07-21 16:39	0	0	One of the Sharia law is that if a man divorce his wife when he's on an ailment that could take his life, then this divorce will not be valid bcoz it's sensed that the divorce might be a way the husband want to use to punish his wife by not wanting her to get some inheritance.				1020770360227135488			https://twitter.com/Bruchagher/status/1020770360227135488	
valentinemutowo	2018-07-20 04:07	1	4	According to our patriachy society, if the wife is caught red handed cheating witb another man and the husband decides to divorce her, he is entitled to have his lobola returned.				1020218678892253184	1020216375674011648	ZiFMStereo PatieMusa TshilaZiFM	https://twitter.com/valentinemutowo/status/1020218678892253184	
Divorce_Talk	2018-07-20 02:44	0	1	My Wife Cheated with a Man at Work, Wife Tells Husband She Cheated http://f89.me/YinXZG2q				1020197816482910208			https://twitter.com/Divorce_Talk/status/1020197816482910208	
ThatRealise	2018-07-19 18:52	0	0	This s why a man can marry again if the wife is incompetent some how such as cannot bear children for him, Ask any woman weather she would rather have her husband cheat on her or have him treat her like a queen and if he decides to marry again she can always divorce				1020079071374397441	1018170532804677632	ian_iveco ConfessionsExMu	https://twitter.com/ThatRealise/status/1020079071374397441	
Faesal_Ah	2018-07-18 23:22	0	0	Plus after divorce,it clear that husband doesn't want his wife. So why doesn't that women move on Nd marry someone else who appreciates her. Why will she want to be back with the man who just kicked her out of his life				1019784569657090048	1019779725286289408	RatanSharda55	https://twitter.com/Faesal_Ah/status/1019784569657090048	
misschunga	2018-07-18 17:36	1	9	I've been single so long I know my man ain't Zambian i know all Zambians. My husband in an unhappily married European man in his mid 30s about to divorce his wife of 13 years. He has 2 kids and I will love them both. someone kind, please tag this when I marry my ex.				1019697563996512256			https://twitter.com/misschunga/status/1019697563996512256	https://abs.twimg.com/emoji/v2/72x72/1f602.png
EddieCheeba	2018-07-18 11:20	2	2	Wife earning 550k, Husband earning 60k and the husband wants the wife to quit the job. Lol that man is a lunatic! Divorce him sis				1019602849842585600			https://twitter.com/EddieCheeba/status/1019602849842585600	
neelayavfc	2018-07-18 07:49	0	0	But if you speak to the women they are brainwashed and don’t say anything. If a Muslim man can have 4 wives, as many children, can divorce by saying talak 3 times and if the wife is still stupid enough to want to be with her husband she has to remarry for one night have sex				1019549778030616576	1019456704738676737	TarekFatah	https://twitter.com/neelayavfc/status/1019549778030616576	
vijeta_aggarwal	2018-07-18 07:36	0	0	A law in our constitution: If a married man (X) has sex with a married woman (B) with her consent, then his wife (Y) can't take any action except divorce, that woman's husband (A) can't take any action against his wife (B), only he (A) can take action against that man (X).				1019546329440313344	1019533059979382784		https://twitter.com/vijeta_aggarwal/status/1019546329440313344	https://pbs.twimg.com/profile_images/909324149302083584/AMu60AQb_normal.jpg
Nadiassay	2018-07-18 02:31	0	1	Why is there jail term for man for a divorce that is void?How does it benefit the wife?How will he support her and kids?Does it leave any place for repairing marriage?Husband in jail,wife married to ‘criminal’ no support kids struggle Bhakts celebrate Muslim women empowerment https://twitter.com/VenkatAthreya1/status/1019274234567319552 …				1019469624855760896			https://twitter.com/Nadiassay/status/1019469624855760896	https://pbs.twimg.com/profile_images/523738002225238016/V1ZdMvVt_normal.jpeg
Dini_Mars	2018-07-18 02:10	0	0	Husband earning 60k that wants wife to leave over half a mil job for any reason is a mad man. Divorce his ass.				1019464317673132032			https://twitter.com/Dini_Mars/status/1019464317673132032	https://abs.twimg.com/emoji/v2/72x72/1f602.png
Sanjay0Deva	2018-07-18 00:55	0	0	The paradox in our legal system in India. Every judge gives judgements based on his fancies! Pic 1: Marriage doesn’t mean wife is ready for sex Pic 2: Man can file for divorce if no sex between husband and wife				1019445517217083393			https://twitter.com/Sanjay0Deva/status/1019445517217083393	https://abs.twimg.com/emoji/v2/72x72/1f600.png
JamesWa26288961	2018-07-17 18:36	0	0	Husband , father, grandfather, cheater, man who had his wife sign divorce papers while she was at death's door and he was cheating on her...man you can never lecture anyone about piety..or anything else for that matter...				1019350225339625472	1019334359432585216	newtgingrich	https://twitter.com/JamesWa26288961/status/1019350225339625472	
AlamanAbdulaziz	2018-07-17 17:41	0	0	Unlike killing wife or poisoning husband and committing crime, there is a option where a couple can separate. Do you know, the wife can initiate the process of divorce also known as Khulna from her husband ? Talaq is a misfortune for a Muslim man, according to the scriptures.				1019336352201048065	1018860576821448704	ridhima_at_wii	https://twitter.com/AlamanAbdulaziz/status/1019336352201048065	
JessLBeebs	2018-07-17 15:09	0	3	Went to pick up a horse today and I said "I'm looking for the Mitchell's?" And the old man replied "well, I'm a Mitchell, but my wife's a babe and that's just the way it is." And if my husband doesn't admire me like that. Then I'm already signing divorce papers				1019298129248583680			https://twitter.com/JessLBeebs/status/1019298129248583680	https://abs.twimg.com/emoji/v2/72x72/270c.png
smDeWittHall	2018-07-17 13:11	0	0	10 When they were in the house again, the disciples asked Jesus about this. 11 He answered, “Anyone who divorces his wife and marries another woman commits adultery against her. 12 And if she divorces her husband and marries another man, she commits adultery.” 2/3				1019268389729112065	1018866592099291136	theweeflea AndyMorrison42	https://twitter.com/smDeWittHall/status/1019268389729112065	
Milkyway1955Z	2018-07-17 12:54	63	61	The most screwed up legal system in India. Every judge gives judgements based on his fancies! Pic 1: Marriage doesn’t mean wife is ready for sex Pic 2: Man can file for divorce if no sex between husband and wife pic.twitter.com/S1VYfmuilI				1019264152257417216			https://twitter.com/Milkyway1955Z/status/1019264152257417216	https://pbs.twimg.com/media/DiUnTsbXcAA_FVu.jpg
smDeWittHall	2018-07-17 12:51	0	1	Um... Mark 10:11 He answered, “Anyone who divorces his wife and marries another woman commits adultery against her. 12 And if she divorces her husband and marries another man, she commits adultery.”				1019263296275435522	1018866592099291136	theweeflea AndyMorrison42	https://twitter.com/smDeWittHall/status/1019263296275435522	
pavarivoga	2018-07-17 10:54	0	0	A woman loved by her husband will grow in loveliness.A man respected by his wife will become more respectable.We didn’t leave any-room for separation or divorce… https://www.instagram.com/p/BlVjh2EhoTuGO9jGQM-Dq07JggieJM7xsXha600/?utm_source=ig_twitter_share&igshid=lvap6n01585w …				1019233835811254273			https://twitter.com/pavarivoga/status/1019233835811254273	
AasnanButt	2018-07-17 05:32	1	0	Dont forget that Imran Khan divorced his wife but the lady did not use her right to get divorce from that man. If the husband was such a loose charater man so what forced that lady to live with him? Money? Fame? Payroll service? Duty of Counterspy? https://twitter.com/Hamidmasoood/status/1019145906011168768 …				1019152738926645248			https://twitter.com/AasnanButt/status/1019152738926645248	
AasnanButt	2018-07-17 05:30	0	5	Dont forget that Imran Khan divorced his wife but the lady did not use her right to get divorce from that man. If the husband was such a loose charater man so what forced that lady to live with him? Money? Fame? Payroll service? Duty of Counterspy?				1019152468607930368	1019144128540618752	Hamidmasoood haroon_natamam	https://twitter.com/AasnanButt/status/1019152468607930368	
MorobadiK	2018-07-16 13:11	0	0	10:11He answered, "Anyone who divorces his wife and marries another woman commits adultery against her.10:12And if she divorces her husband and marries another man, she commits adultery."				1018905898532687872	1018903502800785413		https://twitter.com/MorobadiK/status/1018905898532687872	https://pbs.twimg.com/profile_images/978604983208865792/vsTIOdn3_normal.jpg
bbcriticpak	2018-07-16 08:04	0	1	divorce is one of the most disliked things in islam, that is why one should be more careful before divorcing. plus planned & temporary marriage with the intention of going back to old husband/wife is invalid & not permissible if a man/woman still go for it, they are doing haram				1018828646566580224	1018820925490331648	swatislays	https://twitter.com/bbcriticpak/status/1018828646566580224	
fisforfaheem	2018-07-16 06:38	0	0	if a husband divorces his wife by talaq he can revoke the divorce within the iddah, , the couple can remarryif they divorce a third time, they can not unite within the iddah period nor marry again until the ex mries anthr man, to ensure that the divorce is taken seriously				1018807036706983936	1018755653068906496	TarekFatah	https://twitter.com/fisforfaheem/status/1018807036706983936	
joBeeGeorgeous	2018-07-13 03:18	0	0	The law: Man has sexual intercourse with a married woman. The crime is adultery. Only woman’s husband can seek the man’s prosecutn. Married man has a consensual sexual relationshp with an unmarried woman. No criminal law applies. The man’s wife can seek divorce on this ground. https://twitter.com/MumbaiMirror/status/1017603863241773056 …				1017669455495794688			https://twitter.com/joBeeGeorgeous/status/1017669455495794688	
De_Jaa_Vu	2018-07-12 16:07	0	0	Only that Man can be punished who have sex with someones wife if husband files case.. in all other cases it can be used to get an upper hand in divorce but not punishable.				1017500605865062400	1017406127577788419	destined_hooman	https://twitter.com/De_Jaa_Vu/status/1017500605865062400	
RGrimlock	2018-07-12 10:23	0	1	Wife should divorce the husband. Education does not make you a GOOD MAN. You must have a good moral.				1017414170797469696	1017385585361604614	TODAYonline	https://twitter.com/RGrimlock/status/1017414170797469696	
wittledev	2018-07-12 10:08	0	0	This man writes me on Facebook calling me sexy, asking to take me out... mind you he has a wife and a daughter... I AM DISGUSTED by men if a man who is married can do this i have no faith for my future husband not to do the same... this is why people get divorce!				1017410434826055681			https://twitter.com/wittledev/status/1017410434826055681	
PlatinumB_RICH	2018-07-12 07:23	1	0	In Nigeria, when husband and wife split up, 80% of people will suspect the wife of doing something horrible. To them, it's almost unfathomable for a man to agree to a divorce if his wife is perfect.				1017368893327847424			https://twitter.com/PlatinumB_RICH/status/1017368893327847424	
oegbe	2018-07-11 05:42	0	0	Hmmm.... akin to that man who filed for a divorce simply because his wife of 3 years (both trying for a baby) didn’t remember the names of his (the husband’s) siblings. Interesting!				1016981156229722112	1016910861347311616	GeorgeKakayor henryshield kfayemi	https://twitter.com/oegbe/status/1016981156229722112	
BeckySefton	2018-07-11 04:53	0	0	Man: "my wife loves housework". Woman: "my husband likes being smacked in the mouth". Man: "my wife loves me too much to hit me". Woman: "I want to divorce him but the useless lump needs me". Man: "I really love her". Me: "great..."				1016968715408216064			https://twitter.com/BeckySefton/status/1016968715408216064	
masterstuff2	2018-07-11 04:31	0	0	Thrz a practice called Nikah Halala among Muslims. If husband gives instant talaq (divorce) to wife & later Husband wants to remarry her again, she has to consummate marriage with another man, get divorce from him. Only then she can marry his husband again.				1016963154415378432	1016953573735895040	LindquistLord	https://twitter.com/masterstuff2/status/1016963154415378432	https://abs.twimg.com/emoji/v2/72x72/1f631.png
tintindready	2018-07-11 01:29	0	2	# RHOP so are ex husband's and ex wives not allowed to date after divorce? Why does Karen keep saying stop dating ppl ex husband. Im married to a man that was divorced.			# RHOP	1016917320898400257			https://twitter.com/tintindready/status/1016917320898400257	
firstmuslim	2018-07-10 05:29	0	0	Are you crazy, Islam has no fault divorce, a woman can get a divorce in Islam if her husband's penis is not big enough for her, abolish what? Taxes in Islam is only 2.5% not 20% and the Quran commands the man to pay his wife for Brest feeding his child, everything is wrong here.				1016615294767263744	1016372192068751365	MinimumSt8 Dora_Chance	https://twitter.com/firstmuslim/status/1016615294767263744	
theyknowfreedom	2018-07-10 04:40	2	2	If you are a woman and support Zanu you deserve an abusive husband who cheats on you and lies a lot . If you are a man you deserve a wife who slaps your mother , cheats and anoroya Who if you try divorce will bring ma youth to beat you up.				1016602975979139072			https://twitter.com/theyknowfreedom/status/1016602975979139072	
agniveer	2018-07-09 01:01	24	42	Y # BeHindu - As per Vedas Husband cant divorce wife simply by uttering/ smsing a word 3 times, There can b no difference in marital rights of man & woman, Property rights r same 4 both genders, Child marriage is wrong, Widow’s remarriage is encouraged http://pos.li/2a2f9n pic.twitter.com/CkCU5gr2BP			# BeHindu	1016185556349448199			https://twitter.com/agniveer/status/1016185556349448199	https://pbs.twimg.com/media/Dho3YIYXkAE1XQG.jpg
mariamacfc	2018-07-08 22:32	0	1	Your man wants a second wife. wyd? — Going divorce. My marriage isn't a community thing, I'm not sharing my husband https://curiouscat.me/mariama96/post/562189384?1531103546 …				1016148038975414275			https://twitter.com/mariamacfc/status/1016148038975414275	https://abs.twimg.com/emoji/v2/72x72/2708.png
Brooke1779962	2018-07-06 20:51	0	0	This @ brendonurie guy is married. Explain 2 me whats praiseworthy about a # married man saying he is “attracted 2”...anyone other than his wife? Once ur married, ur # identity becomes irrelevant. What a # pathetic & # disloyal husband. She should divorce him. # Adultery # brendonuriepic.twitter.com/gAr0DdMhzK		@ brendonurie	# married # identity # pathetic # disloyal # Adultery # brendonuriepic	1015397779349401600			https://twitter.com/Brooke1779962/status/1015397779349401600	https://pbs.twimg.com/media/Dhdq3UfWkAERZzN.jpg
MercyReceived	2018-07-06 07:21	0	0	Well I don't think it is logical. Marriage is a spiritual commitment between a man & a woman. In order to reconcile there must be sacrifice. The husband must humbly listen in order to lead. The wife can only follow if she agrees with the decisions. Beatings and Divorce are evil.				1015194090101600257			https://twitter.com/MercyReceived/status/1015194090101600257	
mehrdad1996o	2018-07-06 06:29	0	2	Arab women had a social and political status before Islam Khadijah wife of the Prophet,before marrying Muhammad She is separated from her husband in that time The only man is unable to divorce and like today, a woman has the ability to divorce from a man With the advent of Islam,				1015181015910965248	1015169760835899392	mehrdad1996o CH2517Joan AtheistRepublic	https://twitter.com/mehrdad1996o/status/1015181015910965248	
engineer_pks	2018-07-04 06:40	72	59	Mostly Muslim man give divorce to his wife and she has to face the torture of # NikahHalala (organised rape on the name of religion), so in my opinion husband must go though the procedure of # Halala by goat heared Mullah/Maulavi. Why Muslim Women shall always suffer?			# NikahHalala # Halala	1014458947955249152			https://twitter.com/engineer_pks/status/1014458947955249152	
merecatholicism	2018-07-03 13:24	0	1	The belief in romanticism, want for a 'greater' man, and a desire for pleasurable experiences and a certain passivity and critical attitude towards adult responsibilities is what dooms many a Catholic wife to divorce her dutiful, plump, and self sacrificial husband.				1014198246313472001	1013746966034034688	dlongenecker1	https://twitter.com/merecatholicism/status/1014198246313472001	
Ihaveanopinion9	2018-07-03 10:10	0	0	A married couple plans to have a baby, wife gets pregnant, wife and husband have an argument, wife gets an abortion w/o consent from husband. Or husband & wife divorce, & husband is compelled to pay child support but never wanted the baby in the first place. What now?				1014149349973032960	976538698538979329	climbingatree HeidiM_67	https://twitter.com/Ihaveanopinion9/status/1014149349973032960	
PathanAsmakhan	2018-07-02 08:00	15	32	According to the rules of Islamic marriage,if a man divorces his wife 3 times or issues three divorces at once with triple talaq also called talaq-e-biddat,she cannot remarry him unless and until she marries another man and this new husband divorces her, or she becomes a widow				1013754403038343174			https://twitter.com/PathanAsmakhan/status/1013754403038343174	
iamOlisaeloka	2018-07-01 08:40	0	0	What??????? I'm with him and his new wife. Man was faithful even in divorce. The night they divorced guess who banged a random guy and having exquisite dinner at the same restaurant the husband was washing plates? She deserved the wealth, Diana that helped make Robert deserve him				1013402011541409792	1013383028557647873	NANAesher KAHZKAHZ lekzidex	https://twitter.com/iamOlisaeloka/status/1013402011541409792	
hanzak95	2018-06-29 15:21	1	0	The context of Quran 2:230 is dat if a man divorces his wife thrice she is unlawful 4 him until she marries someone else with the "intention of having a proper marriage not halala 2 go back". With her intent being right even this marriage fails she may go back to her 1st husband				1012778141419372544	1012734983071358977	Neev_24 MeUsmanButt	https://twitter.com/hanzak95/status/1012778141419372544	
Dr_Syed_93	2018-06-29 14:23	0	0	Mis @ maryashakil ,there is no concept of "Nikah Hala" it is a condition that if a Man or a Women want to Re Marrige with his/her first wife/husband after 'Talaq' then a condition is tht Divorced women must be married with other man and If that 2nd husband Also Divorce her....		@ maryashakil		1012763394942873600	1012738639124746240	CNNnews18 maryashakil	https://twitter.com/Dr_Syed_93/status/1012763394942873600	
sachin_027	2018-06-29 09:50	0	4	In Islam, halal translates to something that is permissible, and therefore ‘lawful’. In the context of marriage, Nikah Halala means that if a man divorces his wife he cannot remarry her unless the wife marries another man and this new husband divorces her, (1/2)				1012694860078329856			https://twitter.com/sachin_027/status/1012694860078329856	https://pbs.twimg.com/profile_images/1007180454145884160/WbbhB7jO_normal.jpg
BushraaAhmed	2018-06-29 09:38	0	0	As most virgin woman and widows and divorces didn't have man. And they lost their husband in wars so to compensate that men were allowed to take up more woman as wife so they can provide and protect them				1012691846382870530	1012677072714719233	BushraaAhmed josyjoe	https://twitter.com/BushraaAhmed/status/1012691846382870530	
iHegde	2018-06-29 07:56	0	2	What is Nikah Halala? - According to the rules of Islamic marriage, if a man divorces his wife three times, he cannot remarry her unless and until she marries another man and this new husband divorces her, or she becomes a widow.				1012666000309878784			https://twitter.com/iHegde/status/1012666000309878784	https://pbs.twimg.com/profile_images/691552172794736640/lla2MrCS_normal.jpg
sumitmnc	2018-06-28 04:44	0	1	Will the son from first couple get anything from the male counterpart if his mother marries other man. A+B-->C ( A husband, B wife, C son) Now A and B gets divorce and B marries to D. Will B get anything from property of D?				1012255436056100869	1012047236300263427	VarunNambiar6 DeepikaBhardwaj	https://twitter.com/sumitmnc/status/1012255436056100869	
ElizehK	2018-06-28 03:39	0	0	Actually marriage is incredibly sexist&bigoted a few examples - th requirement to declare a husband and wife (how about non binary sexes and lgbtq), asking for father’s profession but not mother’s, divorce can only be sought on the basis of adultery if it’s between a man&woman				1012239041734029313	1011924282362953729	JuliaHB1	https://twitter.com/ElizehK/status/1012239041734029313	
zerotwo64	2018-06-26 19:36	0	17	Really old man got mad at me today at work and then his wife called the store later and apologized for him I just wanna say thanks old lady divorce your husband and marry me instead.				1011755205325664256			https://twitter.com/zerotwo64/status/1011755205325664256	
guavadog	2018-06-25 12:43	0	5	why do adults think sitcoms featuring a heavy drinker husband and a “nagging” wife are funny it’s such a boring ass trope especially when half the humour is based on the man chatting shit about his overbearing wife like just get a divorce				1011288731003817991			https://twitter.com/guavadog/status/1011288731003817991	
zadama24	2018-06-24 12:36	0	2	A 46-YEAR-OLD man of Lusaka’s Chazanga township has been sued for divorce after he allegedly stabbed his wife in the chest during a marital dispute. Sipiwe Chirwa, 36, told the Matero local court that her husband... http://www.daily-mail.co.zm/man-stabs-wife-sued-for-divorce/ …				1010924754549854209			https://twitter.com/zadama24/status/1010924754549854209	
nesha__tay	2018-06-24 00:45	0	0	If a man treats his wife badly then he isn’t treating his family good! I good father/husband wouldn’t do anything to jeopardize his wife or kids! The choices you make in your marriage effects your family! Cheat on your wife and the family splits because of divorce!				1010745624885710849			https://twitter.com/nesha__tay/status/1010745624885710849	
nesha__tay	2018-06-24 00:31	0	2	If a man treats his wife badly then he isn’t treating his family good! I good father/husband wouldn’t do anything to jeopardize his wife or kids! The choices you make in your marriage effects your family! Cheat on your wife and the family splits because of a divorce!				1010742178463789057	1008720582651842560	Preshy_2014 aishat_sanusi	https://twitter.com/nesha__tay/status/1010742178463789057	
groupiemet	2018-06-23 07:24	0	0	WTF AFRICA- HUSBAND SEH WIFE A GUH SEND HIM GO AN EARLY GRAVE - http://www.jamaicanmateyangroupie.com/wtf-africa/wtf-africa-husband-seh-wife-a-guh-send-him-go-an-early-grave/She …’sroublesome, wants to send me to early grave —Man Ile Tuntun Customary Court Mapo, Ibadan, Oyo State, has adjourned till July 5, a divorce suit brought before it by a man, Yussuf Sodiq, ... pic.twitter.com/DuJJ5022FU				1010483785002110976			https://twitter.com/groupiemet/status/1010483785002110976	https://pbs.twimg.com/media/DgX1paFVAAArZvc.jpg
akkudhanya	2018-06-23 05:30	0	0	In India, both the husband and wife have rights to file a divorce. Only the grounds are different. But when a man files http://www.pathlegal.in/Situations-when-a-husband-can-file-divorce-blog-1100707 …http://www.pathlegal.in/Situations-when-a-husband-can-file-divorce-blog-1100707 …				1010454955629559809			https://twitter.com/akkudhanya/status/1010454955629559809	
hollzballz93	2018-06-22 22:50	0	3	TURNS OUT he was sent to prison a few years back for hiring a hit man to murder his wife to avoid a "messy divorce" because he was gay. His wife? My coworker. The man she was with is HER EX HUSBAND/NOW FIANCE THAT TRIED TO HAVE HER KILLED. WILD.				1010354409509871617	1010354087244623872		https://twitter.com/hollzballz93/status/1010354409509871617	https://pbs.twimg.com/profile_images/980519255564169217/Q_rA7WpG_normal.jpg
