username	date	retweets	favorites	text	geo	mentions	hashtags	tweetid	conversationid	replyto	permalink	imagelink
sandralynn0067	2015-05-18 13:42	0	0	All three of North America's bear species - the polar bear, grizzly bear and American black bear - are threatened... http://fb.me/7lIRZg52l				600355815992774656			https://twitter.com/sandralynn0067/status/600355815992774656	
MrShyRockstar	2015-04-29 22:08	0	0	The Signs as bears - dykeaadelic: Aries- North American Black bear Taurus - Spectacled bear Gemini- Grizzly... http://tmblr.co/Zb6ket1jfktzX				593597644401987584			https://twitter.com/MrShyRockstar/status/593597644401987584	
Burritohrus	2015-04-05 06:10	0	0	The Signs as bears - dykeaadelic: Aries- North American Black bear Taurus - Spectacled bear Gemini- Grizzly... http://tmblr.co/ZYlsGs1hdve4a				584659444585394176			https://twitter.com/Burritohrus/status/584659444585394176	
lauracricket	2015-03-29 03:07	0	0	American black bear, brown bear (grizzly), polar bear, Andean spectacled bear, Asian black bear, giant panda bear, sun bear, & sloth bear.				582076506035326976			https://twitter.com/lauracricket/status/582076506035326976	
2dayswork	2015-03-16 18:30	0	0	American Alsatian-I American Alsatian-I may have my my perfect breed for camping in grizzly, black bear, wolf, coyo… pic.twitter.com/ouLPwxjNjD				577597758300950532			https://twitter.com/2dayswork/status/577597758300950532	https://pbs.twimg.com/media/CAQKGdAWEAAQFbm.jpg
prince1lu2	2015-02-27 19:55	0	0	50's Bear Tie Clip Grizzly American Black by PopcornVintageByTann http://etsy.me/1sshnIo via @ Etsy		@ Etsy		571473800363171840			https://twitter.com/prince1lu2/status/571473800363171840	
Capreezie	2014-12-25 22:18	0	0	"It's an African American grizzly!" "Oh, BLACK BEAR!!"				548316853148196864			https://twitter.com/Capreezie/status/548316853148196864	https://abs.twimg.com/emoji/v2/72x72/1f602.png
joeythebabe	2014-12-20 01:25	0	0	@ normbnyc No Moose on the Island just Elk, Deer, Grizzly, Cougars (Like the # JeepGirls) Black bears & American Eagles (No skunks, ground hog		@ normbnyc	# JeepGirls	546189622254923777	546134905282117632	normbnyc	https://twitter.com/joeythebabe/status/546189622254923777	
LambSolo	2014-10-22 08:16	1	1	pandas are family Ursus genus Ailuropoda but other common bears which are ursidae ursus (grizzly, American and Asian black) @ NickMcIlwain1		@ NickMcIlwain1		524897050249682944			https://twitter.com/LambSolo/status/524897050249682944	
cale_berger	2014-08-14 16:03	0	0	@Doug_Hands I prefer the grizzly but the American black bear and polar are also interesting				500009770473246721			https://twitter.com/cale_berger/status/500009770473246721	
braileysmum	2014-08-05 16:20	0	0	50's Bear Tie Clip Grizzly American Black by PopcornVintageByTann http://etsy.me/1sshnIo via @ Etsy		@ Etsy		496752727112687616			https://twitter.com/braileysmum/status/496752727112687616	
ThePonShop	2014-07-17 18:33	0	0	@ amachtans what is the average size of a North American Black bear, vs a Grizzly Bear?		@ amachtans		489900752177881088	489899964890243072	amachtans	https://twitter.com/ThePonShop/status/489900752177881088	
amachtans	2014-07-17 18:30	0	1	Got some great info on the North American black bear and grizzly bear. Riveting stuff. # OilFieldTraining			# OilFieldTraining	489899964890243072			https://twitter.com/amachtans/status/489899964890243072	
Barsawad	2014-05-19 09:44	0	0	Bear Awareness Week. all 3 ~ polar bear, grizzly bear and American black bear - are threatened: https://www.defenders.org/bear-awareness-week … via @ Defenders		@ Defenders		468386654118350848			https://twitter.com/Barsawad/status/468386654118350848	
JOiNOELLELUV	2014-05-13 03:00	0	0	@ linoftwerkteam the big black American grizzly bear lmfaoooo		@ linoftwerkteam		466110655175884800	466104154490810368	linoftwerkteam	https://twitter.com/JOiNOELLELUV/status/466110655175884800	https://abs.twimg.com/emoji/v2/72x72/1f629.png