username	date	retweets	favorites	text	geo	mentions	hashtags	tweetid	conversationid	replyto	permalink	imagelink
Nillintheblanks	2018-04-27 14:37	0	0	Soldan sağa Leatherface "The Texas Chainsaw Massacre", Freddy Krueger "A Nightmare On Elm Street", Jason Voorhees "Friday The 13th", Michael Myers "Halloween".				989936476929568774	989916444614909953	HBBZNL	https://twitter.com/Nillintheblanks/status/989936476929568774	https://abs.twimg.com/emoji/v2/72x72/1f60e.png
megabeardo	2018-04-12 12:52	0	0	1. A Soldier's Story 2. A Nightmare on Elm Street 3. The Naked Face Now we are really getting into my slasher craze. While I loved Michael Myers and Jason Voorhees, nobody was better than Freddy Krueger for me. I made my friends watch Elm Street at my 6th birthday party! pic.twitter.com/1KE5lGyPl3				984474382620921856	984474336764612608		https://twitter.com/megabeardo/status/984474382620921856	https://pbs.twimg.com/media/DamE4I3XkAAlFNT.jpg
VuongBryan	2013-09-13 14:47	0	0	@Janelle_tori16 Friday the 13th=Jason Voorhees, A Nightmare on Elm Street=Freddy Krueger, Halloween=Michael Myers.				378590681360396288			https://twitter.com/VuongBryan/status/378590681360396288	
nevzataga	2018-07-21 09:08	0	0	I liked a @ YouTube video http://youtu.be/7NdmaXGhd0Q?a Scooby-Doo vs Michael Myers, Jason Voorhees, Freddy Krueger, Chucky, Leatherface,		@ YouTube		1020656844996579329			https://twitter.com/nevzataga/status/1020656844996579329	
tzerigawa	2018-07-20 21:10	4	7	Freddy Krueger, Jason Voorhees and Michael Myers # MyUnholyTrinity			# MyUnholyTrinity	1020476157446303744			https://twitter.com/tzerigawa/status/1020476157446303744	
java_chip9000	2018-07-18 16:11	0	1	Jason Voorhees, Freddy Krueger, Michael Myers				1019676036299096065	1019566249762750464	NexusFolf	https://twitter.com/java_chip9000/status/1019676036299096065	
SirBenKenobi	2018-07-18 00:04	0	1	I spoke with Michael Myers, Freddy Krueger & Jason Voorhees. They told me they didn't do it. pic.twitter.com/Y6SaOJx1mY				1019432634030555136			https://twitter.com/SirBenKenobi/status/1019432634030555136	
Salute_MySpeed	2018-07-17 08:38	0	0	Who has the best theme music... freddy krueger jason voorhees Or Michael Myers I think Michael got it				1019199629236359168			https://twitter.com/Salute_MySpeed/status/1019199629236359168	
fatmansu	2018-07-16 09:13	0	3	Michael Myers, Jason Voorhees, Freddy Krueger, & Leatherface. https://twitter.com/nyounker/status/1018287720051953666 …				1018846155701186560			https://twitter.com/fatmansu/status/1018846155701186560	https://pbs.twimg.com/media/DiGu23vW4AIrwE4.jpg
ActivistAngler	2018-07-14 21:54	0	0	Jason Voorhees, Michael Myers, Freddy Krueger, Hillary Clinton . . . they just won't go away.				1018312845015093250			https://twitter.com/ActivistAngler/status/1018312845015093250	
HugoV0mit	2018-07-14 18:47	0	0	i'm not butthurt or anything but please don't draw porn of Jason Voorhees , Freddy Krueger, Michael Myers (any horror character at that) and Bastion.				1018265861919043584			https://twitter.com/HugoV0mit/status/1018265861919043584	
RedSoxdiehard11	2018-07-13 23:58	0	2	1. Freddy Krueger 2. Michael Myers 3. Jason Voorhees 4. Pennywise 5. Chucky 6. Leatherface 7. Hannibal Lecter 8. Xenomorph 9. Jack Torrance 10. Ghostface 11. Billy the Puppet 12. Candyman 13. Leprechaun				1017981549805961216			https://twitter.com/RedSoxdiehard11/status/1017981549805961216	https://pbs.twimg.com/profile_images/1017728340491464704/8pyW1Lcm_normal.jpg
VanessaGaglione	2018-07-13 17:18	0	3	Perfect combo... 1 of my fav music video tributes to the "Big 3" slasher icons of horror: Jason Voorhees ( # FridayThe13th ), Michael Myers (Halloween) & Freddy Krueger (Nightmare on Elm Street). Featuring "Enter Sandman" by Metallica. https://www.youtube.com/watch?v=iPbvCln_2tQ … -AJ's Music Videos-			# FridayThe13th	1017880890167496704	1017792077256708097	HanaGebka TommyJoeRatliff	https://twitter.com/VanessaGaglione/status/1017880890167496704	
RenegadeEnigma	2018-07-13 15:47	0	0	# fucking_funny # friday_the_13th lol # michael_myers # jason_voorhees # freddy_krueger https://www.instagram.com/p/BlLyF-6lOk6/?utm_source=ig_twitter_share&igshid=1clp8vnq6fdff …			# fucking_funny # friday_the_13th # michael_myers # jason_voorhees # freddy_krueger	1017858026668097536			https://twitter.com/RenegadeEnigma/status/1017858026668097536	
hickslv426	2018-07-12 00:46	0	1	I'd rather Freddy Krueger, Michael Myers, Jason Voorhees fuck these monsters				1017268828366147589	1017188501870161920	AndyRichter	https://twitter.com/hickslv426/status/1017268828366147589	https://abs.twimg.com/emoji/v2/72x72/1f601.png
TheSentaiPRFan	2018-07-09 19:41	0	1	Jason Voorhees > Michael Myers/Freddy Krueger				1016467463167401984	1016316390079418368	FinsterBaby705 NECA_TOYS	https://twitter.com/TheSentaiPRFan/status/1016467463167401984	
tking205	2018-07-08 07:10	0	1	@ LakesideKiller (Continued) - 5. Hannibal Lecter. 4. Chucky & Tiffany. 3. Jigsaw. 2. Michael Myers. Honourable Mention. Mrs. Pamela Voorhees. 1. Freddy Krueger & Jason Voorhees.		@ LakesideKiller		1015916140013514752			https://twitter.com/tking205/status/1015916140013514752	
tking205	2018-07-08 05:55	0	1	(Continued) - 3. Jigsaw. 2. Michael Myers. Honourable Mention. Mrs. Pamela Voorhees. 1. Freddy Krueger & Jason Voorhees.				1015897139384287233	1015897071872770048		https://twitter.com/tking205/status/1015897139384287233	https://pbs.twimg.com/profile_images/927963075822673925/kBB6Qg7J_normal.jpg
JaqueBerry	2018-07-06 14:03	1	3	Based on hands on kills: Jason Voorhees, Michael Myers, Lubin, Freddy Krueger and Jigsaw. Based on psycho: Hans Gruber, Hannibal Lecter, Hans Landa, Anton Chigurh, and Agent Smith. HM-Voldemort				1015295148513611776	1015251582995202048	titMcGrit	https://twitter.com/JaqueBerry/status/1015295148513611776	
STFilmmaker	2018-07-06 14:01	0	1	Freddy Krueger, Jason Voorhees, Michael Myers, Pinhead (Aka Lead Cenobite aka Hell Priest.)				1015294713627201536	1015251582995202048	titMcGrit	https://twitter.com/STFilmmaker/status/1015294713627201536	
whoisneer	2018-07-05 19:38	1	1	Bruh I’m really gonna meet the actors who played Freddy Krueger, Michael, Myers, Jason Voorhees, Pinhead, and Jigsaw next month				1015017087947993088			https://twitter.com/whoisneer/status/1015017087947993088	
_Kocoum	2018-07-05 15:05	0	0	Michael Myers The Thing(The Original) Freddy Krueger Leatherface Jeepers Creepers Jason Voorhees Hannibal Lecter Norman Bates Pinhead Candyman https://twitter.com/funnyjulius/status/1014732534641577984 …				1014948471873384453			https://twitter.com/_Kocoum/status/1014948471873384453	
dylanlately	2018-07-03 05:56	0	0	@ HorrorNightsORL I hope we get some horror icons this year. Texas Chainsaw Massacre, Jason Voorhees, Michael Myers, Ghostface, Norman Bates, Freddy Krueger, etcI need more houses to be announced		@ HorrorNightsORL		1014085380231098369			https://twitter.com/dylanlately/status/1014085380231098369	https://abs.twimg.com/emoji/v2/72x72/1f440.png
samtripoli	2018-07-02 22:12	4	45	I hate the Warriors but I love that signing Boogie shits all over the Lebron to the Lakers Bandwagon Lovefest! It’s like being happy that Freddy Krueger teamed up with Michael Myers to kick Jason Voorhees’s ass! In the end there are no winner but at least includes the Lakers!				1013968624346779648			https://twitter.com/samtripoli/status/1013968624346779648	
realplayboyb81	2018-07-01 12:22	0	2	-เป็นคนชอบฆาตกรน่ากลัวๆแต่ไม่ใช่ผีนะอันนั้นกลัว เช่น Michael myers,Jason voorhees,Freddy krueger				1013457747726102530	1013410861552029696		https://twitter.com/realplayboyb81/status/1013457747726102530	https://abs.twimg.com/emoji/v2/72x72/1f383.png
thewizardofbras	2018-06-27 13:06	0	1	Michael Myers has Big Dick Energy Freddy Krueger has Little Dick Energy Jason Voorhees has Medium Dick Energy Leatherface has Little Dick Energy Chucky has Plastic Dick Energy Ghostface has Little Dick Energy The Fisherman has Medium Dick Energy				1012019275538690049			https://twitter.com/thewizardofbras/status/1012019275538690049	
cuzzincode	2018-06-27 10:27	1	16	If Fortnite doesn’t come out with a Michael Myers, Jason Voorhees, and Freddy Krueger skin during Halloween I’m gonna be pissed				1011979288097316864			https://twitter.com/cuzzincode/status/1011979288097316864	
SellingFunkoUK	2018-06-25 04:59	0	0	Funko Horror Plushies IT - Pennywise Freddy Krueger Jason Voorhees Michael Myers http://rover.ebay.com/rover/1/710-53481-19255-0/1?ff3=2&toolid=10039&campid=5337852079&customid=sellingfunkouk&item=113094830844&vectorid=229508&lgeo=1 …				1011171913106886656			https://twitter.com/SellingFunkoUK/status/1011171913106886656	
chuuymorales12	2018-06-24 23:02	0	0	¿Quién ganaría un fatal 4-way entre Michael Myers, Jason Voorhees, Leatherface y Freddy Krueger? Jajaja xd				1011082227919269888	1011080029982285824	GabyMeza8	https://twitter.com/chuuymorales12/status/1011082227919269888	
Rubybug98	2018-06-24 14:34	0	0	I liked a @ YouTube video http://youtu.be/PghJMycRgwo?a Goosebumps Books Featuring Jason Voorhees, Michael Myers, Leatherface, Freddy Krueger		@ YouTube		1010954443150553091			https://twitter.com/Rubybug98/status/1010954443150553091	
SellingFunkoUK	2018-06-24 05:14	0	0	Funko Horror Plushies IT - Pennywise Freddy Krueger Jason Voorhees Michael Myers http://rover.ebay.com/rover/1/710-53481-19255-0/1?ff3=2&toolid=10039&campid=5337852079&customid=sellingfunkouk&item=113094830844&vectorid=229508&lgeo=1 …				1010813297686384641			https://twitter.com/SellingFunkoUK/status/1010813297686384641	
JBouvia	2018-06-24 01:30	0	1	@ FortniteGame Or make the one where he's in the straightjacket for halloween. Do Jason Voorhees freddy Krueger Michael Myers maybe do a stranger things dollar that'd be dope. Steve from stranger things in fortnite as a legendary skin with his bat as a legendary harvesting tool.		@ FortniteGame		1010757002690060288			https://twitter.com/JBouvia/status/1010757002690060288	
alonso19	2018-06-24 01:01	0	0	Retweeted MisterChip (Alexis) ( @ 2010MisterChip): Están Jason Voorhees, Freddy Krueger, Michael Myers... y Alemania. En cuanto te gires, estás muerto.		@ 2010MisterChip		1010749625589010432			https://twitter.com/alonso19/status/1010749625589010432	
charlesphaire	2018-06-23 22:01	0	0	marry, fuck or kill Freddy Krueger, Michael Myers or Jason Voorhees				1010704328410181632			https://twitter.com/charlesphaire/status/1010704328410181632	
migueldeynes	2018-06-23 19:03	0	0	There are Jason Voorhees, Freddy Krueger, Michael Myers ... and Germany. As soon you turn your back, you are dead. # Germany # ToniKroos			# Germany # ToniKroos	1010659625157431296			https://twitter.com/migueldeynes/status/1010659625157431296	https://abs.twimg.com/emoji/v2/72x72/1f1e9-1f1ea.png
migueldeynes	2018-06-23 16:55	0	0	Están Jason Voorhees, Freddy Krueger, Michael Myers... y Alemania. En cuanto te gires, estás muerto. # Alemania # ToniKroos			# Alemania # ToniKroos	1010627338281906176			https://twitter.com/migueldeynes/status/1010627338281906176	https://abs.twimg.com/emoji/v2/72x72/1f1e9-1f1ea.png
2010MisterChip	2018-06-23 16:09	1715	4671	Están Jason Voorhees, Freddy Krueger, Michael Myers... y Alemania. En cuanto te gires, estás muerto.				1010615809142611968			https://twitter.com/2010MisterChip/status/1010615809142611968	
SellingFunkoUK	2018-06-23 14:49	0	1	Funko Horror Plushies IT - Pennywise Freddy Krueger Jason Voorhees Michael Myers http://rover.ebay.com/rover/1/710-53481-19255-0/1?ff3=2&toolid=10039&campid=5337852079&customid=sellingfunkouk&item=113094830844&vectorid=229508&lgeo=1 …				1010595712558657536			https://twitter.com/SellingFunkoUK/status/1010595712558657536	
SickJay84	2018-06-22 23:35	0	1	Excellent choice. I also grew up on him along with Freddy Krueger, Michael Myers and Chucky. I know this might be blasphemy, but for me Jason Voorhees is my number one favorite and Michael Myers is 2nd.				1010365770772156416	1010357406927335429	HannaSmith0521 Drumdums	https://twitter.com/SickJay84/status/1010365770772156416	
charlesphaire	2018-06-21 20:27	0	0	marry, fuck or kill Freddy Krueger, Michael Myers or Jason Voorhees				1009955996104581120			https://twitter.com/charlesphaire/status/1009955996104581120	
HorrorSquadFilm	2018-06-21 17:00	0	1	Goosebumps Books Featuring Jason Voorhees, Michael Myers, Leatherface, Freddy Krueger and Chucky: http://youtu.be/PghJMycRgwo?a via @ YouTube		@ YouTube		1009903994846801920			https://twitter.com/HorrorSquadFilm/status/1009903994846801920	
AngusRockford	2018-06-21 00:55	0	6	When Freddy Krueger (Sessions), Michael Myers (Ryan), Jason Voorhees (McConnell) and Chucky (Trump) are running our government, every day is a horror show.				1009661001384546306	1009503916558446592	Thom_Hartmann	https://twitter.com/AngusRockford/status/1009661001384546306	
BloodyPopcorn	2018-06-19 20:15	0	4	first off you're gorgeous second... Freddy Krueger, Michael Myers, Jason Voorhees fuck one, kill one, marry one — Fuck Michael; kill Jason; marry Freddy https://curiouscat.me/BloodyPopcorn/post/531493006?1529453759 …				1009228332553134081			https://twitter.com/BloodyPopcorn/status/1009228332553134081	https://abs.twimg.com/emoji/v2/72x72/1f937-200d-2640-fe0f.png
Sivistheone	2018-06-19 16:25	0	0	Ladies and gentlemen, my co-worker's prized possessions. Jason Voorhees, Freddy Krueger, Michael Myers, and Sybil. She, named all of her utensils after horror movie/books killers. Well besides Sybil and the spoon. Its name is scooby-doo. XD pic.twitter.com/dulSlXTFVC				1009170432254234625			https://twitter.com/Sivistheone/status/1009170432254234625	https://pbs.twimg.com/media/DgFLIUKW4AMrXxm.jpg
J__Dotson__10	2018-06-18 14:33	0	1	You think the purge and conjuring are scary but don’t know a damn thing about Jason Voorhees, Freddy Krueger or Michael Myers				1008779872204881920			https://twitter.com/J__Dotson__10/status/1008779872204881920	
AylinMerriweat1	2018-06-16 16:59	0	0	I regard Daniel Robitaille aka Candyman the same rank as Freddy Krueger, Michael Myers, Chucky, Pinhead, Jason Voorhees. Candyman had a complex plot and it is not about hacking horny Teenagers and no plot like some horror.				1008091727327096832	1008088336894836736	hellhorror	https://twitter.com/AylinMerriweat1/status/1008091727327096832	
Shaqattack941	2018-06-14 17:28	0	0	Here's a greater therat for trump the mummy wolfman dracula frankenstein monster jason voorhees freddy krueger chucky michael myers it.				1007374264385884161	1007232575096676352	StephenAtHome	https://twitter.com/Shaqattack941/status/1007374264385884161	
Rasyidharry	2018-06-13 01:53	1	2	Michael Myers baru mau dihidupin lagi. Jason Voorhees & Leatherface nggak jelas, apalagi Freddy Krueger. Sayang, nggak banyak yang kenal Victor Crowley. 4 film sejak 2006. pic.twitter.com/XuMniKwcPL				1006776591261798403			https://twitter.com/Rasyidharry/status/1006776591261798403	https://pbs.twimg.com/media/DfjJ8j6XUAAZlNr.jpg
aipsun	2018-06-12 17:17	0	0	Dan Freddy Krueger ini jatohnya setan ya bukan psikopat. Dia membunuh lewat mimpi. Walaupun yah Michael Myers dan Jason Voorhees juga kayak setan sih ga mati mati				1006646796439842817	1006646451437309952		https://twitter.com/aipsun/status/1006646796439842817	https://pbs.twimg.com/profile_images/948595540358455296/dNwpbJc2_normal.jpg
aipsun	2018-06-12 17:16	0	0	Serial killer dalam film favorite gw: Michael Myers, Leatherface, Jason Voorhees. Sama sama ga pernah ngomong. Paling ga gw suka: Freddy Krueger. Kebanyakan bacot dan garing				1006646451437309952			https://twitter.com/aipsun/status/1006646451437309952	https://pbs.twimg.com/profile_images/948595540358455296/dNwpbJc2_normal.jpg
2hrTV	2018-06-12 14:34	0	4	Reminds me of when I made TARDIS wall skins for Sims. I also made skins for the occupants to look like the Doctors. Next door was a house occupied by Freddy Krueger, Michael Myers and Jason Voorhees.				1006605556533153792	1006594542513065985	nimbos	https://twitter.com/2hrTV/status/1006605556533153792	
sadavies71	2018-06-12 12:29	0	1	Horror Movie Villains Set 1 Freddy Krueger (Nightmare on Elm Street film series) Jason Voorhees (Friday the 13th film series) Michael Myers (Halloween film series) Leatherface (Texas Chainsaw Massacre film series) pic.twitter.com/zHtnECY6Ex				1006574231218544640			https://twitter.com/sadavies71/status/1006574231218544640	https://pbs.twimg.com/media/DfgR0ICV4AA6waJ.jpg
SarahJoSmiley	2018-06-10 18:54	1	8	Behind the Mask: The Rise of Leslie Vernon was a fun, funny, smart, and twisted little movie about the mindset of a wannabe Jason Voorhees/Michael Myers/Freddy Krueger. Really interesting and worth a watch.				1005946376558202880			https://twitter.com/SarahJoSmiley/status/1005946376558202880	
StreetMike90	2018-06-10 14:10	0	1	Bout to make a beat that sounds like Michael Myers and Jason Voorhees are tag teaming the excorcist girl while Freddy Krueger watches from the corner and may or may not be touching himself with the knife glove.				1005874982147231744			https://twitter.com/StreetMike90/status/1005874982147231744	
slasher4hire	2018-06-10 04:07	0	4	It was an original concept with really cool characters and had several cameos from horror icons such as Michael Myers, Freddy Krueger, Jason Voorhees. I don’t remember everything about the story so a complete rewrite would be hard.				1005723158186483713	1005722726663847936		https://twitter.com/slasher4hire/status/1005723158186483713	https://pbs.twimg.com/profile_images/1021273993385586688/QAcB7F5m_normal.jpg
cinemacao	2018-06-08 18:24	0	2	O assassino mascarado Michael Myers está imortalizado nas lendas do terror mundial ao lado de Jason Voorhees, Freddy Krueger e Leatherface, e agora o assassino silencioso das noites de... https://cinemacao.com/2018/06/08/michael-myers-volta-no-primeiro-trailer-de-halloween/ …				1005213899271168000			https://twitter.com/cinemacao/status/1005213899271168000	
prodigy_69	2018-06-08 13:41	0	1	1.Michael Myers 2.Freddy Krueger 3.Leatherface 4.Pinhead 5.Jason Voorhees <last because he’s a cheap knock off of 1.				1005142885656768512	1005128014739443717	Simon_Pegg	https://twitter.com/prodigy_69/status/1005142885656768512	https://abs.twimg.com/emoji/v2/72x72/1f602.png
13Slade	2018-06-08 10:37	0	1	انا اعشق افلام الرعب القديمة و شخصياتها مثل freddy krueger, jason voorhees, Michael Myers, chucky و لكن طبعًا هذا شي زمان حاليا الشخصيات ماتت و مافيه اي فلم رعب يجذبني				1005096585271881730	1005095611492982784		https://twitter.com/13Slade/status/1005096585271881730	https://pbs.twimg.com/profile_images/1008540209322094592/DY95-nzG_normal.jpg
Darth_Jay	2018-06-08 10:34	0	4	To me, Michael Myers has always been more compelling than Jason Voorhees and Freddy Krueger. Now we are getting a film that ignores all the bullshit sequels and brings back Jamie Lee Curtis. Looking forward to this one. https://twitter.com/halloweenmovie/status/1005087118337536000 …				1005095641561919489			https://twitter.com/Darth_Jay/status/1005095641561919489	https://pbs.twimg.com/media/DfImiM4VAAAsayK.jpg
hottoffthetruck	2018-06-05 10:13	0	0	Funko HORROR 3.75" POP 3pc SET MICHAEL MYERS - JASON VOORHEES - FREDDY KRUEGER - Funko Chaser https://funkochaser.weebly.com/1/post/2018/06/funko-horror-375-pop-3pc-set-michael-myers-jason-voorhees-freddy-krueger.html …				1004003187370741765			https://twitter.com/hottoffthetruck/status/1004003187370741765	
TheManCalledBat	2018-06-04 05:43	0	0	@ Mike_Dougherty What I wanna see for # TrickRTreat2 is Sam, Monsters, Vampires, Werewolves, The Leper, Crooked Man, The Witch, Krampus, Clowns, Pennywise, Michael Myers, Jason Voorhees, Letherface, Pinhead, Freddy Krueger & Much More....		@ Mike_Dougherty	# TrickRTreat2	1003573013889994753			https://twitter.com/TheManCalledBat/status/1003573013889994753	https://pbs.twimg.com/profile_images/1020733174601531392/PaEZcBQF_normal.jpg
Orig_Randers	2018-06-03 17:39	0	0	It's like Michael Myers, Jason Voorhees, Freddy Krueger, etc. Having an established "mascot" sells better, but it doesn't automatically make the game/movie better overall.				1003390651440947200	1003036869242818561	JohnWolfeYT	https://twitter.com/Orig_Randers/status/1003390651440947200	
SaraMcL70835365	2018-06-02 01:20	0	0	I added a video to a @ YouTube playlist http://youtu.be/pedNxWF-Vbw?a Michael Myers,Freddy Krueger and Jason Voorhees		@ YouTube		1002781909884293120			https://twitter.com/SaraMcL70835365/status/1002781909884293120	
Witchdoctorfilm	2018-06-01 22:33	0	0	Freddy Krueger Jason Voorhees & Michael Myers ORIGINAL ART BY MATTHEW PARMENTER https://www.ebay.com/itm/192552282396?ssPageName=STRK:MESELX:IT&_trksid=p3984.m1555.l2649 …				1002739969922883584			https://twitter.com/Witchdoctorfilm/status/1002739969922883584	
DevilshlySweet	2018-06-01 21:49	0	1	//If you could base your Neo on a serial killer like Jason Voorhees, Michael Myers, Freddy Krueger, which would fit your adapta... — //Freddy. He seems to have fun with his job of killing, where as Michael and Jason don't appear c... https://curiouscat.me/DevilshlySweet/post/506894204?1527904143 …				1002728772280508421			https://twitter.com/DevilshlySweet/status/1002728772280508421	
JakeTheBean_	2018-05-31 20:19	0	0	Jason Voorhees > Leatherface > Freddy Krueger > Michael Myers pic.twitter.com/8DUiZsF34P				1002343953931304960			https://twitter.com/JakeTheBean_/status/1002343953931304960	
SaraMcL70835365	2018-05-31 18:11	0	0	I added a video to a @ YouTube playlist http://youtu.be/pedNxWF-Vbw?a Michael Myers,Freddy Krueger and Jason Voorhees		@ YouTube		1002311585354969088			https://twitter.com/SaraMcL70835365/status/1002311585354969088	
Witchdoctorfilm	2018-05-29 23:41	0	0	Freddy Krueger Jason Voorhees & Michael Myers ORIGINAL ART BY MATTHEW PARMENTER https://www.ebay.com/itm/192552282396?ssPageName=STRK:MESELX:IT&_trksid=p3984.m1555.l2649 …				1001669837377167360			https://twitter.com/Witchdoctorfilm/status/1001669837377167360	
halloweeneddie	2018-05-29 13:48	0	2	I would still like to see an IT adaption where Pennywise takes on the appearances of: Freddy Krueger, Jason Voorhees, Michael Myers, and Leatherface.				1001520730759094279			https://twitter.com/halloweeneddie/status/1001520730759094279	https://pbs.twimg.com/profile_images/1008098931421503488/ivPxStjT_normal.jpg
WildSheWolf	2018-05-23 22:37	0	1	If you're actually scared of "antifa" c'mon let me whisper in ya ear all about Freddy Krueger, Michael Myers, Jason Voorhees, & Pennywise the Clown.				999479551112744960	999339050690535424	stackartist Vets4AP	https://twitter.com/WildSheWolf/status/999479551112744960	https://abs.twimg.com/emoji/v2/72x72/1f923.png
aidanbreshers1	2018-05-20 13:23	0	0	@ BenBSinger freddy krueger vs pennywise, Jason voorhees vs Michael myers, chucky vs lubdan the leprechaun, and ash vs leatherface. Which of these horror fights sounds cooler to do this year?		@ BenBSinger		998252927985823745			https://twitter.com/aidanbreshers1/status/998252927985823745	
Witchdoctorfilm	2018-05-12 18:56	0	0	Freddy Krueger Jason Voorhees & Michael Myers ORIGINAL ART BY MATTHEW PARMENTER https://www.ebay.com/itm/202306718116?ssPageName=STRK:MESELX:IT&_trksid=p3984.m1555.l2649 …				995437484770242565			https://twitter.com/Witchdoctorfilm/status/995437484770242565	
fw3661	2018-05-12 11:56	0	0	I added a video to a @ YouTube playlist http://youtu.be/4b97gjsKhmU?a Disney Princess vs Michael Myers, Jason Voorhees, Freddy Krueger,		@ YouTube		995331964776300544			https://twitter.com/fw3661/status/995331964776300544	
NMETH14	2018-05-12 07:24	0	1	leatherface, michael myers, ghostface, freddy krueger, candyman, hellraiser, jason voorhees.....				995263465391566850	995247207338082305	SundJeffrey	https://twitter.com/NMETH14/status/995263465391566850	https://abs.twimg.com/emoji/v2/72x72/1f480.png
Witchdoctorfilm	2018-05-12 00:47	0	0	Freddy Krueger Jason Voorhees & Michael Myers ORIGINAL ART BY MATTHEW PARMENTER https://www.ebay.com/itm/202306718116?ssPageName=STRK:MESELX:IT&_trksid=p3984.m1555.l2649 …				995163635247910912			https://twitter.com/Witchdoctorfilm/status/995163635247910912	
deIuthi	2018-05-10 15:54	29	316	koç: leatherface boğa: hannibal lecter ikizler: jack torrance yengeç: norman bates aslan: patrick bateman başak: pinhead terazi: dracula akrep: michael myers yay: freddy krueger oğlak: jason voorhees kova: jigsaw balık: pennywise				994666912406818817			https://twitter.com/deIuthi/status/994666912406818817	
neonbble	2018-05-09 22:30	0	0	dependendo da resposta é ban michael myers, freddy krueger ou jason voorhees? — jason rei que come a passivinha do freddy em frddy vs jason https://curiouscat.me/kkjleo/post/466839045?1525919458 …				994404399299661824			https://twitter.com/neonbble/status/994404399299661824	
thewizardofbras	2018-05-09 15:11	0	1	Omg Dr Loomis is literally the reincarnation of Van Helsing. I've also seen minor similarities between Dracula and Michael Myers. I actually kinda also see Jason Voorhees like Frankenstein's monster and Freddy Krueger like the wolfman, physical wise				994293759956406277	994236306963222529	TallyDude FreddyInSpace	https://twitter.com/thewizardofbras/status/994293759956406277	
Witchdoctorfilm	2018-05-07 23:27	0	0	Freddy Krueger Jason Voorhees & Michael Myers ORIGINAL ART BY MATTHEW PARMENTER https://www.ebay.com/itm/202306718116?ssPageName=STRK:MESELX:IT&_trksid=p3984.m1555.l2649 …				993693826463215616			https://twitter.com/Witchdoctorfilm/status/993693826463215616	
_PROMISCUOUS1	2018-05-03 14:41	1	0	The list goes as followed: 1. Michael Myers/Jason Voorhees 2. Freddy Krueger 3. The Damn Children from the corn https://twitter.com/_SmittyJ_/status/992111097888018432 …				992111819799097345			https://twitter.com/_PROMISCUOUS1/status/992111819799097345	
