username	date	retweets	favorites	text	geo	mentions	hashtags	tweetid	conversationid	replyto	permalink	imagelink
clinjones13	2018-07-17 09:12	0	0	Maria Butina, SPY, in Oval Office with Trump. We should be surprised at this shocking behavior of Trump selling our country out, although, after yesterday... SHOULD WE BE SURPRISED? Our President @ realDonaldTrump is a TRAITOR. @ SpeakerRyan when are you going to IMPEACH? https://twitter.com/TheRickWilson/status/1019202964957859840 …		@ realDonaldTrump @ SpeakerRyan		1019208292160196609			https://twitter.com/clinjones13/status/1019208292160196609	https://pbs.twimg.com/profile_images/986059016051703808/kmiAIN2Y_normal.jpg
patrickmoultney	2018-07-17 09:11	0	1	Look who’s with @ realdonaldtrump in his secretive Oval Office meeting with Russians: None other than Maria Butina @ cnn @ ap @ maddow @ Reuters @ FoxNews @ NBCNewspic.twitter.com/KtdB1e0JDs		@ realdonaldtrump @ cnn @ ap @ maddow @ Reuters @ FoxNews @ NBCNewspic		1019208023066251264	1019040834992427010	Comey	https://twitter.com/patrickmoultney/status/1019208023066251264	https://pbs.twimg.com/media/DiT0SfDWkAYBq-w.jpg
CactusHowl	2018-07-17 09:10	0	0	A pic of # MariaButina, “Russian spy”, in Oval Office the day after Comey was fired. LOL. Ok. Why didn’t the Intel Community know about her & warn @ realDonaldTrump in advance? # wagthedog bullsh*t. # TuesdayThoughts # tcot cc: @ FoxNews @ dbongino @ Jim_Jordan @ jasoninthehouse https://twitter.com/tammylively/status/1019190042550505474 …		@ realDonaldTrump @ FoxNews @ dbongino @ Jim_Jordan @ jasoninthehouse	# MariaButina # wagthedog # TuesdayThoughts # tcot	1019207765057777664			https://twitter.com/CactusHowl/status/1019207765057777664	https://abs.twimg.com/emoji/v2/72x72/1f449.png
TheMrJayBrown	2018-07-17 09:09	0	6	OMG. A Russian spy in the Oval Office. But enough about Donald Trump - Maria Butina is also present in this photo.				1019207463600607232	1019202964957859840	TheRickWilson	https://twitter.com/TheMrJayBrown/status/1019207463600607232	
empowers35	2018-07-17 09:09	0	0	I thought this was a photoshop, but it's not. This is Maria Butina — arrested for being a Russian spy — in the Oval Office with Trump. pic.twitter.com/HSRozWTdLW				1019207355433533440	1019204976441221120	realDonaldTrump RandPaul	https://twitter.com/empowers35/status/1019207355433533440	https://pbs.twimg.com/media/DiTzr4RVAAALH6F.jpg
daniellewolf	2018-07-17 09:08	0	2	Why was Maria Butina in the Oval Office?				1019207253344350209	1019204976441221120	realDonaldTrump RandPaul	https://twitter.com/daniellewolf/status/1019207253344350209	
ampalsson	2018-07-17 09:06	0	0	The same MAria Butina who along the Russian Ambassador and other Russians was invited to the Oval Office, courtesy of one @ realDonaldTrump https://twitter.com/grantstern/status/1018960043465756674 …		@ realDonaldTrump		1019206615181004801			https://twitter.com/ampalsson/status/1019206615181004801	
Lambx	2018-07-17 09:04	4	56	When you have Maria Butina, arrested for being a Russian spy, in the Oval Office the day you fire Comey, what is the American Public supposed to think? By the way the indictment yesterday was for collusion. # impeachTrump			# impeachTrump	1019206276738441221	1019204976441221120	realDonaldTrump RandPaul	https://twitter.com/Lambx/status/1019206276738441221	
lovelostgrl	2018-07-17 09:00	7	11	Hey, look everyone, it's Donny @ realDonaldTrump with the arrested Russian Spy Maria Butina, in the OVAL OFFICE! What's she doing there? Donny, this is TREASON. You are a traitor. Get the hell out of our white house. https://twitter.com/RogueCPI/status/1019202075916414976 …		@ realDonaldTrump		1019205146553790464			https://twitter.com/lovelostgrl/status/1019205146553790464	
AntonioBequer	2018-07-17 08:53	0	0	@ PressSec @ POTUS @ realDonaldTrump - Please explain why Maria Butina was in the Oval Office meeting. # Treasonhttps://twitter.com/sarahkendzior/status/1019197723596247040 …		@ PressSec @ POTUS @ realDonaldTrump	# Treasonhttps	1019203433168031745			https://twitter.com/AntonioBequer/status/1019203433168031745	https://pbs.twimg.com/media/DiTq6KRVAAAafWv.jpg
justblegit	2018-07-17 08:51	0	0	Will you talk about Maria Butina, who you had in the Oval Office when you wouldn’t allow your own country’s press to see? You know, the one who is now indicted. pic.twitter.com/otI1Mb8itc				1019202858388992000	1018992115810910208	realDonaldTrump seanhannity TuckerCarlson	https://twitter.com/justblegit/status/1019202858388992000	https://pbs.twimg.com/media/DiTvmAaWkAEabXX.jpg
peekabelly	2018-07-17 08:35	0	2	@ GOP @ realDonaldTrump # TraitorTrump. Here is Maria Butina in Oval Office with no other Americans present pic.twitter.com/2KrhuvX10m		@ GOP @ realDonaldTrump	# TraitorTrump	1019198894180323328	1019066617458806787	funder	https://twitter.com/peekabelly/status/1019198894180323328	https://pbs.twimg.com/media/DiTr_SeWsAAFZlB.jpg
LonnieHicks10	2018-07-17 08:14	0	0	Guess who was there during the infamous Oval Office meeting in which Trump barred the American media, bragged about firing Comey saying "The Pressure's off" all before giving the Russians damaging Top Secret Information....Maria Butina. Trump, The NRA and GOP are all traitors. pic.twitter.com/VaaEL6LotN				1019193525844566017	1018790677407076353	CharlesOvery HillaryClinton	https://twitter.com/LonnieHicks10/status/1019193525844566017	https://pbs.twimg.com/media/DiTnDxwXkAAspnX.jpg
Vetinari3	2018-07-17 08:12	0	0	Russian spy Maria Butina arrested by . @ FBI pictured below in secret Oval Office meeting with Trump and Russian ambassador. (Standing by the door) pic.twitter.com/nEhbycyO1s		@ FBI		1019193053096169472	1018992115810910208	realDonaldTrump seanhannity TuckerCarlson	https://twitter.com/Vetinari3/status/1019193053096169472	https://abs.twimg.com/emoji/v2/72x72/1f447.png
carlyvwest	2018-07-17 06:52	2	3	@ SenSchumer and @ NancyPelosi now would be a good time to call for impeachment. Putin’s puppet, @ realDonaldTrump, welcomed a Russian spy, Maria Butina, INTO the Oval Office!! pic.twitter.com/9bx72Ph8q1		@ SenSchumer @ NancyPelosi @ realDonaldTrump		1019172901319307265			https://twitter.com/carlyvwest/status/1019172901319307265	https://pbs.twimg.com/media/DiTUWVdUYAA294p.jpg
TinaLynnNelson	2018-07-16 21:06	0	0	Retweeted Vive la Resistance ( @ stanimals): Look here! Maria Butina in the oval office with top Russian spy chiefs and @ realDonaldTrump https://twitter.com/38O9127469/status/1019018482057404416 …https://twitter.com/38O9127469/status/1019018482057404416 …		@ stanimals @ realDonaldTrump		1019025437979303936			https://twitter.com/TinaLynnNelson/status/1019025437979303936	https://pbs.twimg.com/media/DiRH5qtU8AAd5WU.jpg
stanimals	2018-07-16 20:50	8	15	Look here! Maria Butina in the oval office with top Russian spy chiefs and @ realDonaldTrump https://twitter.com/38O9127469/status/1019018482057404416 …		@ realDonaldTrump		1019021451804864513			https://twitter.com/stanimals/status/1019021451804864513	https://pbs.twimg.com/media/DiRH5qtU8AAd5WU.jpg
NcColeT	2018-07-16 17:05	0	0	DOJ Just arrested & Indicted Russian Maria Butina, of Attempting to "INFILTRATE the NRA org. & other Political U.S Org. in an effort to ADVANCE RUSSIAN FEDERATION"! & u want us to swing the Door open to them like u did our Presidential Oval office in the White House?Are u crazy?				1018964838637174784	1018956970143858688	realDonaldTrump	https://twitter.com/NcColeT/status/1018964838637174784	