username	date	retweets	favorites	text	geo	mentions	hashtags	tweetid	conversationid	replyto	permalink	imagelink
aneeslodhi09	2018-07-23 14:06	0	1	Judiciary was targeted and attempts were made to weaken it as an institution whenever it delivered verdicts that went against Nawaz Sharif. He is now doling out plundered wealth to target the judiciary and armed forces. Dr Muhmmad Tahir-ul-Qadri https://www.facebook.com/100005270913878/posts/1016227331896288/ …				1021456562697768961			https://twitter.com/aneeslodhi09/status/1021456562697768961	
NajamUlAssar	2018-07-23 14:06	0	0	After spending few days in my constituency and meeting the nominees, I am impressed by the humbleness of the candidates. I travelled from # Lahore to # Sargodha to cast my vote for a Progressive Pakistan. # NA90 # VoteforPakistan # PakistanElection2018 # PTI # PMLN # PPP			# Lahore # Sargodha # NA90 # VoteforPakistan # PakistanElection2018 # PTI # PMLN # PPP	1021456546922983424			https://twitter.com/NajamUlAssar/status/1021456546922983424	
ul79w	2018-07-23 14:06	0	0	.				1021456545861832704	1021442535405817857	girls3_	https://twitter.com/ul79w/status/1021456545861832704	
FOOLF0RLOUlS	2018-07-23 14:06	0	0	17 minutos para que aquí sean oficialmente los 8 años a las 20:23				1021456530598711296			https://twitter.com/FOOLF0RLOUlS/status/1021456530598711296	
JA_Gypsy_Gyal	2018-07-23 14:06	0	0	yuh too mix ul				1021456530518966272	1021456293855408128	Jamaicanhitman	https://twitter.com/JA_Gypsy_Gyal/status/1021456530518966272	
noorrulhudaa	2018-07-23 14:06	0	0	LEAVE THE MUSIC ALONE FGSSS WHAT ARE YOU PEOPLE.				1021456528661012484	1021061622901690368	SalmanBME	https://twitter.com/noorrulhudaa/status/1021456528661012484	
Hussains17	2018-07-23 14:06	0	0	Waseem Bandami and iqrar ul Hassan in Niklo Pakistan ki khatir,the biggest transition of the time....... pic.twitter.com/kI2QOjupac				1021456458167222272			https://twitter.com/Hussains17/status/1021456458167222272	https://abs.twimg.com/emoji/v2/72x72/1f1f5-1f1f0.png
Arsenemaniac	2018-07-23 14:06	0	0	Wo nai hai. Dusra hai				1021456435782168576	1021445094065475586	Adeel_AFC ImranKhanPTI	https://twitter.com/Arsenemaniac/status/1021456435782168576	
MUNEEBULISLAM10	2018-07-23 14:06	0	0	God bless Ireland				1021456412000620549	999558820870402048	AlysonHenry_ GlamourMagUK	https://twitter.com/MUNEEBULISLAM10/status/1021456412000620549	
JMPSUlT	2018-07-23 14:05	0	1	i freaked out but i keep seeing it and now im just sighinghttps://twitter.com/indiewashere/status/1021400064479191040 …				1021456407185567744			https://twitter.com/JMPSUlT/status/1021456407185567744	
Aashiq_Type	2018-07-23 14:05	0	0	2 maybe 3				1021456398515949568	1021446152238043136	bae_ghairat YeahMahiWay	https://twitter.com/Aashiq_Type/status/1021456398515949568	
IkhlasBakistani	2018-07-23 14:05	0	0	I'm asking about Anwar ul Uloom?				1021456395349241857	1021376960197545984	yasir_prof M__Omer1	https://twitter.com/IkhlasBakistani/status/1021456395349241857	
NH7445	2018-07-23 14:05	1	0	If you want to see change in Pakistan then give vote only to Tehreek Labbaik Ya RasoolAllah (peace be upon him) Islamic system can be implement in Pakistan with your votes therefore think about it # JaagnaTohParega # ٹھپا_لگاؤ_انڈیا_کو_ہراؤ # TabdeeliLahoreSe # JeetKaNishaanTeer			# JaagnaTohParega # ٹھپا_لگاؤ_انڈیا_کو_ہراؤ # TabdeeliLahoreSe # JeetKaNishaanTeer	1021456394447400961			https://twitter.com/NH7445/status/1021456394447400961	
daremys0ul	2018-07-23 14:05	0	1	bienvenide♡				1021456382795698176	1021440161677291520	fathixgoals SoyyLaCone	https://twitter.com/daremys0ul/status/1021456382795698176	