username	date	retweets	favorites	text	geo	mentions	hashtags	tweetid	conversationid	replyto	permalink	imagelink
MySideOfTheRoom	2018-07-23 12:40	0	0	Just Pinned to Home Decor: home decor | house decoration | ladder shelf | indoor plants | white | wooden shelf | interior design | simple | airy https://ift.tt/2JOrQu1				1021434884181692422			https://twitter.com/MySideOfTheRoom/status/1021434884181692422	
design_a_house	2018-07-23 10:07	0	0	Oak Finish 5 Shelf Zig Zag Floating Wall Etagere Home Living Room Den Furniture Enquire now https://ebay.to/2LCH6fe pic.twitter.com/v1clvqTscX				1021396450025115651			https://twitter.com/design_a_house/status/1021396450025115651	https://pbs.twimg.com/media/Diy6qHrWsAEDs5U.jpg
_PaigeIRL	2018-07-23 05:29	0	1	Firstly, why were you in my room And secondly, nah I didn’t take it home, it should be on the second shelve of the book shelf in my room you are more than welcome to use it until I get back				1021326310117986304	1021204150670045185	kiirenxox	https://twitter.com/_PaigeIRL/status/1021326310117986304	https://abs.twimg.com/emoji/v2/72x72/1f602.png
E3printable	2018-07-23 03:18	0	0	My fan has a new home out of the way and still able to blow air around the entire room. Fan from Clas Ohlson, shelf designed and printed by me on a Formbot Raptor using FormFutura rPET recycled Pet-G # formbot # raptor # petg # fan # shelf # custom # interiordesign # formfuturapic.twitter.com/S9Hjz4b4iE			# formbot # raptor # petg # fan # shelf # custom # interiordesign # formfuturapic	1021293399025037312			https://twitter.com/E3printable/status/1021293399025037312	
WreckItBKLYN	2018-07-22 21:46	0	1	Then he kept moving it and she never saw what it really was. Then he came home. On his next trip out there he saw that she had moved it to the living room and had it on a high shelf. OMG.				1021210015171076101	1021198559784456192	CanGal_39	https://twitter.com/WreckItBKLYN/status/1021210015171076101	
AnnaJean_N	2018-07-22 21:33	0	0	You could always send them to me! I have an empty shelf now! Jkhjhjj (ps, I just inherited a new bookshelf... So all the books that were crammed in places are finally getting real homes! And yes, I've moved Laura’s books to my room. ) pic.twitter.com/lQxpZsj8kr				1021206578945388544	1020990004879941632	ohmygouldness	https://twitter.com/AnnaJean_N/status/1021206578945388544	https://abs.twimg.com/emoji/v2/72x72/1f602.png
9livesrock	2018-07-22 11:43	0	23	Today my goals are to keep my anger in check & to go home after work tonight and put up a shelf in my room all by myself				1021058196033720322			https://twitter.com/9livesrock/status/1021058196033720322	https://pbs.twimg.com/profile_images/948368298491736065/CCahOvz7_normal.jpg
design_a_house	2018-07-22 10:17	0	0	Oak Finish 5 Shelf Zig Zag Floating Wall Etagere Home Living Room Den Furniture Ending Soon https://ebay.to/2LCH6fe pic.twitter.com/lMcjn88VpR				1021036611864334336			https://twitter.com/design_a_house/status/1021036611864334336	https://pbs.twimg.com/media/DitzYw1WsAEBsjY.jpg
awakedjh	2018-07-22 03:50	0	1	today a ghost pushed my tv's remote control off the shelf .... I was home alone... no wind in the room.... literally just fell on its own accord,... super hard... but somehow I wasn't scared? It felt calm . Like not like before				1020939119604785152			https://twitter.com/awakedjh/status/1020939119604785152	
c_greaves1	2018-07-21 17:44	0	0	Loving my glass balls ladder shelf and my home ornament in my newly decorated dining room . . . . # diy # diningroom # laddershelf # glassballs # ornaments # homedecor # nexthome… https://www.instagram.com/p/Blgl3YYlRol/?utm_source=ig_twitter_share&igshid=1c2gcl0rr4unn …			# diy # diningroom # laddershelf # glassballs # ornaments # homedecor # nexthome	1020786616367865856			https://twitter.com/c_greaves1/status/1020786616367865856	https://abs.twimg.com/emoji/v2/72x72/1f496.png
scorho	2018-07-21 14:53	0	2	Two of my book cases (and a reference shelf) are in my Schreibwinkl, my home office. I love this room. If you'd like to see it, I give a short tour here: http://scottrhoades.com/doggerybaw/?p=206 … # pwpoeprompts # pitchwars # saturdayshelfies			# pwpoeprompts # pitchwars # saturdayshelfies	1020743603520323584	1020684832177905664		https://twitter.com/scorho/status/1020743603520323584	https://pbs.twimg.com/profile_images/667195607702867970/3hmxRzl9_normal.jpg
LockCade	2018-07-21 14:50	0	1	Alright, got my room vacuumed and mostly cleaned up. Also went downstairs to wash off my desk with shelf unit. Now, I just need to wait for my brother to get home and, once we get chores done, he can help me carry it out of the basement and into my room.				1020742730669002755			https://twitter.com/LockCade/status/1020742730669002755	
design_a_house	2018-07-21 10:07	0	0	Oak Finish 5 Shelf Zig Zag Floating Wall Etagere Home Living Room Den Furniture Ends Soon https://ebay.to/2LCH6fe pic.twitter.com/MuEokY6Go3				1020671654664564737			https://twitter.com/design_a_house/status/1020671654664564737	https://pbs.twimg.com/media/DiondfCX0AEOvan.jpg
daddy_slick_	2018-07-21 09:25	0	0	I think I brought a ghost home I’m laying down and my cat is by me and I hear a loud noise I got into the living room and all my dvds are thrown off the shelf				1020661087132319749			https://twitter.com/daddy_slick_/status/1020661087132319749	https://abs.twimg.com/emoji/v2/72x72/1f610.png
devastation79	2018-07-21 02:28	0	1	So sweetie I'm trying to hang this shelf to see if it's going to work in the ONE space it possible could in all my room(than find homes for five pieces of framed artwork of all types in glass)so im here if you get tired hit me up in the a.m. but I'm Herr just bk n forth				1020556044811096064	1020548073683128320	ShawneeSwick	https://twitter.com/devastation79/status/1020556044811096064	
Amandamegs1974	2018-07-20 20:48	0	0	Omg how adorable we absolutely love to win re home them they look lovely on my living room shelf .please count me in have loved liked and shared				1020470471052144641	1020262666647064577	BullylandUK	https://twitter.com/Amandamegs1974/status/1020470471052144641	https://abs.twimg.com/emoji/v2/72x72/2764.png
laslokrasuljak	2018-07-20 19:22	0	0	Check out Happy Elephant Figure Home Decor Figurine Table Mantel Shelf Living Room Statue http://www.ebay.com/itm/-/113160072570?roken=cUgayN&soutkn=8eJv38 … via @ eBay		@ eBay		1020448785510481920			https://twitter.com/laslokrasuljak/status/1020448785510481920	
laslokrasuljak	2018-07-20 19:18	0	0	My eBay Listing: Happy Elephant Figure Home Decor Figurine Table Mantel Shelf Living Room Statue https://cgi.ebay.com/ws/eBayISAPI.dll?ViewItem&item=113160072570 …				1020447868648222720			https://twitter.com/laslokrasuljak/status/1020447868648222720	
laslokrasuljak	2018-07-20 18:15	0	0	Check out Fleur-de-lis Bookends Room Home Bookshelf Reading Set Bronze Office Decor Shelf http://www.ebay.com/itm/-/113160006059?roken=cUgayN&soutkn=4kubOX … via @ eBay		@ eBay		1020432123973414912			https://twitter.com/laslokrasuljak/status/1020432123973414912	
laslokrasuljak	2018-07-20 18:12	0	0	My eBay Listing: Fleur-de-lis Bookends Room Home Bookshelf Reading Set Bronze Office Decor Shelf https://cgi.ebay.com/ws/eBayISAPI.dll?ViewItem&item=113160006059 …				1020431187297296384			https://twitter.com/laslokrasuljak/status/1020431187297296384	
Gltco	2018-07-20 14:45	0	1	What a showstopping shelf! We love the way Becky has styled our London Bus Shelf for her little boy’s room; the stars create a magical backdrop for that extra wow factor. London Bus Shelf, now £22.40 in our Summer Sale: https://goo.gl/nWe8Fc from @mrs_tatlows_home_ pic.twitter.com/2bbgDDBYCi				1020379060621328384			https://twitter.com/Gltco/status/1020379060621328384	https://abs.twimg.com/emoji/v2/72x72/1f4f8.png
TheSuccessNetWk	2018-07-20 10:06	0	0	Very nice metal & glass wine/baker's rack. Four shelves (three are glass) with large bottom shelf. Plenty of room for your favorite wine or beverage. Will add a touch of class to any home. Must pick up or deliver for additional fee. https://www.facebook.com/1616706031/posts/10215726323783882/ …				1020308935427993600			https://twitter.com/TheSuccessNetWk/status/1020308935427993600	
TheSuccessNetWk	2018-07-20 10:05	0	0	Very nice metal & glass wine/baker's rack. Four shelves (three are glass) with large bottom shelf. Plenty of room for your favorite wine or beverage. Will add a touch of class to any home. Must pick up or deliver for additional fee. https://www.facebook.com/1616706031/posts/10215726314103640/ …				1020308687565582336			https://twitter.com/TheSuccessNetWk/status/1020308687565582336	
ahomeideas	2018-07-19 23:47	0	0	Home Decorating Ideas Living Room shelf behind couch home interior https://ift.tt/2mtK7DJ				1020153140841246722			https://twitter.com/ahomeideas/status/1020153140841246722	
Raunbow_13	2018-07-19 21:15	0	5	Can someone help me build a library area in my room asap. My book shelf fell and took the paint and parts of the wall out. I have like 50+ books with no home rn:((				1020115049338363906			https://twitter.com/Raunbow_13/status/1020115049338363906	
dahlias_n_bloom	2018-07-19 17:12	0	0	Wooden Iron Wall Shelf Wall Mounted Storage Rack Organization For Bedroom Kitchen Home Decor Kid Room DIY Wall Decoration Holder https://dahliasinbloom.net/shop/how-does-your-garden-grow/wooden-iron-wall-shelf-wall-mounted-storage-rack-organization-for-bedroom-kitchen-home-decor-kid-room-diy-wall-decoration-holder/ …pic.twitter.com/oTJkOjRnt6				1020053891608653825			https://twitter.com/dahlias_n_bloom/status/1020053891608653825	https://pbs.twimg.com/media/Dif1m7TV4AAXZMk.jpg
Wood4Good2018	2018-07-19 17:03	0	0	# craft Decorative Wall Hanging Plant Shelf Dark 9x5 Inch Rustic Wood Pot Holder Indoor Flower Stand Wooden Swing Mounted Shelves for Living Room Bathroom Bedroom Home Decor Housewarming Gift pic.twitter.com/2ojB0kx0of			# craft	1020051460523003904			https://twitter.com/Wood4Good2018/status/1020051460523003904	https://pbs.twimg.com/media/DifzZYfWAAE_jew.jpg
JohnAffilSinger	2018-07-19 05:04	0	0	Metal Storage Shelf Dorm Room 5-Tier Folding Rack Durable Home Bedroom Organizer : http://www.ebay.com/itm/232855456397 …pic.twitter.com/XNq6sXlZLf				1019870673727033344			https://twitter.com/JohnAffilSinger/status/1019870673727033344	https://pbs.twimg.com/media/DidO-StWsAAv3HG.jpg
JohnAffilSinger	2018-07-19 05:02	0	0	Check out Metal Storage Shelf Dorm Room 5-Tier Folding Rack Durable Home Bedroom Organizer http://www.ebay.com/itm/-/232855456397?roken=cUgayN&soutkn=g91aZb … via @ eBay		@ eBay		1019870069952786432			https://twitter.com/JohnAffilSinger/status/1019870069952786432	
JohnAffilSinger	2018-07-19 03:19	0	0	Metal Storage Shelf Dorm Room 5-Tier Folding Rack Durable Home Kitchen Organizer : http://www.ebay.com/itm/232855394086 …pic.twitter.com/gFrJ5stVuW				1019844110046248960			https://twitter.com/JohnAffilSinger/status/1019844110046248960	https://pbs.twimg.com/media/Dic20EqV4AAuTlC.jpg
JohnAffilSinger	2018-07-19 03:17	0	0	Check out Metal Storage Shelf Dorm Room 5-Tier Folding Rack Durable Home Kitchen Organizer http://www.ebay.com/itm/-/232855394086?roken=cUgayN&soutkn=b9vtCV … via @ eBay		@ eBay		1019843770068733952			https://twitter.com/JohnAffilSinger/status/1019843770068733952	
JohnAffilSinger	2018-07-19 03:04	0	0	Metal Storage Shelf Dorm Room 2-Tier Folding Rack Durable Home Bedroom Organizer : http://www.ebay.com/itm/232855381085 …pic.twitter.com/EbSDLtMPv9				1019840472972517376			https://twitter.com/JohnAffilSinger/status/1019840472972517376	https://pbs.twimg.com/media/DiczgXmXcAAEuq2.jpg
JohnAffilSinger	2018-07-19 03:02	0	0	Check out Metal Storage Shelf Dorm Room 2-Tier Folding Rack Durable Home Bedroom Organizer http://www.ebay.com/itm/-/232855381085?roken=cUgayN&soutkn=EN4A3w … via @ eBay		@ eBay		1019839957303734272			https://twitter.com/JohnAffilSinger/status/1019839957303734272	
JohnAffilSinger	2018-07-19 02:51	0	0	Metal Storage Shelf Dorm Room 2-Tier Folding Rack Durable Home Kitchen Organizer : http://www.ebay.com/itm/232855367402 …pic.twitter.com/nP2Ow8qwht				1019837131928363008			https://twitter.com/JohnAffilSinger/status/1019837131928363008	https://pbs.twimg.com/media/Dicwd5QWAAArPOj.jpg
JohnAffilSinger	2018-07-19 02:47	0	0	Check out Metal Storage Shelf Dorm Room 2-Tier Folding Rack Durable Home Kitchen Organizer http://www.ebay.com/itm/-/232855367402?roken=cUgayN&soutkn=DPFNSj … via @ eBay		@ eBay		1019835982835863552			https://twitter.com/JohnAffilSinger/status/1019835982835863552	
JohnAffilSinger	2018-07-19 02:28	0	0	Metal Storage Shelf Dorm Room 3-Tier Folding Rack Durable Home Kitchen Organizer : http://www.ebay.com/itm/232855340213 …pic.twitter.com/Z1kOq9SucE				1019831421630910464			https://twitter.com/JohnAffilSinger/status/1019831421630910464	https://pbs.twimg.com/media/DicrRfFWAAAvO_c.jpg
JohnAffilSinger	2018-07-19 02:25	0	0	Check out Metal Storage Shelf Dorm Room 3-Tier Folding Rack Durable Home Kitchen Organizer http://www.ebay.com/itm/-/232855340213?roken=cUgayN&soutkn=m2vLpg … via @ eBay		@ eBay		1019830681340383232			https://twitter.com/JohnAffilSinger/status/1019830681340383232	
bprice_quality	2018-07-19 02:18	0	0	Tier Corner Shelf, Dark Brown Grain/Black Home Furniture Racks Room Decor 744110379822 | eBay http://ow.ly/ZaH630l1dbD				1019828708700577792			https://twitter.com/bprice_quality/status/1019828708700577792	
ctrlpark	2018-07-19 01:18	4	105	when i get home i’ll be selling my exo albums if anyone is interested i need shelf room for my love yourself to line up				1019813696493633538			https://twitter.com/ctrlpark/status/1019813696493633538	
VSR_Premium	2018-07-18 04:48	0	0	Check out Wood Floating Shelves Wall Mounted Shelf Baroque Home Room Hall Display Decor 2p http://www.ebay.com/itm/-/163129354130?roken=cUgayN&soutkn=Z0GL8d … via @ eBay		@ eBay		1019504137678065664			https://twitter.com/VSR_Premium/status/1019504137678065664	
ComOut4Cannabis	2018-07-17 20:37	0	0	A day is coming, my brothers and sisters, when no clone shall be without a home. If no more room there will be a shelf at your gro-store where you can leave that clone for its new Mommy & Daddy who will love and care for it."No more room" - may this be your problem, too. https://twitter.com/donfazool/status/1019322966641741824 …				1019380633150345216			https://twitter.com/ComOut4Cannabis/status/1019380633150345216	https://pbs.twimg.com/media/DiVc08wUEAA08JI.jpg
PropertyRoom	2018-07-17 14:30	0	0	Fill a shelf in your home with some # Riddell mini helmets (some featuring autographs)!pic.twitter.com/pmedYUydem			# Riddell	1019288240661188608			https://twitter.com/PropertyRoom/status/1019288240661188608	https://pbs.twimg.com/media/DiU9QImXcAAUKqH.jpg
ModHomeElements	2018-07-17 13:36	2	3	Manhattan Comfort 17AMC6 Nelson Floating Shelf Panel in White $57.99 - The panel includes 8 shelves in a zig-zag style. Perfect fit for your living room, office, and bedroom. https://tinyurl.com/y98ubq8n # homedecor # interiordesignpic.twitter.com/TdgorsjwuE			# homedecor # interiordesignpic	1019274590923771906			https://twitter.com/ModHomeElements/status/1019274590923771906	https://pbs.twimg.com/media/DiUuyKNX4AAX8mE.jpg
TigermothI	2018-07-17 06:38	0	1	This shelf room divider is a great idea to zone an area yet keep all the natural light. Can't knock a bit of extra storage too! pic.twitter.com/xAmeTGh5TB				1019169574288347136			https://twitter.com/TigermothI/status/1019169574288347136	https://pbs.twimg.com/media/DiTRUePX4AEWZmA.jpg
stitchesfangirl	2018-07-16 15:38	0	5	i'm going to go out and get a shelf! and then i'm going to come home and put things on it! the room will be cleaner!!!! ᕙ[ ・ ∧ ・ ]ᕗ				1018943070556033026			https://twitter.com/stitchesfangirl/status/1018943070556033026	https://pbs.twimg.com/profile_images/963153664658558976/43b2Flle_normal.jpg
ChefSunBear	2018-07-16 09:19	1	2	Repurposing a shelf unit as a bar- $150 Refinishing hardwood floors- $1500 New living room and den furniture- $2500 New vinyl replacement windows- $7500 Buying a home and making it your own- IS FUCKING EXPENSIVE!!! (Go to hell Mastercard....)				1018847562021965825			https://twitter.com/ChefSunBear/status/1018847562021965825	
BasicBCosplay	2018-07-16 00:04	0	0	Love my new bathroom decor. Photos from @ tjmaxx shell is vintage from my grandma. Shelf from etsy! Home is starting to feel more put together one room at a time. # beachdecor # bathroomdecor… https://www.instagram.com/p/BlR0mZVAjW0/?utm_source=ig_twitter_share&igshid=j9qe80b45cml …		@ tjmaxx	# beachdecor # bathroomdecor	1018707955653464071			https://twitter.com/BasicBCosplay/status/1018707955653464071	
Inubashiji	2018-07-15 18:15	0	1	I brought my small shelf over from home and now my room actually kinda looks like a room				1018619980806610944			https://twitter.com/Inubashiji/status/1018619980806610944	https://pbs.twimg.com/profile_images/996608960600858624/p2XX9u4A_normal.jpg
Free_Asheville	2018-07-15 14:11	0	0	Wooden TV stand/entertainment center. Made for a larger size CRT TV, so will only fit smaller widescreen TVs. Good for a bedroom or kids room, or you can just use it as a normal shelf. Good condition. Free to a good home. https://asheville.craigslist.org/zip/d/tv-stand/6643962860.html?utm_source=dlvr.it&utm_medium=twitter&utm_campaign=free_asheville …pic.twitter.com/es7ZPyJtX5				1018558583263260674			https://twitter.com/Free_Asheville/status/1018558583263260674	https://pbs.twimg.com/media/DiKlogrUEAAgWvR.jpg
ImpressHome	2018-07-15 10:11	0	1	"Begin with the storage room and take it one shelf, one corner, one garbage bag, at a time." https://goo.gl/ETh7KH # Vancouver # Interiordesign # modernstyle			# Vancouver # Interiordesign # modernstyle	1018498227753144321			https://twitter.com/ImpressHome/status/1018498227753144321	
design_a_house	2018-07-15 10:03	0	0	Oak Finish 5 Shelf Zig Zag Floating Wall Etagere Home Living Room Den Furniture 10% Off! https://ebay.to/2zFe6lB pic.twitter.com/CFlwmD1LvM				1018496396356440068			https://twitter.com/design_a_house/status/1018496396356440068	https://pbs.twimg.com/media/DiJtExPWsAEq_qw.jpg
heretodestroy	2018-07-15 09:55	0	1	They should have just given it away to a good home. There's room on my shelf for any Black Sabbath album.				1018494250785394691	1018211118349717504	jerryleewilson	https://twitter.com/heretodestroy/status/1018494250785394691	
Kamen_Gamer	2018-07-15 09:36	0	1	Ketchup are people too...they need a home to live in the fridge, not being homeless in a room temperatured shelf. That's the way mama taught me.				1018489566955634688	1018457703046316032	_JenLouise_ Trent99	https://twitter.com/Kamen_Gamer/status/1018489566955634688	https://abs.twimg.com/emoji/v2/72x72/1f642.png
SammieKS13	2018-07-15 07:54	0	0	Thank you soooo much @ carriejc1983 she has found a great home on my shelf in the living room # dcbombshells # loislane # dccomics # nerd # nerdygirl # birthdaygift # thankyou # birthday # superman… https://www.instagram.com/p/BlQFhxulbpF/?utm_source=ig_twitter_share&igshid=63i1ai107wgl …		@ carriejc1983	# dcbombshells # loislane # dccomics # nerd # nerdygirl # birthdaygift # thankyou # birthday # superman	1018463702675345408			https://twitter.com/SammieKS13/status/1018463702675345408	
LockCade	2018-07-15 06:35	0	3	I really don't want to work today. I rather be at home, working on cleaning my room so I can get my desk with shelf unit out of the basement and start freeing my toys from storage... or watch the rest of season two of Voltron: Legendary Defender.				1018443843132448771			https://twitter.com/LockCade/status/1018443843132448771	
homenkitchens	2018-07-14 16:40	0	0	Sauder 418565 Adept Storage Fossil Credenza Storage credenza in...: Sauder 418565 Adept Storage Fossil Credenza Storage credenza in fossil oak finish is an attractive and practical addition to any room. Ample shelf space makes this credenza ideal for s… https://homenkitchen.tumblr.com/post/175891299412 …pic.twitter.com/hp2g0QgO9z				1018233835027394561			https://twitter.com/homenkitchens/status/1018233835027394561	https://pbs.twimg.com/media/DiF-RuEWsAAQd_S.jpg
yungbeezus	2018-07-14 15:49	0	4	last week I was telling my mom how I wanted this shelf for my room and then I came home from work and it was put up. this week I said I wanted mirror closet doors and guess what I came home to my brothers should’ve moved out years ago. I love being an only child				1018220877157228545			https://twitter.com/yungbeezus/status/1018220877157228545	https://abs.twimg.com/emoji/v2/72x72/1f917.png
Kybunker	2018-07-14 14:02	0	1	Check out # Dinosaur Bookend Set FUN and FRIENDLY Kids Room Home Decor Shelf Sitters https://www.ebay.com/itm/Dinosaur-Bookend-Set-FUN-and-FRIENDLY-Kids-Room-Home-Decor-Shelf-Sitters-/323320307987?roken=cUgayN&soutkn=GJIPj5 … via @ eBay		@ eBay	# Dinosaur	1018194136392847360			https://twitter.com/Kybunker/status/1018194136392847360	
design_a_house	2018-07-14 09:58	0	0	Oak Finish 5 Shelf Zig Zag Floating Wall Etagere Home Living Room Den Furniture Ends Soon https://ebay.to/2zFe6lB pic.twitter.com/wMv4CxvXOE				1018132592258879494			https://twitter.com/design_a_house/status/1018132592258879494	https://pbs.twimg.com/media/DiEiMkCXUAITWB_.jpg
AlanBun17	2018-07-14 06:16	0	0	4 hour shifts on Saturday are amazing. Finished now, waiting to go home to Lorna and spend the day changing up the room. Got her an ikea shelf thing for all her comics and POP figurines. Just praying she likes it				1018076699160989696			https://twitter.com/AlanBun17/status/1018076699160989696	https://abs.twimg.com/emoji/v2/72x72/1f605.png
InstantTimeDeal	2018-07-13 22:16	0	0	ad: Yaheetech 5-Shelf Units Storage Rack Corner Shelf Organization Utility Rack Multipurpose Shelf Display Rack for Home Kitchen Living Room Bedroom Office 59.1’’ Height, 2 Set https://www.amazon.com/Yaheetech-5-Shelf-Storage-Organization-Multipurpose/dp/B078HJF7NS?psc=1&SubscriptionId=AKIAINK752IUT74DHSYQ&tag=amzndeals0cd7-20&linkCode=xm2&camp=2025&creative=165953&creativeASIN=B078HJF7NS&utm_source=dlvr.it&utm_medium=twitter …pic.twitter.com/SEkkvRF0Zw				1017955981114798082			https://twitter.com/InstantTimeDeal/status/1017955981114798082	https://pbs.twimg.com/media/DiCBke3UYAAfuFf.jpg
RandyLindsaySC	2018-07-13 16:06	0	0	Check out the unique book shelf in this home's living room. # uniquehomes # coolhomes http://cpix.me/a/50255167 pic.twitter.com/CotgOY887a			# uniquehomes # coolhomes	1017862781242970112			https://twitter.com/RandyLindsaySC/status/1017862781242970112	https://pbs.twimg.com/media/DiAszhfVAAEGIaK.jpg
ImmortalLosses	2018-07-13 14:37	0	0	The male huffs as he unlocks the door and makes his way toward the library in his home, storming past every other room and turning left to enter the office and library. His feet carry him toward the ladder in the room to climb to the top shelf to retrieve the book.				1017840577591824384	1011445449696448512	lnevitableFate	https://twitter.com/ImmortalLosses/status/1017840577591824384	
tervaperse	2018-07-13 12:56	0	6	i was 12 yrs old when i found the original DVD from my town's main library. it was sitting on a shelf in a silent corner by a window. the cover drew me in so i had to rent it! i went straight back home and started watching it alone in our living room				1017814942668353536	1017811313307914240		https://twitter.com/tervaperse/status/1017814942668353536	https://pbs.twimg.com/profile_images/1018786214848188419/sgx7dsFB_normal.jpg
SheilaTeneyck	2018-07-13 11:22	0	0	SONGMICS Corner Shelf Rack, 4-Tier Office Organizer Unit, Ladder Shaped Bookcase, for Home, Living Room, Balcony, Faux Marble, Black ULLS34BW http://stylexotic.com/songmics-corner-shelf-rack-4-tier-office-organizer-unit-ladder-shaped-bookcase-for-home-living-room-balcony-faux-marble-black-ulls34bw/ …pic.twitter.com/VHFeeyYnfy				1017791283128127488			https://twitter.com/SheilaTeneyck/status/1017791283128127488	https://pbs.twimg.com/media/Dh_rxxmUcAACNX_.jpg
eugene_ritchie	2018-07-13 11:22	0	0	SONGMICS Corner Shelf Rack, 4-Tier Office Organizer Unit, Ladder Shaped Bookcase, for Home, Living Room, Balcony, Faux Marble, Black ULLS34BW http://stylexotic.com/songmics-corner-shelf-rack-4-tier-office-organizer-unit-ladder-shaped-bookcase-for-home-living-room-balcony-faux-marble-black-ulls34bw/ …pic.twitter.com/sqUBiejBO5				1017791276316614657			https://twitter.com/eugene_ritchie/status/1017791276316614657	https://pbs.twimg.com/media/Dh_rxYUV4AAp2kr.jpg
homeofbestdeals	2018-07-12 23:11	0	0	The Ikea Kallax cube shelf has to be the most versatile and functional item Ikea sells. Though fabulous for organizing, it can look quite plain and boring when you’re trying to personalize a room in your home. Take a look at these 13 BEST Ikea http://rspec.io/r/203WEW150716				1017607529516359681			https://twitter.com/homeofbestdeals/status/1017607529516359681	
laslokrasuljak	2018-07-12 17:44	0	0	Check out Blue Spiral Tear Drop Glass Art Living Room Decoration Table Mantel Shelf Home http://www.ebay.com/itm/-/113146849742?roken=cUgayN&soutkn=xzgt98 … via @ eBay		@ eBay		1017525170750218240			https://twitter.com/laslokrasuljak/status/1017525170750218240	
laslokrasuljak	2018-07-12 17:37	0	0	My eBay Listing: Blue Spiral Tear Drop Glass Art Living Room Decoration Table Mantel Shelf Home https://cgi.ebay.com/ws/eBayISAPI.dll?ViewItem&item=113146849742 …				1017523317694058496			https://twitter.com/laslokrasuljak/status/1017523317694058496	
