username	date	retweets	favorites	text	geo	mentions	hashtags	tweetid	conversationid	replyto	permalink	imagelink
BrownDethstroke	2017-12-20 13:01	1	4	6. Logan I LOVED Logan but no, it's not the next dark knight (in my opinion) What it is though is a brilliant & heart touching send off to Hugh Jackman's Wolverine & the fox X-Men era. Everything about this movie is pure art! No one will ever play X-23 as good as Dafne Keen did. pic.twitter.com/uE7LVqIIzY				943541896772706304	943529596456071169		https://twitter.com/BrownDethstroke/status/943541896772706304	https://pbs.twimg.com/media/DRgiRhmUEAAIhWZ.jpg
RowellBradley	2017-12-20 12:16	0	3	( SPOILER ALERT!)I watched it on DVD and it turns out after pausing it at the right moment, I found out I have the same blood type as Wolverine Logan's Daughter. Loved the movie to bits and the girl who played Wolverines daughter I think was X -23 was excellent and it is cool				943530631669182464	943444840343273472	WolverSteve WolverineMovie	https://twitter.com/RowellBradley/status/943530631669182464	
NerfedTV	2017-12-15 03:29	0	0	With the # DisneyFoxDeal happening, and @ RealHughJackman not wanting to return to Wolverine, I really hope they fully embrace Laura Kinney. I know FOX has a movie in the works with Craig Kyle (X-23 Creator) and James Mangold (Logan Director) working on it. # AllNewWolverinepic.twitter.com/Y1Av4KtPyp		@ RealHughJackman	# DisneyFoxDeal # AllNewWolverinepic	941586102221266944			https://twitter.com/NerfedTV/status/941586102221266944	
Jrnotjnr	2017-12-14 20:18	9	27	Fox did a great job casting Hugh Jackman as Logan. Marvel finding the right suitor is almost impossible. Unless they make X-23 their new Wolverine. Instead of recasting Logan with a new actor.				941477454232870912			https://twitter.com/Jrnotjnr/status/941477454232870912	
putztrouxa	2017-12-14 09:03	0	0	Hugh Jackman tbm nasceu pra interpretar o Wolverine, mas acho que ele ñ volta mais. E devem fazer um reboot de Logan com outro ator ou usar a Laura (x-23) pra substituir em uma nova franquia.				941307739732631553	941307260231409667		https://twitter.com/putztrouxa/status/941307739732631553	https://pbs.twimg.com/profile_images/1015362789404127232/RVHyVJav_normal.jpg
Burncoat_R	2017-12-11 12:01	0	0	X-23 would be great, especially since Disney Marvell wants to make sure everyone is introduced first and she was in Logan. Too bad it won't happen				940265330861133824	940260482656751622	IntegerDevourer RealHughJackman	https://twitter.com/Burncoat_R/status/940265330861133824	
ambhakeer0501	2017-12-10 21:26	0	0	I've heard the rumors. And I also want him to return for logan-spinoff x-23 movies for a valuable mentor-cameo				940045043968065537	939932750357979136	ComicBook_Movie RealHughJackman Marvel	https://twitter.com/ambhakeer0501/status/940045043968065537	
TuckReal	2017-12-10 14:43	0	0	But what’s going to happen to the Alien franchise, Predator franchise, Deadpool franchise and specially Logan Even though it was the last of Hugh Jackman’s as Wolverine but I heard there was going to be a sequel about X-23 is the cloned daughter of Wolverine, but I guess not https://twitter.com/CNBC/status/938060096852123648 …				939943699240321025			https://twitter.com/TuckReal/status/939943699240321025	https://abs.twimg.com/emoji/v2/72x72/1f61e.png
SethWmJohnson	2017-12-07 10:02	0	2	I hope not. Logan was an amazing Swan Song for @ RealHughJackman and @ SirPatStew as those iconic characters. I’d like to see more X-23 as the new Wolverine.		@ RealHughJackman @ SirPatStew		938785867040284673	938782027406499846	robertliefeld	https://twitter.com/SethWmJohnson/status/938785867040284673	
vannyarevalox2	2017-12-07 00:22	1	1	Logan deserves an Oscar(s) !!! Hugh Jackman killed it along with Patrick Stewart & on top of that gave us Dafne Keen who was a perfect X-23 !!! https://twitter.com/mang0ld/status/938521767521296384 …				938639742240833536			https://twitter.com/vannyarevalox2/status/938639742240833536	
TomatazosCom	2017-11-23 12:58	0	6	Tras el retiro de Hugh Jackman como # Logan, X-23 será la encargada de continuar con su saga, pero ¿Te gustaría este look para su siguiente película? http://bit.ly/2zveS3T pic.twitter.com/BvG7ckELjq			# Logan	933756611381821440			https://twitter.com/TomatazosCom/status/933756611381821440	https://pbs.twimg.com/media/DPVeUbhUEAAZY5k.jpg
Satan_H1mself	2017-11-08 09:21	0	1	The entire old man Logan revolved around the Hulks and not that idiot ripoff x 23. Revolved around sorcery and magic. Where was that? Hugh Jackman stated if and only if wolverine was under the mcu then he might have played wolverine more.				928266204527124480	927641578121977856	thelonelydalek Marvel	https://twitter.com/Satan_H1mself/status/928266204527124480	
JMax1713	2017-11-06 16:28	1	1	@ RealHughJackman @ DafneKeen Old Man Logan Wolverine & X-23 pic.twitter.com/5fuk3zKOCD		@ RealHughJackman @ DafneKeen		927648986332250112			https://twitter.com/JMax1713/status/927648986332250112	https://pbs.twimg.com/media/DN-rx3AUIAAKgw5.jpg
krissssm	2017-10-31 19:29	1	7	My daughter as Laura AKA X-23 # x23 # Logan @ RealHughJackman # DafneKeenpic.twitter.com/3Stk810KZT		@ RealHughJackman	# x23 # Logan # DafneKeenpic	925505059907043329			https://twitter.com/krissssm/status/925505059907043329	https://pbs.twimg.com/media/DNgN73bUIAAS0JF.jpg
Hasnajarooriha1	2017-10-27 03:18	0	0	Logan X-23 Spinoff: Hugh Jackman REVEALS his role in Laura sequel http://fb.me/7LcJ3NNTU				923811202513416192			https://twitter.com/Hasnajarooriha1/status/923811202513416192	
Eddie509	2017-10-26 14:32	0	1	Logan may be gone but he lives on through X-23. I’m glad James Mangold is working on the spin-off script.				923618247496232960			https://twitter.com/Eddie509/status/923618247496232960	
LaGuiaDelVaron	2017-10-25 13:45	6	27	Prepárense: el director de 'Logan' ya está trabajando en un spin-off sobre X-23; ¿saldrá Hugh Jackman? - https://www.laguiadelvaron.com/un-spin-off-de-logan-dobre-x-23-esta-siendo-escrito-portadalista/ …pic.twitter.com/JOBnEdMvwM				923244072793460736			https://twitter.com/LaGuiaDelVaron/status/923244072793460736	https://pbs.twimg.com/media/DNAFlyeVQAAD77y.jpg
RamasScreen	2017-10-25 09:46	0	0	LOGAN/WOLVERINE Spinoff Movie About X-23/LAURA In The Works. Hugh Jackman Won’t Mind Wolverine Recast http://www.ramascreen.com/loganwolverine-spinoff-movie-about-x-23laura-in-the-works-hugh-jackman-wont-mind-wolverine-recast/ …				923183950956294144			https://twitter.com/RamasScreen/status/923183950956294144	
Otacom1313	2017-10-25 09:32	0	0	คิดถึงหนูน้อย X-23 กันมั้ย? หลังจาก Logan ปิดฉากตำนาน Wolverine ของป๋า Hugh Jackman ไปแล้ว... http://fb.me/5cNvvUPkS				923180393582481408			https://twitter.com/Otacom1313/status/923180393582481408	
AyebeLamAnthony	2017-10-25 06:46	0	0	‘Logan’ Spinoff Script Focusing on X-23 in the Works; Hugh Jackman Not Involved http://fb.me/AenIvZyP				923138637394571264			https://twitter.com/AyebeLamAnthony/status/923138637394571264	
renatodscunha	2017-10-18 19:33	1	2	X-23 illustration poster! # x23 # logan # dafnekeen @ RealHughJackman @ WolverineMovie @ FoxFilmdoBrasil http://wp.me/p2dPA-1vS pic.twitter.com/CfSiMX6YVz		@ RealHughJackman @ WolverineMovie @ FoxFilmdoBrasil	# x23 # logan # dafnekeen	920794881521577985			https://twitter.com/renatodscunha/status/920794881521577985	https://abs.twimg.com/emoji/v2/72x72/1f44a-1f3fc.png
mesploto	2017-10-17 10:04	1	3	Hugh Jackman and Dafne Keen (Logan y X-23) http://www.mesploto.com/hugh-jackman-and-dafne-keen-logan-x-23/ …pic.twitter.com/4Tj2PFJvNl				920289530451697664			https://twitter.com/mesploto/status/920289530451697664	https://pbs.twimg.com/media/DMWGcx5V4AAlfvm.jpg
thewineguy61	2017-10-10 17:04	0	0	@ PatrickStew awesome. @ DafneKeen just amazing.Can't wait to see X-23's cycle.She deserves one!I'm sad but I guys did such a great job! # Logan		@ PatrickStew @ DafneKeen	# Logan	917858448255176705	917857873434218496		https://twitter.com/thewineguy61/status/917858448255176705	https://pbs.twimg.com/profile_images/933261288100294656/cx5hYJGq_normal.jpg
WeaponGojiraX	2017-09-26 17:04	0	0	As long as story takes place before Logan it doesn’t matter & as long as X-23 is involved.				912784879498223617	912705978746986496	Osc_Schnauzer14 WolverSteve	https://twitter.com/WeaponGojiraX/status/912784879498223617	
MaddieE55025578	2017-09-21 11:52	1	4	Don't recast the Wolverine period. Hugh Jackman was the only Logan Howlett and will be the only one. X-23 is Logans replacement				910894590114152448	910892690975477760	XMenFilms	https://twitter.com/MaddieE55025578/status/910894590114152448	
MaddieE55025578	2017-09-21 10:33	3	3	Don't you dare replace the Wolverine. Hugh Jackman was the one and the only Wolverine. Pass it on to X-23 don't replace Logan please				910874537151029248	910661856221528065	ComicBookNOW	https://twitter.com/MaddieE55025578/status/910874537151029248	
renatodscunha	2017-09-14 21:05	3	4	BRAND NEW!! X-23 illustration poster! # x23 # logan # dafnekeen @ RealHughJackman @ WolverineMovie @ FoxFilmdoBrasil http://wp.me/p2dPA-1vS pic.twitter.com/rMwYUodDDE		@ RealHughJackman @ WolverineMovie @ FoxFilmdoBrasil	# x23 # logan # dafnekeen	908496952928686081			https://twitter.com/renatodscunha/status/908496952928686081	https://abs.twimg.com/emoji/v2/72x72/1f44a-1f3fc.png
renatodscunha	2017-09-13 20:31	2	2	BRAND NEW!! X-23 illustration poster! # x23 # logan # dafnekeen @ RealHughJackman @ WolverineMovie @ FoxFilmdoBrasil http://wp.me/p2dPA-1vS pic.twitter.com/0ANlmoPuK4		@ RealHughJackman @ WolverineMovie @ FoxFilmdoBrasil	# x23 # logan # dafnekeen	908125927963549696			https://twitter.com/renatodscunha/status/908125927963549696	https://abs.twimg.com/emoji/v2/72x72/1f44a-1f3fc.png
renatodscunha	2017-09-13 09:58	1	1	BRAND NEW!! X-23 illustration poster! # x23 # logan # dafnekeen @ RealHughJackman @ WolverineMovie @ FoxFilmdoBrasil http://wp.me/p2dPA-1vS pic.twitter.com/htZN4wMUqi		@ RealHughJackman @ WolverineMovie @ FoxFilmdoBrasil	# x23 # logan # dafnekeen	907966643892047872			https://twitter.com/renatodscunha/status/907966643892047872	https://abs.twimg.com/emoji/v2/72x72/1f44a-1f3fc.png
4gotnsun	2017-09-10 21:44	0	0	RIP Len. We wouldn't know Hugh Jackman, Old Man Logan, X-23, and countless others if it wasn't for Len's genius creation https://twitter.com/DCComics/status/907025763404201984 …				907057259368329216			https://twitter.com/4gotnsun/status/907057259368329216	https://pbs.twimg.com/media/DJZnHnMV4AAMQU7.jpg
DapDapBabii	2017-09-04 03:21	0	0	Logan! Some scenes between Sir Patrick Stewart & Hugh Jackman and the girl who played Wolverine's daughter, Laura / X-23 caught me off guard				904605267459010561	904603687921754112	KissFMUK	https://twitter.com/DapDapBabii/status/904605267459010561	
Jones6192	2017-08-28 20:20	0	0	I liked a @ YouTube video http://youtu.be/Ei4KyYyjNi0?a Dafne Keen auditions for the role of X-23/Laura in "Logan" opposite Hugh Jackman		@ YouTube		902324959514648577			https://twitter.com/Jones6192/status/902324959514648577	
Crassh11	2017-08-15 19:01	0	0	DEADPOOL WITH LOGAN AND X.23 @ RealHughJackman pic.twitter.com/cAr0YTFi7e		@ RealHughJackman		897594201214529536			https://twitter.com/Crassh11/status/897594201214529536	https://pbs.twimg.com/media/DHTlJgMXUAAM_Nk.jpg
yurciaga	2017-08-12 21:12	0	0	Wolverine Movies: The Evolution of Hugh Jackman’s Logan – http://ComingSoon.net http://www.comingsoon.net/movies/features/809427-logan-wolverine-movies … Love to see X-23 movie !				896540008710000642			https://twitter.com/yurciaga/status/896540008710000642	
JMignt	2017-08-07 18:52	0	0	Hey @ RealHughJackman i drawn Logan and X-23 during my holidays. How is it ? pic.twitter.com/dBHeeVXQyy		@ RealHughJackman		894692826507866113			https://twitter.com/JMignt/status/894692826507866113	https://pbs.twimg.com/media/DGqWYIZWAAA0TNd.jpg
libelulademiel	2017-08-04 19:39	2	1	Logan. - Final inesperado, llore un mar. - X-23 era lo mejor. - Hugh Jackman siendo un actor increíble. pic.twitter.com/6C188c1ECK				893617520950640641	893560783618965504	libelulademiel	https://twitter.com/libelulademiel/status/893617520950640641	https://pbs.twimg.com/media/DGbEONfUIAE-i-f.jpg
Raimondkirr3	2017-07-22 04:06	0	0	Mulle meeldis @ YouTube video LOGAN Movie Clip - Dafne Keen's X 23 Audition - Patrick Stewart and Hugh Jackman Marvel Movie		@ YouTube		888671574009761792			https://twitter.com/Raimondkirr3/status/888671574009761792	
ja117mie	2017-07-10 07:42	0	0	I liked a @ YouTube video http://youtu.be/HtjmFdBH0Vg?a LOGAN Movie Clip - Dafne Keen's X 23 Audition - Patrick Stewart and Hugh Jackman		@ YouTube		884377206318919681			https://twitter.com/ja117mie/status/884377206318919681	
Dan_JADO	2017-07-10 06:55	0	0	Me ha gustado un vídeo de @ YouTube (http://youtu.be/KLgbbEnxcW8?a - Dafne Keen audición X 23 Laura en "Logan" Hugh Jackman).		@ YouTube		884365375990845440			https://twitter.com/Dan_JADO/status/884365375990845440	
D1ru_FX	2017-07-10 02:58	0	0	@ DafneKeen Great job in the movie, I'll be waiting for more X-23! Make Logan Proud!		@ DafneKeen		884305743125598208	875499728934510593	RealHughJackman DafneKeen	https://twitter.com/D1ru_FX/status/884305743125598208	
vErGiL1991	2017-07-08 03:07	1	1	Me gustó un video de @ YouTube http://youtu.be/KLgbbEnxcW8?a Dafne Keen audición X 23 Laura en "Logan" Hugh Jackman		@ YouTube		883583354876162048			https://twitter.com/vErGiL1991/status/883583354876162048	
KFTworkout	2017-07-06 04:21	0	1	X-23 # Logan @ WolverineMovie @ DafneKeen @ RealHughJackman https://twitter.com/wolverinemovie/status/871834039740583936 …		@ WolverineMovie @ DafneKeen @ RealHughJackman	# Logan	882877045474119682			https://twitter.com/KFTworkout/status/882877045474119682	https://pbs.twimg.com/media/DBlIRGgVYAAwNv7.jpg
ebi436	2017-07-05 20:37	0	0	I liked a @ YouTube video http://youtu.be/HtjmFdBH0Vg?a LOGAN Movie Clip - Dafne Keen's X 23 Audition - Patrick Stewart and Hugh Jackman		@ YouTube		882760282048745472			https://twitter.com/ebi436/status/882760282048745472	
WiyuxGaming	2017-07-05 18:42	0	0	Me gustó un video de @ YouTube http://youtu.be/KLgbbEnxcW8?a Dafne Keen audición X 23 Laura en "Logan" Hugh Jackman		@ YouTube		882731545110425601			https://twitter.com/WiyuxGaming/status/882731545110425601	
OfficialJACB	2017-07-04 02:19	0	0	Me ha gustado un vídeo de @ YouTube (http://youtu.be/KLgbbEnxcW8?a - Dafne Keen audición X 23 Laura en "Logan" Hugh Jackman).		@ YouTube		882121645774835717			https://twitter.com/OfficialJACB/status/882121645774835717	
Welsh_Harls88	2017-07-02 14:32	0	2	Cool beans! Check out @ heroesofgeek's # Logan and my # Laura! # XmenForever # cosplay # X-23 # Marceline # geeks # cons # mutantandproudpic.twitter.com/6PiyqvgCRh		@ heroesofgeek	# Logan # Laura # XmenForever # cosplay # X # Marceline # geeks # cons # mutantandproudpic	881581484213235712	881573445762404353	justaddclaws WolverSteve	https://twitter.com/Welsh_Harls88/status/881581484213235712	https://pbs.twimg.com/media/DDwBrcdWsAAhujF.jpg
FeroFenix	2017-06-26 20:39	0	0	Me ha gustado un vídeo de @ YouTube (http://youtu.be/KLgbbEnxcW8?a - Dafne Keen audición X 23 Laura en "Logan" Hugh Jackman).		@ YouTube		879499279471136772			https://twitter.com/FeroFenix/status/879499279471136772	
thakid_aaron	2017-06-19 00:58	0	1	Logan was such an amazing movie..perfect sending off for Hugh Jackman and his Wolverine..and Dafne Keen was a BEAST, so perfect for X-23				876665483247968256			https://twitter.com/thakid_aaron/status/876665483247968256	
twentyoneaugust	2017-06-18 05:39	0	0	I liked a @ YouTube video http://youtu.be/4x65O30c_vM?a LOGAN Promo Clip - Dafne Keen's X-23 Audition (2017) Hugh Jackman X-Men Wolverine		@ YouTube		876373707496804352			https://twitter.com/twentyoneaugust/status/876373707496804352	
Sweggy_Spoder	2017-06-15 21:15	0	0	Please tell me the claws have been passed you will always be my Logan, Hugh, but I NEED MORE X-23! Dafne was outstanding!				875522156662329346	875499728934510593	RealHughJackman DafneKeen	https://twitter.com/Sweggy_Spoder/status/875522156662329346	https://abs.twimg.com/emoji/v2/72x72/1f60d.png
Bournekiller	2017-06-15 20:04	0	0	After seeing Logan when it was in pictures I hope to see X-23 reappear in the future				875504299131916288	875499728934510593	RealHughJackman DafneKeen	https://twitter.com/Bournekiller/status/875504299131916288	