username	date	retweets	favorites	text	geo	mentions	hashtags	tweetid	conversationid	replyto	permalink	imagelink
ElizabethllorT	2018-07-23 01:31	26	535	DON'T EVER LIE TO ME AGAIN AND TELL ME THE ICE CREAM MACHINE ISN'T WORKING! OR ELSE!!!				1021266635422920706	1021234525626609666	scrueggs realDonaldTrump	https://twitter.com/ElizabethllorT/status/1021266635422920706	
thecommish94	2018-07-23 01:22	0	0	To Iranian President Rouhani: THIS FUCK IS A JOKE WE AS A NATION DESPISE HIM OTHER THAN HIS BASE WHICH IS 30% PROBABLY LINE THE HARDLINERS IN IRAN I CANT FIGURE OUT PUNCTUATION BUT AT LEAST IM NOT THE PRESIDENT I WANT 2 SCOOPS OF ICE CREAM MAGA WITCH HUNT				1021264188843339778	1021234525626609666	realDonaldTrump	https://twitter.com/thecommish94/status/1021264188843339778	
dresswhisperer	2018-07-23 01:11	0	1	Did he only get 1 scoop of ice cream for dessert?				1021261553360723970	1021234525626609666	rsmale realDonaldTrump	https://twitter.com/dresswhisperer/status/1021261553360723970	
proudliberal63	2018-07-23 01:00	0	0	@ realDonaldTrump Somebody needs to call the men in the white suits,for real this time! Tell them to bring that nice jacket as well. Be a good boy Mr president and go with the men, they’ll make sure you get a big piece of cake and TWO scoops of ice cream # Jesus! # MoreWhiskeyhttps://twitter.com/realdonaldtrump/status/1021234525626609666 …		@ realDonaldTrump	# Jesus # MoreWhiskeyhttps	1021258734427725826			https://twitter.com/proudliberal63/status/1021258734427725826	https://abs.twimg.com/emoji/v2/72x72/1f602.png
JohnCardarella	2018-07-23 00:45	0	1	Clearly the @ WhiteHouse ran out of ice cream pic.twitter.com/ftSdvD43FW		@ WhiteHouse		1021255019608395776	1021234525626609666	realDonaldTrump	https://twitter.com/JohnCardarella/status/1021255019608395776	
DirtyFcknDanglz	2018-07-23 00:39	0	0	To @ McDonalds NEVER, EVER SAY YOUR ICE CREAM MACHIBE IS BROKEN AGAIN OR YOU WILL SUFFER CONSEQUENCES THE LIKES OF WHICH FEW THROUGHOUT HISTORY HAVE EVER SUFFERED BEFORE. WE ARE NO LONGER A PEOPLE THAT WILL STAND FOR YOUR LIES AND DECEIT. GIVE ME ICE CREAM!		@ McDonalds		1021253352598982657	1021234525626609666	realDonaldTrump	https://twitter.com/DirtyFcknDanglz/status/1021253352598982657	
KellyPawlak	2018-07-23 00:21	0	0	You should really cut back to one scoop if ice cream after dinner -- the blood sugar hit is clearly aggravating your dementia				1021248950614085634	1021234525626609666	realDonaldTrump	https://twitter.com/KellyPawlak/status/1021248950614085634	
pjohnson360	2018-07-23 00:21	0	0	Looks like someone was denied their French fries, double Big Mac, and two scoops of ice cream.				1021248884809531392	1021234525626609666	realDonaldTrump	https://twitter.com/pjohnson360/status/1021248884809531392	
stlkatydid	2018-07-23 00:14	0	0	Hey, Donald, what does 13+ 4 equal? If you answer correctly you can have an extra scoop of vanilla ice cream tonight.				1021247071049986048	1020800615226793986	realDonaldTrump	https://twitter.com/stlkatydid/status/1021247071049986048	
CGM719	2018-07-23 00:12	0	0	Must Be Bored tonite Mr. President! No Ice Cream ?				1021246763489988608	1021234525626609666	realDonaldTrump	https://twitter.com/CGM719/status/1021246763489988608	
respecttheworl2	2018-07-23 00:09	0	0	I wonder what causes the @ POTUS’ anger issues. Not enough Big Macs, golfing, chocolate cake, or ice cream? Or maybe an unhappy marital life? For the sake of world peace, will someone get this man access to a Stormy Daniels’ movie ASAP?		@ POTUS		1021245963581771776	1021234525626609666	realDonaldTrump	https://twitter.com/respecttheworl2/status/1021245963581771776	
andy_bernadett	2018-07-23 00:03	0	0	That's a bit chippy, only one scoop of ice cream tonight?				1021244387194310658	1021234525626609666	realDonaldTrump	https://twitter.com/andy_bernadett/status/1021244387194310658	
ericdbloom	2018-07-22 23:55	0	0	Three scoops of ice cream tonight?				1021242303065702400	1021234525626609666	realDonaldTrump	https://twitter.com/ericdbloom/status/1021242303065702400	
JayCrawford76	2018-07-22 23:55	0	0	Get your third scoop of ice cream and ask them to tuck you in.				1021242283553959937	1021234525626609666	realDonaldTrump	https://twitter.com/JayCrawford76/status/1021242283553959937	
Subvertica	2018-07-22 23:53	0	0	Did you only get one scoop of ice cream tonight?				1021241928057171968	1021234525626609666	realDonaldTrump	https://twitter.com/Subvertica/status/1021241928057171968	
Todd_SpenceJr	2018-07-22 23:42	0	2	Me when I open the freezer to find my ice cream gone.				1021239056670371840	1021234525626609666	realDonaldTrump	https://twitter.com/Todd_SpenceJr/status/1021239056670371840	https://abs.twimg.com/emoji/v2/72x72/1f92c.png
thoudailyblab	2018-07-22 23:36	0	1	Someone didn't get their 2 scoops of ice cream after dinner....				1021237522473467904	1021234525626609666	realDonaldTrump	https://twitter.com/thoudailyblab/status/1021237522473467904	
adamselzer	2018-07-22 23:34	0	0	And in three months you’ll be having a summit, kissing Rouhani’s ass and calling it ice cream. I know it, you know it, everyone knows it.				1021237126212579328	1021234525626609666	realDonaldTrump	https://twitter.com/adamselzer/status/1021237126212579328	
ReallyGoddess	2018-07-22 23:34	1	2	Did you have a fight with your lover, Putin? oh honey, do like the rest of us. Buy some ice cream, play Pretty Woman, and never, ever tweet or text while hangry, unmedicated or drunk! this shit haunts u forever.				1021237108986601472	1021234525626609666	realDonaldTrump	https://twitter.com/ReallyGoddess/status/1021237108986601472	
vaswati16th	2018-07-22 23:34	0	0	Time for your two scoops of ice cream with a generous helping of valium.				1021237102409854976	1021234525626609666	realDonaldTrump	https://twitter.com/vaswati16th/status/1021237102409854976	
Christina0059	2018-07-22 23:27	0	0	We get it!!.. U don't like obama or clinton... But you're over 70 years old.. & 4 now, U are the president, no matter how U stole it.. when are U going to let the Obama, Clinton pouting go? GROW UP & STOP ACTING LIKE A 7 YEAR OLD that didnt get the flavor of ice cream U wanted				1021235443986321409	1021158915206152193	realDonaldTrump	https://twitter.com/Christina0059/status/1021235443986321409	
SanchiYasui	2018-07-22 23:15	0	0	How can you say others lie if you have ever told a lie? If a lie falls in the forest, does anybody hear? Why have you abdicated your god given gift to think for yourself? YOU discern lies. Or just keep eating that ice cream and let MSNBS do all the heavy lifting for you				1021232276519116800	1020984152357777408	ruby62 realDonaldTrump	https://twitter.com/SanchiYasui/status/1021232276519116800	
katywh20	2018-07-22 21:27	1	1	The 2 of you could drive any woman to eat a half gal of ice cream ha ha				1021205220381126656	1020638469087875072	katywh20 tato_kay	https://twitter.com/katywh20/status/1021205220381126656	
jeankrak	2018-07-22 20:59	0	0	On Monday: “Somebody bring me my ice cream 2-scoops. Where’s my Ivanka-wonky? Daddy wants a huggy.” The man is deranged.				1021197980957802497	1021158915206152193	errolbarnett amandadeibert realDonaldTrump	https://twitter.com/jeankrak/status/1021197980957802497	
ttweets_two	2018-07-22 20:25	2	6	Have some ice cream! pic.twitter.com/pIcDlFn6Ok				1021189566169075712	1021137490252640258	realDonaldTrump SenatorDole	https://twitter.com/ttweets_two/status/1021189566169075712	https://pbs.twimg.com/media/Div-ebQXcAAjvql.jpg
HearSomeJoke	2018-07-22 20:21	0	1	Did @ realDonaldTrump tell you what kind of ice cream you were allowed to get? You can lick the ice cream while you lick his boots. # TraitorRoy		@ realDonaldTrump	# TraitorRoy	1021188591001788416	1021144990846803968	RoyBlunt	https://twitter.com/HearSomeJoke/status/1021188591001788416	
SusanDoyle1963	2018-07-22 19:18	0	3	So when # KimJongUn broke it off with Demented Donny Two Scoops Did baby Don eat 1 pint or one gallon of ice cream with his McDonalds? @ realDonaldTrump Bigly sad		@ realDonaldTrump	# KimJongUn	1021172742282928128			https://twitter.com/SusanDoyle1963/status/1021172742282928128	
DDBrowsAcctMgr	2018-07-22 19:06	0	1	haha YES! I can see trump putting his lips up to the slot that they slide the food through, every day, yelling "It was all a WITCH HUNT! Why didn't Obama do anything?! I shouldn't be here, I DID NOTHING WRONG! Also, can I get some extra bread with this? And some ice cream!!"				1021169569086562310	1021158915206152193	PalmerReport realDonaldTrump	https://twitter.com/DDBrowsAcctMgr/status/1021169569086562310	
PMcinaw	2018-07-22 19:04	0	0	He wanted to but your buddy mitch said no. Go eat your ice cream and put your phone down. # PutinsPuppet # TraitorInChief			# PutinsPuppet # TraitorInChief	1021169155393957888	1021158915206152193	realDonaldTrump	https://twitter.com/PMcinaw/status/1021169155393957888	
theresa62605716	2018-07-22 18:59	0	3	He sounds scared and weak. And guilty af. Maybe they ran out of ketchup for his overdone steak. And only one scoop of ice cream as punishment for his debacle of the Helinski Summit. He's hangry and he is getting fatter and more unhinged by the day!				1021167790940565504	1021158915206152193	K200mph realDonaldTrump	https://twitter.com/theresa62605716/status/1021167790940565504	
tafkam08	2018-07-22 18:45	0	0	For reals. I’m sure the ice cream machine is never broken at the one he frequents.				1021164408553295879	1021158915206152193	DaleMoss2 realDonaldTrump	https://twitter.com/tafkam08/status/1021164408553295879	https://abs.twimg.com/emoji/v2/72x72/1f602.png
trump_douchebag	2018-07-22 18:27	0	1	Umm...we said this about 14 times now, big guy. It's gonna be okay. We'll take our meds, have some ice cream, and wait for the FBI to show up. Peachy!				1021159733212991491	1021158915206152193	realDonaldTrump	https://twitter.com/trump_douchebag/status/1021159733212991491	
trump2trumpIRL	2018-07-22 18:25	0	0	Aight, @ realDonaldTrump, maybe its ice cream time!		@ realDonaldTrump		1021159223529562113			https://twitter.com/trump2trumpIRL/status/1021159223529562113	
trump2trumpIRL	2018-07-22 16:25	0	0	Ok ok ok, @ realDonaldTrump, I know the Welwyn Garden City Party are on your mind but its ice cream time!		@ realDonaldTrump		1021129016932216832			https://twitter.com/trump2trumpIRL/status/1021129016932216832	
trump2trumpIRL	2018-07-22 16:15	0	0	Yo Prez, @ realDonaldTrump, I know the The House Party - Homes For Londoners are on your mind but its ice cream time!		@ realDonaldTrump		1021126560252932096			https://twitter.com/trump2trumpIRL/status/1021126560252932096	
alcpjr	2018-07-22 15:55	0	1	Getting the Police or the DOJ or the FBI to own up is harder than getting a 3 year old to own up when they talk ice cream without permission				1021121584218689536	1020828400150294529	TomFitton realDonaldTrump	https://twitter.com/alcpjr/status/1021121584218689536	
stephen_smay	2018-07-22 14:10	0	0	I agree. You are SOOOO bad for our country. Please double up on the bacon cheeseburgers and have four scoops of ice cream. # pus_filled_boil			# pus_filled_boil	1021095194509230080	1021020863733420032	realDonaldTrump	https://twitter.com/stephen_smay/status/1021095194509230080	
dazzle_lax	2018-07-22 13:50	0	1	Late addition @ corndawg13 and ice cream any type anytime!		@ corndawg13		1021090147704614913	1021077603430457344	dazzle_lax thelanceandre	https://twitter.com/dazzle_lax/status/1021090147704614913	
Garymar46004602	2018-07-22 13:48	0	0	Russia doesn’t want peace They want to end all democracies around the world You don’t make friends with Putin but President Doucebag Can’t seem to comprehend that. You must stand up to the bully, not buy him a ice cream cone and go skipping through Donnyland				1021089688042590209	1021020863733420032	rocktill1 realDonaldTrump	https://twitter.com/Garymar46004602/status/1021089688042590209	
DesMoinesghost	2018-07-22 13:28	0	1	Somebody took their conspiracy pills this morning . Sadly, I fully expect your next tweet to state that Hillary has left subliminal messages on all the Whitehouse toilet paper. The TP rolls call to you late at night between Big Macs and ice cream treats.				1021084518281895937	1021016070134648833	realDonaldTrump PeteHegseth FoxNews	https://twitter.com/DesMoinesghost/status/1021084518281895937	https://abs.twimg.com/emoji/v2/72x72/1f602.png
NerdimusSupreme	2018-07-22 12:23	0	0	I am sure he took you out for ice cream for being such a great asset. # YouCantReasonWithTreasonpic.twitter.com/DrwutEE6H1			# YouCantReasonWithTreasonpic	1021068103159955456	1021020863733420032	realDonaldTrump	https://twitter.com/NerdimusSupreme/status/1021068103159955456	https://pbs.twimg.com/media/DiuPuQ5UEAA3tA5.jpg
geborgenheit4	2018-07-22 11:08	0	0	Witch hunt! Disgusting! Nice! We wil see. Nobody knows. Maybe. I said wouldn't. Stable genius. Shameful. Smart. Know words. Date my ivanka. 3 wives. Hold hands. Bald. Covfefe. Kfc. Mcdo. Doin great. CJina. Ice cream. Mostly i associate u with these. Funny.				1021049380999086080	1021007656511852544	realDonaldTrump	https://twitter.com/geborgenheit4/status/1021049380999086080	
p_trish529	2018-07-22 10:29	0	0	. @ realDonaldTrump You deserve a bucket or two. Make sure you get some chocolate cake too, with lots and lots of ice cream. https://twitter.com/kfc/status/1011375987261624321 …		@ realDonaldTrump		1021039640134942721			https://twitter.com/p_trish529/status/1021039640134942721	https://pbs.twimg.com/amplify_video_thumb/1010162224470609920/img/vjMMI3YPlfLX6zeg.jpg
Dawno8385	2018-07-22 10:15	1	4	You're losing it, Drumpfy. You KNOW they have you. You're going to jail. No tanning bed No orange hair color No dental veneers No gold toilets No two scoops of ice cream No NOTHING You can rant and rave about HRC and the Dems all you want. Theyre NOT going to jail. YOU are. Bye.				1021036104101892097	1020984152357777408	realDonaldTrump	https://twitter.com/Dawno8385/status/1021036104101892097	
bryned	2018-07-22 09:59	0	0	Was there cake and ice cream?				1021031895008727041	1021020863733420032	realDonaldTrump	https://twitter.com/bryned/status/1021031895008727041	
FrankReichlin	2018-07-22 09:49	0	2	Hey, pal. I have a question for you. When you're in prison in a year or so, are you going to keep referring to yourself in the third person? Like: "If inmate 4583221 doesn't get two scoops of ice cream, someone's gonna get shivved."				1021029499008364544	1021016070134648833	realDonaldTrump FoxNews	https://twitter.com/FrankReichlin/status/1021029499008364544	
TenaciousEye	2018-07-22 09:38	1	8	Lies...and ice cream (2 scoops).				1021026707942371328	1021011761791524864	looklikeoprah2 tedlieu	https://twitter.com/TenaciousEye/status/1021026707942371328	
KenThompson18	2018-07-22 09:20	0	0	If by great you mean you agreed to bend over to Putin in every way, then yeah, I guess. Did he give you 2 scoops of ice cream?				1021022197530292224	1021020863733420032	realDonaldTrump	https://twitter.com/KenThompson18/status/1021022197530292224	
OhGawdAMusician	2018-07-22 07:56	1	0	Self-licking ice cream cone! Unless heard from you within 24 hours, I am stealing that phrase.				1021001008992980992	1020856217944711173	TomFitton realDonaldTrump	https://twitter.com/OhGawdAMusician/status/1021001008992980992	
SacTownGrandma	2018-07-22 02:44	0	0	Oh, you poor baby, you can’t even spell “collusion,” let alone use it in a sentence. Go back to your nursery and let nanny fix you a greasy double burger and give you extra scoops of ice cream, while the adults fix the mess you made during this years’ long tantrum of yours.				1020922569950547968	1020803264617615360	realDonaldTrump	https://twitter.com/SacTownGrandma/status/1020922569950547968	