username	date	retweets	favorites	text	geo	mentions	hashtags	tweetid	conversationid	replyto	permalink	imagelink
OrlandoStands	2018-03-04 09:10	0	0	@ SecretaryRoss @ MeetThePress “whatever his final decision is what will happen” in reference to @ realDonaldTrump and # steeltariffs ... exactly what you’d expect from a 5 y.o. trying to pick a flavor of ice cream.		@ SecretaryRoss @ MeetThePress @ realDonaldTrump	# steeltariffs	970300488938909698			https://twitter.com/OrlandoStands/status/970300488938909698	
trublubeliever	2018-02-27 23:02	0	0	@ realDonaldTrump thinks nepotism is an ice cream flavor? https://twitter.com/funder/status/968669717291511808 …		@ realDonaldTrump		968698016076107776			https://twitter.com/trublubeliever/status/968698016076107776	
iamRachelWolf	2018-02-27 00:44	0	1	Oh, it's way more than just pouting. Watch his face. Watch his eyes. @ realDonaldTrump literally checks out and is probably thinking about what flavor of ice cream he'll have after his cheeseburgers. https://twitter.com/cooljim198/status/968354787849891841 …		@ realDonaldTrump		968361049996087296			https://twitter.com/iamRachelWolf/status/968361049996087296	
mjohnson33755	2018-02-24 20:13	0	0	And I bet she’s going to ask you the tough questions like your favorite ice cream flavor or where you can find the best Big Mac... # ImpeachTrump			# ImpeachTrump	967568260391755776	967564998238142471	realDonaldTrump JudgeJeanine FoxNews	https://twitter.com/mjohnson33755/status/967568260391755776	
Raguleader	2018-02-24 18:05	0	0	My takeaway is that CPAC polls their members to ask how much they think POTUS should tweet. But have they polled them to ask what their favorite flavor of ice cream is? THE AMERICAN PEOPLE DESERVE TO KNOW.				967535959968399360	967529976001126401	ColMorrisDavis realDonaldTrump CPAC	https://twitter.com/Raguleader/status/967535959968399360	
B0b_____	2018-02-19 09:25	0	0	Freedom to eat any flavor of ice cream. pic.twitter.com/nmokFUOvtj				965593299221295104	964232645495459840	AmericanCtzen71 de_lorme	https://twitter.com/B0b_____/status/965593299221295104	https://pbs.twimg.com/media/DWZ5-ttVQAAhihu.jpg
kristiancau	2018-02-17 21:05	0	2	On choosing ice cream flavor; Kiddo 1: I want chocolate. Kiddo 2: I choose chocolate. Kiddo 3: I'll go for chocolate. Mom: We'll have 3 spinach flavored ice cream please. Kids = voters, Mom = electoral college.				965044493102678018	964938678362628096	kristiancau Woke_Meemstar	https://twitter.com/kristiancau/status/965044493102678018	
edschweppe	2018-02-13 16:07	0	0	(note for vision-impaired folks: the image in the quote tweet is a Photoshopped picture of a pint of Ben & Jerry’s ice cream. The flavor is called "Indict Mint". Various Trump Administration figures are illustrated, with Donald featured.)				963519993769062402	963515663619903489		https://twitter.com/edschweppe/status/963519993769062402	https://pbs.twimg.com/profile_images/1710867485/me_at_star_75x100_normal.png
coachmcanear	2018-02-09 16:53	0	0	If we let the democrats have it there way we would all make 35k a year with socialized medicine and we would only have one flavor of ice cream. Vanilla, how boring.				962082148579794944	961959738853548033	realDonaldTrump	https://twitter.com/coachmcanear/status/962082148579794944	
NoahSchles	2018-02-06 13:26	0	0	Would you reject Donald Trump if he was an ice cream flavor				960942679143022592	960941492079652865	UrbanAchievr	https://twitter.com/NoahSchles/status/960942679143022592	
YaleHollander	2018-02-05 10:26	0	0	I think the whole frozen-slab, ice cream mix-in shtick is played out. I much prefer a high fat, small batch product that focuses on flavor and mouthfeel, and not a bunch of unnecessary outside junk. On which side of the fence do your preferences lie?				960535050780577793	960530665702912000	realDonaldTrump	https://twitter.com/YaleHollander/status/960535050780577793	
harris44_tl	2018-01-31 08:20	0	1	@ NancyPelosi are you awake? Not certain which flavor ice cream will make this news more palatable for you.. # DennisNunes		@ NancyPelosi	# DennisNunes	958691435175448576	958680810080653312	lizpeek realDonaldTrump	https://twitter.com/harris44_tl/status/958691435175448576	
scottlong1968	2018-01-30 17:48	0	0	That is because there is no safe spaces when President @ realDonaldTrump enters a room. Now they're all getting counseling, while they pet on their therapy dogs (Poor dogs), and eating Ben an Jerry's ice cream... I think the flavor they're eating is, Crow https://twitter.com/FoxNews/status/958447363642871808 …		@ realDonaldTrump		958472040247414784			https://twitter.com/scottlong1968/status/958472040247414784	https://pbs.twimg.com/media/DU0WyysW0AAZEkA.jpg
glasseswigguy	2018-01-30 17:48	0	0	Hey @ realDonaldTrump in your speech tonight can you please address the debate that is sweeping the nation- it is such a controversial issue that I feel the need to tweet you directly- HOW DO YOU PRONOUNCE THIS ICE CREAM FLAVOR???!!!		@ realDonaldTrump		958471972257705984			https://twitter.com/glasseswigguy/status/958471972257705984	https://pbs.twimg.com/profile_images/795980182368768000/oE2G9b7F_normal.jpg
PuffinPuff	2018-01-28 19:55	0	4	You have offered nobody a wonderful anything. I am offering the world a wonferful new ice cream flavor called Impeach Trump. It had a fruity and just flavor.				957779121504948225	957462746060206080	realDonaldTrump	https://twitter.com/PuffinPuff/status/957779121504948225	
licleoncio	2018-01-25 19:07	0	0	Wtf, @ VicenteFoxQue maybe @ realDonaldTrump really want your “enchilada completa”, now and the ice cream? Lemon flavor?		@ VicenteFoxQue @ realDonaldTrump		956680026002542592	956651449336942592	CNN	https://twitter.com/licleoncio/status/956680026002542592	
CeceliaTU1	2018-01-24 20:58	0	5	Hey, one last question, Mr President, just for fun: If you were a flavor of ice cream, what would you be? pic.twitter.com/8VFgJkRDV8				956345396820836352	956322473955545089	CeceliaTU1 realDonaldTrump	https://twitter.com/CeceliaTU1/status/956345396820836352	https://pbs.twimg.com/media/DUWfEYOXkAMQsoH.jpg
akaMonty	2018-01-24 20:28	0	1	If @ POTUS @ realDonaldTrump was an ice cream flavor, he'd be called Butterscotch Bullshit.		@ POTUS @ realDonaldTrump		956337957958488065			https://twitter.com/akaMonty/status/956337957958488065	
psnprotectors	2018-01-24 15:54	0	0	Oh Yea Fearless Leader. it seems to me that our government is being childish like 2 12 year olds fighting over what flavor ice cream. # FearlessLeaderTrump			# FearlessLeaderTrump	956269072609660931	955428815777533952	realDonaldTrump	https://twitter.com/psnprotectors/status/956269072609660931	
oregonsnowmount	2018-01-20 18:39	0	0	What flavor ice cream is this? pic.twitter.com/a4iYVRgsQv				954861060355444736	954526153276116992	TuckerCarlson DonaldJTrumpJr	https://twitter.com/oregonsnowmount/status/954861060355444736	https://pbs.twimg.com/media/DUBZEVTX0AEjrcc.jpg
Buzzzz_zzzzzz	2018-01-19 22:53	0	0	Things DemocRATS have in COMMON with toddlers. 1. Not intellectually mature enough to compromise. Unless u promise ice cream. What flavor does Schumer like? 2. If u don’t cave to demands, kicking & screaming tantrum will ensue regardless of consequences. 3. Nuh uh! He did it!				954562505136902144	954203025488347137	SenSchumer realDonaldTrump	https://twitter.com/Buzzzz_zzzzzz/status/954562505136902144	
TkaBrake	2018-01-17 08:38	0	0	We the press demand to know how many scoops & what flavor of ice cream, right now!!				953622479431401473	953270558573154305	realDonaldTrump	https://twitter.com/TkaBrake/status/953622479431401473	https://abs.twimg.com/emoji/v2/72x72/1f602.png
cblfailure	2018-01-16 15:30	0	0	Mint Chip USED TO be my favorite flavor ice cream. Thanks for ruining that, dumbass!				953363902468943874	953352036309000194	BasketOfSexy realDonaldTrump	https://twitter.com/cblfailure/status/953363902468943874	
WaltonDornisch	2018-01-09 19:53	0	0	What’s your favorite flavor of ice cream?				950893238264594434	950884128379035650	realDonaldTrump	https://twitter.com/WaltonDornisch/status/950893238264594434	
Limbaugh2016	2018-01-08 17:50	0	0	LOL!!! There are lot of us conservatives out here that are not @ realDonaldTrump supporters. I can't speak of UCB professors, but my philosophy is that we will never agree on everything, from ice cream flavor, sports team or politics. We can agree to disagree civilly.		@ realDonaldTrump		950499972218261506	950083485573709824	MarekZee businessinsider	https://twitter.com/Limbaugh2016/status/950499972218261506	
notrussianguy	2018-01-05 17:24	0	0	That's right, Alan. You inspire me to ask lefty lib Dan an equally relevant question: What is your favorite ice cream flavor?				949406275871244288	949303089416294401	alan_no1 dantoujours	https://twitter.com/notrussianguy/status/949406275871244288	
YaleHollander	2018-01-04 11:55	0	2	To me, soft-serve ice cream is overrated. I like the stuff you have to scoop - more flavor and mix-in options, better mouthfeel. Dark chocolate fudge brownie is the best!				948961085385781251	948881133340708864	realDonaldTrump	https://twitter.com/YaleHollander/status/948961085385781251	
HerrShapiro	2018-07-23 13:48	1	5	. @ Oreo Bad reviews in Israel for your ice cream cookie. cc @ realDonaldTrump		@ Oreo @ realDonaldTrump		1021452003141185536	1021437867682422787		https://twitter.com/HerrShapiro/status/1021452003141185536	https://pbs.twimg.com/profile_images/1012230461953802240/ieIBkdjg_normal.jpg
RaymondOAnders2	2018-07-23 13:29	0	0	It may be the flavor of the # DeepState, but the real reason @ realDonaldTrump encourages # TrumpCult to avoid chocolate ice cream is because of the color!		@ realDonaldTrump	# DeepState # TrumpCult	1021447223056318465	1021406040406011905	Trumptweets2020	https://twitter.com/RaymondOAnders2/status/1021447223056318465	
GypseyBarke	2018-07-23 12:50	0	0	Backlash from coming across to world as a complete whimp, & lackey to leader of a foreign government: Putin. Attn @ realDonaldTrump Play some golf, eat plenty of KFC & ice cream. Do anything to distract your riled up self from pushing the red button! https://twitter.com/realDonaldTrump/status/1021234525626609666 …		@ realDonaldTrump		1021437477121417224			https://twitter.com/GypseyBarke/status/1021437477121417224	
Michael_McGurl	2018-07-23 12:41	0	0	“And THEN there were the strawberries in the ice cream! Then I knew I had ‘em” pic.twitter.com/4y1SkSKLxg				1021435207600128000	1021349516878974977	realDonaldTrump	https://twitter.com/Michael_McGurl/status/1021435207600128000	
Dottmann09	2018-07-23 12:26	0	1	This nigga was patty caking in the intro while suspectely eating an ice cream cone with a Donald Trump colored ankle bitter.. I'm done. Wackness.				1021431319627272197	1021258634259574784	XXL	https://twitter.com/Dottmann09/status/1021431319627272197	
trump2trumpIRL	2018-07-23 12:05	0	0	Aight, @ realDonaldTrump, Sound as a bell. and also its ice cream time!		@ realDonaldTrump		1021426053355622401			https://twitter.com/trump2trumpIRL/status/1021426053355622401	
linahawaii	2018-07-23 11:43	1	0	@ REALDONALDTRUMP NEVER EVER EVER GIVE ME ONLY ONE SCOOP OF ICE CREAM OR YOU WILL SUFFER CONSEQUENCES THE LIKES OF WHICH FEW THROUGHOUT HISTORY HAVE EVER SUFFERED BEFORE! I AM NO LONGER A PRESIDENT WHO WILL STAND FOR YOUR STINGY SERVINGS OF MY CHUNKY MONKEY.		@ REALDONALDTRUMP		1021420518103240704			https://twitter.com/linahawaii/status/1021420518103240704	
Gladiatrix2017	2018-07-23 11:40	0	1	No matter how many times, or different ways u say it, it’s still a LIE. The dossier was not used to obtain the FISA warrant. Perhaps u should get someone to read it to u, maybe draw u a little picture with stick figures. If U listen quietly maybe you’ll get some ice cream later				1021419778760585216	1021347230022807552	realDonaldTrump	https://twitter.com/Gladiatrix2017/status/1021419778760585216	
HolyheadSeagull	2018-07-23 11:20	0	2	@ realDonaldTrump NEVER, EVER THREATEN SEAGULLS AGAIN OR WE WILL COME AND STEAL YOUR CHIPS, YOUR ICE CREAM CORNETS AND POOP ON YOUR CARS MAKING YOU SUFFER CONSEQUENCES THE LIKE OF WHICH FEW THROUGHOUT HISTORY HAVE EVER SUFFERED BEFORE. BE CAUTIOUS!		@ realDonaldTrump		1021414696979714050	1021408880453136384	john_melfyn dailypostwales	https://twitter.com/HolyheadSeagull/status/1021414696979714050	
iclaudius	2018-07-23 11:18	0	1	Soon you’ll start complaining about who took the vanilla ice cream. Pathetic. pic.twitter.com/BeekEYfW6X				1021414305768632320	1021388295618682881	realDonaldTrump	https://twitter.com/iclaudius/status/1021414305768632320	https://pbs.twimg.com/media/DizK44tXUAAh5HH.jpg
xxHouse82xx	2018-07-23 11:03	0	0	@ realDonaldTrump @ McDonalds Hillary Clinton tells the truth just as much as a McDonald's ice cream machine works.		@ realDonaldTrump @ McDonalds		1021410414125637632			https://twitter.com/xxHouse82xx/status/1021410414125637632	
DemocratsUnite3	2018-07-23 10:39	0	1	So @ realdonaldtrump are you still going to try to feed us bullshit and tell us it's ice cream? Now you want to go after people who have already been granted citizenship? Maybe you should start with @ FLOTUS Trump ramps up scrutiny of legal immigrants http://a.msn.com/01/en-us/BBKWwZr?ocid=st …		@ realdonaldtrump @ FLOTUS		1021404318455533570			https://twitter.com/DemocratsUnite3/status/1021404318455533570	
AlanMil17486799	2018-07-23 10:33	0	3	It would seem that you are the one that has gone crazy this morning with these tweets..you won, you are the President, but you act like a spoiled little boy that dropped his ice cream cone. Man Up and work, if you work you will not have time for these petty tweets & name calling				1021402968086654976	1021384752136409088	realDonaldTrump	https://twitter.com/AlanMil17486799/status/1021402968086654976	
AmyAtrebas	2018-07-23 10:29	0	0	I kind of understand, it’s just I think he is a bully. You saw his tweet yesterday to Iran? On the other hand I don’t take the time out to criticize him for eating two scoops of ice cream				1021401981636624385	1019218575691837443	ResargNivek StacyDAlessand3 realDonaldTrump	https://twitter.com/AmyAtrebas/status/1021401981636624385	https://abs.twimg.com/emoji/v2/72x72/1f609.png
LovesLucy	2018-07-23 10:26	0	0	In my opinion, you are nothing more than a tool for Putin. Mueller never sleeps, Desperate Don. (And Baby Trump might just float down Manhattan on Thanksgiving.) Eat your ice cream, and settle down.				1021401263580286976	1021388295618682881	realDonaldTrump	https://twitter.com/LovesLucy/status/1021401263580286976	
NancyIndeed	2018-07-23 10:15	0	2	Omg get a bowl of ice cream and go to your room, you freaking toddler!				1021398451261669377	1021384752136409088	realDonaldTrump	https://twitter.com/NancyIndeed/status/1021398451261669377	
CLRo777	2018-07-23 10:09	0	0	Oh look, Fat Hitler talks tough while scarfing a gallon of ice cream in his xtra large jammies while tucked safely in his man baby cradle.				1021396912837029888	1021234525626609666	realDonaldTrump	https://twitter.com/CLRo777/status/1021396912837029888	
sdamackay	2018-07-23 09:57	0	1	This is the best thing ever. Behind ice cream.				1021393806460153858	1021287836438257665	Htygrett1 tedlieu	https://twitter.com/sdamackay/status/1021393806460153858	
trump2trumpIRL	2018-07-23 09:56	0	0	Yo Prez, @ realDonaldTrump, maybe its ice cream time!		@ realDonaldTrump		1021393502855475203			https://twitter.com/trump2trumpIRL/status/1021393502855475203	
LovesLucy	2018-07-23 09:36	0	0	Get this man his ice cream, STAT! Three scoops! It's only 9:30 AM & he's off the rails. (Mueller never sleeps & Trump baby is coming.)				1021388578306383873	1021384752136409088	realDonaldTrump	https://twitter.com/LovesLucy/status/1021388578306383873	
SoniaCurlChic	2018-07-23 09:31	0	2	Donald Trump is by far the biggest modern day history mistake America has made. . He behaves like a child that doesn't know if they want vanilla or chocolate ice cream.. . He has meetings, doesn't say shit and then OUTSIDE and away he changes his story. . Douche				1021387398150787072			https://twitter.com/SoniaCurlChic/status/1021387398150787072	
USMCSoonerMooma	2018-07-23 09:30	0	1	The ice cream machine has better negotiation skills than Cheeto DJT.				1021386953781055489	1021234525626609666	kidkatiedid realDonaldTrump POTUS	https://twitter.com/USMCSoonerMooma/status/1021386953781055489	
GhostofSamMcGee	2018-07-23 09:05	0	0	Calm down, get naked and chase Melania around Oval Office, think of Bill & Jeffrey's "Lolita Express" flavored ice cream. If Mel is busy, Devin Nunes is under your bed,,,,				1021380758475190277	1021370601863294977	realDonaldTrump	https://twitter.com/GhostofSamMcGee/status/1021380758475190277	
hale_teddy	2018-07-23 09:04	1	0	Fitton Calls FBI’s FISA Application a ‘Self-Licking Ice Cream Cone’-Corrupt dishonesty to get court approval to spy on @ RealDonaldTrump team->https://www.lifezette.com/2018/07/fitton-calls-fbis-fisa-application-a-self-licking-ice-cream-cone/?utm_source=right-rail-trending …pic.twitter.com/22f8zy1pnv		@ RealDonaldTrump		1021380438235885569			https://twitter.com/hale_teddy/status/1021380438235885569	https://pbs.twimg.com/media/DiyryIJWsAAedyk.jpg
Tuffloid	2018-07-23 08:53	0	0	@ realDonaldTrump Your threats against Iran do NOT make you look strong. They make you look like a spoiled 8 year old who didn't get ice cream.		@ realDonaldTrump		1021377800748584960			https://twitter.com/Tuffloid/status/1021377800748584960	
rvanbree	2018-07-23 08:39	0	0	Did that big bad Muslim scare you little # TraitorTot? Would 2 scoops of ice cream make it all better? Now get back under the covers and get some sleep. Tommorow the grown ups will fix it. # TrumpRussia # DelusionalDonnie only Congress can declare war btw! # FuckOff			# TraitorTot # TrumpRussia # DelusionalDonnie # FuckOff	1021374266825060352	1021234525626609666	realDonaldTrump	https://twitter.com/rvanbree/status/1021374266825060352	
luni_pax	2018-07-23 07:38	0	1	I think stupid is a compliment at this point. He needs to see a psychiatrist, he cannot be allowed to take care of an ice cream truck!				1021358863822524417	1021349516878974977	PalmerReport realDonaldTrump	https://twitter.com/luni_pax/status/1021358863822524417	
anonymoustache	2018-07-23 07:37	0	0	Back to imaginationland where Eric serves ice cream and cupcakes to avoid the truth of falling wages				1021358704665513989	1021351802334310400	diomyyunsa DiogenesCritic	https://twitter.com/anonymoustache/status/1021358704665513989	
joetorres85_joe	2018-07-23 07:36	0	1	Better yet go watch some cartoons take some nap time and if you @ realDonaldTrump don’t tweet you can have ice cream for lunch. Shhh our secret		@ realDonaldTrump		1021358360434806784	1021351630648815616	Airvooocht realDonaldTrump JudicialWatch	https://twitter.com/joetorres85_joe/status/1021358360434806784	
JereeGeeStavich	2018-07-23 07:25	1	0	Self Licking Ice Cream Cone, what a nice way to describe these swindlers, cheats, liars, & traitors that were out to topple @ realDonaldTrump a man who is working for hard for this Nation, & we the people that the bums that have been living high off the hog, are worried.		@ realDonaldTrump		1021355526788190208	1021352365595774976	foxandfriends TomFitton	https://twitter.com/JereeGeeStavich/status/1021355526788190208	
Better_POTUS	2018-07-23 07:15	0	0	An ice cream stick would make a better president than @ realDonaldTrump		@ realDonaldTrump		1021353059384004608			https://twitter.com/Better_POTUS/status/1021353059384004608	
huemanz	2018-07-23 06:40	0	0	Donyyy, be nice now or no more little coming party with them nice vroom! vroom! military trucks and them nice plastic soldiers with nifty pow! pow! fire sticks. Want some ice cream? yeaaa.. that's better, ok 2 scoops makes it feels like nice tities				1021344243212865536	1021234525626609666	realDonaldTrump	https://twitter.com/huemanz/status/1021344243212865536	
rausc15	2018-07-23 06:39	0	0	OMG you’re off the rails. You can sound so threatening using all caps but to their face you would melt like your 2 scoops of vanilla ice cream. This is what happens to a weak president who didn’t stand up for his country in front of the world.				1021344063826612224	1021234525626609666	realDonaldTrump	https://twitter.com/rausc15/status/1021344063826612224	
camev56	2018-07-23 06:34	0	0	Great, our country is now being run by a hormonal teenage girl. Wouldn’t a tub of ice cream and a facial be a better activity than bitch tweeting threats in the middle of the night?				1021342737965158400	1021234525626609666	realDonaldTrump	https://twitter.com/camev56/status/1021342737965158400	
KateBradwin	2018-07-23 05:47	0	0	Deflect much? "Its not MY fault I made a mess with the chocolate ice cream, you should have thought about that before you let me steal it!" You argue like a damn child. It's almost over. Your boat is going down fast Drumpf and you aren't taking the rest of the country with you.				1021330856315670533	1021158915206152193	realDonaldTrump	https://twitter.com/KateBradwin/status/1021330856315670533	
PamEllaCasual	2018-07-23 05:41	0	0	No two scoops of ice cream for you				1021329468084948993	1021234525626609666	realDonaldTrump	https://twitter.com/PamEllaCasual/status/1021329468084948993	
trump2trumpIRL	2018-07-23 05:35	0	0	Psst @ realDonaldTrump, Sound as a bell. and also its ice cream time!		@ realDonaldTrump		1021327900455432192			https://twitter.com/trump2trumpIRL/status/1021327900455432192	
kara_jilly	2018-07-23 05:11	0	0	Seriously tho... @ realDonaldTrump sounds like a god damn toddler stomping his feet because his mom said “no you can’t have the ice cream.” This is our “president”...what a fucking joke. We’re not a country that will stand for “demented words”...Do you even listen to yourself?! pic.twitter.com/va8u6qqDX9		@ realDonaldTrump		1021321786766618625			https://twitter.com/kara_jilly/status/1021321786766618625	https://pbs.twimg.com/media/Dix2v7tW0AAu7Gf.jpg
ikhowudi	2018-07-23 04:53	0	0	Uh oh - was Melania not up for being ‘grabbed’ last night? Calm down and go have some ice cream dude				1021317391760994306	1021234525626609666	realDonaldTrump	https://twitter.com/ikhowudi/status/1021317391760994306	
TheFijiWolf	2018-07-23 04:00	0	0	Surgeon general @ vivek_murthy, can you check in on President Sundown? He may not have gotten all of his ice cream scoops this evening		@ vivek_murthy		1021304125034643456	1021234525626609666	realDonaldTrump	https://twitter.com/TheFijiWolf/status/1021304125034643456	
Cole90029LA	2018-07-23 03:30	0	0	I've been to Lake Havasu...so pass. But could you imagine if Twitter dusted off their......yeah...you're probally right. I'm eating my ice cream tonight. ...just because.				1021296576281522176	1021234525626609666	EuthyphroOfPhx AmericaFightHim	https://twitter.com/Cole90029LA/status/1021296576281522176	
not2deepNu	2018-07-23 03:29	0	1	Glad I’m not the only one that suspects their lying about that damn ice cream machine! We’re on to you @ McDonalds		@ McDonalds		1021296231434375168	1021234525626609666	ElizabethllorT scrueggs realDonaldTrump	https://twitter.com/not2deepNu/status/1021296231434375168	
trump2trumpIRL	2018-07-23 03:24	0	0	Ok ok ok, @ realDonaldTrump, I know the UK Community Issues are on your mind but its ice cream time!		@ realDonaldTrump		1021295049001365504			https://twitter.com/trump2trumpIRL/status/1021295049001365504	
cherokee_welch	2018-07-23 03:15	0	1	ADD A VANILLA ICE CREAM CONE TO MY ORDER & YOU BETTER ADD EXTRA STRAWS. THERE'S NO SUCH THING AS STRAW POLLUTION. ITS A DEM HOAX STARTED BY CROOKED HILARY.				1021292772463075328	1021234525626609666	realKimDonTrump RealityRecaps realDonaldTrump	https://twitter.com/cherokee_welch/status/1021292772463075328	
Frog131908	2018-07-23 02:33	0	0	TO # McDonalds : WE ARE TIRED OF YOU TELLING US THAT THE ICE CREAM MACHINE IS BROKEN. WE ARE NO LONGER ACCEPTING THIS EXCUSE ON A 100 DEGREE DAY! NEVER THROUGHOUT HISTORY HAVE WE SUFFERED BEFORE. WE WON’T STAND FOR THIS ANY LONGER WHEN # CHICKFILA IS OPEN EVERYDAY, BUT SUNDAY!			# McDonalds # CHICKFILA	1021282173318463488	1021234525626609666	realDonaldTrump	https://twitter.com/Frog131908/status/1021282173318463488	
salshine	2018-07-23 01:55	0	0	Nite nite Donnie. Go put your jammies on, get your Bowl of ice cream, and then go nite nite. You’ve done enough damage for 1 day. Sleep tight!				1021272631989788677	1021234525626609666	realDonaldTrump	https://twitter.com/salshine/status/1021272631989788677	
vgm1360	2018-07-23 01:54	0	0	To my roommate: NEVER, EVER EAT MY ICE CREAM IN FREEZER FOR WHEN I BACK FROM MY F*ING JOB AGAIN OR YOU WILL SUFFER CONSEQUENCES THE LIKES OF WHICH FEW THROUGHOUT HISTORY HAVE EVER SUFFERED BEFORE. I AM NO LONGER A ROOMMATE THAT WILL STAND FOR STOLEN FROZEN ICE CREAM. BE CAUTIOUS!				1021272381203943431	1021234525626609666	realDonaldTrump	https://twitter.com/vgm1360/status/1021272381203943431	
WaleedAlaskar	2018-07-23 01:52	0	0	Are they suppose to be frightened Take a vocation Donald ,have an Ice cream somewhere				1021271862666579968	1021234525626609666	realDonaldTrump	https://twitter.com/WaleedAlaskar/status/1021271862666579968	https://abs.twimg.com/emoji/v2/72x72/1f631.png
YouEnjoyMyself	2018-07-23 01:41	0	1	Here’s some fake news: have you ever felt despair at being denied a shake or cone at McD? Not alone. Experts say that calls to crisis lines increase in areas in correlation to Ice cream or shake machine outages at the Golden Arches.				1021268948657098752	1021234525626609666	scrueggs ElizabethllorT realDonaldTrump	https://twitter.com/YouEnjoyMyself/status/1021268948657098752	
Redtapebass	2018-07-23 01:33	0	1	How dare you tell me your ice cream machine is broke at 9:30 at night!!!				1021266920518144000	1021234525626609666	scrueggs realDonaldTrump	https://twitter.com/Redtapebass/status/1021266920518144000	
