username	date	retweets	favorites	text	geo	mentions	hashtags	tweetid	conversationid	replyto	permalink	imagelink
aurora_84	2018-07-21 18:13	0	0	(Nice! I'm not sure how we do it in Bulgaria, hm. I personally put my hand flat palm up, with my non-thumb fingers curled in, stick out my thumb as one and then unfold the rest when I count up.)				1020793819468529665	1020791220212322304	lemayol	https://twitter.com/aurora_84/status/1020793819468529665	
LifeTipsPage	2018-07-21 17:56	0	0	Make a fist with your left hand, squeeze your left thumb, then put your right index finger down your throat. NO GAG REFLEX.				1020789745360699397			https://twitter.com/LifeTipsPage/status/1020789745360699397	
Chhipz	2018-07-21 17:15	0	0	People saying console players are bad because they need aim assist when they use their thumbs, as opposed to mouse + keyboard players using their ENTIRE arm/ hand/ fingers to aim are incredibly stupid.				1020779267473530880			https://twitter.com/Chhipz/status/1020779267473530880	
ForsakenVagrant	2018-07-21 15:07	0	0	With his free hand, Demetrius takes the stack of cards between his thumb and the rest of his fingers. The offer of two hundred bucks makes his eyes widen. "For that kind of money? Hell yes! What random places do you want me to put them? How far you want me to go?" https://twitter.com/stone_heather_/status/1020742363067666433 …				1020747068757954561			https://twitter.com/ForsakenVagrant/status/1020747068757954561	
B9BLUE1	2018-07-21 14:14	0	0	You said we only have four fingers on each hand some call thumb a digit like you might do but it's the same, as the pic i sent you shows,it's for your benefit glad i could help				1020733690215845888	1020698923395178498	AnthonyeAnt stuartb10397843	https://twitter.com/B9BLUE1/status/1020733690215845888	https://abs.twimg.com/emoji/v2/72x72/1f602.png
DarcSeven	2018-07-21 14:12	0	0	I'm tipping my hand a little, but I'm kinda frustrated that I'm having so much trouble trying to draw cartoon bear paws. It's 3 bigger fingers and a thumb. Why is this so difficult for me to do?				1020733257183211520			https://twitter.com/DarcSeven/status/1020733257183211520	
AsaNoArashi	2018-07-21 13:48	0	0	And she's rubbing the tip between her index and thumb fingers, as well as holding it from further below with her other hand. "Not until you beg for my pats~"				1020727120056717315	1020689744219574274	HellTsun	https://twitter.com/AsaNoArashi/status/1020727120056717315	
B9BLUE1	2018-07-21 12:14	0	0	Well i like to call my thumb a finger otherwise it would just get lonely being the only digit on my hand.				1020703614652829696	1020698923395178498	AnthonyeAnt stuartb10397843	https://twitter.com/B9BLUE1/status/1020703614652829696	
pianotechorg	2018-07-21 11:00	0	0	The Hand is a Bipartite Structure Fingers/thumb and the wrist https://app.pianotechnique.org/series/48 # rotation # jazzpianoexercise # lisztetudespic.twitter.com/qW07NrMYJD			# rotation # jazzpianoexercise # lisztetudespic	1020684844697899008			https://twitter.com/pianotechorg/status/1020684844697899008	https://pbs.twimg.com/media/DiozdMjXUAAvj3Y.jpg
Congenitalhand	2018-07-21 10:07	5	7	Common pediatric hand problems including # trigger finger/ thumb are typically straightforward to treat. But # complications occur. # handsurgery http://bit.ly/2mvQjuK @ WUSTLortho @ STLChildrens @ ShrinersStLouis		@ WUSTLortho @ STLChildrens @ ShrinersStLouis	# trigger # complications # handsurgery	1020671599228473355			https://twitter.com/Congenitalhand/status/1020671599228473355	
Onthewing4	2018-07-21 09:51	0	1	Oh and don't allow any cowgirl antics, She's on top,riding you madly,your bladder is getting hammered,she clamped on to you like baby chimp, sticking a cheeky finger in! Hand over your mouth,thumb in your eye, quite uncomfortable that,.I would imagine!				1020667503696113664	1020079753783627776	Onthewing4 ItMightBeJimbo cravin4	https://twitter.com/Onthewing4/status/1020667503696113664	
RunawayLycan	2018-07-21 05:22	0	0	« fully exposed. He grabs at the underside of Jace’s genitals hard, a thumb in his hole and his fingers gripping his balls while he uses his free hand to undo his own pants. No words are said, only hoarse breathing and small growls.				1020599862528749568	1020521355580723201	RunawayLycan WealthyBrit	https://twitter.com/RunawayLycan/status/1020599862528749568	
stuartbruce	2018-07-21 03:14	0	2	I used to need one hand and a thumb to count my friends who support Leave. I don't even need all my fingers anymore as hardly anyone left supporting it, now it is clear it is practically impossible. https://twitter.com/campbellclaret/status/1020559642668216320 …				1020567735103901697			https://twitter.com/stuartbruce/status/1020567735103901697	
willfromthe1975	2018-07-21 00:55	0	18	tonight I burned my thumb so badly I can no longer finger gun with my right hand. god wants me to suffer				1020532815270744064			https://twitter.com/willfromthe1975/status/1020532815270744064	
Doxerful	2018-07-21 00:20	0	0	All you have to do is click where to shoot on pc. Console players have to use one thumb on one hand to aim and another finger on another hand to shoot. Shouldn’t console players have aim assist you dweeb?				1020523777359339520	1020488424367763456	CallOut2k NanoCheesin HankDaTank	https://twitter.com/Doxerful/status/1020523777359339520	
tokyorendezvous	2018-07-20 22:18	0	0	"[He] opened the packet and inserted his thumb and fore-finger, slowly, gingerly, like a conjurer performing a sleight-of-hand trick before a puzzled audience, and, beaming all over his face, extracted from the tobacco a glittering object which he held out before the spectators."				1020493307116388355			https://twitter.com/tokyorendezvous/status/1020493307116388355	
Dusken_Bat	2018-07-20 22:05	0	0	A left black scalloped and gloved hand would go the pouch of his utility belt. Opening it up , and pulling from it a Pellet. Food-Ration Pellet. Clutching it between a index finger and thumb, brought it to his mouth , and placed it inside. Chewing. Slowly. Quietly.				1020489998251057152			https://twitter.com/Dusken_Bat/status/1020489998251057152	
MainJPW	2018-07-20 22:03	0	9	Those are his index fingers. If look at the left hand you’ll see his folded thumb under his index finger.				1020489532838465536	1020482620323520512	Sonic_Hedgeblog	https://twitter.com/MainJPW/status/1020489532838465536	
BlakeLawatch	2018-07-20 21:45	0	1	I’m wondering if Joey used two fingers and his thumb or whole hand? # SmallHands # CantEscapeItNow			# SmallHands # CantEscapeItNow	1020484782642290691	1020479730334781442	joeylaurenshow BoiseHawks	https://twitter.com/BlakeLawatch/status/1020484782642290691	
baekyawn__	2018-07-20 21:08	0	0	yung may sugat ka sa ring finger (right hand) tapos kinuhaan ka ng dugo sa right arm mo tangina di ko maramdaman tong right arm ko hanggang daliri nangangatog na rin si thumb jsbshsks				1020475522160082944			https://twitter.com/baekyawn__/status/1020475522160082944	
AndiMarcie	2018-07-20 20:42	0	0	Somehow managed to slice my thumb and pointer finger on my left hand with a knife ... what ... why				1020469130716213249			https://twitter.com/AndiMarcie/status/1020469130716213249	
Myndseth	2018-07-20 18:39	0	0	Dream league soccer then iffa join my thumb with any finger, den set my other hand to block pic.twitter.com/iCkVLdiYtp				1020438165344178181	1020305476301611008	Nigerianbadass	https://twitter.com/Myndseth/status/1020438165344178181	https://abs.twimg.com/emoji/v2/72x72/1f61d.png
Chefpantsu	2018-07-20 17:19	0	0	If you want more spread, place your hand higher and rub between thumb and index and middle finger. The more air the sprinkles fall through the wider the spread				1020418049667551232	1020155446840233984	IAmLindsayJones	https://twitter.com/Chefpantsu/status/1020418049667551232	
FingerThumbs	2018-07-20 17:09	0	0	'A Wonderful Love' What a stunning and emotionally charged piece. 3D hand cast of a grown up daughter and her mum. Love, comfort, memories, precious, beautiful.............. # memories… https://www.instagram.com/p/Bld9EIPBbeL/?utm_source=ig_twitter_share&igshid=mzpignh3ivlk …			# memories	1020415427187560448			https://twitter.com/FingerThumbs/status/1020415427187560448	
AP_Weltall	2018-07-20 16:55	0	0	Put your finger tips (not thumb) on a table so your hand is near flat. Lift your ring finger even half as far as your other fingers.				1020411985312149504	1020148730715099138	renleve ClarencePJones	https://twitter.com/AP_Weltall/status/1020411985312149504	
fallingfortruth	2018-07-20 15:52	2	4	Jin knows that he has a big dick! It's glorious! His high school girlfriend couldn't even get her hand all the way around it and had to jack him off with both of her hands wrapped around it, thumbs lined up together on the underside of his shaft and her fingers laced together.				1020395942976147457	1020392498361876481	droolyjin pisstae	https://twitter.com/fallingfortruth/status/1020395942976147457	
beztweets	2018-07-20 15:44	0	1	I use a flat hand (as is the convention when driving) and avoid thumbs up; I suspect it can risk being mistaken for a middle finger				1020393926824538112	1015534224986791936	MumbrianSpinner lliwedd	https://twitter.com/beztweets/status/1020393926824538112	https://abs.twimg.com/emoji/v2/72x72/1f642.png
Jo_Frost	2018-07-20 15:12	0	1	1st:Start 2 bcome aware whn u do.. when- tired,hungry,bored,tv watching,emotionally spent, concentrating? 2nd: with mental awareness STOP n redirect, rotate in palm of hand calming small ball or jangle elastic bands with fingers from thumb hand. More awareness,mre discipline.				1020386083022942208	1020197070588841984	Ashley19960746	https://twitter.com/Jo_Frost/status/1020386083022942208	https://abs.twimg.com/emoji/v2/72x72/263a.png
AwWilkin	2018-07-20 14:59	0	1	Insurance and because you wouldn't trust Trump AT ALL!! If Trump shook your hand any sane person would check to see if they still had 10 fingers and thumbs!!				1020382594133905408	1020378184527708160	pacelattin	https://twitter.com/AwWilkin/status/1020382594133905408	
dadropovahat	2018-07-20 14:56	0	1	"Your thumb is opposite to your fingers, your left hand to your right. Opposing forces accomplish something when common ground is found. How to(2) unite to become one(1); it's all in your hands."				1020381947116351489	1020369675778064385	tristan_jpg	https://twitter.com/dadropovahat/status/1020381947116351489	https://abs.twimg.com/emoji/v2/72x72/1f5ff.png