username	date	retweets	favorites	text	geo	mentions	hashtags	tweetid	conversationid	replyto	permalink	imagelink
def242	2018-06-20 06:35	0	0	Seriously? As a grandmother and a mother, I am appalled that you can be so tone deaf about what is happening right now in the United States. Shame!				1009384223000625152	1009222291887218693	FLOTUS WhiteHouse	https://twitter.com/def242/status/1009384223000625152	
will_lv76	2018-06-19 13:20	0	0	Or Trump's first immigrant wife, or his immigrant mother, or his immigrant grandmother or his immigrant grandparents On Trump and his dad were actually born in the United States in his lineages but he is the leader of anti-immigration				1009123665516978177	1009071403918864385	anverhelm realDonaldTrump FLOTUS	https://twitter.com/will_lv76/status/1009123665516978177	
sharoncdorman	2018-05-28 12:18	1	6	On Memorial Day as a mother & grandmother I am begging you to use your influence to end this atrocity & bring these babies & children back to their parents. We are better than this, we are the United States of America not Nazi Germany. # WhereAreTheChidrenpic.twitter.com/9qyfUhPDsG			# WhereAreTheChidrenpic	1001135578396708864	1001098317856673793	FLOTUS	https://twitter.com/sharoncdorman/status/1001135578396708864	https://pbs.twimg.com/media/DeS_e2zUQAAdZkX.jpg
lemonwacki	2018-04-21 23:25	0	0	It is an honor to have you in service to the United States. I am sure the entire Bush family was honored by your presence at the funeral of their precious wife, mother and grandmother. Thank you for representing our country so well				987895214974042118	987751695013826561	FLOTUS	https://twitter.com/lemonwacki/status/987895214974042118	https://abs.twimg.com/emoji/v2/72x72/1f1fa-1f1f8.png
BarbaraMcNinch2	2018-02-01 17:34	0	0	Barry never paid porn star Michael was one! YES! Sheriff Joe has birth certificate! Barry born in Kenya! I saw, listened to Barry's grandmother n brother ON TV in United States! HIS Grandmother stated she watched Barry being born in her hut in Kenya				959193333913538565	959095268154204162	GuyEndoreKaiser FLOTUS	https://twitter.com/BarbaraMcNinch2/status/959193333913538565	https://abs.twimg.com/emoji/v2/72x72/203c.png