username	date	retweets	favorites	text	geo	mentions	hashtags	tweetid	conversationid	replyto	permalink	imagelink
KlonnieChron	2018-06-07 10:55	0	1	Waiting for the right to ask why ice cream of color gets a day and vanilla doesn't # NationalChocolateIceCreamDay			# NationalChocolateIceCreamDay	1004738589907800064			https://twitter.com/KlonnieChron/status/1004738589907800064	
nellychillin	2018-06-06 11:49	13	53	Some FACTS: 1. I have the most beautiful followers on twitter 2. My twitter people are gonna do some amazing things in life 3. I support you all 4. Vanilla ice cream is so good 5. Purple is the most regal color on earth				1004389908428021760			https://twitter.com/nellychillin/status/1004389908428021760	
benreedtweets	2018-06-05 14:55	1	6	There is nothing to disagree with, it's his list not anyone else's. That's like saying "I respectfully disagree your favorite ice cream color is chocolate, because mine is vanilla."				1004074285454053378	1004066299419320320	mrbrotatohead notaxation	https://twitter.com/benreedtweets/status/1004074285454053378	
kahmil_	2018-06-04 22:35	0	0	lol this isn’t true. vanilla ice cream has always been a cream-ish color. You can make vanilla ice cream without preservatives and it’s still the same color.				1003827638123843584	1003816970771451904	aconjurewoman	https://twitter.com/kahmil_/status/1003827638123843584	
angelnobody13	2018-06-04 22:30	1	2	hot take: vanilla is actually one of the best ice cream flavors people just think its boring bc a) its overused b) it has no color c) they are fools				1003826397192773632			https://twitter.com/angelnobody13/status/1003826397192773632	
ChildOfYsrael	2018-06-03 15:44	0	2	Damn, ya’ll so racist Ice Cream CAN’T even be its natural color! # BlackTwitter # organic # gmo # vanillabean # vanilla # vanillaicecream # icecream # organicfood # healthyfoodpic.twitter.com/iIWp5UW0Rv			# BlackTwitter # organic # gmo # vanillabean # vanilla # vanillaicecream # icecream # organicfood # healthyfoodpic	1003361906613030912			https://twitter.com/ChildOfYsrael/status/1003361906613030912	https://abs.twimg.com/emoji/v2/72x72/1f633.png
maglolz	2018-06-03 06:03	0	0	If Vanilla beans are naturally black in color, how come vanilla ice cream or most vanilla flavored foods are white?				1003215711383228416			https://twitter.com/maglolz/status/1003215711383228416	
AnswerDave	2018-06-03 01:21	0	1	I need to do that more often. Add color to quotes by mentioning what the player was eating at the time. I remember interviewing Peter Bourjos while he ate vanilla ice cream.				1003144612226031616	1003137300916682754	dj_mosfett jlwoj	https://twitter.com/AnswerDave/status/1003144612226031616	
alsaturat	2018-06-02 02:18	0	0	color pencils are the vanilla of ice cream,				1002796657875062784			https://twitter.com/alsaturat/status/1002796657875062784	
molinaxyyy	2018-06-01 05:34	0	0	It's just hard to accept when your skin color is like a chocolate sandwich ice cream, vanilla and chocolate. Huhuhu. I need to have a tan skin first, I guess				1002483545049186304			https://twitter.com/molinaxyyy/status/1002483545049186304	
mus_of_icecream	2018-05-31 22:12	0	2	Prepare yourself for some ice cream KNOWLEDGE: Similar to the grapes that make wine, no two vanilla beans are the same in flavor, aroma, or color! Can't say we haven't taught you anything about ice cream!				1002372158251851776			https://twitter.com/mus_of_icecream/status/1002372158251851776	
Kikiii_kb	2018-05-28 23:29	0	0	Like the shit pisses me off. I’m the lightest of my friends. Skin the same color of vanilla ice cream. Have I used my skin color to justify the way I act. No I’m not bougie. No I don’t think I’m better than anyone. No I don’t believe every black male is attracted girls my color.				1001304456624050176			https://twitter.com/Kikiii_kb/status/1001304456624050176	
dntgvafvck	2018-05-21 21:05	0	0	Favorite color: black, white, blue. (basta dark colors, don't give me pastel babato ko sayo yan. hahaha jk, mabait ko) Guilty pleasure (food hindi tao): SNICKERS. taboy ko na lahat ng tsokolatre. im triggeredt af. VANILLA ICE CREAM. 'cause why not? s/o kay kurt dyan /grins. pic.twitter.com/nAQpED8zTT				998731450387120128	998729513507827712		https://twitter.com/dntgvafvck/status/998731450387120128	https://pbs.twimg.com/media/Ddw01PaV4AAUBCY.jpg
LondonJac11	2018-05-21 09:21	0	1	Thought of the day: Vanillas natural color is dark brown ... so why is vanilla ice cream white ? pic.twitter.com/kGbBNwabWN				998554465937580032			https://twitter.com/LondonJac11/status/998554465937580032	https://abs.twimg.com/emoji/v2/72x72/1f914.png
boobslucas	2018-05-19 04:09	0	5	favorite color? favorite flavor of ice cream? favorite ulam? mcdo or jollibee? — any shade of red or gray, vanilla or pistachio, adobo or sinigang, mcdo or jollibee https://curiouscat.me/BOOBSLUCAS/post/487207659?1526717341 …				997750964886130688			https://twitter.com/boobslucas/status/997750964886130688	
goopkid17	2018-05-16 09:11	0	0	I've seen this post a lot and I feel it might actually be related to color, not use? As in, a cake, ice cream, yogurt, bread, cracker, with nothing added, tends to be white. So is vanilla. If i see tinted bread, I'll automatically assume its flavor, even if it's dye.				996739857975267328	996059649186004992	vandroidhelsing	https://twitter.com/goopkid17/status/996739857975267328	
Aldowyn	2018-05-16 02:20	0	0	Replace vanilla ice cream with white skin color and it still works, so no harm done				996636612204244992	996633079157440512	BRKeogh	https://twitter.com/Aldowyn/status/996636612204244992	
DeansPie	2018-05-15 21:27	0	1	Like at the Ice cream section. What color do you want? In it better not be Vanilla. lol				996562662124343297	996559969406324737	thornbudd	https://twitter.com/DeansPie/status/996562662124343297	