username	date	retweets	favorites	text	geo	mentions	hashtags	tweetid	conversationid	replyto	permalink	imagelink
jmandese	2018-06-26 10:19	0	3	An even more profound question is why the President of the United States uses social media to spew conspiracy theories from a radical fringe conservative news pundit. "In February 2014, Napolitano expressed disdain for Abraham Lincoln on Fox News." https://en.m.wikipedia.org/wiki/Andrew_Napolitano …				1011614906846793728	1011602664143106048	realDonaldTrump	https://twitter.com/jmandese/status/1011614906846793728	
vivacantona7	2018-06-26 04:49	2	7	Have you just (apart from the childish IQ comment) threatened someone on social media? You’re supposed to be the president of the United States, not a 13 year old school girl, try to act like a president, the whole world is laughing at you # wankpuffin			# wankpuffin	1011531876203401216	1011295779422695424	realDonaldTrump	https://twitter.com/vivacantona7/status/1011531876203401216	
BlueHumanity	2018-06-25 23:45	0	2	"It’s a little more complicated [to shun someone] when the professional racist is the president of the United States." Well, over social media it's quite easy to tweet @ realDonaldTrump and say, "I SHUN YOU TRUMP, YOU FECKING RACIST RAPIST!" See? Easy. https://mobile.nytimes.com/2018/06/25/opinion/trump-sarah-huckabee-sanders-restaurant-civility.html …		@ realDonaldTrump		1011455496484634626			https://twitter.com/BlueHumanity/status/1011455496484634626	
h3llr4yz0r	2018-06-25 19:31	0	1	Because civility is calling the President of the United States a "dick" on social media.				1011391482257920000	1011389124475961345	GregShugar realDonaldTrump	https://twitter.com/h3llr4yz0r/status/1011391482257920000	
davidwasman	2018-06-25 18:49	1	4	Musician Phillip McCain said on social media that he’d like to shoot immigrants attempting to enter the United States. So @ realDonaldTrump & @ PressSec: Fuck your calls for civility. This is the hate you created. You own this and all the violent rhetoric currently circulating.pic.twitter.com/HD78S8ai1z		@ realDonaldTrump @ PressSec		1011380862548668417			https://twitter.com/davidwasman/status/1011380862548668417	https://pbs.twimg.com/media/DgklWYrXcAAosWJ.jpg
walters_kandi	2018-06-25 16:47	0	0	The president of the United states should stay off social media and do is effing JOB				1011350101153869824	1011212766487728133	realDonaldTrump	https://twitter.com/walters_kandi/status/1011350101153869824	
keith_brenton	2018-06-25 15:46	0	0	President of the United States, insulting members of Congress on social media. How mature. How intelligent. How presidential. </sarcasm>				1011334856700198920	1011295779422695424	realDonaldTrump	https://twitter.com/keith_brenton/status/1011334856700198920	
Shannonydm40	2018-06-25 14:23	10	116	Is the president of the united states allowed to try to ruin a citizen's business using his official social media account?				1011313922366943232	1011212766487728133	realDonaldTrump	https://twitter.com/Shannonydm40/status/1011313922366943232	
serfartsalot	2018-06-25 14:17	0	1	I miss the days when the President of the United States didn't sit on social media and hurl juvenile insults at people. Democrat, Republican, or any party would be fine, we just need an adult as a leader. # ToddlerInChief # Twitler # ImpeachTrump			# ToddlerInChief # Twitler # ImpeachTrump	1011312441656053762	1011295779422695424	realDonaldTrump	https://twitter.com/serfartsalot/status/1011312441656053762	
mczolton	2018-06-25 11:28	15	111	Is this the president of the United States trashing a restaurant on social media, or a screaming toddler with too much time on his hands? I honestly can't tell.				1011269865364250625	1011212766487728133	realDonaldTrump	https://twitter.com/mczolton/status/1011269865364250625	
_the_becca_	2018-06-25 11:13	0	1	Hey @ realDonaldTrump, you should focus on doing your job as President of the United States instead of attacking small businesses and anyone who you don’t agree with, on social media. You are pathetic.		@ realDonaldTrump		1011266072794812417	1011250435284348928	ShannonSharpe	https://twitter.com/_the_becca_/status/1011266072794812417	
jimcacciatore	2018-06-25 08:59	0	0	With due respect, Mr. President, it is not within historical norms for the President of the United States to make personal attacks on private citizens or entertainment programs via social media. Please refrain from such activity in order to maintain the dignity of the office.				1011232340838944768	1011036519812030467	realDonaldTrump jimmyfallon	https://twitter.com/jimcacciatore/status/1011232340838944768	
SellByBuild	2018-06-25 06:47	0	0	Are you The President of The United States or do you work at TMZ? Or The National Inquirer? You actually invested your Finite Presidential Time into Tweeting this nonsense? # leadership # communication # goals # America # time # News # Media # psychology # SocialMedia # USA # Congress			# leadership # communication # goals # America # time # News # Media # psychology # SocialMedia # USA # Congress	1011199235335868418	1011036519812030467	realDonaldTrump jimmyfallon	https://twitter.com/SellByBuild/status/1011199235335868418	
parrthetic	2018-06-24 21:29	0	2	You’re whining about jimmy Fallon? If u worked for me (you do) I’d fire you (I can’t). Quit watching tv & obsessing about social media. Ur the goddamn president of the United States, start doing your job! What some late night host says is irrelevant. How do you not know this?				1011058695185281024	1011036519812030467	realDonaldTrump jimmyfallon	https://twitter.com/parrthetic/status/1011058695185281024	
serolfyssej	2018-06-24 15:06	0	0	Every time I log into any of my social media accts I ask myself: why is Donald Trump president of the United States?				1010962489062768640			https://twitter.com/serolfyssej/status/1010962489062768640	
jemsmommy	2018-06-24 11:34	0	0	It’s very sad the the United States “president” uses social media to name call. # BeBest # StopBullying from the top down.			# BeBest # StopBullying	1010908927314317312	1010569562138406912	realDonaldTrump	https://twitter.com/jemsmommy/status/1010908927314317312	
SuzieLogan	2018-06-23 22:43	0	7	The entire United States is in a civil war-instead of North/South it’s everyone. No guns or cannons, just social media sites, emojis, emotions, bad behaviors, and horrible actions and words. How will it end? Will anyone really win?				1010715061386665991	1010713386911502337	Franklin_Graham PressSec	https://twitter.com/SuzieLogan/status/1010715061386665991	https://abs.twimg.com/emoji/v2/72x72/1f64f-1f3fb.png
schmostories	2018-06-23 15:38	0	0	It’s really sad that the President of the United States degrades and makes fun of people on social media.				1010608098950766592	1010569562138406912	realDonaldTrump	https://twitter.com/schmostories/status/1010608098950766592	
LastTrueLiberal	2018-06-23 11:49	0	0	When people say "Clinton" they are referring to the 42nd President of the United States William Jefferson Clinton. Sadly you live in a 20 minute social media world and believe that Hillary is the center of the Democrat party. This all started under Bill Clinton. Look it up				1010550408891097088	1010505990259855361	ganglywhitegirl realDonaldTrump	https://twitter.com/LastTrueLiberal/status/1010550408891097088	
jacobbbplus	2018-06-23 00:07	0	2	President Trump is indeed the president of the United States, but I don't think the symbolic disownment of that is oblivious to it. As for the lies, disinfo, and vitriol on social media... start with the Twitter account of @ realDonaldTrump. He's an exceptionally guilty president.		@ realDonaldTrump		1010373730684596224	1010303163398852614	GeauxwriteLis erikschubach Firstmate1060	https://twitter.com/jacobbbplus/status/1010373730684596224	
abhaya_porta	2018-06-22 17:27	0	0	On Friday June 15, 2018, the sitting president of the United States of America Donald Trump, referred to his constituents as his "followers," and the entire country dismissed the statement as social media lexicon. What do you think? @ abhaya_portapic.twitter.com/sbUKFcINwj		@ abhaya_portapic		1010272968004591616			https://twitter.com/abhaya_porta/status/1010272968004591616	
tazolini	2018-06-20 14:37	0	0	If anyone doesn’t like the way OUR President is running this nation, go ahead and feel free to either: Keep your thoughts/feelings OFF SOCIAL MEDIA OR... leave the United States of AMERICA It’s quite SIMPLE!				1009505562927587329	1009411866475532288	realDonaldTrump	https://twitter.com/tazolini/status/1009505562927587329	https://abs.twimg.com/emoji/v2/72x72/1f1fa-1f1f8.png
LandenWakil	2018-06-20 13:42	0	0	# WorldRefugeeDay is the result of elected US officials. Stop and think — is @ realDonaldTrump the problem? Or are his crimes just another Dear Diary entry into the blood-soaked history of the United States? Bastard was just the first one to have MSM and social media on his ass		@ realDonaldTrump	# WorldRefugeeDay	1009491576962338817			https://twitter.com/LandenWakil/status/1009491576962338817	
GeigerNews	2018-06-20 10:51	4	0	I hope most clear-thinking Americans observe that, at 9:00 AM, on a weekday morning, the president of the freakin’ United States is wasting his time posting conspiracy theories on social media. It’s not like you have an important job or anything. # WorstPresidentEver			# WorstPresidentEver	1009448583421091841	1009435777992884227	realDonaldTrump FoxNews	https://twitter.com/GeigerNews/status/1009448583421091841	
sambanks2	2018-06-19 11:32	0	3	The future of the United States is completely hopeless. The citizens of this country keep getting dumber and dumber every single day. Social media comments continue to be proof of this. It’s so disheartening. # ThanksTrump Fuck you @ realDonaldTrump!		@ realDonaldTrump	# ThanksTrump	1009096524251398144			https://twitter.com/sambanks2/status/1009096524251398144	https://abs.twimg.com/emoji/v2/72x72/1f595.png
Iivingpoetry	2018-06-19 10:42	0	2	how is donald trump THE PRESIDENT OF THE UNITED STATES still allowed to spread fake news and shit talk over social media				1009083945869119489			https://twitter.com/Iivingpoetry/status/1009083945869119489	
mrtommyjeff	2018-06-17 13:16	2	3	Seeking asylum in the United States is NOT illegal. Contrary to what the band of evil emissaries from the @ WhiteHouse are spewing on television, social media, and in various interviews. @ realDonaldTrump @ msnbc @ JoeNBC @ Morning_Joe @ nytimes @ washingtonpost		@ WhiteHouse @ realDonaldTrump @ msnbc @ JoeNBC @ Morning_Joe @ nytimes @ washingtonpost		1008397902568476673			https://twitter.com/mrtommyjeff/status/1008397902568476673	
gilwins	2018-06-16 17:53	0	0	The socialists own the entertainment industry, the mainstream media, the social media, the education system, big websites, the liberal hate machine and the rich elites. Donald Trump only owns one group. The American people. And that is why he is President of The United States.				1008105323897466880			https://twitter.com/gilwins/status/1008105323897466880	
troicurtosi	2018-06-16 16:28	0	0	Did you have a request from Obama to see his private texts? What a stupid question on your part. He's the president of the United States, his private texts or his private business. As it is he's very open in the way he communicates through social media.				1008083909001674753	1007577375905861637	krassenstein ModiFiedIndia_ realDonaldTrump	https://twitter.com/troicurtosi/status/1008083909001674753	
Broder512	2018-06-16 09:41	0	8	Can someone let @ realDonaldTrump know that he's the President of the United States and not the social media intern at Fox and Friends?		@ realDonaldTrump		1007981478800773120			https://twitter.com/Broder512/status/1007981478800773120	
bison_stew	2018-06-14 11:13	0	0	I wonder what Donny thinks this is about, "Two British political operatives were in regular contact with the Russian ambassador in London while they campaigned for, and met with, Donald Trump in the United States in 2016, a review of emails and social media posts shows"				1007279770038489089	1007278671097417729	DavidKernohan realDonaldTrump	https://twitter.com/bison_stew/status/1007279770038489089	
bison_stew	2018-06-14 09:25	0	0	Don't forget this, "Two British political operatives were in regular contact with the Russian ambassador in London while they campaigned for, and met with, Donald Trump in the United States in 2016, a review of emails and social media posts shows"				1007252627967467520	1007230400756928512	PutinFluffer JohnCronan1	https://twitter.com/bison_stew/status/1007252627967467520	
BtcBillionaire7	2018-06-14 01:15	0	0	Two British political operatives were in regular contact with the Russian ambassador in London while they campaigned for, and met with, Donald Trump in the United States in 2016, a review of emails and social media posts shows. https://www.cnn.com/2018/06/13/politics/banks-wigmore-russian-ambassador-meetings/index.html …				1007129461333090305			https://twitter.com/BtcBillionaire7/status/1007129461333090305	
Rick1976Gladden	2018-06-14 00:39	0	0	Two British political operatives were in regular contact with the Russian ambassador in London while they campaigned for, and met with, Donald Trump in the United States in 2016, a review of emails and social media posts shows. https://www.cnn.com/2018/06/13/politics/banks-wigmore-russian-ambassador-meetings/index.html …				1007120265908817920			https://twitter.com/Rick1976Gladden/status/1007120265908817920	
Day1983Angel	2018-06-14 00:16	0	0	Two British political operatives were in regular contact with the Russian ambassador in London while they campaigned for, and met with, Donald Trump in the United States in 2016, a review of emails and social media posts shows. https://www.cnn.com/2018/06/13/politics/banks-wigmore-russian-ambassador-meetings/index.html …				1007114472001945600			https://twitter.com/Day1983Angel/status/1007114472001945600	
OneStateD_503	2018-06-13 21:21	0	0	. @ realDonaldTrump @ RussianEmbassy 2 British political operatives were in regular contact w/the Russian ambassador in London while they campaigned for, and met w/ Donald Trump in the United States in 2016, a review of emails and social media posts shows. https://cnn.it/2l6lsnZ		@ realDonaldTrump @ RussianEmbassy		1007070503662743552			https://twitter.com/OneStateD_503/status/1007070503662743552	