username	date	retweets	favorites	text	geo	mentions	hashtags	tweetid	conversationid	replyto	permalink	imagelink
PatrickTuohey	2018-05-10 16:04	0	0	Tourism: When Kansas City is not Kansas City http://showmeinstitute.org/blog/transparency/tourism-when-kansas-city-not-kansas-city … @ ShowMe @ TonysKansasCity # moleg # ksleg # KCpic.twitter.com/kiK2B82I1Y		@ ShowMe @ TonysKansasCity	# moleg # ksleg # KCpic	994669501470924800			https://twitter.com/PatrickTuohey/status/994669501470924800	https://pbs.twimg.com/media/Dc3Ghq4V4AASAzl.jpg
KittensDP	2018-05-10 11:49	0	0	Kansas City really gets behind support their tourism industry!				994605350597939204	994274982669815813	EvilAngelVideo	https://twitter.com/KittensDP/status/994605350597939204	
VisitKC	2018-05-10 11:37	2	3	Meet local hospitality leaders as they reflect on the past, present and future of tourism in Kansas City: http://bit.ly/2KPfSSs # nttw18 # HowWeDoKCpic.twitter.com/igsBSQHkvh			# nttw18 # HowWeDoKCpic	994602364605730817			https://twitter.com/VisitKC/status/994602364605730817	https://pbs.twimg.com/media/Dc2JMnVUQAAJuQN.jpg
mhazaaaaaa	2018-05-10 10:47	1	1	Looks like Kansas City’s tourism board needs a new directum. pic.twitter.com/O6QjvGCKbz				994589685749026816			https://twitter.com/mhazaaaaaa/status/994589685749026816	https://pbs.twimg.com/media/Dc1-C77X4AY-6ao.jpg
DougGiuffre	2018-05-10 06:06	0	2	Kansas City making some bold decisions with their tourism campaign				994519137182461952	994358948592529408	CreminIV	https://twitter.com/DougGiuffre/status/994519137182461952	
RedAlabamaTory	2018-05-10 05:13	1	2	KC obviously bends over backwards to serve its tourists. # KansasCity # tourism # Grammar # Spelling # CopyEditing # Editing # embarrassingpic.twitter.com/Rgq3UHHCTK			# KansasCity # tourism # Grammar # Spelling # CopyEditing # Editing # embarrassingpic	994505596735979520			https://twitter.com/RedAlabamaTory/status/994505596735979520	https://pbs.twimg.com/media/Dc0xkYxVQAAkl6M.jpg
KMKUGULET	2018-05-09 23:02	7	7	Someone inform the @ Totals # Kansas City Tourism Department or whatever. Please. @ CharmianNearypic.twitter.com/u6wEmNCI2Y		@ Totals @ CharmianNearypic	# Kansas	994412360612786176			https://twitter.com/KMKUGULET/status/994412360612786176	https://pbs.twimg.com/media/DczcxOUUwAAMel2.jpg
YOGA_O	2018-05-09 21:02	0	0	Sadly that picture was photoshopped as was the one for Kansas City's tourism - https://www.snopes.com/fact-check/does-welcome-sign-kansas-city-typo/ … funny nonetheless				994382023547596800	993465110189363200	JanJava RenzaS	https://twitter.com/YOGA_O/status/994382023547596800	
kenlars99	2018-05-09 19:37	0	1	Similar to Kansas City tourism				994360816773357568	994312810464243714	madheiress moodvintage	https://twitter.com/kenlars99/status/994360816773357568	
bondwooley	2018-05-09 10:53	0	0	According to The Kansas City Star, hotel and motel tourist revenue has gone up $73 million. # thekansascitystar # innovation # funnysigns # kansascity # tourism # lesterandcharliepic.twitter.com/gebUjDoMHQ			# thekansascitystar # innovation # funnysigns # kansascity # tourism # lesterandcharliepic	994228775851364357			https://twitter.com/bondwooley/status/994228775851364357	https://pbs.twimg.com/media/Dcw1zVGX4AUjOOQ.jpg
LesterCharlie	2018-05-09 10:33	1	3	According to The Kansas City Star, hotel and motel tourist revenue has gone up $73 million. # thekansascitystar # innovation # funnysigns # kansascity # tourism # lesterandcharliepic.twitter.com/2RLagS0n04			# thekansascitystar # innovation # funnysigns # kansascity # tourism # lesterandcharliepic	994223769890762753			https://twitter.com/LesterCharlie/status/994223769890762753	https://pbs.twimg.com/media/DcwxP9eW0AIL99-.jpg
3trinitythree	2018-05-09 07:50	0	1	Seems the Kansas City tourism board have been listening to the podcast pic.twitter.com/6Y6RDZHjIx				994182832397406208	993970076092116992	AndyZak75 TheTwoMikes	https://twitter.com/3trinitythree/status/994182832397406208	https://pbs.twimg.com/media/DcwMAK9W0AEd2fq.jpg
CraigChild	2018-05-09 07:41	0	0	Yes, Kansas City really gets behind tourism.				994180657541730304	994119839840169984	MarkBraund	https://twitter.com/CraigChild/status/994180657541730304	
The_Angry_Nun	2018-05-09 05:18	0	2	Sounds painful.. Surely there has to be a better way to encourage tourism... # BestTypoEver # KansasCity pic.twitter.com/tACbLlndTB			# BestTypoEver # KansasCity	994144635567132672			https://twitter.com/The_Angry_Nun/status/994144635567132672	https://pbs.twimg.com/media/DcvpRdhX0AA7gu6.jpg
DannyLenihan	2018-05-09 02:04	0	2	Well, that’s one way to boost tourism... # KansasCity # anal # tourism # visitkcpic.twitter.com/Md4MHQ2puZ			# KansasCity # anal # tourism # visitkcpic	994095672281493504			https://twitter.com/DannyLenihan/status/994095672281493504	https://pbs.twimg.com/media/Dcu8vepX4AAHpsQ.jpg
RacineRichman	2018-05-08 22:55	0	1	Just incase anyone wanted to visit Kansas # kansas # kansascity # tourism pic.twitter.com/qyUFEBUOzm			# kansas # kansascity # tourism	994048155711918083			https://twitter.com/RacineRichman/status/994048155711918083	https://abs.twimg.com/emoji/v2/72x72/1f602.png
JavaPostProd	2018-05-08 22:30	2	3	Those Kansas City # tourism # marketing sessions must really adhere to the old brainstorming adage that there’s no such thing as a bad idea. https://twitter.com/groovetimead/status/993903567546105856 …			# tourism # marketing	994041942919950336			https://twitter.com/JavaPostProd/status/994041942919950336	
kazzemz	2018-05-08 19:25	0	0	Tourism is about to boom in Kansas City				993995375634780160	993984078012657664	LEGIQN	https://twitter.com/kazzemz/status/993995375634780160	
TonysKansasCity	2018-05-08 17:57	2	0	TKC Double Take: The Sign Was Obviously Photoshop BUT The Kansas City Tourism Numbers Are Just As Phony. Here's An Important Bit Of Evidence: https://bit.ly/2IlngGW pic.twitter.com/mgUQkqVt2X				993973121240596480			https://twitter.com/TonysKansasCity/status/993973121240596480	https://pbs.twimg.com/media/DctM-3ZV4AAJx-8.jpg
JamBandsRuinMe	2018-05-08 17:37	0	0	Kansas City tourism got a bum rap. https://www.facebook.com/jambandsruinedmylife/posts/1915267681838931 …				993968102361747457			https://twitter.com/JamBandsRuinMe/status/993968102361747457	
Hubert1863	2018-05-08 16:57	0	0	@ KCMO @ KansasCityTimes Does any one in Kansas City tourism proof read there signs....? pic.twitter.com/FdekkVQiWL		@ KCMO @ KansasCityTimes		993958204261351424			https://twitter.com/Hubert1863/status/993958204261351424	https://pbs.twimg.com/media/Dcs_t6WU0AAM2Op.jpg
ModernDayLifeCo	2018-05-08 16:50	1	1	# tourism # KansasCity # comedy # justforfun # lolpic.twitter.com/AX7hrvTpmf			# tourism # KansasCity # comedy # justforfun # lolpic	993956310868746240			https://twitter.com/ModernDayLifeCo/status/993956310868746240	https://pbs.twimg.com/media/Dcs9_vwX4AEe_WM.jpg
DanielleNorwood	2018-05-08 16:49	0	1	Today, I was invited to go on the City Tour, sponsored by Visit Topeka. Set to coincide with National Travel and Tourism Week, representatives from the hotel and travel industry and I toured the Kansas Children's Discovery Center, The Topeka Zoo, the Kan… https://ift.tt/2K72c4d pic.twitter.com/1cgDng3d9k				993955956022181888			https://twitter.com/DanielleNorwood/status/993955956022181888	https://pbs.twimg.com/media/Dcs9rISXcAISVEe.jpg
richardpropes	2018-05-08 16:40	0	0	Kansas City tourism officials wonder why they're always the butt of jokes. https://www.facebook.com/richardpropes/posts/10156328485156796 …				993953874842091520			https://twitter.com/richardpropes/status/993953874842091520	
Ace_Collins	2018-05-08 16:27	0	1	Not sure, that's the Kansas City Missouri tourism board, while the # creekoftheweek fortified compound is in Kansas City Kansas.			# creekoftheweek	993950450448728065	993932355684458496	Spielbergstud talkindawson	https://twitter.com/Ace_Collins/status/993950450448728065	
DeepEndDining	2018-05-08 16:09	1	3	Kansas City deploys invasive new tourism campaign. Bend over. pic.twitter.com/I82pBvisG8				993945989680582656			https://twitter.com/DeepEndDining/status/993945989680582656	https://pbs.twimg.com/media/Dcs0m7uU8AAw616.jpg
IceCream4UKC	2018-05-08 15:53	0	0	City of Shawnee expressing their gratitude to all hospitality workers. Celebrating national tourism week with !! — at Courtyard Kansas City Shawnee https://www.facebook.com/LickItDontDripIt/posts/1618965428219886 …				993941976780242944			https://twitter.com/IceCream4UKC/status/993941976780242944	https://abs.twimg.com/emoji/v2/72x72/1f366.png
DrJuanLPerez	2018-05-08 14:49	8	22	Oh really, Kansas City? # Tourism pic.twitter.com/m2bMn0S2GC			# Tourism	993925767863160832			https://twitter.com/DrJuanLPerez/status/993925767863160832	https://pbs.twimg.com/media/DcsiNkYWAAEoqjb.jpg
BrianManzullo	2018-05-08 13:47	0	0	For those of you sharing that Kansas City tourism photo: It does say "actually." https://twitter.com/MontyDavisKC/status/993893023170822144 …				993910349593239553			https://twitter.com/BrianManzullo/status/993910349593239553	
CynicalVision50	2018-05-08 13:39	0	0	Does the Kansas City Tourism Bureau provide lube? https://twitter.com/matthewjdowd/status/993842651983212544 …				993908227938181121			https://twitter.com/CynicalVision50/status/993908227938181121	https://pbs.twimg.com/media/DcrWn1HUwAAuVg0.jpg
TheSpinDoctor	2018-05-08 13:30	2	26	And you ask why tourism is soaring in Kansas City...? # editingpic.twitter.com/gPnslcnQ7d			# editingpic	993906090592030721			https://twitter.com/TheSpinDoctor/status/993906090592030721	https://pbs.twimg.com/media/DcsQHZjU8AEA6w_.jpg
JBurlowski	2018-05-08 13:00	0	0	The world needs more # proofreaders! # proofreading # editing # KansasCity # tourism pic.twitter.com/dBdqNhZvPu			# proofreaders # proofreading # editing # KansasCity # tourism	993898556372250624			https://twitter.com/JBurlowski/status/993898556372250624	https://abs.twimg.com/emoji/v2/72x72/1f633.png
gnpm72	2018-05-08 12:34	0	1	Their hardcore about tourism in Kansas City https://twitter.com/guygavrielkay/status/993595377029758977 …				993891890192896000			https://twitter.com/gnpm72/status/993891890192896000	
KarinDiskin	2018-05-08 12:24	0	0	Kansas City seems to be giving a bum steer to its tourism industry. https://twitter.com/joncoopertweets/status/993766330011672576 …				993889508784394240			https://twitter.com/KarinDiskin/status/993889508784394240	https://pbs.twimg.com/media/DcqRNEkU0AAAFtg.jpg