username	date	retweets	favorites	text	geo	mentions	hashtags	tweetid	conversationid	replyto	permalink	imagelink
randy_travel	2018-07-23 11:20	0	1	@ BrianKMBC Greetings from West MI where I notice u worked in Lansing as I am in Grand Rapids reporting on politics/crime beat/travel and tourism and economy and do hope u will follow me from Kansas City.		@ BrianKMBC		1021414756626911232			https://twitter.com/randy_travel/status/1021414756626911232	https://abs.twimg.com/emoji/v2/72x72/1f1fa-1f1f8.png
yVoNNeFullyAliv	2018-07-22 15:11	0	1	I make mini promotional videos showcasing attractions for the artistically minded, muses, city planners, architects, tourism, festivals, progressives, millenials, musicians, and anyone ... For booking for your event: EMAIL - yvonne.oprean47@gmail.com https://youtu.be/G9lvtbbmmyg				1021110605535752192			https://twitter.com/yVoNNeFullyAliv/status/1021110605535752192	
TonysKansasCity	2018-07-22 11:54	1	0	Kansas City Homeless Riot Arson Shuts Down Beardsley Road For ONE YEAR. While @ KCMO Appraises The Cost To Repair, The Reality Is That PERVASIVE POVERTY IMPACTS THE LOOP While @ MayorSlyJames Champions Taxpayer Subsidy For Development Schemes & Tourism. https://bit.ly/2zX7Fuo pic.twitter.com/h1F7jgmqsn		@ KCMO @ MayorSlyJames		1021060828953497600			https://twitter.com/TonysKansasCity/status/1021060828953497600	https://pbs.twimg.com/media/DiuJNw2U8AEPXZy.jpg
SeLaDamosTODA	2018-07-21 10:57	0	1	# humour # humor well done # KansasCity! # KansasSlogans # Kansas # tourism pic.twitter.com/P9ntTuT0Lg			# humour # humor # KansasCity # KansasSlogans # Kansas # tourism	1020684101026820098			https://twitter.com/SeLaDamosTODA/status/1020684101026820098	https://abs.twimg.com/emoji/v2/72x72/1f923.png
KittyKansas	2018-07-20 19:54	0	1	May require regulation of a tourism industry?				1020456846811856902	1020455381728931841	RoyBlunt	https://twitter.com/KittyKansas/status/1020456846811856902	
GovLovePodcast	2018-07-20 08:13	0	0	Get the heck into Dodge! Learn about the efforts of Dodge City, Kansas to bring tourism to the queen of the cowtowns http://elgl.org/2018/07/20/podcast-dodge-city-kansas-melissa-mccoy/ …				1020280449296486400			https://twitter.com/GovLovePodcast/status/1020280449296486400	
ham_LRT	2018-07-19 19:16	0	5	/3 .... ideas such as a "Shop Passport", community rally, mobile music fest, tourism ideas, custom store signage during construction, advance communications, and other business mitigation techniques during LRT construction. No businesses shut down in Kansas City. # LRTreadypic.twitter.com/hSa8yZ7qwL			# LRTreadypic	1020084910302744576	1020078345466175488		https://twitter.com/ham_LRT/status/1020084910302744576	https://pbs.twimg.com/media/DigRzymUEAEhIbw.jpg
VisitBaldwin	2018-07-19 09:48	0	1	Couldn’t agree more, @ RepAdamLusker! The Baldwin City area is the proud home to historic attractions that begin the story of Kansas. @ BlackJackBattle @ bakeru # baldwincityks # travelkshttps://twitter.com/RepAdamLusker/status/1002584343641018369 …		@ RepAdamLusker @ BlackJackBattle @ bakeru	# baldwincityks # travelkshttps	1019942039876710400			https://twitter.com/VisitBaldwin/status/1019942039876710400	https://pbs.twimg.com/media/DenlIP8UYAAGoN9.jpg
VisitBaldwin	2018-07-18 19:58	0	0	Everybody knows Baldwin City is the unofficial @ SNICKERS capital of Northeast Kansas!		@ SNICKERS		1019733252087668737	1019417517108944897	GetBaldwinCity SNICKERS	https://twitter.com/VisitBaldwin/status/1019733252087668737	
VisitBaldwin	2018-07-17 11:33	0	1	Great pics of the Kansas Belle Dinner Train, @ roscoepoet! Thanks for sharing. # AllAboard # baldwincitykshttps://twitter.com/roscoepoet/status/990789581560733696 …		@ roscoepoet	# AllAboard # baldwincitykshttps	1019243731705311232			https://twitter.com/VisitBaldwin/status/1019243731705311232	
VisitBaldwin	2018-07-17 11:27	0	1	Happy belated anniversary, @ ReyofGratitude! We’re glad you enjoyed your special evening on the Kansas Belle Dinner Train. # AllAboard # baldwincitykshttps://twitter.com/reyofgratitude/status/998518445531697152 …		@ ReyofGratitude	# AllAboard # baldwincitykshttps	1019242090042191872			https://twitter.com/VisitBaldwin/status/1019242090042191872	
VisitBaldwin	2018-07-17 11:18	0	0	Thanks for visiting Baldwin City and riding the Kansas Belle Dinner Train! Come back and see us anytime! # allaboard # baldwincityks			# allaboard # baldwincityks	1019239875911012352	1018979861472468992	SeniorLuv	https://twitter.com/VisitBaldwin/status/1019239875911012352	
CountzPRTravel	2018-07-16 12:20	0	1	The Union Station In Kansas City, Shines Blue In Honor Of Yordano Ventura http://bit.ly/2kkfTQi # kc # kcmo # travel # destinations # yordanoventura # vacation # placestosee # jetsetter # getthere # tourism # yordanoventura			# kc # kcmo # travel # destinations # yordanoventura # vacation # placestosee # jetsetter # getthere # tourism # yordanoventura	1018893062985142272			https://twitter.com/CountzPRTravel/status/1018893062985142272	
PassRailOK	2018-07-16 08:10	1	4	Passenger Rail 101. The Oklahoma Tourism and Passenger Rail Act of 1996 led to the establishment of the # HeartlandFlyer in 1999. Excitement quickly turned into frustration as the legislature refused to fund service expansion to Kansas City. It is time for action.			# HeartlandFlyer	1018830184563269632			https://twitter.com/PassRailOK/status/1018830184563269632	
CountzPRTravel	2018-07-16 00:20	0	1	The Union Station In Kansas City, Shines Blue In Honor Of Yordano Ventura http://bit.ly/2kkfTQi # kc # kcmo # travel # destinations # yordanoventura # vacation # placestosee # jetsetter # getthere # tourism			# kc # kcmo # travel # destinations # yordanoventura # vacation # placestosee # jetsetter # getthere # tourism	1018711860000980992			https://twitter.com/CountzPRTravel/status/1018711860000980992	
mph_phd	2018-07-15 21:29	0	2	Forgot to tell y'all, this event raises money for domestic violence victims while contributing to Kansas City's tourism industry. Very well attended and fun event. Happy to serve on the # NTDF board. @ KCMOCreative # hotstilletto # heelsthatheal # kansascity		@ KCMOCreative	# NTDF # hotstilletto # heelsthatheal # kansascity	1018668882960273408	1018632700771565568		https://twitter.com/mph_phd/status/1018668882960273408	https://pbs.twimg.com/profile_images/905438402883047429/d5-ikQ77_normal.jpg
CCOQMuseum	2018-07-15 14:32	1	0	Discover Us On Vintage American http://bit.ly/VintageAmericaOQM … # blackhistory # kcks # kansascity # travel # tourism # kansas http://www.discoverypub.com/columns/ken/0114_TravelingWithKen/index.html …			# blackhistory # kcks # kansascity # travel # tourism # kansas	1018563894032371712			https://twitter.com/CCOQMuseum/status/1018563894032371712	
CountzPRTravel	2018-07-14 21:35	0	1	Pack Your Bags - Destination Downtown Kansas City Solar Eclipse http://bit.ly/2wACe5v # 2017solareclipse # solareclipse # weather # kcmo # kc # travel # destinations # vacation # wanderer # jetsetter # tourist # onthego # seetheworld # worldtraveler # travelgram # tourism # explore			# 2017solareclipse # solareclipse # weather # kcmo # kc # travel # destinations # vacation # wanderer # jetsetter # tourist # onthego # seetheworld # worldtraveler # travelgram # tourism # explore	1018307926178615296			https://twitter.com/CountzPRTravel/status/1018307926178615296	
The_NCS	2018-07-10 07:57	2	2	From New York to Kansas City, if you're up for a little Mob tourism this summer, let these be your guide: http://www.newzbreaker.com/2018/01/29/the-mafia-chronicles-mob-tourism-by-the-book-and-app/ …				1016652552396558336			https://twitter.com/The_NCS/status/1016652552396558336	
CelesteLupercio	2018-07-09 11:43	2	0	Great news for us! Angie Jeffries is official. One of my favorite orgs in Kansas City. # travel # tourism # attractions # KansasCity # SKAL # SKALleague # SKALUSA # network @ SKAL_Intl @ skal_USA https://lnkd.in/eKAhFKr		@ SKAL_Intl @ skal_USA	# travel # tourism # attractions # KansasCity # SKAL # SKALleague # SKALUSA # network	1016347172298739712			https://twitter.com/CelesteLupercio/status/1016347172298739712	
Shulab	2018-07-09 03:03	0	1	"The Perfect Way to Explore Modern Kansas City? A Streetcar, Believe It or Not." # NYT # Travel # Advrnture # discovary # nature # traveling # traveller # explore # tourism https://ift.tt/2z9k7qt pic.twitter.com/OMq0mIWw9V			# NYT # Travel # Advrnture # discovary # nature # traveling # traveller # explore # tourism	1016216288572649472			https://twitter.com/Shulab/status/1016216288572649472	https://pbs.twimg.com/media/DhpTVDCXUAAvR2N.jpg
lornawardnews	2018-07-07 12:43	0	0	Blog: # Knuckleheads - A hidden gem on the other side of the tracks in # KansasCity. (Part 1/3) # incrediblemusic # travel # adventure # discovery # tourism @ Knuckleheadskc @ VisitKChttps://lornaward.com/2018/07/07/knuckleheads-a-hidden-gem-on-the-other-side-of-the-tracks-in-kansas-city-part-3-3/ …		@ Knuckleheadskc @ VisitKChttps	# Knuckleheads # KansasCity # incrediblemusic # travel # adventure # discovery # tourism	1015637383906250753			https://twitter.com/lornawardnews/status/1015637383906250753	
lornawardnews	2018-07-07 12:42	0	2	Blog # Knuckleheads 3/3 - a hidden gem on the other side of the tracks (Part 3/3) # KansasCity # music # travel # discovery # tourism # USA @ meganruger @ MrScottyDennis @ Knuckleheadskc @ visitkc http://lornaward.com/2018/07/07/knuckleheads-a-hidden-gem-on-the-other-side-of-the-tracks-in-kansas-city-part-3-3/ …pic.twitter.com/cKWQDZdHtQ		@ meganruger @ MrScottyDennis @ Knuckleheadskc @ visitkc	# Knuckleheads # KansasCity # music # travel # discovery # tourism # USA	1015637090376265728			https://twitter.com/lornawardnews/status/1015637090376265728	https://pbs.twimg.com/media/DhhEjPvVMAACY3v.jpg
lornawardnews	2018-07-07 06:31	0	0	Blog 2/3: # Knuckleheads - A hidden gem on the other side of the tracks in # KansasCity (Part 2/3) # travel # music # tourism # adventure @ Knuckleheadskc @ visitkc https://lornaward.com/2018/07/07/knuckleheads-a-hidden-gem-on-the-other-side-of-the-tracks-in-kansas-city-part-2-3/ …		@ Knuckleheadskc @ visitkc	# Knuckleheads # KansasCity # travel # music # tourism # adventure	1015543846040690688			https://twitter.com/lornawardnews/status/1015543846040690688	
lornawardnews	2018-07-07 05:40	0	0	Blog: # Knuckleheads - A hidden gem on the other side of the tracks in # KansasCity (Part 2/3) # travel # music # tourism # adventure @ Knuckleheadskc @ visitkc http://lornaward.com/2018/07/07/knuckleheads-a-hidden-gem-on-the-other-side-of-the-tracks-in-kansas-city-part-2-3/ …pic.twitter.com/G6T0Y6BDZD		@ Knuckleheadskc @ visitkc	# Knuckleheads # KansasCity # travel # music # tourism # adventure	1015531071079841792			https://twitter.com/lornawardnews/status/1015531071079841792	https://pbs.twimg.com/media/DhfkIHRVQAEe711.jpg
lornawardnews	2018-07-06 16:43	0	0	Blog: # Knuckleheads - A hidden gem on the other side of the tracks in # KansasCity. (Part 1/3) # incrediblemusic # travel # adventure # discovery # tourism @ Knuckleheadskc @ visitkc https://lornaward.com/2018/07/06/knuckleheads-a-hidden-gem-on-the-other-side-of-the-tracks-in-kansas-city-part-1-3/ …		@ Knuckleheadskc @ visitkc	# Knuckleheads # KansasCity # incrediblemusic # travel # adventure # discovery # tourism	1015335348971429892			https://twitter.com/lornawardnews/status/1015335348971429892	
lornawardnews	2018-07-06 15:09	0	0	# Knuckleheads - A hidden gem on the other side of the tracks in # KansasCity. (Part 1/3) # incrediblemusic # travel # adventure # discovery # tourism @ Knuckleheadskc @ visitkc http://lornaward.com/2018/07/06/knuckleheads-a-hidden-gem-on-the-other-side-of-the-tracks-in-kansas-city-part-1-3/ …pic.twitter.com/pMOMVWFwKR		@ Knuckleheadskc @ visitkc	# Knuckleheads # KansasCity # incrediblemusic # travel # adventure # discovery # tourism	1015311891252629504			https://twitter.com/lornawardnews/status/1015311891252629504	https://pbs.twimg.com/media/DhccyJvV4AAt93C.jpg
JordanSchevene	2018-07-06 07:42	0	1	Check out my most recent shoot for Bicycle Retailer. # kansascity # tourism # cycling # bicycletour # BicycleRetailer # funonbikes https://www.facebook.com/jordan.schevene/posts/10156570702179433 …			# kansascity # tourism # cycling # bicycletour # BicycleRetailer # funonbikes	1015199368092225537			https://twitter.com/JordanSchevene/status/1015199368092225537	
TourismShare	2018-07-02 18:41	0	0	Beauty of Kansas draws tourism, generating billions - Kansas City Star http://dlvr.it/QZG9s6				1013915486776582144			https://twitter.com/TourismShare/status/1013915486776582144	
kaseyk33	2018-06-29 10:35	0	1	I cannot wait to do this to @ NYIslanders fans in the coming days. Can anyone get me 100 Kansas City Tourism pamphlets so I can show those idiots where their team will be in a few years? @ WeBleedBlueNYC # NYRhttps://twitter.com/barstoolsports/status/1012300957298974721 …		@ NYIslanders @ WeBleedBlueNYC	# NYRhttps	1012706011046600704			https://twitter.com/kaseyk33/status/1012706011046600704	https://pbs.twimg.com/ext_tw_video_thumb/1012090077122584578/pu/img/xESB_K9BAGy1TPYZ.jpg
heffstl	2018-06-27 23:04	1	0	Beneath the Hall of Waters # kansascity # igkansascity # missouri # instakc # excelsiorsprings # travel # instatravel # travelgram # tourism # instago # passportready # ilovetravel # instatravelling… https://www.instagram.com/p/BkjXXTenfOO/?utm_source=ig_twitter_share&igshid=1w6wv0952ztml …			# kansascity # igkansascity # missouri # instakc # excelsiorsprings # travel # instatravel # travelgram # tourism # instago # passportready # ilovetravel # instatravelling	1012169748153556993			https://twitter.com/heffstl/status/1012169748153556993	
heffstl	2018-06-27 23:01	1	1	Above the Hall of Waters # kansascity # igkansascity # missouri # instakc # excelsiorsprings # travel # instatravel # travelgram # tourism # instago # passportready # ilovetravel # instatravelling… https://www.instagram.com/p/BkjXGmznaMg/?utm_source=ig_twitter_share&igshid=sjrsk31nz83y …			# kansascity # igkansascity # missouri # instakc # excelsiorsprings # travel # instatravel # travelgram # tourism # instago # passportready # ilovetravel # instatravelling	1012169170828648449			https://twitter.com/heffstl/status/1012169170828648449	
PatrickTuohey	2018-06-25 11:19	0	0	Are Kansas City's tourism numbers just more # FakeNews? https://showmeinstitute.org/blog/transparency/tourism-when-kansas-city-not-kansas-city … @ VisitKC @ ShowMe # KC @ KCMOpic.twitter.com/qMXWofEwmB		@ VisitKC @ ShowMe @ KCMOpic	# FakeNews # KC	1011267694925053953			https://twitter.com/PatrickTuohey/status/1011267694925053953	https://pbs.twimg.com/media/Dgi-lTiUYAAYmUG.jpg
AdubToGo	2018-06-25 10:57	0	0	Was fully intending on voting for you in 2020 to bring America back to sanity. As a lifelong Kansas Citian Im thrilled to vote sooner. If there’s anything a former tourism/visitor engagement manager for the city & current non-profit development manager can do to help, please ask.				1011262096443695104	1011256734470606849	JasonKander	https://twitter.com/AdubToGo/status/1011262096443695104	
poorhouseinmo	2018-06-20 22:15	0	1	This BEAUTIFUL ad is running on tv in Kansas City. Thank you for believing KC is the diverse market we truly are & running it here! # Pride # NoH8 Lesbian Wedding Happens in Vegas in Heartwarming New Tourism Ad http://www.newnownext.com/lesbian-wedding-visit-las-vegas-ad/05/2018/?utm=share_twitter … via @ NewNowNext		@ NewNowNext	# Pride # NoH8	1009620861761064961			https://twitter.com/poorhouseinmo/status/1009620861761064961	
nickconser	2018-06-15 13:43	0	0	Kansas City is the new Wild Wild West great for tourism.				1007680105940967426	1007675168121147392	EllenKCTV5	https://twitter.com/nickconser/status/1007680105940967426	
CelesteLupercio	2018-06-15 11:17	1	2	What an exciting message to receive! Katie Schillare is officially joining me and my fellow SKALleagues! One of the greatest orgs I'm involved with in Kansas City. # travel # tourism # attractions # SKAL # SKALUSA @ SKAL_Intl @ skal_USAhttps://lnkd.in/eK9QSiB		@ SKAL_Intl @ skal_USAhttps	# travel # tourism # attractions # SKAL # SKALUSA	1007643307760070656			https://twitter.com/CelesteLupercio/status/1007643307760070656	
aeferg09	2018-06-14 17:31	0	1	The fans from overseas would come to visit Kansas city. Hosting these events isn't about locals going it's about tourism and increased revenue.				1007375082132516865	1007089427909414913	DrownsTC kkwhb	https://twitter.com/aeferg09/status/1007375082132516865	
MMCCinc	2018-06-14 11:29	0	0	When I’m sitting in a meeting with colleagues in Dodge City KS, I’m sitting in a room filled with good people! The Travel Industry Association of Kansas does good things on behalf of KS tourism business.				1007283825393782786			https://twitter.com/MMCCinc/status/1007283825393782786	
obscenetweets31	2018-06-13 14:33	0	1	It’s really just a tourism thing, LA/ San Fran too good to pass up. If you’re a fan coming from South Korea per say for one or two group games it’s easier to fly to LA. Kansas City is a weird one.. there will be another compact World Cup soon. Brazil was huge				1006967882385903620	1006912078114934785	2wiseguysinc Red_Roscoe	https://twitter.com/obscenetweets31/status/1006967882385903620	
DontDeflect	2018-06-10 10:37	2	4	Off to Kansas City, MO for the AP English Literature Reading! Eight hour days, reading AP essays from all over the country. Want to beat my personal best of 1,200 essays. (In other news, the Kansas City Tourism Bureau needs a proofreader). pic.twitter.com/FjRHCl0jzZ				1005821173551075328			https://twitter.com/DontDeflect/status/1005821173551075328	https://pbs.twimg.com/media/DfVlBi4UcAAICXg.jpg
RoghobC	2018-06-06 09:56	1	2	# Limerick @ Limerick_ie great to be at # CNPAmericas18 # newyork big insights on # cityregion # brandstrategy from US cities & # AmazonHQ2 # fdi # tourism # integration # collaboration # Philadelphia # Kansas # Miamipic.twitter.com/BPzTvVsTXc		@ Limerick_ie	# Limerick # CNPAmericas18 # newyork # cityregion # brandstrategy # AmazonHQ2 # fdi # tourism # integration # collaboration # Philadelphia # Kansas # Miamipic	1004361467217498118			https://twitter.com/RoghobC/status/1004361467217498118	https://pbs.twimg.com/media/DfA1bVHU8AAcA8H.jpg
Resonanceco	2018-06-06 09:54	0	4	Philadelphia, Kansas City and Miami leaders on the importance of economic and tourism development collaboration in attracting business investment @ cityofphilly # AmazonHQ # CNPAmericas18 # bestcities # placebranding # economicdevelopment @ citynationplace @ bestcitiesorgpic.twitter.com/taLFRtkiLt – bei NYU Rosenthal Pavilion		@ cityofphilly @ citynationplace @ bestcitiesorgpic	# AmazonHQ # CNPAmericas18 # bestcities # placebranding # economicdevelopment	1004360889930264588			https://twitter.com/Resonanceco/status/1004360889930264588	https://pbs.twimg.com/media/DfA05pPWkAIq-Tc.jpg
VisitKC	2018-05-31 12:05	0	0	Thank you for joining us! We appreciate your time and investment in Kansas City's tourism industry.				1002219576929726465	1001577729253396480	repcleaver USTravel TravelCoalition	https://twitter.com/VisitKC/status/1002219576929726465	
TravelCoalition	2018-05-31 12:00	0	6	Thank you to @ VisitKC for hosting a successful # TravelTalk with @ repcleaver; a true # travel champion who understands the importance of tourism to Kansas City. pic.twitter.com/LIoWRhl6nK		@ VisitKC @ repcleaver	# TravelTalk # travel	1002218258542596099			https://twitter.com/TravelCoalition/status/1002218258542596099	https://pbs.twimg.com/media/DeiNwOtWkAES9dF.jpg
TravelEservicis	2018-05-31 03:29	0	0	Tourism > Trip: March 2018 Kansas City Chapter Update> Enjoying the http://bit.ly/2J2pTOU # Travelpic.twitter.com/MrId0PciFM			# Travelpic	1002089577165836288			https://twitter.com/TravelEservicis/status/1002089577165836288	https://pbs.twimg.com/media/DegjKL4U0AAquZX.jpg
MarhabaNet	2018-05-27 15:29	0	0	Did you know? # Kansas_City welcomes 25 million visitors # anally. # Travel # Tourism @ kcpolicepic.twitter.com/vYWcmyZ8K7		@ kcpolicepic	# Kansas_City # anally # Travel # Tourism	1000821409210187776			https://twitter.com/MarhabaNet/status/1000821409210187776	https://pbs.twimg.com/media/DeOhwlOUwAAYxZM.jpg
NotMyLinkedIn	2018-05-21 21:54	0	1	aww, it's even sadder than kansas city tourism ads. i forgot how adorable and earnest midwest tourism promoters are.				998743845146800128	998743396591206400	Goodtweet_man	https://twitter.com/NotMyLinkedIn/status/998743845146800128	
B_baby8186	2018-05-21 14:59	0	0	Naming KCI after MLK would be detrimental to Kansas City and tourism!! What ties does MLK have to KC?? None! https://twitter.com/mayorslyjames/status/997544794359463937 …				998639485830213632			https://twitter.com/B_baby8186/status/998639485830213632	https://abs.twimg.com/emoji/v2/72x72/1f612.png
broodcow	2018-05-18 19:47	1	0	# KSWX So who knew Kansas was a tourism destination? Storm chasers from Oakley clear to Scott City. Busses of them.			# KSWX	997624691769700352			https://twitter.com/broodcow/status/997624691769700352	
joyceangelos	2018-05-17 12:45	0	0	Kansas City has them too. Great for tourism, getting to and from w/out parking hassles. The bus is not cool.				997156069087440897	997152755537137664	babloo328	https://twitter.com/joyceangelos/status/997156069087440897	
WFG_NS	2018-05-17 05:06	1	0	TownePlace Suites by Marriott open for business in Kansas City, Missouri # travel # tourism # bhivelabshttp://dld.bz/gPgpN			# travel # tourism # bhivelabshttp	997040663890989056			https://twitter.com/WFG_NS/status/997040663890989056	
JSharpComedy	2018-05-14 00:48	0	1	Kansas City is bringing up the rear on tourism. https://www.instagram.com/p/BivrhfSljLK/?utm_source=ig_twitter_share …				995888533939208193			https://twitter.com/JSharpComedy/status/995888533939208193	
KansasCity_inMO	2018-05-13 16:19	0	1	This is a doctored photo and VisitKC is the tourism bureau for Kansas City, Missouri. This streetcar stop is in Kansas City, Missouri. The original and real Kansas City is in Missouri. pic.twitter.com/npGHN8I38g				995760366796685312	995664582009085952	Amber69Skye dixonwriting	https://twitter.com/KansasCity_inMO/status/995760366796685312	https://pbs.twimg.com/media/DdGmxHRU0AAWI97.jpg
ChrisTheBarMan	2018-05-13 12:02	0	0	Ohhhh myyyyy. Kansas City is trying to bump up their tourism numbers with some new signs. pic.twitter.com/LinKoeYHPr				995695696035631104			https://twitter.com/ChrisTheBarMan/status/995695696035631104	https://pbs.twimg.com/media/DdFh_LSXcAAQ1Sz.jpg
RobotThomas	2018-05-12 17:55	1	7	Travel and Tourism is a tough gig in Kansas City apparently. pic.twitter.com/8aFCoV09iv				995422360772624384			https://twitter.com/RobotThomas/status/995422360772624384	https://pbs.twimg.com/media/DdBzWlcVQAAitIu.jpg
VIZENTEMORA	2018-05-12 13:52	0	0	No butts about it: Viral photo of Visit KC tourism sign is a prank - Kansas City Star http://dlvr.it/QSdjT4 pic.twitter.com/XMyEnKmAlF				995361026475417600			https://twitter.com/VIZENTEMORA/status/995361026475417600	https://pbs.twimg.com/media/DdA7lAfVAAANzfP.jpg
JimBostdorff	2018-05-12 10:40	0	0	Also why tourism has hit the skids in Kansas City.				995312760312475650	995304092871348225	GrimmerLisa	https://twitter.com/JimBostdorff/status/995312760312475650	
SeanGroark	2018-05-11 21:46	0	1	Should have told that to Kansas City’s tourism industry pic.twitter.com/XmK1B399hg				995117891082244096	995104168477159424	Daynamite13	https://twitter.com/SeanGroark/status/995117891082244096	https://pbs.twimg.com/media/Dc9ecaiU0AAWHU6.jpg
bryantd23	2018-05-11 17:27	0	0	2.) A funding agreement with the North Kansas City Historical Society to help with the Caboose preservation efforts. $20,000 will be used from the Convention and Tourism Fund. The full agenda can be found here: http://nkc.org/common/pages/DisplayFile.aspx?itemId=12953805 … (2/2)				995052694082654214			https://twitter.com/bryantd23/status/995052694082654214	
analloversdate	2018-05-11 14:19	0	0	Misspelled Tourism Sign Promotes Anal Sex In Kansas City: Misspelled Tourism Sign Promotes Anal Sex In Kansas City NewNowNextFull coverage http://dlvr.it/QSXvCD				995005441380831232			https://twitter.com/analloversdate/status/995005441380831232	
dtropea116	2018-05-11 14:14	0	0	Kansas City, Where our tourism board is only excelled by our literacy program for children.				995004199384616962	993612155076382721	LeggoMyMeggoYo	https://twitter.com/dtropea116/status/995004199384616962	
shanevanderhart	2018-05-11 10:45	0	1	Yesterday in Kansas City, @ kovanderhart suggests before we head back home: "Let's go look for iconic # Instagram murals in the city." This is # Millennial tourism, LOL. # KCMOhttps://twitter.com/kovanderhart/status/994706932723314689 …		@ kovanderhart	# Instagram # Millennial # KCMOhttps	994951511376613376			https://twitter.com/shanevanderhart/status/994951511376613376	https://pbs.twimg.com/media/Dc3orIvVQAEro6W.jpg
champsatlife	2018-05-11 09:39	0	0	Kansas City has really upped their commitment to tourism. # FAILpic.twitter.com/xhpAgxlJLD			# FAILpic	994935115380764672			https://twitter.com/champsatlife/status/994935115380764672	https://pbs.twimg.com/media/Dc64NcuU8AAhP1x.jpg
bobafett26	2018-05-11 04:12	0	3	Kansas City tourism on the mark pic.twitter.com/0svjkBLewA				994852858532171776			https://twitter.com/bobafett26/status/994852858532171776	https://pbs.twimg.com/media/Dc5tZm3WkAA5EFd.jpg
VisitKC	2018-05-10 19:04	12	23	Each year, Kansas City's tourism industry generates $5.5 billion in economic impact. # nttw18 # HowWeDoKCpic.twitter.com/hAYyYKo7Sx			# nttw18 # HowWeDoKCpic	994714705372549122			https://twitter.com/VisitKC/status/994714705372549122	https://pbs.twimg.com/media/Dc3vwKSX0AUTlpT.jpg
