username	date	retweets	favorites	text	geo	mentions	hashtags	tweetid	conversationid	replyto	permalink	imagelink
JROSENBERG1	2017-11-16 11:11	0	0	New video by CNBC: Ben & Jerry's Founders Ben Cohen & Jerry Greenfield: Raise, Don't Cut Our Taxes | CNBC https://youtu.be/xgxwYj7alwc				931192919536685057			https://twitter.com/JROSENBERG1/status/931192919536685057	
oregonvt	2017-11-13 14:14	0	0	Wealth, a group that advocates progressive causes. Signers include Ben & Jerry's Ice Cream founders Ben Cohen and Jerry Greenfield, fashion designer Eileen Fisher, billionaire hedge fund manager George Soros, and philanthropist Steven Rockefeller, as well as many individuals and				930151795418165249			https://twitter.com/oregonvt/status/930151795418165249	
rl93930	2017-11-13 11:02	0	1	Some people who have signed onto the letter include Ben & Jerry's Ice Cream founders Ben Cohen and Jerry Greenfield, fashion designer Eileen Fisher, billionaire hedge fund manager George Soros and philanthropist Steven Rockefeller. https://twitter.com/thehill/status/930100958410964994 …				930103595604647936			https://twitter.com/rl93930/status/930103595604647936	https://pbs.twimg.com/media/DOhh5C1XkAE0bCA.jpg
ErinCox01	2017-09-12 14:31	0	0	Ben Cohen and Jerry Greenfield of Ben & Jerry's = BEST entrepenuers ever # MCCBiz			# MCCBiz	907672958285606913			https://twitter.com/ErinCox01/status/907672958285606913	
blingbling_mike	2017-08-01 02:00	0	0	Connaissez-vous l’histoire des fameuses glaces tant appréciées Ben & Jerry’s ? Ben Cohen et Jerry Greenfield... http://fb.me/t4wQjxuw				892263653742960645			https://twitter.com/blingbling_mike/status/892263653742960645	
madoceoeo	2017-05-09 15:35	0	0	価格551円～ Ben & Jerry's Homemade Ice Cream & Dessert Book Jerry Greenfield Workman Publishing Company Ben Cohen Nancy… http://dlvr.it/P5xglp pic.twitter.com/XzKa20leuG				862028179472498688			https://twitter.com/madoceoeo/status/862028179472498688	https://pbs.twimg.com/media/C_aKD0EV0AEjNul.jpg
jasont42	2017-05-04 16:54	1	2	Ben Cohen and Jerry Greenfield (Ben & Jerry's Ice Creams)				860236148181958656	860233115930963973	KyleKulinski	https://twitter.com/jasont42/status/860236148181958656	
samlinksha9	2016-12-12 19:07	0	0	Ben & Jerry's Homemade Ice Cream & Dessert Book - Ben Cohen, Jerry Greenfield & Nancy Stevens: With little skill,… http://dlvr.it/Msl7yf				808463218305683456			https://twitter.com/samlinksha9/status/808463218305683456	
BLFeed	2016-12-01 15:07	0	0	REQUEST: Ben & Jerry's Homemade Ice Cream & Dessert Book by Ben Cohen, Jerry Greenfield, Nancy Stevens - http://www.booklending.com/~B0073SPDHM				804416609842593796			https://twitter.com/BLFeed/status/804416609842593796	
husbandsa	2016-11-09 14:30	1	2	I know this isn't the best time, but Ben Cohen and Jerry Greenfield from Ben & Jerry's are coming to GSU tomorrow. its lit				796434906394066944			https://twitter.com/husbandsa/status/796434906394066944	
sometingy	2016-10-15 10:26	0	0	A photograph showing Ben Cohen and Jerry Greenfield, the founders of Ben & Jerry’s, holding a “We Hate Cops” Extremist Xenophobia				787298556784873472			https://twitter.com/sometingy/status/787298556784873472	
rosasay	2016-10-07 14:17	0	0	Ben Cohen and Jerry Greenfield, founders of Ben and Jerry's weigh in on business Kuleana: https://www.theguardian.com/commentisfree/2016/oct/07/donald-trump-tax-avoidance-businesses …				784457666802221058			https://twitter.com/rosasay/status/784457666802221058	
canadafreepress	2016-10-07 08:00	0	1	Ben & Jerry’s goes full-on racist: Capital Research Center Leftists Ben Cohen and Jerry Greenfield of Ben & J... http://bit.ly/2dQNXAw				784362661530050560			https://twitter.com/canadafreepress/status/784362661530050560	
gppisu	2016-09-16 11:03	0	0	Ben & Jerry's Homemade Ice Cream & Dessert Book (English Edition) Ben Cohen (著), Jerry Greenfield (著), Nancy ... http://amzn.to/2cEsVnS				776798552240467968			https://twitter.com/gppisu/status/776798552240467968	
shatteredlady54	2016-08-13 10:06	0	0	What are Ben and Jerry's last names? Jerry Greenfield and Ben Cohen were born four days apart. Twenty-seven... http://fb.me/7ywV8vYZw				764463086170431488			https://twitter.com/shatteredlady54/status/764463086170431488	
Camera_Fun_Fair	2016-07-15 04:25	0	0	Ben & Jerry's Homemade Ice Cream & Dessert Book: Ben Cohen, Jerry Greenfield, Nancy Stevens: 2015894 http://pinterest.com/pin/343892121528794723/ …				753868038018043905			https://twitter.com/Camera_Fun_Fair/status/753868038018043905	
samlinksha9	2016-07-04 09:30	0	0	Ben & Jerry's Homemade Ice Cream & Dessert Book - Ben Cohen, Jerry Greenfield & Nancy Stevens: With little skill,… http://dlvr.it/Ljx6lM				749958586252439552			https://twitter.com/samlinksha9/status/749958586252439552	
DailyBagelCafe	2016-06-30 11:15	0	0	DID YOU KNOW?: When Ben Cohen and Jerry Greenfield founded Ben & Jerry's they had originally planned to open a... http://fb.me/8bb28du0f				748535447819673600			https://twitter.com/DailyBagelCafe/status/748535447819673600	
rafaTT08	2016-06-28 20:07	0	0	queria só agradecer ao Ben Cohen e ao Jerry Greenfield por terem criado a "Ben&Jerry's"				747944464715505664			https://twitter.com/rafaTT08/status/747944464715505664	
PennyStocksMomo	2016-05-27 21:14	0	2	http://bit.ly/a2oCi7 OT: Ben Cohen & Jerry Greenfield, Co-Founders Of "Ben & Jerry's" ... http://amzn.to/1RysWpZ # PCgames # Wii # games			# PCgames # Wii # games	736365024105496576			https://twitter.com/PennyStocksMomo/status/736365024105496576	
democrat_rss	2016-05-23 16:32	0	0	Ben & Jerry’s Corporate Takeover – Laura Flanders Show: Ben Cohen & Jerry Greenfield talk about their relucta... http://bit.ly/1Xsm4Bo				734844351382065152			https://twitter.com/democrat_rss/status/734844351382065152	
neashoemaker	2016-05-17 14:06	0	1	Ben & Jerry's co-founders Ben Cohen and Jerry Greenfield visited North Carolina Central University in Durham to... http://fb.me/2OgearAHB				732633387849125890			https://twitter.com/neashoemaker/status/732633387849125890	
cuandocomoydond	2016-05-10 14:01	0	0	Truthdiggers of the Week: Ben Cohen and Jerry Greenfield of Ben & Jerry’s Fame: Natasha Hakimi http://www.truthdig.com/report/item/truthdigger_of_the_week_ben_cohen_and_jerry_20160423#.VzIh7qWjezM.twitter …				730095404683960320			https://twitter.com/cuandocomoydond/status/730095404683960320	
SLiliopoulos	2016-05-08 12:57	0	0	How Ben&Jerry’s Became The World’s Most Beloved Ice Cream: Did you know that Ben Cohen and Jerry Greenfield o... http://bit.ly/1O8FcCH				729354433742573568			https://twitter.com/SLiliopoulos/status/729354433742573568	
jerseyjournal	2016-05-02 19:55	0	1	Ben & Jerry's founders tout 'genuine and authentic' Bernie Sanders: Ben Cohen and Jerry Greenfield ur... http://bit.ly/1UtKUjS				727285494896185344			https://twitter.com/jerseyjournal/status/727285494896185344	
HudsonCtyNews	2016-05-02 19:48	0	0	Ben & Jerry's founders tout 'genuine and authentic' Bernie Sanders: Ben Cohen and Jerry Greenfield urged a crowd of… http://m.tbnn.it/LCczjp				727283573141590016			https://twitter.com/HudsonCtyNews/status/727283573141590016	
Doratwagb	2016-05-02 19:46	0	0	Ben & Jerry's founders tout 'genuine and authentic' Bernie Sanders: Ben Cohen and Jerry Greenfield urged a cr... http://bit.ly/1UtKUjS				727283240164200448			https://twitter.com/Doratwagb/status/727283240164200448	
lankathilina	2016-05-02 19:46	0	0	Ben & Jerry's founders tout 'genuine and authentic' Bernie Sanders: Ben Cohen and Jerry Greenfield urged a cr... http://bit.ly/1UtKUjS				727283234631864320			https://twitter.com/lankathilina/status/727283234631864320	
us_news_update	2016-05-02 19:46	0	0	Ben & Jerry's founders tout 'genuine and authentic' Bernie Sanders: Ben Cohen and Jerry Greenfield urged a cr... http://twits.info.tm/1Bxy				727283223022047232			https://twitter.com/us_news_update/status/727283223022047232	
Len46840A	2016-05-02 12:02	1	0	Ben Cohen and Jerry Greenfield, the Ben & Jerry’s co-founders, held an event at George Washington University, where they scooped ice				727166267271045125			https://twitter.com/Len46840A/status/727166267271045125	
jogos_criancas	2016-05-01 03:15	0	0	US News : Ben & Jerry's Founders On Bernie Sanders Vowing To Stay In Race Ben Cohen and Jerry Greenfield weigh in … pic.twitter.com/xWVtmJcJUg				726671385607700480			https://twitter.com/jogos_criancas/status/726671385607700480	https://pbs.twimg.com/media/ChWnxmaWUAAGH8D.jpg
DavidAlanCompto	2016-04-28 11:31	0	0	Best Business Model - Ben & Jerry's Ice Cream: Ben Cohen, Jerry Greenfield prove progressiveness & business can work together profitably..				725709132859248641			https://twitter.com/DavidAlanCompto/status/725709132859248641	
CMoneyKS	2016-04-27 22:49	0	1	Taking a cue from Ted Cruz' playbook, Bernie Sanders introduces Ben Cohen & Jerry Greenfield of Ben & Jerry's as co-VPs on his Dem ticket				725517251772715008			https://twitter.com/CMoneyKS/status/725517251772715008	
baadasssss37	2016-04-25 20:33	0	0	Truthdiggers of the Week: Ben Cohen and Jerry Greenfield of Ben & Jerry’s Fame: Natasha Hakimi http://www.truthdig.com/report/item/truthdigger_of_the_week_ben_cohen_and_jerry_20160423/#.Vx63VvA415Q.twitter …				724758263783378944			https://twitter.com/baadasssss37/status/724758263783378944	
amerlekelly	2016-04-25 15:51	1	1	Truthdiggers of the Week: Ben Cohen and Jerry Greenfield of Ben & Jerry’s Fame: Natasha Hakimi http://www.truthdig.com/report/item/truthdigger_of_the_week_ben_cohen_and_jerry_20160423#.Vx51Jjarzlc.twitter …				724687189238534144			https://twitter.com/amerlekelly/status/724687189238534144	
gppisu	2016-04-25 12:54	0	0	Ben & Jerry's Homemade Ice Cream & Dessert Book (English Edition) Ben Cohen (著), Jerry Greenfield (著), Nancy S... http://amzn.to/1pywhyG				724642759223574528			https://twitter.com/gppisu/status/724642759223574528	
shrimp_shrimpy	2016-04-25 11:45	0	1	Truthdiggers of the Week: Ben Cohen and Jerry Greenfield of Ben & Jerry’s Fame http://bit.ly/1UaynS2				724625454024503296			https://twitter.com/shrimp_shrimpy/status/724625454024503296	
RealDead67	2016-04-25 11:45	0	0	Truthdiggers of the Week: Ben Cohen and Jerry Greenfield of Ben & Jerry’s Fame http://bit.ly/1UaynS2				724625453181472768			https://twitter.com/RealDead67/status/724625453181472768	
NM99791307	2016-04-25 11:45	0	0	Truthdiggers of the Week: Ben Cohen and Jerry Greenfield of Ben & Jerry’s Fame http://bit.ly/1UaynS2				724625452015468544			https://twitter.com/NM99791307/status/724625452015468544	
newstome72	2016-04-25 11:45	0	0	Truthdiggers of the Week: Ben Cohen and Jerry Greenfield of Ben & Jerry’s Fame http://bit.ly/1UaynS2				724625451117875200			https://twitter.com/newstome72/status/724625451117875200	
inkme211	2016-04-25 11:45	0	0	Truthdiggers of the Week: Ben Cohen and Jerry Greenfield of Ben & Jerry’s Fame http://bit.ly/1UaynS2				724625450136395776			https://twitter.com/inkme211/status/724625450136395776	