username	date	retweets	favorites	text	geo	mentions	hashtags	tweetid	conversationid	replyto	permalink	imagelink
gidimeister	2018-07-11 15:24	0	3	Kinda reminds me of so many other fortunes built on things which are ancient. Howard Schultz (Starbucks), Ben Cohen and Jerry Greenfield (Ben & Jerry's Ice Cream), Steve Ells (Chipotle), Dave Dahl (Dave's Killer Bread) and so on, just on what we eat and drink.				1017127428496424960	1017125864956362752		https://twitter.com/gidimeister/status/1017127428496424960	https://pbs.twimg.com/profile_images/1013479643700170754/03U9InFv_normal.jpg
CBaSE_UoG	2018-06-08 15:29	0	3	# FunFactFriday: It's # NationalBestFriendsDay so we want to highlight a successful pair! Ben Cohen and Jerry Greenfield, co-founders of Ben & Jerry's, met in high school gym class! After an ice-cream making class, they invested $12,000 and opened their first ice cream shop! pic.twitter.com/LRokCV5FZP			# FunFactFriday # NationalBestFriendsDay	1005170054814674944			https://twitter.com/CBaSE_UoG/status/1005170054814674944	https://pbs.twimg.com/media/DfMUkmAW0AAMyPT.jpg
PSU_OSA	2018-05-24 08:35	3	20	Fun fact of the day!! Ben Cohen and Jerry Greenfield, founders of Ben & Jerry’s ice cream, took a course on ice cream making at Penn State’s creamery! pic.twitter.com/0ZoqQRb2kf				999630077469102080			https://twitter.com/PSU_OSA/status/999630077469102080	https://pbs.twimg.com/media/Dd9mPFRVMAAMzVK.png
onc3uponatime95	2018-05-13 16:47	0	0	Ben Cohen & Jerry Greenfield (aka Ben & Jerry): Bring back the 'One Sweet Whirled' flavour to Ben & Jerry's Ice Cream! - Sign the Petition! https://chn.ge/2IFRsg7 via @ Change		@ Change		995767459117494277			https://twitter.com/onc3uponatime95/status/995767459117494277	
wond75	2018-05-06 02:15	0	0	On this day in 1978, Ben & Jerry's ice cream had its beginnings as Ben Cohen and Jerry Greenfield opened an ice cream parlor at a converted gas station in Burlington, Vermont. @ benandjerrysUK @ benandjerrys # vermontpic.twitter.com/dkRx4SqQzx		@ benandjerrysUK @ benandjerrys	# vermontpic	993011299469676544			https://twitter.com/wond75/status/993011299469676544	https://pbs.twimg.com/media/DcfignGW0AA1gHs.jpg
RickWIKY	2018-05-05 14:20	0	0	Rock Calendar 5-5-78: Ben Cohen and Jerry Greenfield open an ice cream parlor at a converted gas station in Burlington, Vermont. Today, Ben & Jerry's Ice Cream is loved by millions. No.1 Song: Night Fever- Bee Gees -- No.1 LP: "Saturday Night Fever" Soundtrack- Bee Gees				992831307410563074			https://twitter.com/RickWIKY/status/992831307410563074	
TodayThatWas	2018-05-05 09:29	6	3	May 5/1978 - Ben Cohen & Jerry Greenfield start their ice cream company, known as Ben & Jerry's. pic.twitter.com/sBvQToBt8v				992758178772332545			https://twitter.com/TodayThatWas/status/992758178772332545	https://pbs.twimg.com/media/Dcb8QH4X0AIAkjI.jpg
StevenWABX	2018-05-05 07:18	0	0	Rock Calendar 5-5-78: Ben Cohen and Jerry Greenfield open an ice cream parlor at a converted gas station in Burlington, Vermont. Today, Ben & Jerry's Ice Cream is loved by millions. No.1 Song: Night Fever- Bee Gees -- No.1 LP: "Saturday Night Fever" Soundtrack- Bee Gees				992725252018003968			https://twitter.com/StevenWABX/status/992725252018003968	
PressHerald	2018-05-05 07:03	6	19	Morning, Twitter. # OTD in 1978, Ben & Jerry’s ice cream had its beginnings as Ben Cohen and Jerry Greenfield opened an ice cream parlor at a converted gas station in Burlington, Vermont. We're partial to the Chunky Monkey. pic.twitter.com/UWcmk5BGAu			# OTD	992721423629242369			https://twitter.com/PressHerald/status/992721423629242369	https://pbs.twimg.com/media/Dcba2TeW4AA5bZj.jpg
CompostBoston	2018-04-27 17:02	0	2	Ben Cohen and Jerry Greenfield, cofounders of @ benandjerrys (Ben and Jerry’s) never leave home without their Bootstrap bucket! The notorious ice cream brand is committed to social and environmental activism, especially through the Ben and Jerry’s Foundat… https://www.instagram.com/p/BiFpYyhhvP1/ pic.twitter.com/ECrF8OVurG		@ benandjerrys		989972999632834561			https://twitter.com/CompostBoston/status/989972999632834561	https://pbs.twimg.com/media/Db0XMlKWAAAbw8q.jpg
NanInKansas	2018-04-19 20:18	0	10	Do you like Ben and Jerry's Ice Cream and think they've built a successful business? Ben Cohen and Jerry Greenfield not only slung herb growing up in Queens, when they rolled out the Ben & Jerry's ice-cream company, it included flavors like Cherry Garcia.				987123417567694849	987091347214659585	NanInKansas jpodhoretz	https://twitter.com/NanInKansas/status/987123417567694849	
BJGreenMtn	2018-04-10 10:40	0	0	Free Cone ( Clinic) Day at Ben & Jerry’s Riverwalk. Ben Cohen and Jerry Greenfield (Ben & Jerry) opened their first Ice Cream shop in 1978 locating in an abandoned gas station in Burlington Vt. In celebration... https://www.facebook.com/BenJerrysYorktown/posts/2028541247165647 …				983716279520563200			https://twitter.com/BJGreenMtn/status/983716279520563200	
AdelphiUMag	2018-04-09 18:01	0	1	Ben Cohen and Jerry Greenfield (best known for Ben and Jerry’s ice cream) are coming to Adelphi tomorrow! http://bit.ly/2xXAr83				983464829192228864			https://twitter.com/AdelphiUMag/status/983464829192228864	
charmichol	2018-04-06 16:13	3	19	Report Cards came out today but remember, Jerry Greenfield dropped out of medical school and perused a career with his bud Ben Cohen in an Ice Cream Parlor, which later became Ben and Jerry’s.				982350569514917889			https://twitter.com/charmichol/status/982350569514917889	
AdelphiWSB	2018-04-05 12:39	0	0	Tuesday, April 10th from 7-8:30 pm, in the Performing Arts Center, Concert Hall. Ben Cohen and Jerry Greenfield of Ben & Jerry’s Ice Cream will be providing a lecture ‘Ben and Jerry: An Evening of Entrepreneurial... https://www.facebook.com/AdelphiWSB/posts/2033238300251900 …				981934282724671488			https://twitter.com/AdelphiWSB/status/981934282724671488	
AdelphiWSB	2018-04-05 12:35	1	3	Tuesday, April 10th from 7-8:30 pm, in the Performing Arts Center, Concert Hall. Ben Cohen and Jerry Greenfield of Ben & Jerry’s Ice Cream will be providing a lecture ‘Ben and Jerry: An Evening of Entrepreneurial Spirit, Social Responsibility, and Radical Business Philosophy’. pic.twitter.com/w7uEQOsGSM				981933443658539011			https://twitter.com/AdelphiWSB/status/981933443658539011	https://pbs.twimg.com/media/DaCHQegVMAAiWus.jpg
JeffreyAHinton	2018-02-20 19:02	0	0	Chocolate cookie dough ice cream was invented by Ben and Jerry, who knew? Ben & Jerry's: Ben Cohen And Jerry Greenfield http://one.npr.org/i/562899429:564777542 …				966100712982683648			https://twitter.com/JeffreyAHinton/status/966100712982683648	
soekawaarit0	2018-02-19 17:08	0	0	"Last fall, more than 400 American millionaires and billionaires, including George Soros, Steven Rockefeller and Ben & Jerry’s Ice Cream founders Ben Cohen and Jerry Greenfield, wrote an open letter urging Congress not to cut taxes for the rich." 税への意識半端ない。				965709681862701057			https://twitter.com/soekawaarit0/status/965709681862701057	
HemalNepal	2018-02-19 15:01	0	1	Last fall, more than 400 American millionaires and billionaires, including George Soros, Steven Rockefeller and Ben & Jerry’s Ice Cream founders Ben Cohen and Jerry Greenfield, wrote an open letter urging Congress not to cut taxes for the rich.				965677659995848704			https://twitter.com/HemalNepal/status/965677659995848704	
Itsara_Th	2018-02-18 22:52	178	37	เศรษฐีและมหาเศรษฐีชาวอเมริกันมากกว่า 400 คนรวมทั้ง George Soros, Steven Rockefeller และ Ben & Jerry's ผู้ก่อตั้ง Ice Cream Ben Cohen และ Jerry Greenfield เขียนจดหมายเปิดผนึกเพื่อให้สภาคองเกรสไม่ต้องลดภาษีให้กับคนรวย ตัดภาพกลับมาที่เมืองไทย....แล้วก็ส่ายหัว				965433892936155137			https://twitter.com/Itsara_Th/status/965433892936155137	
missinglinkBDS	2018-02-01 07:40	1	1	Ice cream moguls Ben Cohen & Jerry Greenfield started their careers by taking a $5 course on the points of preparing ice cream. They opened their first Ben & Jerry’s location in 1978 in an abandoned gas station! They are now a worldwide brand & household name. # Throwback # TBTpic.twitter.com/SSRMUGjvdj			# Throwback # TBTpic	959043680760983556			https://twitter.com/missinglinkBDS/status/959043680760983556	https://pbs.twimg.com/media/DU81JBCW4AEtU5o.jpg
JaneEary	2018-01-07 07:56	1	1	EMAIL FROM BEN & JERRY’S ICE CREAM Hi, fellow MoveOn member, This is Ben Cohen and Jerry Greenfield, but you probably know us better as Ben and Jerry, the ice cream guys. Back when we were running Ben & Jerry's, we'd spend our winters brewing up new flavors for the spring /1				949988137442430976			https://twitter.com/JaneEary/status/949988137442430976	
republicbuzz	2018-01-04 04:43	0	0	Ben & Jerry's Ice Cream founders Ben Cohen and Jerry Greenfield, fashion designer Eileen Fisher, billionaire hedge fund... http://bit.ly/2AnNMYd pic.twitter.com/GxgtmdKeME				948852465075564544			https://twitter.com/republicbuzz/status/948852465075564544	https://pbs.twimg.com/media/DSsASUpVMAA8OZy.jpg
sholvah2010	2018-01-03 16:30	0	0	(At 33:32-ish) “... A lot of our problems would be solved if we made the ice cream...shittier...” Great podcast Ben &amp; Jerry's: Ben Cohen And Jerry Greenfield http://one.npr.org/i/562899429:564777542 … via @ nprone		@ nprone		948667971332788224			https://twitter.com/sholvah2010/status/948667971332788224	https://abs.twimg.com/emoji/v2/72x72/1f366.png
poetinpa	2017-12-24 14:04	0	0	A Christmas Message to Donald Trump from Ben and Jerry https://youtu.be/XsvukN8LpWc via @ YouTube Ben Cohen & Jerry Greenfield of Ben & Jerry's ice cream breakdown @ realdonaldtrump's budget; who will benefit &. who will NOT benefit.		@ YouTube @ realdonaldtrump		945007173633011714			https://twitter.com/poetinpa/status/945007173633011714	
MicroscopeReady	2017-12-07 21:26	0	0	.Signers include Ben & Jerry's Ice Cream founders Ben Cohen and Jerry Greenfield, fashion designer Eileen Fisher, billionaire hedge fund manager George Soros, and philanthropist Steven Rockefeller, as well as part of the top 5 percent ($1.5M in assets or earning $250,000+ a year) https://twitter.com/friendeden100/status/938902550501355521 …				938957864135286785			https://twitter.com/MicroscopeReady/status/938957864135286785	
jpverkamp	2017-11-28 14:27	0	0	Ben & Jerry's: Ben Cohen And Jerry Greenfield http://www.npr.org/series/490248027/how-i-built-this … Neat listen about the history / origins of Ben & Jerry's. Makes me want some icecream.				935590913522446340			https://twitter.com/jpverkamp/status/935590913522446340	
ScottKilmartin	2017-11-24 18:46	1	1	The Greatful Dead of ice cream, on @ HowIBuiltThis Ben & Jerry's: Ben Cohen And Jerry Greenfield http://pca.st/episode/7ef0cdd6-469a-40e0-933d-97686ea1055d …		@ HowIBuiltThis		934206565938110464			https://twitter.com/ScottKilmartin/status/934206565938110464	
JoeMooreKHON2	2017-11-21 23:27	2	10	Did you know...when Ben & Jerry's began in 1978 , its founders Ben Cohen and Jerry Greenfield originally planned on making bagels. But the equipment required to make bagels was more expensive than what they would need for ice cream, so they went with that instead.				933190068650483713			https://twitter.com/JoeMooreKHON2/status/933190068650483713	
mjp2520	2017-11-16 21:02	0	0	Signers include Ben & Jerry's Ice Cream founders Ben Cohen and Jerry Greenfield, fashion designer Eileen Fisher, billionaire hedge fund manager George Soros, and philanthropist Steven Rockefeller,				931341829672402944			https://twitter.com/mjp2520/status/931341829672402944	
oregonvt	2017-11-13 14:14	0	0	Wealth, a group that advocates progressive causes. Signers include Ben & Jerry's Ice Cream founders Ben Cohen and Jerry Greenfield, fashion designer Eileen Fisher, billionaire hedge fund manager George Soros, and philanthropist Steven Rockefeller, as well as many individuals and				930151795418165249			https://twitter.com/oregonvt/status/930151795418165249	
rl93930	2017-11-13 11:02	0	1	Some people who have signed onto the letter include Ben & Jerry's Ice Cream founders Ben Cohen and Jerry Greenfield, fashion designer Eileen Fisher, billionaire hedge fund manager George Soros and philanthropist Steven Rockefeller. https://twitter.com/thehill/status/930100958410964994 …				930103595604647936			https://twitter.com/rl93930/status/930103595604647936	https://pbs.twimg.com/media/DOhh5C1XkAE0bCA.jpg
madoceoeo	2017-05-09 15:35	0	0	価格551円～ Ben & Jerry's Homemade Ice Cream & Dessert Book Jerry Greenfield Workman Publishing Company Ben Cohen Nancy… http://dlvr.it/P5xglp pic.twitter.com/XzKa20leuG				862028179472498688			https://twitter.com/madoceoeo/status/862028179472498688	https://pbs.twimg.com/media/C_aKD0EV0AEjNul.jpg
jasont42	2017-05-04 16:54	1	2	Ben Cohen and Jerry Greenfield (Ben & Jerry's Ice Creams)				860236148181958656	860233115930963973	KyleKulinski	https://twitter.com/jasont42/status/860236148181958656	
samlinksha9	2016-12-12 19:07	0	0	Ben & Jerry's Homemade Ice Cream & Dessert Book - Ben Cohen, Jerry Greenfield & Nancy Stevens: With little skill,… http://dlvr.it/Msl7yf				808463218305683456			https://twitter.com/samlinksha9/status/808463218305683456	
BLFeed	2016-12-01 15:07	0	0	REQUEST: Ben & Jerry's Homemade Ice Cream & Dessert Book by Ben Cohen, Jerry Greenfield, Nancy Stevens - http://www.booklending.com/~B0073SPDHM				804416609842593796			https://twitter.com/BLFeed/status/804416609842593796	
gppisu	2016-09-16 11:03	0	0	Ben & Jerry's Homemade Ice Cream & Dessert Book (English Edition) Ben Cohen (著), Jerry Greenfield (著), Nancy ... http://amzn.to/2cEsVnS				776798552240467968			https://twitter.com/gppisu/status/776798552240467968	
Camera_Fun_Fair	2016-07-15 04:25	0	0	Ben & Jerry's Homemade Ice Cream & Dessert Book: Ben Cohen, Jerry Greenfield, Nancy Stevens: 2015894 http://pinterest.com/pin/343892121528794723/ …				753868038018043905			https://twitter.com/Camera_Fun_Fair/status/753868038018043905	
samlinksha9	2016-07-04 09:30	0	0	Ben & Jerry's Homemade Ice Cream & Dessert Book - Ben Cohen, Jerry Greenfield & Nancy Stevens: With little skill,… http://dlvr.it/Ljx6lM				749958586252439552			https://twitter.com/samlinksha9/status/749958586252439552	
SLiliopoulos	2016-05-08 12:57	0	0	How Ben&Jerry’s Became The World’s Most Beloved Ice Cream: Did you know that Ben Cohen and Jerry Greenfield o... http://bit.ly/1O8FcCH				729354433742573568			https://twitter.com/SLiliopoulos/status/729354433742573568	
DavidAlanCompto	2016-04-28 11:31	0	0	Best Business Model - Ben & Jerry's Ice Cream: Ben Cohen, Jerry Greenfield prove progressiveness & business can work together profitably..				725709132859248641			https://twitter.com/DavidAlanCompto/status/725709132859248641	
gppisu	2016-04-25 12:54	0	0	Ben & Jerry's Homemade Ice Cream & Dessert Book (English Edition) Ben Cohen (著), Jerry Greenfield (著), Nancy S... http://amzn.to/1pywhyG				724642759223574528			https://twitter.com/gppisu/status/724642759223574528	
gppisu	2016-04-25 07:39	0	0	Ben & Jerry's Homemade Ice Cream & Dessert Book (English Edition) Ben Cohen (著), Jerry Greenfield (著), Nancy S... http://amzn.to/1SHOtDM				724563598823944192			https://twitter.com/gppisu/status/724563598823944192	
Azerbaijan_Intl	2016-04-24 09:59	1	0	Truthdiggers of the Week: Ben Cohen and Jerry Greenfield of Ben & Jerry’s ice cream Fame: Natasha Hakimi http://www.truthdig.com/report/item/truthdigger_of_the_week_ben_cohen_and_jerry_20160423#.VxzRE8D4IPY.twitter …				724236204028235776			https://twitter.com/Azerbaijan_Intl/status/724236204028235776	
PittsburghPG	2016-04-21 14:31	1	1	Feel the (cool) bern: Ben Cohen and Jerry Greenfield, co-founders of Ben & Jerry's Ice Cream,… https://www.instagram.com/p/BEePJaEBkSB/				723217592769470464			https://twitter.com/PittsburghPG/status/723217592769470464	
politiceur	2016-04-19 19:37	0	0	Ben and Jerry Deliver Free Ice Cream and Politics in Washington Ben Cohen and Jerry Greenfield, the Ben & Jerry's c… http://goo.gl/roM2hx				722569737021087744			https://twitter.com/politiceur/status/722569737021087744	
TakiyahDavis1	2016-04-19 19:09	0	0	Ben & Jerry's ice cream kings Ben Cohen and Jerry Greenfield arrested in Washington | Metro News http://metro.co.uk/2016/04/19/dont-panic-but-ice-cream-kings-ben-jerry-have-been-arrested-5827161/#mv-b …				722562791782002688			https://twitter.com/TakiyahDavis1/status/722562791782002688	
MarketingEdgeM	2016-04-19 12:13	0	0	Ben Cohen and Jerry Greenfield (co-founders of Ben & Jerry's ice cream) were among approximately 300 people... http://fb.me/1f3c1pFyE				722458124284604416			https://twitter.com/MarketingEdgeM/status/722458124284604416	
MarketingEdgeM	2016-04-19 12:13	0	0	Ben Cohen and Jerry Greenfield (co-founders of Ben & Jerry's ice cream) were among approximately 300 people... http://fb.me/86Dxiekpp				722458117519179776			https://twitter.com/MarketingEdgeM/status/722458117519179776	
MasonDixonRadio	2016-04-19 09:57	0	0	Ben & Jerry’s co-founders Ben Cohen and Jerry Greenfield have been arrested! Find out why!: http://bit.ly/1SQCDB4 @ benandjerrys # IceCream		@ benandjerrys	# IceCream	722423857483792384			https://twitter.com/MasonDixonRadio/status/722423857483792384	
MyQ105	2016-04-19 09:57	0	0	Ben & Jerry’s co-founders Ben Cohen and Jerry Greenfield have been arrested! Find out why!: http://bit.ly/1SQCDB4 @ benandjerrys # IceCream		@ benandjerrys	# IceCream	722423857471234048			https://twitter.com/MyQ105/status/722423857471234048	
NikkiCruzRadio	2016-04-19 09:57	0	0	Ben & Jerry’s co-founders Ben Cohen and Jerry Greenfield have been arrested! Find out why!: http://bit.ly/1SQCDB4 @ benandjerrys # IceCream		@ benandjerrys	# IceCream	722423857450246145			https://twitter.com/NikkiCruzRadio/status/722423857450246145	
AngelaSites	2016-04-19 09:29	0	0	Ben & Jerry’s ice cream founders arrested during Washington rally: Ben Cohen and Jerry Greenfield w... http://bit.ly/1reLsyR # jeruselum			# jeruselum	722416829080076288			https://twitter.com/AngelaSites/status/722416829080076288	
pzf	2016-04-19 09:24	88	95	JUST IN: Co-Founders of Ben & Jerry's Ice Cream, Ben Cohen & Jerry Greenfield, were arrested http://pzfeed.com/founders-ben-jerrys-ice-cream-arrested-us-capitol/ …pic.twitter.com/Vyzb8Eq8lb				722415556339625984			https://twitter.com/pzf/status/722415556339625984	https://pbs.twimg.com/media/CgaIwn7UAAAGHdO.jpg
FrhenHongo	2016-04-19 07:18	0	0	First Draft: Ben and Jerry Deliver Free Ice Cream and Politics in Washington: Ben Cohen and Jerry Greenfield, the Ben & Jerry’s co-fo...				722383984345284608			https://twitter.com/FrhenHongo/status/722383984345284608	
CHNGAlbany	2016-04-15 11:57	0	1	Ben & Jerry In Albany 4/15: Ben Cohen and childhood friend Jerry Greenfield opened Ben & Jerry’s Homemade Ice Cream… http://m.tbnn.it/L3zN4y				721004446650511360			https://twitter.com/CHNGAlbany/status/721004446650511360	
Evangelina9011	2016-04-04 07:00	1	1	Ben Cohen and Jerry Greenfield, the ice cream makers behind Ben and Jerry's, in New York City to give away pints of a new flavor				716943450348920832			https://twitter.com/Evangelina9011/status/716943450348920832	
Waikiki_Kid	2016-04-01 11:20	0	0	Ben Cohen and Jerry Greenfield (Ben and Jerry's ice-cream) walked though the NYSE in the heart of Wall Street to... http://fb.me/B8qe8sjt				715921869556289536			https://twitter.com/Waikiki_Kid/status/715921869556289536	
azul_violenta	2016-03-21 10:29	0	0	# UTRGV Distinguished Speaker Series will feature Ben Cohen & Jerry Greenfield of # Ben&Jerry's Ice Cream on April 12. pic.twitter.com/alwzRMTh3V			# UTRGV # Ben	711922665330745344			https://twitter.com/azul_violenta/status/711922665330745344	https://pbs.twimg.com/media/CeFB5FtXIAAngJF.jpg
ballotboxtees	2016-02-21 20:39	0	0	Ben Cohen and Jerry Greenfield, founders of Ben and Jerry's, scooping ice cream for Bernie… https://www.instagram.com/p/BCEZiaaxKgU/				701582166908600320			https://twitter.com/ballotboxtees/status/701582166908600320	
ballotboxtees	2016-02-21 20:37	0	0	Ben Cohen and Jerry Greenfield, founders of Ben and Jerry's, scooping ice cream for Bernie… https://www.instagram.com/p/BCEZiaaxKgU/				701581510755749889			https://twitter.com/ballotboxtees/status/701581510755749889	
motif65	2016-01-26 09:39	1	0	Boycott "Ben & Jerry's" ice cream. Ben Cohen and Jerry Greenfield apparently are a couple of socialists who... http://fb.me/7AqeXaJT7				691993821228326912			https://twitter.com/motif65/status/691993821228326912	
todays_books	2015-12-17 06:35	0	0	# Hot # Gifts Ben & Jerry's Homemade Ice Cream & Dessert Book Ben Cohen (Author), Jerry Greenfield (Autho... http://amzn.to/1YmOcmM # books			# Hot # Gifts # books	677452010782765056			https://twitter.com/todays_books/status/677452010782765056	
laceyguck	2015-10-20 08:57	0	1	Ben Cohen & Jerry Greenfield quit their jobs after taking a $5 class in ice cream making. Now we have Ben & Jerry's.				656454309517758464			https://twitter.com/laceyguck/status/656454309517758464	
DentonforBernie	2015-09-30 17:45	1	0	Thom Hartmann talks with Ben Cohen & Jerry Greenfield, Co-Founders, Ben & Jerry's Ice Cream, about efforts to get... http://fb.me/5qFx8eKA2				649339318205452288			https://twitter.com/DentonforBernie/status/649339318205452288	
palestininianpr	2015-08-24 11:03	5	3	“Ben Cohen and Jerry Greenfield, the founders of Ben & Jerry’s Ice Cream, have announced their support for Obama’s nuclear deal				635829769062477824			https://twitter.com/palestininianpr/status/635829769062477824	
samlinksha9	2015-08-05 09:46	0	0	Ben & Jerry's Homemade Ice Cream & Dessert Book - Ben Cohen, Jerry Greenfield & Nancy Stevens: With little skill,… http://dlvr.it/BlfHjB				628925064159719425			https://twitter.com/samlinksha9/status/628925064159719425	
Sham___Wow	2015-07-14 15:20	0	7	Ben Cohen & Jerry Greenfield aka the founders of Ben & Jerry's ice cream support Bernie Sanders so that's cool as heck				621036460125220864			https://twitter.com/Sham___Wow/status/621036460125220864	
TheBookFarmInc	2015-07-10 13:24	0	0	Unwrap the lives of talented Ben & Jerry’s Homemade # IceCream manufacturers, Ben Cohen and Jerry Greenfield! http://www.thebookfarminc.com/product.php?productid=394425&cat=0&page=1 …			# IceCream	619557753615314944			https://twitter.com/TheBookFarmInc/status/619557753615314944	
uber420	2015-07-07 22:31	0	1	Ben Cohen & Jerry Greenfield (of Ben & Jerry's ice cream) endorse idea of cannabis-infused ice cream. Count us in! http://ow.ly/PcD74				618608217875181568			https://twitter.com/uber420/status/618608217875181568	
HighEnd_Gear	2015-07-05 13:28	0	0	Ben & Jerry's Homemade Ice Cream & Dessert Book Ben Cohen (Author), Jerry Greenfield (Author), Nancy Stevens (... http://amzn.to/1H1bnK7				617746900297449472			https://twitter.com/HighEnd_Gear/status/617746900297449472	
_Books__	2015-07-04 21:01	0	0	Ben & Jerry's Homemade Ice Cream & Dessert Book Ben Cohen (Author), Jerry Greenfield (Author… http://goo.gl/fb/nltXb7				617498618476535809			https://twitter.com/_Books__/status/617498618476535809	
CarlaMorrisShow	2015-07-02 17:03	0	0	Ben & Jerry’s founders Ben Cohen and Jerry Greenfield. *** Ben & Jerry's Scooped Ice Cream Exclusively featured... http://fb.me/7ISvlFWvm				616713832455507969			https://twitter.com/CarlaMorrisShow/status/616713832455507969	
uber420	2015-06-24 19:31	0	0	Ben Cohen & Jerry Greenfield (of Ben & Jerry's ice cream) endorse idea of cannabis-infused ice cream. Count us in! http://ow.ly/NYdrQ				613851866045267969			https://twitter.com/uber420/status/613851866045267969	
uber420	2015-06-13 07:01	0	0	Ben Cohen & Jerry Greenfield (of Ben & Jerry's ice cream) endorse idea of cannabis-infused ice cream. Count us in! http://ow.ly/NYdrC				609677036815273985			https://twitter.com/uber420/status/609677036815273985	
uber420	2015-06-07 18:30	0	2	Ben Cohen & Jerry Greenfield (of Ben & Jerry's ice cream) endorse idea of cannabis-infused ice cream. Count us in! http://ow.ly/NYdrg				607676084319068160			https://twitter.com/uber420/status/607676084319068160	
DavidMDrucker	2015-05-26 17:31	1	1	# BigBusinessForBernie RT @ Bencjacobs: Ben Cohen and Jerry Greenfield of Ben & Jerry's ice cream now being introduced at Bernie rally		@ Bencjacobs	# BigBusinessForBernie	603312474746654720			https://twitter.com/DavidMDrucker/status/603312474746654720	
Bencjacobs	2015-05-26 17:27	6	8	Ben Cohen and Jerry Greenfield of Ben & Jerry's ice cream now being introduced at Bernie rally				603311494906945536			https://twitter.com/Bencjacobs/status/603311494906945536	
_Books__	2015-05-03 12:10	0	0	Ben & Jerry's Homemade Ice Cream & Dessert Book Ben Cohen (Author), Jerry Greenfield (Author… http://goo.gl/fb/024xQP				594896857295368193			https://twitter.com/_Books__/status/594896857295368193	
DavidSudjiman	2015-04-04 15:28	0	0	The Entrepreneurial Spirit: Ben Cohen and Jerry Greenfield, Founders of Ben & Jerry’s Ice Cream - Pitchi http://blog.pitchi.com/the-entrepreneurial-spirit-ben-cohen-and-jerry-greenfield-founders-of-ben-jerrys-ice-cream/ …				584437319471505408			https://twitter.com/DavidSudjiman/status/584437319471505408	
uber420	2015-04-04 04:00	0	0	Ben Cohen & Jerry Greenfield (of Ben & Jerry's ice cream) endorse idea of cannabis-infused ice cream. Count us in! http://ow.ly/L6EDT				584264246504116224			https://twitter.com/uber420/status/584264246504116224	
uber420	2015-03-08 21:30	0	0	Ben Cohen & Jerry Greenfield (of Ben & Jerry's ice cream) endorse idea of cannabis-infused ice cream. Count us in! http://ow.ly/JWMzI				574744105412096000			https://twitter.com/uber420/status/574744105412096000	
