username	date	retweets	favorites	text	geo	mentions	hashtags	tweetid	conversationid	replyto	permalink	imagelink
Naghaz_Poetry	2014-09-04 09:54	0	0	News Lines: Azeem Shair Shah Abdull Karem R.A ka 403wan Uraas Mubarak Aj Rag Or Samah K Sath Khtam Howa. Ref: Kawish News Web Page. -Qadir-				507527012660310016			https://twitter.com/Naghaz_Poetry/status/507527012660310016	
ThisIsMyStream	2014-07-04 23:59	0	1	Hacker News - Show HN: Automatic web page content extractor for Node.js and the command line http://bit.ly/1sbEuoR				485271752272928768			https://twitter.com/ThisIsMyStream/status/485271752272928768	
tek_news	2014-07-04 23:05	1	3	HNews: Show HN: Automatic web page content extractor for Node.js and the command line http://bit.ly/1j6Us3O # nodejs			# nodejs	485258040216530945			https://twitter.com/tek_news/status/485258040216530945	
FreeLanceISM	2014-06-20 19:21	0	0	@ mintel2011 Was glad to see you on my time line. Check out this new news web page. http://knews.esy.es/index.php?l=zh to see up to the minute news .		@ mintel2011		480128226757726208	480127481379164161	mintel2011	https://twitter.com/FreeLanceISM/status/480128226757726208	
Alan_Au	2014-04-16 15:13	0	0	Web page source code: 1800 lines. Actual news article content: 10 lines. There's overhead to make things look nice, but this is ridiculous.				456510631273693185			https://twitter.com/Alan_Au/status/456510631273693185	
ChaseSupport	2014-04-04 13:55	0	0	@ language_news That is a legitimate number. It is an inbound automated line; the web page only lists numbers to speak with a live rep. ^MB		@ language_news		452142373846646784	452130816504516608	language_news	https://twitter.com/ChaseSupport/status/452142373846646784	
havensupport	2014-01-14 13:24	0	0	Haven Sells First Complete Tube Processing Line In China. Read more at Haven’s Latest News web page at: http://www.havencut.com/latest-news.php				423158736698363904			https://twitter.com/havensupport/status/423158736698363904	
MyPDJewelryBox	2013-11-20 12:36	1	0	Big news! You can now browse the entire current Premier Designs jewelry line on my personal web page! To... http://fb.me/33wKCkvaW				403215178785124354			https://twitter.com/MyPDJewelryBox/status/403215178785124354	
SportingChap	2013-11-05 19:31	0	0	When you have to hit Page Down on a desktop view web page before you can even read the first line of a news article... ugh.				397883809221206016			https://twitter.com/SportingChap/status/397883809221206016	
flipwils11	2013-07-27 09:45	0	0	http://CNN.com is drunk on their breaking news, huge font main web page area. Too many stories not meriting the "breaking" tag line.				361120244418359296			https://twitter.com/flipwils11/status/361120244418359296	
mtaylor1405	2013-05-11 03:24	0	0	membership reminders & team line ups but no text over captaincy news we have to check web page @ melbournefc @ WTay93 10/10 communication		@ melbournefc @ WTay93		333120402375200768			https://twitter.com/mtaylor1405/status/333120402375200768	
NewLifeContract	2013-03-13 10:23	0	0	@ NewLifeContract Great news from #New#Life#Contract Team! New web page is on line with a lot of amazing news! http://www.newlifecontract.com		@ NewLifeContract		311845081680318464			https://twitter.com/NewLifeContract/status/311845081680318464	
LdyPngn	2013-02-21 00:21	0	0	Haha. Local news station’s tag line on web page: “Continuous News Coverage”. Need to add, “Of nothing local”. @ KXLF		@ KXLF		304460709327163392			https://twitter.com/LdyPngn/status/304460709327163392	
CCKoepp	2012-12-30 20:11	0	0	Web page has been updated with news about Remnant in the Stars, Drug War, and Lines of Succession... and the Next... http://fb.me/1ptgtNoao				285553795566542848			https://twitter.com/CCKoepp/status/285553795566542848	
MercedesPickel3	2012-10-30 21:07	0	0	News Briefs  Laven Partners launches web page on AIFMD, Nine Entertainment not over the line yet - http://moneyandinvestmentnews.com/news-briefs-%c2%96-laven-partners-launches-web-page-on-aifmd-nine-entertainment-not-over-the-line-yet-as-debt-fight-lingers/ …				263446982461386752			https://twitter.com/MercedesPickel3/status/263446982461386752	