username	date	retweets	favorites	text	geo	mentions	hashtags	tweetid	conversationid	replyto	permalink	imagelink
1BITCH1ofBOSTON	2018-07-23 13:19	0	13	He is The President of the United States! Some rules he DOES NOT have to obey! Especially on here!				1021444719308673026	1021234525626609666	justicedems realDonaldTrump Twitter	https://twitter.com/1BITCH1ofBOSTON/status/1021444719308673026	
TrumpDotDotDot	2018-07-23 13:16	12	92	JUST IN: The President of the United States voices a moronic opinion about the Washington Post, followed by a downright lie that the profitable paper "loses a fortune." Full Disclosure: This reporter became a paid subscriber to the WaPo digital edition following Trump's 2016 win.				1021443855990837254	1021388295618682881	realDonaldTrump	https://twitter.com/TrumpDotDotDot/status/1021443855990837254	
shawnchegini	2018-07-23 13:14	0	0	Its crazy how the @ realDonaldTrump ,President of the United States, can side with the Russian President over our own Intelligence agencies, not pay taxes, dodge a war, and also wants to lecture black football players on Patriotism.		@ realDonaldTrump		1021443510547836928			https://twitter.com/shawnchegini/status/1021443510547836928	
shim_daniel	2018-07-23 13:10	0	0	OR OTHERWISE YOU WILL GET A FACE-TO-FACE MEETING, THE LEGITIMACY OF A MEETING WITH THE PRESIDENT OF THE UNITED STATES, AND MILITARY CONCESSIONS WITHOUT GIVING UP ANYTHING AT ALL! LIKE KIM JUNG UN GOT! SO LET THAT BE A WARNING TO YOU! YEAH!				1021442346754367488	1021234525626609666	realDonaldTrump	https://twitter.com/shim_daniel/status/1021442346754367488	
Mike_Sleigh	2018-07-23 13:06	0	0	The president of the United States is threatening war to the leader of Iran...over Twitter what the fuck is wrong with you Donald Trump, be a diplomat not a fucking moron, I am scared to think of the people who voted for this man				1021441555054432261			https://twitter.com/Mike_Sleigh/status/1021441555054432261	https://abs.twimg.com/emoji/v2/72x72/1f602.png
sm19451	2018-07-23 13:04	0	1	This shows how foolish he is an doesn't think right other wise he would've shot his foot in this picture. People need to see what he really is he is very dangerous to be president of the United States of America.				1021441022327508993	1021438091926687748	theaddamstweets tedlieu realDonaldTrump	https://twitter.com/sm19451/status/1021441022327508993	
Anthony32647136	2018-07-23 13:03	0	1	So why do you keep bringing up the Democrats losing? Is it because you are so insecure that your election was not legitimate? It's because you know the truth the Russians meddled in the election and you know you are not the rightful president of the United States.				1021440743716483072	1020800615226793986	realDonaldTrump	https://twitter.com/Anthony32647136/status/1021440743716483072	
ForeverLogical	2018-07-23 12:59	13	84	The President of the United States is NOT supposed to speak out against private companies this way, let alone the free press. Trump's legacy should be a slew of new laws regarding the office of the President. They were NEVER necessary before, not until this con man took office				1021439748341096448	1021384752136409088	realDonaldTrump	https://twitter.com/ForeverLogical/status/1021439748341096448	
Bwit716	2018-07-23 12:58	0	0	You know what? It’s playing on the minds of Americans just like the NK tweet did. Real question—why does the president of the United States of America feel the need to explode on twitter and worry millions of its citizens. It’s a selfish, undignified response. @ realDonaldTrump		@ realDonaldTrump		1021439490332741632	1021382583114797057	benshapiro	https://twitter.com/Bwit716/status/1021439490332741632	
ForeverLogical	2018-07-23 12:58	173	950	The President of the United States is NOT supposed to speak out against private companies this way, let alone the free press. Trump's legacy should be a slew of new laws regarding the office of the President. They were NEVER necessary before, not until this con man took office				1021439373584158721	1021388295618682881	realDonaldTrump	https://twitter.com/ForeverLogical/status/1021439373584158721	
Skitatch	2018-07-23 12:58	0	0	if you allow twitter to silence trump you are essentially allowing a private company to control what the president of the united states can say. that doesnt sound dystopian to you? would you react the same way had a liberal leader, or anyone else, tweeted this?				1021439368198836224	1021234525626609666	glover_ceo realDonaldTrump	https://twitter.com/Skitatch/status/1021439368198836224	
SanfordDavin	2018-07-23 12:58	0	0	The President of the United States, knowingly telling falsehoods about the FISA warrants to the American people. You sir are a liar.				1021439297541398528	1021341698734030848	realDonaldTrump	https://twitter.com/SanfordDavin/status/1021439297541398528	
WilburForce2016	2018-07-23 12:57	0	0	@ realDonaldTrump The President of the United States of America is a TRAITOR. The President of the United States of America is a TRAITOR. The President of the United States of America is a TRAITOR. The President of the United States of America is a TRAITOR.		@ realDonaldTrump		1021439251613978624	1021438142342225927	Lawrence	https://twitter.com/WilburForce2016/status/1021439251613978624	
jolleeHolly	2018-07-23 12:57	0	0	To Iranian President Rouhani: NEVER EVER LISTEN TO ANYTHING THAT DONALD TRUMP SAYS, HE IS A BURLAP SACK OF MOLDY AGED WHITE CHEDDAR PARADING AS A MAN PARADING AS PRESIDENT OF THE UNITED STATES AND IS VERY CONFUSED BY THINGS LIKE FIRE AND SHINY OBJECTS, BE CAUTIOUS!				1021439126518759424			https://twitter.com/jolleeHolly/status/1021439126518759424	
RoguePatriot2	2018-07-23 12:56	0	0	Trump is a sociopath and pathological LIAR who has clearly demonstrated his inability and/or unwillingness to faithfully execute the Office of President of the United States. ~ Invoke the 25th Amendment, Section 4 immediately. ~				1021438813216768000	1021388295618682881	realDonaldTrump	https://twitter.com/RoguePatriot2/status/1021438813216768000	
WilburForce2016	2018-07-23 12:55	0	0	The President of the United States of America is a TRAITOR.				1021438655070687232	1021388295618682881	realDonaldTrump	https://twitter.com/WilburForce2016/status/1021438655070687232	
danbrownbuilds	2018-07-23 12:53	0	0	dan I hate to break this to you but donald j trump is the president of the united states				1021438123270582273	1021255068501200897	danbilicki	https://twitter.com/danbrownbuilds/status/1021438123270582273	
based_aspie	2018-07-23 12:52	0	2	oMg tHe prEsiDent oF tHe uNiTeD sTatEs iS tElLiNg anOtHeR cOunTrY tHeY wOnT gEt aWaY wItH mAkInG tHrEatS aGaInSt tHe U.S. aNyMOre wHaT a mOnStEr¡¡ pic.twitter.com/RAdppTrSsk				1021437926327058433	1021234525626609666	justicedems realDonaldTrump Twitter	https://twitter.com/based_aspie/status/1021437926327058433	https://pbs.twimg.com/media/DizgV5CVAAYP1KC.jpg
STPFreak	2018-07-23 12:50	0	0	4th crazy tweet of the day. The President of the United States foaming at the mouth and crying Witch Hunt as he drools mashed peas and the nurses tighten up the straps on his straight jacket.				1021437529399193612	1021351630648815616	realDonaldTrump JudicialWatch	https://twitter.com/STPFreak/status/1021437529399193612	
WutaiClan	2018-07-23 12:50	0	0	@ realDonaldTrump Question: When the President of the United States can't even be honest about a couple affairs he had before he was elected, how in the hell can you trust him to be honest about ANYTHING that matters? No one believes you because you lie about EVERYTHING.		@ realDonaldTrump		1021437473279205376			https://twitter.com/WutaiClan/status/1021437473279205376	
STPFreak	2018-07-23 12:49	0	3	3rd crazy tweet of the day. The President of the United States continues his out of control mental downward spiral as the walls close in.				1021437064917733376	1021349516878974977	realDonaldTrump	https://twitter.com/STPFreak/status/1021437064917733376	
felipediego56	2018-07-23 12:48	0	0	So now The President of The United States who sided with Putin against our Intelligence Agency is going after an American Company. How can Republicans stand by and watch this? This guy needs to be reeled in by Congress.				1021436948450238466	1021384752136409088	realDonaldTrump	https://twitter.com/felipediego56/status/1021436948450238466	
StuartCarson	2018-07-23 12:47	0	0	@ jack @ TwitterSupport Come on. Not to say @ realDonaldTrump is the law, but people in positions of power and authority should be held to higher standards than the rest of us. This isn’t some 16 year old trolling, it’s the President of the United States. Making a very real threat.		@ jack @ TwitterSupport @ realDonaldTrump		1021436757865385985	1021256617927593985	rebeccacaca94	https://twitter.com/StuartCarson/status/1021436757865385985	
jstines3	2018-07-23 12:47	25	107	Yeah, report the PRESIDENT OF THE UNITED STATES for telling one of our SWORN ENEMIES (who calls for death to America) to back off or suffer the consequences. You democrat clowns are scraping the bottom of the barrel -- your loss in November will be EPIC!				1021436578688913408	1021234525626609666	justicedems realDonaldTrump Twitter	https://twitter.com/jstines3/status/1021436578688913408	
TrumpLiesMatte1	2018-07-23 12:46	4	8	# TrumpLiesAgain You GAVE UP America’s prestige & stature in your meeting with # Putin Watching a President of the United States meekly kowtowing to a murderous dictator of a regime that attacked America was HUMILIATING. You are a national embarrassment # ResignNow # TreasonSummit			# TrumpLiesAgain # Putin # ResignNow # TreasonSummit	1021436414129344512	1021370601863294977	realDonaldTrump	https://twitter.com/TrumpLiesMatte1/status/1021436414129344512	
RippDemUp	2018-07-23 12:46	0	1	As president of the United States, Donald J. Trump has the power to pardon Dylan Roof. Now, let that sink in before you concoct yet another bullshit reason to justify why voting isn't important. Yes, I'll wait. # VotingMatters # GOTV			# VotingMatters # GOTV	1021436328171491329			https://twitter.com/RippDemUp/status/1021436328171491329	
aelman	2018-07-23 12:44	2	8	Fair point. Let me go on record: Donald Trump has been a disaster as President of the United States. As American citizens, we hired him to do a job, and he clearly sucks at it. For the good of the country (and humanity) he should quit or BE FIRED. Please resign, Mr. President. https://twitter.com/DavidDark/status/948414454592622592 …				1021436006568845312			https://twitter.com/aelman/status/1021436006568845312	
dostdarvatan20	2018-07-23 12:40	4	43	The majority of the people of Iran support the policies of the President of the United States against the Islamic Republic of Iran, regardless of the words of the corrupt officials of the Islamic Republic, continue to press for the regime. Thank you president Trump pic.twitter.com/QGmnBdxBhl				1021434956038508544	1021234525626609666	realDonaldTrump POTUS	https://twitter.com/dostdarvatan20/status/1021434956038508544	https://pbs.twimg.com/media/DizdrKPX4AE5fWW.jpg
TheBritishSone	2018-07-23 12:39	0	0	Threatening another country via Twitter..... I really do question Donald Trump's mental stability because should a World Leader be behaving like this? This is the kind of behaviour that I would expect from a school kid. Not the President of the United States! https://twitter.com/realDonaldTrump/status/1021234525626609666 …				1021434734512156672			https://twitter.com/TheBritishSone/status/1021434734512156672	
McGeno19	2018-07-23 12:37	0	0	Just for a moment consider this is The President of the United States living on Twitter making nutty statements. Insulting, berating and denying. No regard for the office.				1021434248002228225	1021341698734030848	realDonaldTrump	https://twitter.com/McGeno19/status/1021434248002228225	https://abs.twimg.com/emoji/v2/72x72/1f1fa-1f1f8.png
mllauer3	2018-07-23 12:35	0	0	Then why don't we know exactly what you talked about? You are the President of the United States and were on US business, but we know nothing about what you gave up. Why didn't you have your aides or witnesses present. What are you hiding?				1021433623478718464	1021370601863294977	realDonaldTrump	https://twitter.com/mllauer3/status/1021433623478718464	
maggie_lang	2018-07-23 12:34	0	0	This is all a bunch of lies. From the president of the united states. All lies.				1021433265243152384	1021341698734030848	realDonaldTrump	https://twitter.com/maggie_lang/status/1021433265243152384	
DavidGuidotti5	2018-07-23 12:33	0	0	Well, he is the President of the United States and you are not. Time you got over it.				1021433242313011201	1021347230022807552	GodcallsBS realDonaldTrump	https://twitter.com/DavidGuidotti5/status/1021433242313011201	
2bit_tempest	2018-07-23 12:33	0	0	To the president of the United States: NEVER, EVER THREATEN THE UNITED STATES AGAIN OR WE WILL REMOVE YOU FROM OFFICE. WE ARE NO LONGER A COUNTRY THAT WILL STAND FOR YOUR DEMENTED WORDS OF VIOLENCE & DEATH.				1021433237573255168	1021234525626609666	realDonaldTrump	https://twitter.com/2bit_tempest/status/1021433237573255168	
AmisKcamis	2018-07-23 12:32	0	0	I never thought I would have to report a tweet as harmful and hateful that was sent by the President of the United States of America @ Twitter please for National safety block/lock @ realDonaldTrump		@ Twitter @ realDonaldTrump		1021432819803967488			https://twitter.com/AmisKcamis/status/1021432819803967488	https://abs.twimg.com/emoji/v2/72x72/203c.png
LUCIUSGAUNICHA2	2018-07-23 12:31	0	0	UNITED STATES PRESIDENT DONALD TRUMP EXECUTIVE ORDER AND UNITED STATES VICE PRESIDENT MIKE PENCE AND UNITED STATES ATTORNEY GENERAL JEFF SESSIONS AND THE PRESIDENT OF THE CRIME… https://www.instagram.com/p/BklZbYJAbIA/?utm_source=ig_twitter_share&igshid=mdhi63e13cat …				1021432521882513409			https://twitter.com/LUCIUSGAUNICHA2/status/1021432521882513409	
lsclavos	2018-07-23 12:30	0	0	God bless my president Donald Trump I wish you can also serve a third term. The best president of the United States will ever have go get them Trump				1021432356480176128	1021281430670897152	peterson__scott	https://twitter.com/lsclavos/status/1021432356480176128	
Chris79699884	2018-07-23 12:29	0	0	@ realDonaldTrump is busy throwing obfuscation tweets. He is nervous. He thinks he's the master gamesman, but the reality is he is a compromised individual who isn't fit to be President of the United States. He has always been a bullshit artist.		@ realDonaldTrump		1021432004577984512	1021392725248180225	AdamSchiffCA	https://twitter.com/Chris79699884/status/1021432004577984512	
hansnich5063	2018-07-23 12:28	0	0	Unless you’re from N Korea or Russia, in which case, you’re A-okay in Trumps eyes. Trump, you are the president of the United States of America, not a 13 year old middle schooler, your all caps makes you look extremely ignorant, not tough.				1021431751120424961	1021234525626609666	realDonaldTrump	https://twitter.com/hansnich5063/status/1021431751120424961	
dezi0630	2018-07-23 12:27	0	0	We're living in 2018, where the president of the United States is # DonaldTrump and he threatens other countries over Twitter. pic.twitter.com/w7HIGxVEMS			# DonaldTrump	1021431668878520320			https://twitter.com/dezi0630/status/1021431668878520320	
8mbgmgs	2018-07-23 12:26	0	0	I can hardly believe that this is the actual President of the United States of America posting this crap, on twitter.				1021431247200038912	1021234525626609666	realDonaldTrump	https://twitter.com/8mbgmgs/status/1021431247200038912	
MojtabaBiglar	2018-07-23 12:25	0	1	Warning to Donald John Trump President of the United States Never threaten the people of Iran. Otherwise, the people of Iran will decide to destroy America, Israel and Saudi Arabia # Stopmrddlingiranian # ShutUpTrump # ShutUpPompeo # Rouhanipic.twitter.com/EQEI1Zcoy0			# Stopmrddlingiranian # ShutUpTrump # ShutUpPompeo # Rouhanipic	1021431078068924416			https://twitter.com/MojtabaBiglar/status/1021431078068924416	https://pbs.twimg.com/media/DizaJGWX4AEZyrF.jpg
gael_wench	2018-07-23 12:23	0	2	You're completely overlooking the fact the president of the United States is acting like a sundowning lunatic. Words do matter, as do actions. It doesn't matter if he's Tweeting his insanity to a make-believe country. He's still Tweeting irrational, explosive nonsense.				1021430633342660615	1021388295618682881	JDiaz1205 SkyrocOne	https://twitter.com/gael_wench/status/1021430633342660615	
mgach31	2018-07-23 12:23	0	0	In my opinion, the President of the United States should deal with facts and policy and save his opinions for the memoir. You're running the country like a business alright. A personal revenge business. NFL, Amazon, who else hurt you and will feel your abuse of power?				1021430489343840258	1021388295618682881	realDonaldTrump	https://twitter.com/mgach31/status/1021430489343840258	
67d6bf08c2bc4a7	2018-07-23 12:22	0	0	You are no a victim! You have no idea what being the President of the United States means! You are a Traitor to our country! Quit attacking our Justice Department!				1021430286221959168	1021349516878974977	realDonaldTrump	https://twitter.com/67d6bf08c2bc4a7/status/1021430286221959168	
Instant29861588	2018-07-23 12:20	0	0	your Oath “I do solemnly swear that I will faithfully execute the Office of President of the United States, and will to the best of my Ability, preserve, protect and defend the Constitution of the United States." 1st Amendment: Free Press w/o Governmental interference.				1021429822944366592	1021370601863294977	realDonaldTrump	https://twitter.com/Instant29861588/status/1021429822944366592	
PamelaWatters13	2018-07-23 12:20	0	0	Six thirty in the morning and as the President of the United States this is what you wake up concerned about? People are right, you are unfit to be a leader! # impeach45			# impeach45	1021429775041286155	1021341698734030848	realDonaldTrump	https://twitter.com/PamelaWatters13/status/1021429775041286155	
VLVANCE	2018-07-23 12:19	2	4	The President of the United States is a # LIAR! He knew about the Russian HACK of our election before he was “INSTALLED!” @ realDonaldTrump https://twitter.com/kendilaniannbc/status/1021386338342522881 …		@ realDonaldTrump	# LIAR	1021429514272878593			https://twitter.com/VLVANCE/status/1021429514272878593	
gwells43	2018-07-23 12:18	0	0	@ realDonaldTrump President Donald J Trump is the president of the United States of America, not the World. Merit immigration, immigrants standing on their own feet, and limiting those that don't, eases the tremendous burden on our taxpayers. Let's make America Great Again!		@ realDonaldTrump		1021429272425238529			https://twitter.com/gwells43/status/1021429272425238529	
butterflysuziq	2018-07-23 12:16	0	0	@ davidmweissman The President of the United States ACTUALLY gets his intelligence briefings from Fox News and then tweets them out as if they are rock-solid facts. The President of the United States. Fox News. Maybe I'm still asleep. I hope.		@ davidmweissman		1021428817095782401	1021341698734030848	realDonaldTrump	https://twitter.com/butterflysuziq/status/1021428817095782401	
DesMcLeish	2018-07-23 12:14	0	0	You gave up the integrity of the office of the President of the United States of America when you threw US intelligence agencies and the FBI under the bus. Makes you a # FakePresident # MoronsAreGoverningAmerica # MorallyUnfit			# FakePresident # MoronsAreGoverningAmerica # MorallyUnfit	1021428366564646917	1021370601863294977	realDonaldTrump	https://twitter.com/DesMcLeish/status/1021428366564646917	
butterflysuziq	2018-07-23 12:13	0	0	@ Stonekettle Did he actually write this? "So now we find out..." Is he actually referring to WHAT HE JUST WATCHED ON FOX AND FRIENDS? The President of the United States? Gets his information from Fox & Friends? Like, did this actually just really happen?		@ Stonekettle		1021427973797400577	1021341698734030848	realDonaldTrump	https://twitter.com/butterflysuziq/status/1021427973797400577	
JanDriessen	2018-07-23 12:12	0	1	This is how the President of the United States, @ realDonaldTrump now threatens countries. On Twitter! WITH LOTS OF CAPITAL LETTERS. Twitter to impress. # fail # sad # dangeroushttps://twitter.com/realdonaldtrump/status/1021234525626609666 …		@ realDonaldTrump	# fail # sad # dangeroushttps	1021427875235467265			https://twitter.com/JanDriessen/status/1021427875235467265	
NyssaBuenrostro	2018-07-23 12:06	0	0	Jealous!!? . @ realDonaldTrump is the PRESIDENT OF THE UNITED STATES OF AMERICA!		@ realDonaldTrump		1021426362018455552	1021384752136409088	GregShugar realDonaldTrump	https://twitter.com/NyssaBuenrostro/status/1021426362018455552	https://abs.twimg.com/emoji/v2/72x72/1f926-1f3fb-200d-2642-fe0f.png
SandraM39924753	2018-07-23 12:06	0	0	Attention Trump Voters: please start recognizing the obvious—Trump is not up to the job of President of the United States. Amazon is a paranoid’s grievance, not a national problem				1021426255906811904	1021384752136409088	realDonaldTrump	https://twitter.com/SandraM39924753/status/1021426255906811904	
gael_wench	2018-07-23 12:05	0	0	As the president of the United States, he has no business attacking private business in official Tweets. Or in any official capacity. Until he's out of office, every burp or fart is in official capacity. So...				1021426204707098624	1021388295618682881	JDiaz1205 SkyrocOne	https://twitter.com/gael_wench/status/1021426204707098624	
KiitosAnne	2018-07-23 12:03	0	0	WTF. President of the United States. Jesus wept.				1021425601666637824	1021234525626609666	realDonaldTrump	https://twitter.com/KiitosAnne/status/1021425601666637824	
DorchTroy	2018-07-23 11:59	0	5	Its unbelievable the President of the United States has been up since 6am tweeting like a drunk college student.				1021424681029722113	1021388295618682881	danmac939 realDonaldTrump	https://twitter.com/DorchTroy/status/1021424681029722113	
darshancampos	2018-07-23 11:59	0	0	# Akon stated he was preparing to confront the @ President of the United States, # DonaldTrump, during the 2020 presidential elections. "I'm going to go after Trump… I'm not holding my tongue," @ Akon said. https://www.google.com/amp/s/www.coindesk.com/akon-akoin-crypto-africa-catches-fire/amp/ …		@ President @ Akon	# Akon # DonaldTrump	1021424529632055296			https://twitter.com/darshancampos/status/1021424529632055296	https://abs.twimg.com/emoji/v2/72x72/1f44f.png
lavenousglo	2018-07-23 11:58	0	1	@ realDonaldTrump You do a really bad job of trying to steer everyone's attention away from your impending end as president of the United States. It's a shame. I really hoped that you would have been a decent human being. # AnIdiotOnPennsylvaniaAve # ShutUpTrump # GoAway		@ realDonaldTrump	# AnIdiotOnPennsylvaniaAve # ShutUpTrump # GoAway	1021424377223557120			https://twitter.com/lavenousglo/status/1021424377223557120	
jlswls2012	2018-07-23 11:57	0	0	The President of the United States of America stood on the world stage and threw this country under the bus! He held a private meeting that his own people STILL don't know what happened & Russia is acting on them and giving the narrative. Trump is corrupt & a traitor.				1021424146599809024	1020984152357777408	JWMiller8050 Lauriandcollies	https://twitter.com/jlswls2012/status/1021424146599809024	
craigfalkenhage	2018-07-23 11:57	1	0	This is not the way a person with balanced mind behaves. This is not the way a President of the United States behaves. It’s far past the time for you to go.				1021424124051140608	1021234525626609666	realDonaldTrump	https://twitter.com/craigfalkenhage/status/1021424124051140608	
lost_alias	2018-07-23 11:56	7	12	The fact that this tweet was sent by the President of the United States is sickening. We are handling international trade like a modern version of Mean Girls. Tweeting something does not show strength. Real leadership doesn’t need likes and public praise. # NotMyPresident			# NotMyPresident	1021423762661683200	1021287836438257665	tedlieu realDonaldTrump	https://twitter.com/lost_alias/status/1021423762661683200	
hozrnbz22	2018-07-23 11:50	0	0	Right?!? I’m devastated. I legit just asked the President of the United States of America to please, stop name-calling and threatening. President used to MEAN something, now he’s causing my respect to dwindle more each passing day.				1021422227965669376	1021234525626609666	Khristophoros realDonaldTrump	https://twitter.com/hozrnbz22/status/1021422227965669376	https://abs.twimg.com/emoji/v2/72x72/1f4af.png
mr_dilone_music	2018-07-23 11:48	0	0	Honestly this just comes off as weakness. The president of the United States sounding more like a 10 year old who got killed one too many times in Call of Duty. If he's going to spend all this time around Putin then he should at least learn how to be intimidating like him. Smh				1021421877850509313	1021234525626609666	realDonaldTrump	https://twitter.com/mr_dilone_music/status/1021421877850509313	
Nano_coin	2018-07-23 11:48	0	0	'Covfefe' tells you all you need to know about Donald Trump At 12:06 a.m. ET, the President of the United States tweeted this: "Despite the constant negative press covfefe." http://rss.cnn.com/~r/rss/cnn_latest/~3/GMer_DPVHPU/index.html …				1021421768911802369			https://twitter.com/Nano_coin/status/1021421768911802369	
melliflea	2018-07-23 11:47	0	0	It's hard to believe you're president of the United States. Putin is getting his money's worth. He couldn't have found a more moronic, puerile, corrupt, and empty person. You're a tragedy for us, but a victory for our enemy.				1021421486047834112	1021234525626609666	realDonaldTrump	https://twitter.com/melliflea/status/1021421486047834112	
