username	date	retweets	favorites	text	geo	mentions	hashtags	tweetid	conversationid	replyto	permalink	imagelink
Nogard1951	2018-07-21 10:36	0	0	It's way past time to shut down Mueller. Anyone with more than three functioning brain cells knows by now that his mission is to continue digging for dirt, ANY DIRT, that can possibly lead to destroying Trump, the constitutionally elected president of the United States.				1020678931362459650	1020642287725043712	realDonaldTrump	https://twitter.com/Nogard1951/status/1020678931362459650	
teaselysmom	2018-07-21 09:06	0	0	I actually live in a time where the President of the United States just tweeted “your favorite president” in reference to himself.....warrants are usually served when people are caught unaware. This is what we refer to as “real life.” Welcome to it!				1020656153540407296	1020642287725043712	realDonaldTrump	https://twitter.com/teaselysmom/status/1020656153540407296	
RO61583837	2018-07-21 09:01	0	0	@ realDonaldTrump I think Donald that it is time that you realize that You are NO LONGER President of the United States. You are now just a D*ck that spends time in Washington that NO ONE LIKES and NEVER WILL!		@ realDonaldTrump		1020654953214300162			https://twitter.com/RO61583837/status/1020654953214300162	
intheboombox	2018-07-21 08:36	0	0	Inconceivable a person as corrupt, morally bankrupt, who lies every time he opens his mouth, has committed a lifetime of crimes and conspired and colluded with a hostile foreign government to help in his election is now the president of the United States but here we are.				1020648677000589312	1020642287725043712	realDonaldTrump	https://twitter.com/intheboombox/status/1020648677000589312	
Heres_Judy	2018-07-21 03:15	0	0	Trump Embraces Russia Debate is alive and well again - can’t believe it! Isn’t it in Presidential Oath, "I will faithfully execute the Office of President of the United States"? US Congress must now make a stand. 1st time: public Congress criticism. 2nd time: impeach for treason!				1020567807585472512	1020432499082702849	realDonaldTrump	https://twitter.com/Heres_Judy/status/1020567807585472512	
mikewachtel	2018-07-21 02:24	0	0	@ realDonaldTrump With everything going on in your life as a Father, as a Husband and as the President of The United States of America, how do you seriously have the time to actively tweet and criticize the @ NFL and the @ NFLPA? Leave that to the Viewers. # DoYourJobPlease		@ realDonaldTrump @ NFL @ NFLPA	# DoYourJobPlease	1020555170453819392			https://twitter.com/mikewachtel/status/1020555170453819392	
Tierna	2018-07-21 00:18	0	0	Does that work for the President of the United States? First time caught siding with an evil dictator...well you know the rest. Football players don’t control nukes.				1020523396143214592	1020432499082702849	realDonaldTrump	https://twitter.com/Tierna/status/1020523396143214592	
JonDStrange1	2018-07-20 20:46	0	1	It was a disgrace!!! Was the deal you made to give back the countries they lost in the USSR's downfall? If so you'll go down as the Russian President of the United States. Is this what your doing? If so your time will come and the "People" of the U.S. will take arms against you.				1020469980930818048	1019376680572456960	realDonaldTrump	https://twitter.com/JonDStrange1/status/1020469980930818048	
MVinc10560	2018-07-20 20:25	0	0	The President of the United States is a pathetic, worthless, feckless dotard...still alive & just as ineffective!! We all can believe it!!! U brought a lot of SH*T w/ U when U took this job. About time U started doing it & STFU!! pic.twitter.com/71jJoouPMO				1020464703129161728	1020432499082702849	realDonaldTrump	https://twitter.com/MVinc10560/status/1020464703129161728	https://pbs.twimg.com/media/Dilqa0vUYAESC00.jpg
toneely22	2018-07-20 20:24	0	0	President of the United States. First Time being a Traitor /Out of the White House. Second Time being a Traitor /Out of the Country. America must Take a Stand!!				1020464599764819968	1020432499082702849	realDonaldTrump	https://twitter.com/toneely22/status/1020464599764819968	
RAroundtheclock	2018-07-20 20:16	0	0	So you don’t have enough to do as President of the United States- you have time to run the NFL too? WOW you are truly amazing .				1020462484313034753	1020432499082702849	realDonaldTrump	https://twitter.com/RAroundtheclock/status/1020462484313034753	https://abs.twimg.com/emoji/v2/72x72/1f644.png
socaltara	2018-07-20 19:46	0	1	How about the President of The United States takes a stand. First time honoring a dangerous dictator (North Korea’s) he was given a pass. Second time honoring a dangerous dictator (Russia’s) let’s put him out!				1020454813178314752	1020432499082702849	realDonaldTrump	https://twitter.com/socaltara/status/1020454813178314752	
numbakrunch	2018-07-20 19:40	0	0	I was just thinking this is exactly the sort of thing the President of the United States should be spending his/her limited time thinking about.				1020453407822315522	1020432499082702849	realDonaldTrump	https://twitter.com/numbakrunch/status/1020453407822315522	
magost	2018-07-20 19:11	0	0	Doesn't the president of the United States of America swears to preserve, protect and defend the Constitution of the United States? First time treasoning, life time sentence!				1020446195410456577	1020432499082702849	realDonaldTrump	https://twitter.com/magost/status/1020446195410456577	
fembratt	2018-07-20 18:52	0	1	You actually have time to think about this? You do know these are 2 separate career paths, right? Dude pick a lane, President of the United States of America or armchair quarterback??				1020441363685376000	1020432499082702849	realDonaldTrump	https://twitter.com/fembratt/status/1020441363685376000	
quail_robert	2018-07-20 18:45	0	0	Why are you worried about this? As President of the United States haven't you got more important things to do? What a waste of time!				1020439540857634816	1020432499082702849	realDonaldTrump	https://twitter.com/quail_robert/status/1020439540857634816	
dontbhasty	2018-07-20 18:12	0	0	Remember when you were president of the United States and didn’t waste time tweeting shit like a bitter 6th grader? Oh...wait. Wishful thinking.				1020431350254489602	1020425741664751616	realDonaldTrump	https://twitter.com/dontbhasty/status/1020431350254489602	
DolandMar123	2018-07-20 15:06	0	0	@ TheView WHOOP WHOOP, you are disgusting, also untalented. EVERY TIME YOU TALK, A BIG TURD COMES OUT OF YOUR MOUTH. You were supposed to move after DONALD J. TRUMP became PRESIDENT OF THE UNITED STATES OF AMERICA. WHAT IS TAKING YOU SO LONG. Judge Pirro is great!		@ TheView		1020384519852122112			https://twitter.com/DolandMar123/status/1020384519852122112	
CovfefeAgent	2018-07-20 14:58	0	0	You’re a fool.... and I have no time for fools such as YOU but before I go just remember Donald Trump is the President of the United States!				1020382575527956480	1020339263055937536	Strikemaster211 TheView	https://twitter.com/CovfefeAgent/status/1020382575527956480	https://abs.twimg.com/emoji/v2/72x72/1f44f.png
RealAmericanMa1	2018-07-20 13:12	0	0	Ever since @ realDonaldTrump became # president was the first time in my lifetime that the president of the United States was not the most powerful man in the world! # pussypresident		@ realDonaldTrump	# president # pussypresident	1020355731428528128			https://twitter.com/RealAmericanMa1/status/1020355731428528128	
AwardsDaily	2018-07-20 12:35	14	62	You hear that sound @ realDonaldTrump? That's the sound of the people of America finally realizing that a hostile foreign power has compromised the President of the United States. High crimes against the United States. It's time to impeach your treasonous ass out of DC. https://twitter.com/neeratanden/status/1020026487150383104 …		@ realDonaldTrump		1020346489493524480			https://twitter.com/AwardsDaily/status/1020346489493524480	
carolynkey134	2018-07-20 09:33	0	7	This has been the first time to my knowledge that the president of the United States was not considered the most powerful man in the world today is Putin				1020300650305998848	1019932691339399168	Crimbo51 AliCologne realDonaldTrump	https://twitter.com/carolynkey134/status/1020300650305998848	
HoistTheBlack	2018-07-20 09:03	0	0	I know you're very busy and commend your time allocation but do you think it's possible the President of the United States of America might have a couple other things put on his desk that could require his attention first? Say, Syria and/or terrorism just as an example.				1020293114475548672	1020285014616002560	ChrisJZullo realDonaldTrump	https://twitter.com/HoistTheBlack/status/1020293114475548672	
TrumpDotDotDot	2018-07-20 09:01	5	35	JUST IN: The President of the United States applies political pressures to the intentionally apolitical Fed, after they raised rates in response to inflationary pressures HE created, notably a yuge tax cut during a time of full employment, and a senseless trade global war. pic.twitter.com/DIqPdHq0Tn				1020292575553519616	1020290163933630464	realDonaldTrump	https://twitter.com/TrumpDotDotDot/status/1020292575553519616	
madavis662	2018-07-20 08:37	1	6	Yet you use it as an opportunity to bash the president. I'm sure you've never missed giving condolences to someone because you didn't what happened. You expect a president of the United States to know every time every bad thing happens in the whole world? Wow				1020286675904270337	1020285014616002560	ThrilliamCXP realDonaldTrump	https://twitter.com/madavis662/status/1020286675904270337	
corvidaryum	2018-07-20 05:07	1	17	Did the President of the United States of America just say "I told you so?" I haven't heard someone say that since the last time I saw my 4 year old niece.				1020233624644476928	1019932691339399168	realDonaldTrump	https://twitter.com/corvidaryum/status/1020233624644476928	
themattjack	2018-07-20 03:38	0	2	Donald Trump during his time as President of the United States (c. 2018) pic.twitter.com/uNiDuoFXMy				1020211302520827904			https://twitter.com/themattjack/status/1020211302520827904	https://pbs.twimg.com/media/DiiExNNVAAEG_Eg.jpg
thismomentonly	2018-07-20 03:35	0	1	Such sad, disturbing and embarrassing times when you Google the word ‘idiot’ and the first thing that appears is the President of the United States, @ realDonaldTrump. It’s way past time.. # Trump needs to be removed from office. pic.twitter.com/XbEw7PExAK		@ realDonaldTrump	# Trump	1020210562402324480			https://twitter.com/thismomentonly/status/1020210562402324480	https://pbs.twimg.com/media/DiiEGLpWkAA_3Um.jpg
LABlackPrideVP	2018-07-20 03:06	0	0	@ realDonaldTrump is unfit to be President of the United States. It is time for @ SpeakerRyan and @ SenateMajLdr to lead a bipartisan effort to remove him from office before he destroys our values in the world. He has become a clear and present danger. Country before party. Pray		@ realDonaldTrump @ SpeakerRyan @ SenateMajLdr		1020203337956802560	1020179254053662720	thehill	https://twitter.com/LABlackPrideVP/status/1020203337956802560	
kwhitney2015	2018-07-20 01:07	0	0	Substance over form this is Twitter come on guys he's the president of the United States and who are you? Are you even a US citizen LOL are you one of those Russian Bots that hates every time Trump makes makes a post				1020173281385738240	1019909066456489986	JennLuRawlings MaryNovaria realDonaldTrump	https://twitter.com/kwhitney2015/status/1020173281385738240	
BluBtfly70	2018-07-20 00:35	1	2	None of that matters when the President of the United States of America is committing treason, holding hate rallies, separating parents and children, inciting violence against Maxine Waters and others who challenge daily threats against humanity. Time for you to exit our house!				1020165283674304512	1019903123312308224	realDonaldTrump foxandfriends FoxNews	https://twitter.com/BluBtfly70/status/1020165283674304512	
RHacker007	2018-07-19 18:37	0	0	@ realDonaldTrump Mr. President, DNI Dan Coats @ SenDanCoats, is a disgrace to the United States. A puppet for the # DeepState; it is time for his removal from office. Why shouldn't the President of the USA meet with the President of Russia (Largest Nuclear Power), regularly?		@ realDonaldTrump @ SenDanCoats	# DeepState	1020075217119580162			https://twitter.com/RHacker007/status/1020075217119580162	https://abs.twimg.com/sticky/default_profile_images/default_profile_normal.png
billmanrique	2018-07-19 17:44	1	0	The only verifiable truth is that Donald Trump is the President of the United States of American. Are you disputing that? The waste of time is from our part when we have to answer demented claims that are "truly" unverified				1020061747867267072	1019932691339399168	MissesThe90s NevesEsque realDonaldTrump	https://twitter.com/billmanrique/status/1020061747867267072	
missdeejones32	2018-07-19 16:57	0	0	I'm sorry is he the president of my United States only? My leader? Last time I checked his title is President of the United States of America. He is not just my leader and I'm not saying that everything he does is right I'm just saying cut the guy some slack and let him work.				1020050010665177088	1019932691339399168	Malteseblackcat pnelson1258 realDonaldTrump	https://twitter.com/missdeejones32/status/1020050010665177088	
KartonRichard	2018-07-19 15:43	0	0	@ trudyrubin I would like to share information with you that may prove that Donald Trump is not legally the President of the United States and can be removed. This would not entail the problematic procedure of impeachment The information is very time sensitive. RK 215-768-2672		@ trudyrubin		1020031325242306562			https://twitter.com/KartonRichard/status/1020031325242306562	
miche11e_palmer	2018-07-19 14:58	0	1	I really don’t understand how the president of the United States of America has so much free time on his hands to tweet this much. I don’t even have enough time in my busy schedule to catch up on reading all of these. Surely you have something more important to be doing.				1020020071337549824	1020008975922810883	realDonaldTrump	https://twitter.com/miche11e_palmer/status/1020020071337549824	
LUCIUSGAUNICHA2	2018-07-23 14:03	0	0	UNITED STATES PRESIDENT DONALD TRUMP EXECUTIVE ORDER AND UNITED STATES VICE PRESIDENT MIKE PENCE AND UNITED STATES ATTORNEY GENERAL JEFF SESSIONS AND THE PRESIDENT OF THE CRIME… https://www.instagram.com/p/BklZbYJAbIA/?utm_source=ig_twitter_share&igshid=1kr3x9i3233xl …				1021455793437257729			https://twitter.com/LUCIUSGAUNICHA2/status/1021455793437257729	
Audrakat	2018-07-23 14:02	0	1	Pretty sick that we have a # Democrat defending a terrorist mullah over $ twtr rules? This is the President of the United States making dam sure another 911 never happens again. 3000 died horrible death's & Flight 93 gave their lives to save thousands at the Capital. NEVER again.			# Democrat	1021455440725434374	1021234525626609666	slimwiththebrim pjmk1995	https://twitter.com/Audrakat/status/1021455440725434374	
alikin9	2018-07-23 14:01	0	0	THE PRESIDENT OF THE UNITED STATES IS A TRAITOR WHO ATTACKS HIS OWN NATIONAL INTELLIGENCE AGENCIES TO COVER UP HIS CRIMINAL ACTS.				1021455177595998208	1021347230022807552	realDonaldTrump	https://twitter.com/alikin9/status/1021455177595998208	
ChangeDems	2018-07-23 13:59	0	0	The President of the United States of America announcing @ foxandfriends program scheduling. So sad the USA Presidency has gone down this low.		@ foxandfriends		1021454851212005377	1021337592904732672	realDonaldTrump foxandfriends	https://twitter.com/ChangeDems/status/1021454851212005377	
spacecowgirl915	2018-07-23 13:58	0	0	Disgraceful that the President of the United States continues to attack the media. The Constitution states, "The press serves the governed not the governor." Ignorant traitor! pic.twitter.com/UH660jwsD2				1021454483233046528	1021388295618682881	realDonaldTrump	https://twitter.com/spacecowgirl915/status/1021454483233046528	https://pbs.twimg.com/media/Dizuzb_V4AEVaXu.jpg
jlswls2012	2018-07-23 13:56	0	6	It's illegal for the President of the United States to throw his country under the bus in favor of Russia, correct? It's illegal for the President to line his pockets thru his position, correct? Pick a country, America or Russia, simple.				1021453981107793921	1021451895028658176	russellstuart davidhogg111 realDonaldTrump	https://twitter.com/jlswls2012/status/1021453981107793921	
Ninjamuri	2018-07-23 13:53	0	0	Yo @ Twitter FOR REAL?? This doesn't violate ANY of your policies? This is the actual (unfortunately) president of the United States threatening nuclear war against another nuclear capable nation. Please fix. Thx.		@ Twitter		1021453363924250624	1021234525626609666	realDonaldTrump	https://twitter.com/Ninjamuri/status/1021453363924250624	
mskowronek	2018-07-23 13:52	0	0	We wouldn’t know because for some insane reason what you discussed is a secret. Maybe you should remember who the President of the United States works for.				1021452913762332672	1021370601863294977	realDonaldTrump	https://twitter.com/mskowronek/status/1021452913762332672	
lalproperty	2018-07-23 13:52	0	0	Mr President: you are doing a phenomenal job as President Of The United States! Those of us with true eyes to see; can see through the foolishness of the Corrupt Media! There are millions praying for you personally and for your administration. We love you Mr President!				1021452912512438273	1021370601863294977	realDonaldTrump	https://twitter.com/lalproperty/status/1021452912512438273	
AndyQashou	2018-07-23 13:49	0	1	The President of the United States is NOT supposed to speak out against private companies this way, let alone the free press. Correct Trump is not president of USA				1021452371900157952	1021388295618682881	ForeverLogical tazarae20 realDonaldTrump	https://twitter.com/AndyQashou/status/1021452371900157952	
WaxDreamer_FP	2018-07-23 13:49	0	0	Wait a second...Did the president of the United States...just make a meme?				1021452241654468613	1021234525626609666	realDonaldTrump	https://twitter.com/WaxDreamer_FP/status/1021452241654468613	
SharonD88546391	2018-07-23 13:48	0	0	The investigation to find out which Americans helped the Russians in their goal to divide us as a nation should be of concern to all of us. Probably as the President of the United States you should want to get to the bottom of this. Why are you so afraid of the truth?				1021452070505852928	1021351630648815616	realDonaldTrump JudicialWatch	https://twitter.com/SharonD88546391/status/1021452070505852928	
think_teach1	2018-07-23 13:48	0	0	# TrumpRussia The President of the United States is a traitorous Russian agent who takes his orders from Putin. Perhaps he should stop sticking his orange nose where it doesn’t belong. He has more important concerns. # TrumpButtOut			# TrumpRussia # TrumpButtOut	1021451890851164160	1020432499082702849	realDonaldTrump	https://twitter.com/think_teach1/status/1021451890851164160	
KMalouf2	2018-07-23 13:47	0	0	@ realDonaldTrump @ SenateGOP @ HouseGOP "Facts are stubborn things; and whatever maybe our wishes, our inclinations, or the dictates of our passions, they cannot alter the state of facts and evidence." Author: John Adams, 2nd President of the United States. Still true now!		@ realDonaldTrump @ SenateGOP @ HouseGOP		1021451800400941056			https://twitter.com/KMalouf2/status/1021451800400941056	
jaman495	2018-07-23 13:45	0	0	The President of the United States (or Divided States rather) thinks climate change is a Chinese hoax, the 44th President was born in Kenya, we barreled in $150B to Iran, Mexicans are rapists and drug dealers, trade wars are easy to win, Putin is a good guy, Kim is a great leader				1021451201081094144	1021438091926687748	tedlieu realDonaldTrump	https://twitter.com/jaman495/status/1021451201081094144	
PennyCarrigan1	2018-07-23 13:44	1	4	That's a crying shame to say about a President of the United States, but unfortunately, it's so dam TRUE!!!				1021451095577677825	1021341698734030848	ZemanLynnZ realDonaldTrump	https://twitter.com/PennyCarrigan1/status/1021451095577677825	
lecavanaugh	2018-07-23 13:43	3	10	It’s truly pathetic that the president of the United States is speaking out against the free press. All you do is attack America and its institutions. Most unpatriotic president in history.				1021450802169372674	1021388295618682881	realDonaldTrump	https://twitter.com/lecavanaugh/status/1021450802169372674	
garypenovich	2018-07-23 13:43	0	0	This is the kind of measured and thoughtful statesmanlike oratory one expects from the Office of the President of the United States of America. Oh. I meant "isn't".				1021450719310708736	1021234525626609666	realDonaldTrump	https://twitter.com/garypenovich/status/1021450719310708736	
xandamere	2018-07-23 13:41	0	0	Remember all the times you "predicted" Obama would start a war with Iran as a distraction? Hmmmm.... Also, the President of the United States is attacking another country on the Internet with an incoherent Tweet in ALL CAPS. Sure, this is fine.				1021450121534291969	1021234525626609666	realDonaldTrump	https://twitter.com/xandamere/status/1021450121534291969	
Raymond87045830	2018-07-23 13:40	1	7	Man, get over it. You want to start a War with Iran so you can be proven a Strong President but, you're Weak. Weak in the Mind, and Weak in the White House. You attack Iran, and you & your family will need protection long after being the President of the United States. pic.twitter.com/0emiq2ExdL				1021449883880968192	1021234525626609666	realDonaldTrump	https://twitter.com/Raymond87045830/status/1021449883880968192	https://pbs.twimg.com/media/DizrPsPUwAABCAD.jpg
SBFNC	2018-07-23 13:39	0	0	You must still be up on that beautiful mountain. So, I'm going to tweet for you today. Hope that's OK. It's Monday, July 23, 2018. I humbly call for the resignation of Donald J Trump as President of the United States.				1021449854436986887	1020451771477442560	BoycottUtah	https://twitter.com/SBFNC/status/1021449854436986887	
MichaelGMalloy	2018-07-23 13:39	0	0	Seriously, how can this big of a joke of a human being be the President of the United States? BTW, just like everything that comes out of that pie-hole of yours, this too is a lie. https://www.politico.com/media/story/2016/12/the-profitable-washington-post-adding-more-than-five-dozen-journalists-004900 …				1021449794642997248	1021388295618682881	realDonaldTrump	https://twitter.com/MichaelGMalloy/status/1021449794642997248	
DarkWarrior2018	2018-07-23 13:35	0	0	Threatening American citizens, businesses and the Free Press is completely against the Oath of Office that you took as the President of the United States of America. "will to the best of his ability, preserve, protect and defend the Constitution of the United States."				1021448755550334977	1021384752136409088	realDonaldTrump	https://twitter.com/DarkWarrior2018/status/1021448755550334977	
littlejewboy	2018-07-23 13:33	0	0	I love the mental image of the President of the United States reading all our replies...hey Donnie, thanks for all the great “meta” comedy!!				1021448269233238016	1021433378208301056	SparklesOrelce realDonaldTrump	https://twitter.com/littlejewboy/status/1021448269233238016	
VickiSerreino	2018-07-23 13:32	0	0	The President of the United States should NOT be using an official government platform to defame an American business. You are shameful and VERY BAD for this country. Cmon Bezos sue this MF’er please?!!				1021448019902980096	1021388295618682881	realDonaldTrump	https://twitter.com/VickiSerreino/status/1021448019902980096	
RoguePatriot2	2018-07-23 13:30	0	0	Trump is a sociopath and pathological LIAR who has clearly demonstrated his inability and/or unwillingness to faithfully execute the Office of President of the United States. ~ Invoke the 25th Amendment, Section 4 immediately. ~				1021447415583293440	1021380986452545537	realDonaldTrump	https://twitter.com/RoguePatriot2/status/1021447415583293440	
Bluebeaner	2018-07-23 13:29	0	1	@ IJasonAlexander @ realDonaldTrump The President of the United States is a liar who can't read		@ IJasonAlexander @ realDonaldTrump		1021447332469125122	1021344757933584391	TimOBrien	https://twitter.com/Bluebeaner/status/1021447332469125122	
tomtrusnovic	2018-07-23 13:29	0	0	..and here comes the play by play twitter commentary, because there is certainly no more important way that the president of the united states should be spending their time.				1021447102696755200	1021337592904732672	realDonaldTrump foxandfriends	https://twitter.com/tomtrusnovic/status/1021447102696755200	
The_Next_007	2018-07-23 13:23	0	0	Where was this "tough President" when meeting w/ Putin? @ realDonaldTrump acted like his lapdog instead of President of the United States. At best he doesn't know what he is doing, at worst he is actually trying to destroy the country for making fun of tiny hands. # outnumberedot		@ realDonaldTrump	# outnumberedot	1021445626108579842	1021443370831499264	FoxNews RepDougCollins	https://twitter.com/The_Next_007/status/1021445626108579842	
mariannefarme18	2018-07-23 13:22	0	0	@ HillaryClinton Did you actually think God was going to allow you to be President of the United States? You may not have seen "the handwriting on the wall" but we Christians can see it for you & that's why Donald Trump is President of the United States.		@ HillaryClinton		1021445362136027136			https://twitter.com/mariannefarme18/status/1021445362136027136	
ericaj58	2018-07-23 13:20	0	0	@ realDonaldTrump The ONLY way you can say this is not more damaging to you is you didn’t read it or you didn’t understand it. Then there’s the obvious, you’re lying. This is the President of the United States? https://twitter.com/ericaj58/status/1021444138674184192 …		@ realDonaldTrump		1021445025303998464			https://twitter.com/ericaj58/status/1021445025303998464	
