username	date	retweets	favorites	text	geo	mentions	hashtags	tweetid	conversationid	replyto	permalink	imagelink
lt_danmagiclegs	2018-04-17 23:11	0	2	I see you and raise you this first responder at the Pride Parade smoking a stogie and watching as several gay men danced in a open fire hydrant. You can smell the Chicago style hot dogs in his sweat pic.twitter.com/0N2dAvocfc				986441985882980352	986297577489526784	bonjour_jamie ChiPartyAunt	https://twitter.com/lt_danmagiclegs/status/986441985882980352	https://pbs.twimg.com/media/DbCLwHBXkAAP9rK.jpg
Luxe_Saga	2017-11-04 03:00	0	0	Rustlay? The guy behind the gay pride parade fire-hydrant tweet insertion tweet?				926705618534014976	926692785364897792	DCSD_Bryce rusatus	https://twitter.com/Luxe_Saga/status/926705618534014976	
Anarcha_	2017-09-09 01:00	0	1	This reminds me of an article I saw of a gay pride parade where a guy tried taking a whole fire hydrant up his ass, and needed paramedics.				906381759088033792	906379069616525312	Portaldrop	https://twitter.com/Anarcha_/status/906381759088033792	
Luxe_Saga	2017-11-04 03:00	0	0	Rustlay? The guy behind the gay pride parade fire-hydrant tweet insertion tweet?				926705618534014976	926692785364897792	DCSD_Bryce rusatus	https://twitter.com/Luxe_Saga/status/926705618534014976	
Anarcha_	2017-09-09 01:00	0	1	This reminds me of an article I saw of a gay pride parade where a guy tried taking a whole fire hydrant up his ass, and needed paramedics.				906381759088033792	906379069616525312	Portaldrop	https://twitter.com/Anarcha_/status/906381759088033792	