username	date	retweets	favorites	text	geo	mentions	hashtags	tweetid	conversationid	replyto	permalink	imagelink
jtorbert1	2018-07-14 13:11	0	0	Hillary Clinton Gave 20 Percent of United States’ Uranium to Russia in Exchange for Clinton Foundation Donations totaling $145 million while serving as Secretary of State. Crooked Hillary!!				1018181323813466112	1016491204786184192	WeDemandJustice HillaryClinton	https://twitter.com/jtorbert1/status/1018181323813466112	
vandaplas1	2018-07-13 15:27	0	0	WHAT IS THE STATUS OF THE UNITED STATES GOVERNMENT'S JUSTICE DEPARTMENT'S CRIMINAL INVESTIGATION OF HILLARY & THE IMPEACHED BILL CLINTON, & THE CLINTON FOUNDATION? Jerome				1017853090404487168			https://twitter.com/vandaplas1/status/1017853090404487168	
SalernoAnthony	2018-07-13 13:28	0	0	FACT CHECK: Hillary Clinton Gave 20 Percent of United States' Uranium to Russia in Exchange for Clinton Foundation… http://sumo.ly/Vvbi via @ snopes # IamAFT # HILLARYCLINTON		@ snopes	# IamAFT # HILLARYCLINTON	1017823171867807744			https://twitter.com/SalernoAnthony/status/1017823171867807744	
vandaplas1	2018-07-12 22:49	0	0	WHAT IS THE STATUS OF THE UNITED STATES GOVERNMENT'S JUSTICE DEPARTMENT'S CRIMINAL INVESTIGATION OF HILLARY & THE IMPEACHED BILL CLINTON, & THE CLINTON FOUNDATION? Jerome				1017601915469918208			https://twitter.com/vandaplas1/status/1017601915469918208	
Independent_RR	2018-07-12 21:51	0	1	Charities sell their # DonorLists. The Clinton # foundation is all a cover up to receive and send confidential # info shared and sold on citizens of the United States especially if they supported # BernieSanders or their # PoliticalOpponents.			# DonorLists # foundation # info # BernieSanders # PoliticalOpponents	1017587222693007361			https://twitter.com/Independent_RR/status/1017587222693007361	
eddiejakes	2018-07-12 18:41	0	0	Yes, all those statements are true, plus you left out that they built an industrial park on farmland because they said it would create 15,000 jobs and resulted in barely 2,000. I think the United States and the Clinton Foundation owe those people a lot in restitution.				1017539531233513472	1017531775025807360	cmon_now KyleKulinski	https://twitter.com/eddiejakes/status/1017539531233513472	
vandaplas1	2018-07-12 14:53	0	0	WHAT IS THE STATUS OF THE United States GOVERNMENT'S JUSTICE DEPARTMENT'S CRIMINAL INVESTIGATION OF HILLARY & THE IMPEACHED BILL CLINTON, & THE CLINTON FOUNDATION? Jerome				1017482196720943104			https://twitter.com/vandaplas1/status/1017482196720943104	
MartyCorona	2018-07-12 13:56	0	0	The Clinton Foundation improves lives across the United States and around the world to create economic opportunity, improve public health, … https://twitter.com/ClintonFdn/status/955243825131393025 …				1017467815815720960			https://twitter.com/MartyCorona/status/1017467815815720960	https://pbs.twimg.com/media/DUG1MhvUQAAfrfR.jpg
vandaplas1	2018-07-11 22:45	0	0	WHAT IS THE STATUS OF THE United States GOVERNMENT'S JUSTICE DEPARTMENT'S CRIMINAL INVESTIGATION OF HILLARY & THE IMPEACHED BILL CLINTON, & THE CLINTON FOUNDATION? Jerome				1017238597446045696			https://twitter.com/vandaplas1/status/1017238597446045696	
aaronrlovett	2018-07-11 16:08	0	0	Isn't it Time, we the people, SEE that The Clinton Foundation, The Bush Family, The Trump Organization and Hedge Fund owners HAVE SHORTED the United States before and will do it again. POTUS leaves for Macao in late September. you reddit here today.				1017138592848711680			https://twitter.com/aaronrlovett/status/1017138592848711680	