username	date	retweets	favorites	text	geo	mentions	hashtags	tweetid	conversationid	replyto	permalink	imagelink
STICKS090460	2018-07-18 02:51	0	1	The standard of driving in SE London this morning is shite, even by the usual shite standards. Seen three near-misses so far, one of which was a Police van nearly rear-ending a car, because not paying attention.				1019474619932270592			https://twitter.com/STICKS090460/status/1019474619932270592	
awrc93	2018-07-17 18:47	0	1	You show me anyone living in London who says they have gone a full 24 hours without hearing a car alarm or police siren and I’ll show you a liar x				1019352830241632258			https://twitter.com/awrc93/status/1019352830241632258	
philtvnews	2018-07-17 15:36	0	0	Woman accused of ramming husband’s car with hers...but police in Laurel County say her violent behavior didn’t end when they got her to jail. More from London at 430 and 530 @ SdickSam @ wymt https://www.instagram.com/p/BlWD-sphuVX/?utm_source=ig_twitter_share&igshid=1j317vomjxmei …		@ SdickSam @ wymt		1019304741615042561			https://twitter.com/philtvnews/status/1019304741615042561	
Roxana_M_Molina	2018-07-17 13:37	0	1	@ emc1912 Story: Ten Mile High Speed Pursuit Across London Ends in Putney - Police helicopter tracked stolen car trav... http://putneysw15.com/default.asp?se …		@ emc1912		1019274981203677185	1019012239947427841	RyanHand_	https://twitter.com/Roxana_M_Molina/status/1019274981203677185	
TheTrainTravelr	2018-07-17 11:34	0	0	Police: Car crash in London is traffic accident, not terror | WTOP http://bki.me/KipAcx9q				1019244040498315265			https://twitter.com/TheTrainTravelr/status/1019244040498315265	
TheTrainTravelr	2018-07-17 09:37	0	0	Police: Car crash in London is traffic accident, not terror - Washington Times http://bki.me/XDmzeKG7				1019214402132865024			https://twitter.com/TheTrainTravelr/status/1019214402132865024	
SimonPelling	2018-07-17 08:02	0	0	I liked a @ YouTube video http://youtu.be/Lg63krBVB3Q?a London Armed Police car responding VERY FAST with BULLHORN!		@ YouTube		1019190606550241282			https://twitter.com/SimonPelling/status/1019190606550241282	
EastKent999vids	2018-07-17 07:30	1	2	London Armed Police car responding VERY FAST with BULLHORN!: http://youtu.be/Lg63krBVB3Q?a via @ YouTube		@ YouTube		1019182505885302784			https://twitter.com/EastKent999vids/status/1019182505885302784	
putneysw15	2018-07-17 06:07	1	0	Story: Ten Mile High Speed Pursuit Across London Ends in Putney - Police helicopter tracked stolen car trav... http://www.putneysw15.com/default.asp?section=info&page=concrime369.htm …				1019161768558583808			https://twitter.com/putneysw15/status/1019161768558583808	
Buckets74	2018-07-17 00:44	0	0	No doubt terrifying for the driver, but how the fluck did the dude miss from such close range?? She’s bloody lucky to be alive! UK police release CCTV footage of gunman opening fire at passing car during London peak hour traffic https://www.perthnow.com.au/news/world/uk-police-release-cctv-footage-of-gunman-opening-fire-at-passing-car-during-london-peak-hour-traffic-ng-b88891895z?utm_campaign=share-icons&utm_source=twitter&utm_medium=social&tid=1531802607719 …				1019080343834382341			https://twitter.com/Buckets74/status/1019080343834382341	
RailRider_	2018-07-17 00:33	0	0	Police: Car crash in London is traffic accident, not terror http://f1h.me/2utJ3Anh				1019077649132589057			https://twitter.com/RailRider_/status/1019077649132589057	
RailwayMinister	2018-07-16 22:47	0	0	Police: Car crash in London is traffic accident, not terror | My Connection from Cox http://urq.me/SrjA9HjL				1019050824700395520			https://twitter.com/RailwayMinister/status/1019050824700395520	
RyanHand_	2018-07-16 20:13	2	16	After a brief 4 hour delay in Milan I just got back to London and there’s 2 police helicopters above our house and lots of police cars on my street, not sure what’s going on but hope everyone is safe! # Wandsworthpic.twitter.com/V6274iM8FD			# Wandsworthpic	1019012239947427841			https://twitter.com/RyanHand_/status/1019012239947427841	
ISpaceReporter	2018-07-16 17:52	0	0	A police officer was rammed into a roadside barrier by a teenage driver during a dramatic high speed chase in south London. Dashcam footage shows Ramone Kidd, 19, driving his car straight at Sgt Chris... https://interspacereporter.com/uk/moment-car-drove-into-police-officer/ …				1018976731871498240			https://twitter.com/ISpaceReporter/status/1018976731871498240	
acpfonline	2018-07-16 09:46	0	0	This is Britain where being a black man in a car with tinted windows will get you pulled but if you drive round London you won’t see a wealthy white folk without tints Disgusting Police Abuse & Harrasment Aggresive False Arrest https://youtu.be/24jx6FgnS5o via @ YouTube		@ YouTube		1018854308438306816			https://twitter.com/acpfonline/status/1018854308438306816	https://abs.twimg.com/emoji/v2/72x72/1f1ec-1f1e7.png
JamieTh58019729	2018-07-16 07:14	1	0	@ MGassanly Car Dumped on Chichester Street London, Damaged both Sides Stolen or involved in Ram Raid, MET Police Not interested can the Council get it removed it is in breach of Rule 241, 242 and 243 of Highway code parked near junction, school exit, parking bay. pic.twitter.com/cfBJyeDkzj		@ MGassanly		1018816154138238976			https://twitter.com/JamieTh58019729/status/1018816154138238976	https://pbs.twimg.com/media/DiOO4HXW4AA474r.jpg
sohailanjum	2018-07-16 06:13	0	2	just witnessed an undercover police car chasing a guy on a moped at high speed... welcome to London				1018800666528108544			https://twitter.com/sohailanjum/status/1018800666528108544	https://abs.twimg.com/emoji/v2/72x72/1f60e.png
Lndn_Plow	2018-07-16 05:59	0	0	Moment car drove into police officer https://www.plow.io/post/moment-car-drove-into-police-officer?utm_source=Twitter&utm_campaign=London … +1 LondonBot # London # UK			# London # UK	1018797352641953792			https://twitter.com/Lndn_Plow/status/1018797352641953792	
LisaMariePlays	2018-07-16 03:56	1	17	Just saw a police officer jump out of an unmarked police car wearing (I shit you not) a Hawaiian shirt, bright blue shorts and a London Met Police vest casually on top.				1018766380534042624			https://twitter.com/LisaMariePlays/status/1018766380534042624	https://abs.twimg.com/emoji/v2/72x72/1f914.png
RailwayMinister	2018-07-16 02:03	0	0	London police say car crash that hurt 11 outside Natural History Museum not a terror attack | Toronto Star http://urq.me/N2ammuqa				1018737816979869697			https://twitter.com/RailwayMinister/status/1018737816979869697	
RailRider_	2018-07-16 01:00	0	0	Police: Car crash in London is traffic accident, not terror - Washington Times http://f1h.me/XDmzeKG7				1018722127095255040			https://twitter.com/RailRider_/status/1018722127095255040	
ChainTrainGang	2018-07-16 00:54	0	0	Police: Car crash in London is traffic accident, not terror | WTNH Connecticut News http://bki.me/Ap2LrPrf				1018720563769085952			https://twitter.com/ChainTrainGang/status/1018720563769085952	
ConsumerMiss	2018-07-15 13:02	0	0	@ Tesco I'm injured & car written off by hit-and-run driver in London on Friday evening, all witnessed by and (almost certainly) captured on Tesco lorry driver's cabin camera. Police involved. Your driver captured clearly on my dashcam as witnessing the incident.. 1/2		@ Tesco		1018541437833613312			https://twitter.com/ConsumerMiss/status/1018541437833613312	
baccolini_alan	2018-07-15 09:42	0	1	@ TfL Please TFL Can you return our London Road in North Cheam back to Sutton Council control. We have phoned 101 to request the Police to investigate these idiots in these loud sounding cars but they don't pick the phone up. Sutton ciuncil say its your responsibility.		@ TfL		1018491063579893761			https://twitter.com/baccolini_alan/status/1018491063579893761	
TheTrainTravelr	2018-07-15 08:58	0	0	Police: Car crash in London is traffic accident, not terror | KRQE News 13 http://bki.me/FSPXhMFa				1018480018513645568			https://twitter.com/TheTrainTravelr/status/1018480018513645568	
ChainTrainGang	2018-07-14 20:51	0	0	Police: Car crash in London is traffic accident, not terror â€“ WSVN 7News | Miami News, Weather, Sports | Fort ... http://bki.me/ZWqB2M8i				1018296974238474245			https://twitter.com/ChainTrainGang/status/1018296974238474245	
FairlessRebecca	2018-07-14 16:54	0	1	It’s busy but moving, well managed by the police and the car parks fine you get 2 hours for shopping so we just had a look around london then came and parked up! You can see and hear the stadium from Tesco				1018237435984142338	1018236059031887874	Juddlinski	https://twitter.com/FairlessRebecca/status/1018237435984142338	
TheTrainTravelr	2018-07-14 09:55	0	0	Police: Car crash in London is traffic accident, not terror | The Seattle Times http://bki.me/yCFBEkEf				1018131767805534208			https://twitter.com/TheTrainTravelr/status/1018131767805534208	
mehreenzahra	2018-07-14 04:40	16	30	Military police boarded # NawazSharif’s flight as it landed from London via Abu Dhabi. Paramilitary Rangers linked arms & battled against Sharif supporters to escort him off the aircraft into a waiting car and then across 200 yards to another small aircraft https://www.theguardian.com/world/2018/jul/13/suicide-bomb-attack-kills-85-and-wounds-100-at-mastung-pakistan-election-rally …			# NawazSharif	1018052663991205888			https://twitter.com/mehreenzahra/status/1018052663991205888	
antroia	2018-07-14 02:49	0	2	Anti-trump protestors at Trafalgar. Political exhibit at The Design Museum. Roads closed off and police escort of black, armored cars. Military helicopters flying over Portobello market. And a nice pint and burger down at the pub. It’s been a great weekend trip to London so far.				1018024617473175552			https://twitter.com/antroia/status/1018024617473175552	
RailRider_	2018-07-14 02:34	0	0	Police: Car Crash in London Is Traffic Accident, Not Terror - Bloomberg http://f1h.me/veSVtkTA				1018020885624696832			https://twitter.com/RailRider_/status/1018020885624696832	
ChainTrainGang	2018-07-13 23:23	0	0	Police: Car crash in London is traffic accident, not terror http://bki.me/2utJ3Anh				1017972799514832896			https://twitter.com/ChainTrainGang/status/1017972799514832896	
exploredogs	2018-07-13 23:03	0	3	Police Officers In Camden, London Offering ‘Free Car Ventilation Services’ For Those Who Lock Their Dogs In Their Car https://cstu.io/1fc440 # Puppy # CutePuppy # CuteDogs # Dogs # CutePuppies			# Puppy # CutePuppy # CuteDogs # Dogs # CutePuppies	1017967741414887424			https://twitter.com/exploredogs/status/1017967741414887424	
RailRider_	2018-07-13 22:41	0	0	Police: Car crash in London is traffic accident, not terror | KRQE News 13 http://f1h.me/FSPXhMFa				1017962301666856960			https://twitter.com/RailRider_/status/1017962301666856960	
ChainTrainGang	2018-07-13 22:04	0	0	Police: Car Crash in London Is Traffic Accident, Not Terror - Bloomberg http://bki.me/veSVtkTA				1017953069257101313			https://twitter.com/ChainTrainGang/status/1017953069257101313	
Live4Trains	2018-07-13 14:11	0	0	Police: Car crash in London is traffic accident, not terror | KRQE News 13 http://bki.me/FSPXhMFa				1017834036880920577			https://twitter.com/Live4Trains/status/1017834036880920577	
TheTrainTracker	2018-07-13 13:17	0	0	London police say car crash that hurt 11 outside Natural History Museum not a terror attack | Toronto Star http://bx1.me/N2ammuqa				1017820395284631552			https://twitter.com/TheTrainTracker/status/1017820395284631552	
makesmilk	2018-07-13 12:10	1	21	Trump motorcade zooms past us in North London. Either that or a rrrreally big family who like many black cars and need police motorcycles. All children in the car had permission to swear.				1017803345581441024			https://twitter.com/makesmilk/status/1017803345581441024	
01_nasir	2018-07-13 10:22	0	0	@ Kashifabbasiary @ arsched @ WaseemBadami Salaam the whole team ,I am watching your programm here in London, lease sho the clip when Mariam threw the pen on the floor and lady police officer picked it up and gave it to Mariam and she threw it back in the car with orogant smile.		@ Kashifabbasiary @ arsched @ WaseemBadami		1017776167921815552			https://twitter.com/01_nasir/status/1017776167921815552	
AlastairMckenzi	2018-07-13 09:24	1	2	@ metpoliceuk # police car holds up traffic on busy London street to tell cyclist (who is legally allowed to be there) that he should be in a cycle lane. Shocking attitude. # shouldknowbetter # space4cycling		@ metpoliceuk	# police # shouldknowbetter # space4cycling	1017761731291111429			https://twitter.com/AlastairMckenzi/status/1017761731291111429	
JohnFavere	2018-07-13 09:03	1	1	PRESIDENT TRUMP IN 2015 A POLICE OFFICER FROM WIND GAP PENNSYLVANIA CONTACTED A FBI AGENT IN NEW YORK CITY REGARDING FETO GULEN AN A LONDON GOLDMAN SACS EMPLOYEE I WAS TOLD THAT FETO GULENS PEOPLE SURROUND THE POLICE CAR WHEN THEY HEARD HE WAS PULLED OVER HAD 5 IDS ON HAND pic.twitter.com/kWPfLFic0w				1017756327983108097			https://twitter.com/JohnFavere/status/1017756327983108097	https://pbs.twimg.com/media/Dh_L_KEW0AIe1N9.jpg
SophieFelton	2018-07-13 07:21	0	1	En route to London. Driving from Burford to Oxford Parkwayslong the A40 (stupid trains) saw 8 unmarked police cars driving on full blues in the other direction. Possibly towards Woodstock. Possibly unrelated. Odd! Looking forward to today! # UKtrumpvisit # london # stoptrumppic.twitter.com/O0aVapqu2A			# UKtrumpvisit # london # stoptrumppic	1017730835187978241			https://twitter.com/SophieFelton/status/1017730835187978241	https://pbs.twimg.com/media/Dh-0y8qXcAEgdDP.jpg
RailwayMinister	2018-07-13 07:13	0	0	Police: Car Crash In London Is Traffic Accident, Not Terror | Yeshiva World News http://urq.me/Is9OuCby				1017728622583480320			https://twitter.com/RailwayMinister/status/1017728622583480320	
ammaraYounas_TG	2018-07-13 06:30	7	3	Fahad Malik studied law in London was assassinated on the night of August 14, last year, in Islamabad by gangstes. He was leaving Shalimar police station after duty, acting for a client, when his car was stopped and he was showered with bullets. # FahadsKillersToATCpic.twitter.com/VZDhqbwvU5			# FahadsKillersToATCpic	1017717820988252160			https://twitter.com/ammaraYounas_TG/status/1017717820988252160	https://pbs.twimg.com/media/Dh-o6HxWkAEJV5Z.jpg
Fayyaz38365143	2018-07-13 05:35	0	1	@ arifhameed15. Maryam's son has been arrested by the London Police for hitting someone..Yousef Raza Gillani's son kiiled two young Guys in a Car Accident ..No Justice was provided to them. See the difference Bhatti Sb.		@ arifhameed15		1017704152221114368			https://twitter.com/Fayyaz38365143/status/1017704152221114368	
conner_moxham	2018-07-13 05:20	0	0	A car is a weapon. Heh, in London, they're banning sharp cutting knives because they're weapons. I'm not allowed to walk around with a stick or club because it's a weapon. How about we just not take away people's stuff until they've given us cause to. That being said, meth pipe				1017700299002089473	1017495729051320320	young2theend jsnfwlr	https://twitter.com/conner_moxham/status/1017700299002089473	https://abs.twimg.com/emoji/v2/72x72/1f61c.png
historikat	2018-07-13 02:38	0	1	Although given the numbers of police cars on the M6 yesterday (presumably all heading to London) probably best I stopped when I did!				1017659547165560833	1017518582341742592	dr_hick	https://twitter.com/historikat/status/1017659547165560833	
EnemiesShadow	2018-07-12 23:17	0	0	Visting london next week havent been in years see some police cars while im about hopefully and @ MetTaskforce Dog units if any want to visit me		@ MetTaskforce		1017609031639339009			https://twitter.com/EnemiesShadow/status/1017609031639339009	https://pbs.twimg.com/profile_images/871139333952208898/gprVFxFZ_normal.jpg
ChainTrainGang	2018-07-12 19:18	0	0	Police: Car crash in London is traffic accident, not terror | The Spokesman-Review http://bki.me/HmdXuqzO				1017548809314988034			https://twitter.com/ChainTrainGang/status/1017548809314988034	
ladytereska	2018-07-12 17:26	0	1	I did this tour yesterday it’s London police cars are normal my broad beans got pulled weeks ago it’s all abou the purple beans now pic.twitter.com/HTzdzhjWPX				1017520596761104384	1017507862342496256	CliffSimpson6	https://twitter.com/ladytereska/status/1017520596761104384	https://abs.twimg.com/emoji/v2/72x72/1f602.png
memoriapop	2018-07-12 12:50	1	7	9 discos que este año cumplen 40 de haber sido editados. *Grease- OST *Andy Gibb- Shadow dancing *The Police-Outlandos d'Amour *The Cars- The Cars *Wings-London Town *Chic-C'est Chic *Barry Manilow-Even Now *Billy Joel-52nd Street *The Who-Who are you. pic.twitter.com/q2giOORKFt				1017451099794505728			https://twitter.com/memoriapop/status/1017451099794505728	https://pbs.twimg.com/media/Dh61Ip6UYAANx4L.jpg