username	date	retweets	favorites	text	geo	mentions	hashtags	tweetid	conversationid	replyto	permalink	imagelink
NainikaKashyap	2018-05-30 19:29	10	8	Anti-Hindus/Pakistanis/Anti-Indians repeat the rubbish you do. # Sweden an many other # European countries have become rape capitals of the world. ReligionOfPeace followers, raping westerners daily/hourly. Over 1 Million girls # raped by Islamic gangshttps://www.independent.co.uk/news/world/europe/sweden-and-denmark-have-highest-number-of-sexual-assaults-in-europe-a6800901.html …			# Sweden # European # raped	1001968868552773633	1000104859264151552	SRALoholic Risk_up_108 indiatvnews	https://twitter.com/NainikaKashyap/status/1001968868552773633	
bookofkatherine	2018-05-30 15:16	0	0	Six years ago Migrants were hunting underage girls to rape them. Now, the media doesn't even report on the gangs, which don't even lure- they just attack. Sweden is even running TV ads to "accept" Muslim Migrants- not warning it's become #1 in world rape. https://youtu.be/LqOydLrpqGE				1001905135679950849			https://twitter.com/bookofkatherine/status/1001905135679950849	
dawsonmalibu	2018-05-30 10:54	0	0	@ KTHopkins PC to keep rape of girls by gangs of migrants and illegal aliens a secret! How low will UK leftist Fascists go? Same problem throughout Europe. Sweden is the rape capital of Europe. When are Euros going to fight back vs "multiculturalism" invasion, rape & murder??!!		@ KTHopkins		1001839260339617792			https://twitter.com/dawsonmalibu/status/1001839260339617792	
AndyCapistrano	2018-05-30 05:52	0	0	Sweden, in its infinite wisdom when it come to Islam, has told girls afraid of rape to lodge a metal spoon in their knickers when entering the country via any airport. This way they will be taken aside and presumably helped to escape t... https://gab.ai/For-Britain/posts/26620815 …				1001763205515915265			https://twitter.com/AndyCapistrano/status/1001763205515915265	
chasesingh_	2018-05-29 19:49	0	1	He’s a misdirection artist. He has said nothing about the thousands of girls that have been sexually abused and murdered by Islamic rape gangs in the UK. Germany, Norway, Sweden, etc are seeing exponential rises in sexual violence committed by Islamic immigrants also. Disgrace.				1001611541073055745	1000718192388558848	MoragHR mehdirhasan HoaxteadR	https://twitter.com/chasesingh_/status/1001611541073055745	
SraaSuominen	2018-05-28 10:17	0	1	"-- if our politicians were to display even a fraction of the courage of those women and girls who refuse to stay silent, then laws will be changed." How activists got Sweden to recognise sex without consent is rape. https://www.amnesty.org/en/latest/news/2018/05/how-activists-got-sweden-to-recognise-that-sex-without-consent-is-rape/?utm_source=twitter&utm_medium=article&utm_term=&utm_campaign=social … # consent # HejaSverige # allavi # metoo			# consent # HejaSverige # allavi # metoo	1001105251460636673			https://twitter.com/SraaSuominen/status/1001105251460636673	https://abs.twimg.com/hashflags/MeToo_v3/MeToo_v3.png
BelottiLiza	2018-05-27 17:25	1	1	Bans Media???Is this something @ SwedishPM agreed to introduce in Sweden Media never write about afghans who rape swedish girls Firedepartments run away from a fire because immigrants are throwing rocks Isn’t that coward Polis the sameSee how the safety of Sweden are cracking https://twitter.com/realalexjones/status/1000846510815371265 …		@ SwedishPM		1000850523136851968			https://twitter.com/BelottiLiza/status/1000850523136851968	https://abs.twimg.com/emoji/v2/72x72/1f4e1.png
LostGuide3	2018-05-25 12:35	0	0	Sweden is stupid af . Swedish rapists be like: Excuse me madam, I'm really horny and you're the only girl around plus you're alone, may I rape you? I'm a law abiding rapist and I asked for your consent. Your fault if you say no. https://twitter.com/PeterSweden7/status/999323072271405059 …				1000052640833769472			https://twitter.com/LostGuide3/status/1000052640833769472	https://abs.twimg.com/emoji/v2/72x72/1f602.png
KudeRaju	2018-05-25 08:55	0	1	just to be clear, Assange was setup (fitup) in Sweden w false malicious accusations of rape. The girls already said Assange never raped . Clinton hate Assange bc Dems blame Assange for helping @ realDonaldTrump win, & tell truth about Hillary. cc @wikileakstaskforce @ KimDotcomhttps://twitter.com/CNN/status/999968342785036288 …		@ realDonaldTrump @ KimDotcomhttps		999997473534820352			https://twitter.com/KudeRaju/status/999997473534820352	https://pbs.twimg.com/media/DeCZ6HYX0AEEbHi.jpg
lucidparanoia	2018-05-25 01:37	0	0	LOL! If he raped a girl in Sweden he would need to be extradited to the Sweden. Why the fuck does the US want him? It's because of rape. How are you this naive?				999887261989720064	999785343627837440	MangoMaCall	https://twitter.com/lucidparanoia/status/999887261989720064	
sinbad_W	2018-05-24 09:55	0	0	How activists got Sweden to recognise that sex without consent is rape | In 2013, Sweden was shaken by a court's decision to acquit three young men accused of raping a 15-year old girl with a wine bottle until she bled. https://www.amnesty.org/en/latest/news/2018/05/how-activists-got-sweden-to-recognise-that-sex-without-consent-is-rape/?utm_source=twitter&utm_medium=article&utm_term=&utm_campaign=social …				999650098995912704			https://twitter.com/sinbad_W/status/999650098995912704	
Navarrebeacher	2018-05-24 09:22	0	0	This was a local city police warning that had a brutal rape of a 17 year old girl and three other recent rapes. Google this Fake News post against a great country of Sweden. Shame				999641747738320897	999323072271405059	PeterSweden7 BoomBustProfits	https://twitter.com/Navarrebeacher/status/999641747738320897	
MarcusVegetable	2018-05-24 09:11	0	0	# dont # touch a # girl in # sweden or u will be # arrested for # rape if i got dat right pic.twitter.com/7jCaBk6DRC			# dont # touch # girl # sweden # arrested # rape	999638943023890432			https://twitter.com/MarcusVegetable/status/999638943023890432	https://abs.twimg.com/emoji/v2/72x72/1f607.png
aawumadbro	2018-05-24 05:26	0	1	This ruling is a trap. In Sweden, Islamic rape gangs have been acquitted of raping grossly underage girls who were too young, afraid, confused, and weak to say no. This is just the Swedes trying to gloss over and nullify their Islamic rape problem.				999582493287170048	999579533987713024	nytimes	https://twitter.com/aawumadbro/status/999582493287170048	
juliettehoope15	2018-05-23 23:53	0	0	Sexig Tjej Fran Svenskafittacom http://go.sexidude.com/r.php?fa&uc=k_t8nt&v=34309917 … www donkey amateur sex videos homemade dog knot stuck in ass free videos webcam hoodfucktapes swedish sex date rape drug suck videos scandinavian girls tube hanna sweden blowjob video				999498546197000193			https://twitter.com/juliettehoope15/status/999498546197000193	
93arcticari	2018-05-23 13:18	0	0	Yes for Sweden. We need more countries that can do it, because lots of people think it's okay to do this without consent. IT'S NOT OKAY, IT'S NEVER OKAY!! girls should never experience rape or sexual violence, it's disgusting that men doesn't care about it				999338766421635074	999338216053444609	zaralarsson	https://twitter.com/93arcticari/status/999338766421635074	
Aditya_RAW007	2018-05-22 16:46	0	0	Yes you are happy with the death of our people, so I too will be happy with the death of your people. Some Wahabi refugees have even started rape with Swedish girls in Sweden Lol				999028629097992192	993374632458838016	HerNameIs_Bea	https://twitter.com/Aditya_RAW007/status/999028629097992192	
MungoWump	2018-05-21 20:41	0	0	UK police say it isn't rape if moslem men are involved. If girls are underage, the Labour party approves of the experience. 40% of voters support Labour. And you think Sweden is sick?				998725526108991488	998693644898131970	PeterSweden7	https://twitter.com/MungoWump/status/998725526108991488	
IBTTFKDmuhammad	2018-05-21 15:31	0	1	A 17yr old # girl[I think in # Sweden] who was being # raped by a # muslim, used # pepperspray on him and got away. When # she # reported the attempted # rape..she was # charged..4using the pepper spray. # Swedish # Danish # Dutch # British # French # Spanish # Scandinavian # European # Europe # EU			# girl # Sweden # raped # muslim # pepperspray # she # reported # rape # charged # Swedish # Danish # Dutch # British # French # Spanish # Scandinavian # European # Europe # EU	998647378855976961	998640335264862208	babyviper101 V_of_Europe	https://twitter.com/IBTTFKDmuhammad/status/998647378855976961	
BMartinovski	2018-05-19 13:45	29	37	A 13 yrs old girl was impregnated by a married 50 years old man. He appeals a rape verdict by claiming he was asleep during the rape. A Court of Appeal cancels the rape verdict, frees him and awards him a monetary compensation for the trouble. # Sweden https://twitter.com/BirroMarcus/status/997568531410677760 …			# Sweden	997896098982309888			https://twitter.com/BMartinovski/status/997896098982309888	
meatheadsucks	2018-05-19 01:03	0	0	Seriously? Sweden has a rape epidemic. England has ha Danny attacks, grooming gangs where they are raping girls, Jews are being attacked on Germany etc				997704258781822976	997699849008107520	RogueGinny	https://twitter.com/meatheadsucks/status/997704258781822976	
55nils	2018-05-14 05:16	0	0	Much more are classified as rape than in no other countries in the world since that. And as you can, 2010 was the same as now, the 160.000 refugees came late 2015. In Sweden an allowed free sex relationship 16 year old boy and 14 year old girl, can classes as rape after 2005.				995956052096114688	986924784033427456	55nils Fiskabein TietoCorp	https://twitter.com/55nils/status/995956052096114688	
daryldime	2018-05-13 07:48	0	1	Well... long before Hillary ran he did rape a girl in Sweden. So I mean, there's that. Not that that would deter a trump supporter such as yourself.				995631992304734208	994051467479736320	SMTM2016 Jimrharv	https://twitter.com/daryldime/status/995631992304734208	
fugazip	2018-05-12 17:55	1	1	She was # Stabbed and burned by two # muslims. One of them had tried to rape 12-year old girl before, and Mireille Knoll reported this to the police. This is just one of many such cases, and there will surely be more in # France, # Germany, # Sweden, # UK as # islam gets stronger there.			# Stabbed # muslims # France # Germany # Sweden # UK # islam	995422233572102144	995412027131777024	Henk_Vertrokken	https://twitter.com/fugazip/status/995422233572102144	
OvTK93zEqUxjtIU	2018-05-12 15:37	0	0	fisting 14 g123t http://sosante.mobi/r.php?uc=k_n1&v=35693235 … bdsm puppy girl fisting sex video 3gp swedish rape videos big tits scandinavian schoolgirls girl fisted by soldiers Bihari big boobs women hd hannah sweden				995387556303900672			https://twitter.com/OvTK93zEqUxjtIU/status/995387556303900672	https://abs.twimg.com/emoji/v2/72x72/1f449.png
epicesquire	2018-05-12 11:15	0	1	This is disgusting! Sweden: School principal claims "Rapists are victims too" after boys gang rape Swedish girl http://www.thegatewaypundit.com/2017/03/sweden-muslim-classmates-gang-rape-14-year-old-girl-remain-school-rapists-victims/ …				995321666237534208			https://twitter.com/epicesquire/status/995321666237534208	
EuniceTrump	2018-05-12 10:47	0	0	Sweden: Police refuse to publish description of three men who raped ten-year-old girl https://wp.me/p4hgqZ-Bus via @ jihadwatchRS @ feminists # feminist # metoo # rape		@ jihadwatchRS @ feminists	# feminist # metoo # rape	995314635673931777			https://twitter.com/EuniceTrump/status/995314635673931777	https://abs.twimg.com/hashflags/MeToo_v3/MeToo_v3.png
gnewqit	2018-05-11 16:31	0	0	So Sweden is the new place to go to rape girls? Replacing Thailand?				995038825268248576	994565540613120001	PrisonPlanet	https://twitter.com/gnewqit/status/995038825268248576	
deborahmays141	2018-05-11 12:37	0	0	Sexig Svensk Mamma http://sosante.mobi/r.php?uc=k_n1&v=35575653 … pic grandpa amateur gay videos beth chapman homemade sex tape webcamporn swedish rape video humpdate pics girls scandinavian schoolgirls porn a videos of naic pussy sweden				994979715571208194			https://twitter.com/deborahmays141/status/994979715571208194	https://abs.twimg.com/emoji/v2/72x72/1f449.png
Dannycrosby5	2018-05-11 08:52	0	0	I'm thoroughly convinced the judiciary in Sweden is compromised!! There is no other explanation!! Afghan migrants answer hospitality of Swedish girl with brutal rape https://voiceofeurope.com/2018/05/afghan-migrants-answer-hospitality-of-swedish-girl-with-brutal-rape/#.WvWPisrn5Xc.twitter …				994923135509000195			https://twitter.com/Dannycrosby5/status/994923135509000195	
BSpiritu	2018-05-10 09:42	0	1	2 months and 60 detention for 2 rapist for the rape of a 16 year old girl. Sweden claims to be a feminist/equal rights cointry, yet they treat their female victims as secons rate citizens with these kind of degrating low pubishments. https://www.infowars.com/sweden-afghan-migrant-who-raped-16-year-old-girl-gets-just-two-months-jail/ …				994573509245448193			https://twitter.com/BSpiritu/status/994573509245448193	
BMartinovski	2018-05-10 09:21	35	46	Gang rape attack of girl, her body left with blue marks after the rape as she had to fight for her life. 2 months prison and no deportation. Shame on you, Lund district court! # Sweden # val2018https://twitter.com/GronaSagverk/status/994546704996294656 …			# Sweden # val2018https	994568032822480896			https://twitter.com/BMartinovski/status/994568032822480896	
mer1781	2018-05-10 07:41	0	1	Two adult Muslim men who posed as teenagers rape Swedish girl who showed them hospitality. Swedish court sentences them to 6 months. Doesn’t deport them # Sweden # ReligionofPeace https://voiceofeurope.com/2018/05/afghan-migrants-answer-hospitality-of-swedish-girl-with-brutal-rape/ …			# Sweden # ReligionofPeace	994543002717736961			https://twitter.com/mer1781/status/994543002717736961	
Textualsatisfac	2018-05-10 04:43	0	0	A 16 yo Swedish girl chats online with an Afghani boy. Whilst the parents r away she brings him and his mate over.They rape her.What kind of parents let their teenage girl chat with Afghan boys and then leave her HOME ALONE 2 have them over?? This is the sick state of Sweden atm.				994498198025719808			https://twitter.com/Textualsatisfac/status/994498198025719808	https://pbs.twimg.com/profile_images/1000357277772247040/j5KvKnxf_normal.jpg
DanielLorenzen1	2018-07-23 14:31	0	0	Alrighty boys and girls.. i've booked my train ticket to Sweden, so Pre Copencon is a GO!!				1021462741247291395			https://twitter.com/DanielLorenzen1/status/1021462741247291395	
1989BradGilbert	2018-07-23 14:28	0	0	Be careful now in Toronto. Trudeau's chickens are starting to hatch.... 10 year old precious girl KILLED and another precious 18 year old killed last night. Trudeau likes what's happened in Germany & Sweden. Too bad they don't follow Poland, Croatia, Hungary, Slovakia.				1021461981528805376	1021413367854948352	rogerscup	https://twitter.com/1989BradGilbert/status/1021461981528805376	
ErikaMo68435810	2018-07-23 14:19	0	0	http://soscarsubdh.ga/jsQRnpo teeny strip group kissing latina naughty america compilation girls out west porno mistress dildo masturbation oral sex videos the habib show mexican west playboy tv cum porn 3some life selector girl huge cock couples sweden				1021459718844440576			https://twitter.com/ErikaMo68435810/status/1021459718844440576	
RobServos	2018-07-23 14:15	0	0	http://yacopiewi.ml/IMHqUUy latina leg show online party hardcore porno sex tits porn stream ass asian young oldje still stockings video online hardcore female joymii girls club seventeen escort chat bbw bisexual download panties youporn nympho sweden				1021458921997905920			https://twitter.com/RobServos/status/1021458921997905920	
WinklerSkip	2018-07-23 14:15	0	0	http://sabiatiodw.ml/fY9PO2O local younger teenage facial xxx girls out of the family squirt korean porn japanhdv femdom lesbian oldje galleries babe female agent chat small tits from wife lover wet and puffy pics matures videos sex puba porno sweden				1021458911298236417			https://twitter.com/WinklerSkip/status/1021458911298236417	
JoeyBreaux2	2018-07-23 13:58	0	0	http://zopeerfisyf.ga/Ye84laj porn upload best gonzo video oldje fat cumpilations fake hospital yanks babe white hot teens hd after porno stockings bikini pictures hookups girl fetish sex anal drunk sex orgy massage rooms xvideos free fetish pov sweden				1021454586765238272			https://twitter.com/JoeyBreaux2/status/1021454586765238272	
DawnDykstra4	2018-07-23 13:51	0	0	http://deconconsox.ga/88DhU5v porn oldje 2k dogfart network sex reality kings xxx playboy tv photos small tits movies porno movies older brazzers hot teens hd matures face sitting pornstars woman orgasm at free out of the family slime wave sweden				1021452677111218176			https://twitter.com/DawnDykstra4/status/1021452677111218176	
Brittan49007287	2018-07-23 13:50	0	0	http://tetauimuu.ga/wvwSAqQ pics model west hot teens hd licking women handjob movies evil angel porno small tits sexo porn older dp 3gp games hot g vibe fat bollywood nudes hd pov creampie huge cock german goo girls sex erotic white sweden				1021452544692899842			https://twitter.com/Brittan49007287/status/1021452544692899842	
TuasonRich	2018-07-23 13:49	0	0	http://noticktricsa.ml/884dbeE big tits gb younger dating else someone adult girl uk girls girlfriend services fr teen beautiful for free california casual babe website single offenbach sex real wants nearby interracial tinder year old online sweden				1021452159630626816			https://twitter.com/TuasonRich/status/1021452159630626816	
LoriKhan19	2018-07-23 13:46	0	0	http://notehbusll.ga/3X04iQQ teen watch babe big tit photos girls pussy dating women girl buddy teenage advice blonde over 18 sex nearby newfoundland online 18+ stream tips agency solihull soul mate charm seeking snapchat interracial north sweden				1021451562613235712			https://twitter.com/LoriKhan19/status/1021451562613235712	
KyleFreedman3	2018-07-23 13:45	0	0	http://miceitiatv.ml/xIv3U0j serious young sweet dates girl matures teen xxx sabadell cam ladies euro charm swinger friends look for advice sex mate iphone new online lonely dating woman new york uk big tits europe us girls websites club sweden				1021451211885686786			https://twitter.com/KyleFreedman3/status/1021451211885686786	
E9ester	2018-07-23 13:44	0	0	Am adăugat un videoclip la o listă de redare pe @ YouTube, http://youtu.be/j7PgOcJNhjo?a Nightcore - Girl From Sweden		@ YouTube		1021450970033737730			https://twitter.com/E9ester/status/1021450970033737730	
EricLyles11	2018-07-23 13:44	0	0	http://gisegioqm.ml/IcQ7IEX wants boyfriend girl 18+ england teen erotic black german soulmate us maine girls wife sex hook up christian ladies dates free online america dating connection beautiful nevada hookups just cougar soul mate sweden				1021450947678130177			https://twitter.com/EricLyles11/status/1021450947678130177	
warner_rahman	2018-07-23 13:29	0	0	http://bucentgeofs.ga/EzS4gEf wanting europe passion ebony show top women app services ladies teen english england carmarthenshire asian to dating redhead new flirt matures girls guide manitoba online hookup girl free wife match au tips sex sweden				1021447279738318849			https://twitter.com/warner_rahman/status/1021447279738318849	
Stephan36898627	2018-07-23 13:29	0	0	http://neabmartj.ga/G3lQQ8T college teen service memphis whatsapp best marry naked america matchmaking hookups at escort wants au soul mate younger show online german girls girl chat american girlfriend labrador chatroom christian dating sex sweden				1021447260901650434			https://twitter.com/Stephan36898627/status/1021447260901650434	
MaryBel72379298	2018-07-23 13:29	0	0	http://pemisumme.ga/Slh9yeJ agencies serious 24\7 dating web swinger sweet girls big tit friend online chatroom fr college without good tips latina iphone nude montana teenage bbw teen vigo sex girl snapchat singles eastern chicks affair sweden				1021447254748647424			https://twitter.com/MaryBel72379298/status/1021447254748647424	
NatePurdon	2018-07-23 13:21	0	0	http://sueadmabv.ml/xZurfXf top latina casual eu no site partners cougar nz mate sex girl chicks dating photo teen webcam us girls mom maryland younger english charm guide online rotherham euro affair 24\7 stream wife hooking up interested sweden				1021445225011589120			https://twitter.com/NatePurdon/status/1021445225011589120	
SandraG61117774	2018-07-23 13:16	0	0	http://gutraceswh.ml/SPMYBk9 eleganxia movie dapink cumpilations sex glamour pornstar dolls porn porno photos pictures for porn female korean stream cum ddf network 2k huge cock 4k party hardcore dane jones couple reality kings redtube girls sweden				1021444040221429760			https://twitter.com/SandraG61117774/status/1021444040221429760	
Bsj6GDkIfXHEfBH	2018-07-23 13:15	0	0	http://keroanieti.ml/YRrfjYN babe bisexual porno group strip 4k sticky redtube latin my dirty hobby chick pass network sex couple sexo sexual perv city movies outdoor pregnant before women leg show online porno party hardcore porn stockings wet sweden				1021443673253433345			https://twitter.com/Bsj6GDkIfXHEfBH/status/1021443673253433345	
Stephan36898627	2018-07-23 13:12	0	0	http://neabmartj.ga/rxAZg6m kansas college xxx pussy asian dating milf chicks online new jersey photo nude teen girls relation agency younger female matches sex top lifetime singles recommended west for free big tits christian girl date sweden				1021442977019899906			https://twitter.com/Stephan36898627/status/1021442977019899906	
MikeHen49222083	2018-07-23 13:12	0	0	http://bitremabnc.ml/0L9NTjL perv city euro babe facials latina hdv pass naughty fake agent squirt girls videos dagfs sex chick pass network couple porn nubile films kissing escort porno leg show online together live deep throat wicked pictures sweden				1021442956023255043			https://twitter.com/MikeHen49222083/status/1021442956023255043	
AbilleJoanna	2018-07-23 13:10	0	0	http://ranicmorrwl.ml/3fud0Tv video private photos reality kings escort love home porn blowjob group upskirt of dildo cam casual blonde dp casting sex korean black small huge boobs pornhub dagfs ebony fisting compilation porno porn teens xvideo sweden				1021442327515226113			https://twitter.com/AbilleJoanna/status/1021442327515226113	
Nichola31405874	2018-07-23 13:09	0	0	http://hariorisfh.ga/4FflOw2 nearby college hookups fr arizona soulmate online girls top big tit escort christchurch dating mature by teen year old someone affair over 18 matches girl ladies casual eastern sex hook up girlfriend young french sweden				1021442172707581954			https://twitter.com/Nichola31405874/status/1021442172707581954	
HernandezSuki	2018-07-23 13:03	0	0	http://zopeerfisyf.ml/Uc1WIup young 4k casting compilation porn teen matures photos from tits sexual movie sex beauty teenage perfect gonzo pregnant perv city porno avi orgasm pics nippon hd xvideos bonga cams outdoor girls out west cock casual sweden				1021440620693475328			https://twitter.com/HernandezSuki/status/1021440620693475328	
CraigRingle	2018-07-23 13:00	0	0	http://pounclamyt.ml/718Hh7Z relation find european partner dating teen matchmaking milf girls dunedin college latin city mecklenburg nearby woman girl sex using online relationship britain apps moms watch best lover tips date england near me sweden				1021439826179043330			https://twitter.com/CraigRingle/status/1021439826179043330	
MEDlClNELWT	2018-07-23 12:59	0	1	adib if ure confused i was in an online friend gc and there was this girl from sweden and she ended up confessing to my bicurious ass abt how she liked me and we dated for like a month or something idk bro long distance online rs are hard but we skyped every day and shit				1021439634406903810	1021358044972658689	mesmeric_malik Yshudaitelya	https://twitter.com/MEDlClNELWT/status/1021439634406903810	
TaniaSm47951072	2018-07-23 12:53	0	0	http://bomasineu.ml/PIZFW06 europe single girl meetme young teen show horny buddy rhineland lover looking for look for mature flirt big tit asia younger for free new dating online near by girls nîmes hook up wives agencies sex near me nz sweden				1021438061027225600			https://twitter.com/TaniaSm47951072/status/1021438061027225600	
Sabrina55639437	2018-07-23 12:47	0	0	http://sueadmabv.ga/iRSFFEK women girl online people ladies mom babe sex recommended heart chatrooms girlfriend girls near oregon group teenage matches apps mississauga cute milfs near by uk dating teen nearby older au horny german and sweden				1021436663308963846			https://twitter.com/Sabrina55639437/status/1021436663308963846	
DanielVaquera8	2018-07-23 12:47	0	0	http://woloyteod.ml/nAE4KDa femdom club seventeen home cumpilation lesbians threesome teen photos galleries pornotube porno hardcore older sex porn slime wave movie bbw pornhub fake hospital dagfs nympho private russian with sexy girls out west sweden				1021436577065652224			https://twitter.com/DanielVaquera8/status/1021436577065652224	
AbilleJoanna	2018-07-23 12:46	0	0	http://ranicmorrwl.ml/9sElKMr strip ebony jim slip shaved of brunette masturbation 21sextury games women naughty chat face sitting leg show online double penetration sex deep throat porn nympho bondage lesb porno erotic videos strapon iphone sweden				1021436333338910721			https://twitter.com/AbilleJoanna/status/1021436333338910721	
KIMBFALCONE	2018-07-23 12:45	0	1	Was listening to a girl from Sweden the other day saying they are socialists but there freedoms aren’t fucked with. We need to start taking care of our citizens. Let’s rip the band aid off and do it. When bush blew the economy you ripped the band aid on us and no one cared. 1/				1021436256042070016	1021132108381683712	Comey	https://twitter.com/KIMBFALCONE/status/1021436256042070016	
