username	date	retweets	favorites	text	geo	mentions	hashtags	tweetid	conversationid	replyto	permalink	imagelink
Benjaminnoel16	2018-06-23 21:14	0	0	I liked a @ YouTube video http://youtu.be/5Jl8fhTeNLw?a Very shocking car accident compilation. Deaths on road 2017 Подборка ДТП		@ YouTube		1010692497285308416			https://twitter.com/Benjaminnoel16/status/1010692497285308416	
FlipTvKenya	2018-06-23 07:40	0	0	BREAKING DIAMOND PLATNUMZ CHEATS DEATH IN A ROAD ACCIDENT: http://youtu.be/5kRB_-SIwqQ?a via @ YouTube		@ YouTube		1010487820358705152			https://twitter.com/FlipTvKenya/status/1010487820358705152	https://abs.twimg.com/emoji/v2/72x72/1f525.png
FlipTvKenya	2018-06-23 07:37	0	0	I added a video to a @ YouTube playlist http://youtu.be/5kRB_-SIwqQ?a BREAKING DIAMOND PLATNUMZ CHEATS DEATH IN A ROAD ACCIDENT		@ YouTube		1010487019288526848			https://twitter.com/FlipTvKenya/status/1010487019288526848	https://abs.twimg.com/emoji/v2/72x72/1f525.png
kacie83	2018-06-22 23:39	0	1	It’s so sketch to me. I do believe Max’s death was some sort of accident but Rebecca’s .. no way! How they can morally come up with that conclusion baffles me. Would someone really take the time to do elaborate knots just to end their life & NAKED, pleaseSo many questions				1010366682089443329	1010352994003705856	KendallRaeOnYT YouTube	https://twitter.com/kacie83/status/1010366682089443329	https://abs.twimg.com/emoji/v2/72x72/1f914.png
sdfollow2	2018-06-22 13:35	0	0	I liked a @ YouTube video http://youtu.be/_VK5rr81OGw?a omg! live accident!4 persons spot death!pokhara to kathmandu#episode 45		@ YouTube		1010214787098271745			https://twitter.com/sdfollow2/status/1010214787098271745	
RenegadeBad_Dog	2018-06-22 13:10	0	0	I was involved in a near Death accident.: http://youtu.be/nyXrxZphk28?a via @ YouTube		@ YouTube		1010208319439560704			https://twitter.com/RenegadeBad_Dog/status/1010208319439560704	
bbnnewshyd	2018-06-22 09:06	0	0	I added a video to a @ YouTube playlist http://youtu.be/IaOk6G2qltQ?a Train Accident 1 person spot death At Mailardevpally | Ranga Reddy		@ YouTube		1010147059142406144			https://twitter.com/bbnnewshyd/status/1010147059142406144	
bbnnewshyd	2018-06-22 09:06	0	0	I added a video to a @ YouTube playlist http://youtu.be/i6lNGq_p-lw?a Road Accident 2 Person Spot Death At Suncity Opp | Under Narsingi PS		@ YouTube		1010147058941079552			https://twitter.com/bbnnewshyd/status/1010147058941079552	
bbnnewshyd	2018-06-22 09:06	0	0	I added a video to a @ YouTube playlist http://youtu.be/daBqnELcfuA?a Road Accident 2 person spot death At pahadi shareef p's limit |		@ YouTube		1010147058806935552			https://twitter.com/bbnnewshyd/status/1010147058806935552	
MasonValdovinos	2018-06-21 20:01	0	0	I liked a @ YouTube video http://youtu.be/ttEZD8xJyfo?a 127 Pet unexpected accident death l Pet Sudden death- sudden accidental death or		@ YouTube		1009949563275370502			https://twitter.com/MasonValdovinos/status/1009949563275370502	
stingnewz	2018-06-21 14:10	0	0	21 06 18 MALDA ACCIDENT DEATH BITE LOCAL PUBLIC: http://youtu.be/-rpweE5AEMM?a via @ YouTube		@ YouTube		1009861197712240647			https://twitter.com/stingnewz/status/1009861197712240647	
stingnewz	2018-06-21 14:06	0	0	21 06 18 MALDA GAZOLE ACCIDENT DEATH BITE BISWAJIT BISWAS PUBLIC: http://youtu.be/S5VboTiVdtc?a via @ YouTube		@ YouTube		1009860216089972736			https://twitter.com/stingnewz/status/1009860216089972736	
WhealthByRS	2018-06-21 00:16	0	0	2018 Near Death Moments - Accidents: http://youtu.be/HaXL5KeO0oI?a via @ YouTube		@ YouTube		1009651159404023809			https://twitter.com/WhealthByRS/status/1009651159404023809	
Ferts54	2018-06-20 22:57	0	0	Me ha gustado un vídeo de @ YouTube (http://youtu.be/VuSuDDgmM2A?a - Near Death GoPro Dash Cam Video Highway Accident).		@ YouTube		1009631349265846272			https://twitter.com/Ferts54/status/1009631349265846272	
KinyajuiEliud	2018-06-20 10:35	0	0	I liked a @ YouTube video http://youtu.be/gz2Ckr9GPvo?a Was Diana's Death Really an Accident? | Princess Diana: Tragedy or Treason?		@ YouTube		1009444520348577792			https://twitter.com/KinyajuiEliud/status/1009444520348577792	
TechnicalGyan15	2018-06-20 05:23	0	0	Sour bazar truck vs smoth girl /accident/ spot death/ ।Technical Gyan । https://youtu.be/WujLoa04Dj8 via @ YouTube		@ YouTube		1009366205390413824			https://twitter.com/TechnicalGyan15/status/1009366205390413824	https://abs.twimg.com/emoji/v2/72x72/1f629.png
PariyarSaugat	2018-06-19 11:02	0	0	omg! live accident!4 persons spot death!pokhara to kathmandu#episode 45: http://youtu.be/_VK5rr81OGw?a via @ YouTube		@ YouTube		1009088929050619906			https://twitter.com/PariyarSaugat/status/1009088929050619906	
PariyarSaugat	2018-06-18 11:11	0	0	omg! spot death accident#pokhara to kathmandu#episode 45: http://youtu.be/wuRflESMNCE?a via @ YouTube		@ YouTube		1008728952800792576			https://twitter.com/PariyarSaugat/status/1008728952800792576	
fumihiko1214	2018-06-17 02:12	0	1	Bus Accident In Bolivia ( Bolivia's death road swallows a bus ) https://youtu.be/EuDZ0o0uXfk @ YouTubeより デスロ一ド (閲覧注意) 世界のデスロ一ド top5 に入る ボリビアのバス。 安全に渡り切ったように見えるが 実際は落ちてしまう、 TVでは放送しない動画。		@ YouTubeより		1008230999803621376			https://twitter.com/fumihiko1214/status/1008230999803621376	