username	date	retweets	favorites	text	geo	mentions	hashtags	tweetid	conversationid	replyto	permalink	imagelink
tcmfootballtips	2018-07-21 08:39	0	0	SG .. (WIN & BTTS) Treble @22/1 ..... small stake only .... Ostersunds & Yes Fc Honka & Yes Atlanta Utd & Yes *Games in ... Sweden, Finland, USA.				1020649532013645824			https://twitter.com/tcmfootballtips/status/1020649532013645824	
Joan1Elizabe	2018-07-21 06:55	0	0	watch https://asianmilfporno.com/video/sharing-cuckold-hot-milf-wife/?bust=433 … asian milf porn russian british swedish norsk finnish german italian norwegian norway czech danish latina denmark australian swiss hd sweden finland aussie french xxx sex nsfw				1020623328191696896			https://twitter.com/Joan1Elizabe/status/1020623328191696896	https://abs.twimg.com/emoji/v2/72x72/23ec.png
dayton_musicmen	2018-07-21 00:55	0	2	1/2: While we await the official roster to be announced for Sweden & Finland, the US & Canada have announced their players for the 2018 World Juniors Summer Showcase. Dayton is proud to have 8 players representing the USA and Canada...				1020532712355115008			https://twitter.com/dayton_musicmen/status/1020532712355115008	
RufinoJimenez6	2018-07-20 21:01	0	1	Actually look at Denmark, Sweden, Finland, New Zeland, Ireland, France, Belgium. Socialist democracy’s are very different than socialist dictatorships.				1020473736397492224	1020462862504873984	LucMatte9 FoxNews SenSanders	https://twitter.com/RufinoJimenez6/status/1020473736397492224	
saoirse91	2018-07-20 19:56	0	3	In Sweden & Finland, McDonalds has the McVegan w a special vegan mayo. & the fries are vegan here, too. In January, McD announced that the McVegan is doing so well that it will be a permanent menu item, so should be coming to more countries soon :)				1020457571277209601	1020400379270389760	rewildheart	https://twitter.com/saoirse91/status/1020457571277209601	
mattyglesias	2018-07-20 19:49	4	48	The Norwegian case is best known but they have state-owned enterprises in Sweden & Finland and even the neoliberal shills in Denmark. pic.twitter.com/hg0sU6JCBP				1020455670280347649	1020454315859808256		https://twitter.com/mattyglesias/status/1020455670280347649	https://pbs.twimg.com/media/DiljBD5UYAASWX1.jpg
timteachtweet	2018-07-20 19:49	0	0	We are not Greece. Nor is Germany, Sweden, Finland, Denmark, France, Belgium, the Netherlands or most other member states. Which shows countries in the EU make their own destinies.				1020455624117837824	1020271401591287808	georgen1967 KenSmith2307	https://twitter.com/timteachtweet/status/1020455624117837824	
mjdwaring	2018-07-20 16:26	4	21	As announced in this months @ TGOMagazine the next edition has a special Scandinavian supplement, I have the privilege of being the guest editor. Great features by TGO regulars but some new contributors too with tales of big trips from across Sweden, Finland and Norway. pic.twitter.com/gBWev5Z7Qn		@ TGOMagazine		1020404582856486913			https://twitter.com/mjdwaring/status/1020404582856486913	https://pbs.twimg.com/media/Dik0iR6X0AIWvLC.jpg
ArcticLawyer	2018-07-20 15:53	1	1	Just in case anybody was still wondering if # climatechange is real: visit the # Arctic. Bring firefighting equipment. Thanks. # ForestFire # HeatWave2018 # Norway # Sweden # Finlandhttps://twitter.com/Nordic_News/status/1020395723777544192 …			# climatechange # Arctic # ForestFire # HeatWave2018 # Norway # Sweden # Finlandhttps	1020396294592958470			https://twitter.com/ArcticLawyer/status/1020396294592958470	
preferdrummers	2018-07-20 13:37	0	0	If you could travel anywhere, where would you go and why? — Northern Europe (Sweden, Finland, Norway, Denmark, Latvia, Estonia, Lithuania) and Iceland becaus... https://curiouscat.me/adayofvals/post/577766078?1532108265 …				1020362135652663302			https://twitter.com/preferdrummers/status/1020362135652663302	
tromarqui	2018-07-20 12:47	2	2	Darrera setmana. Extrems Spain-Sweden-Finland. pic.twitter.com/kOUwFaEfHj				1020349532348067840			https://twitter.com/tromarqui/status/1020349532348067840	https://pbs.twimg.com/media/DikCepfXUAE54kF.jpg
RusiAlpo	2018-07-20 12:20	0	0	Indeed. Germany failed and Sweden & Finland believed in the integration of Russia. One example. The Northern dimension of the EU was wrongly re-directed by Prime Minister Lipponen to become the "bridge" EU&R ,although the original idea was to strengthen ND of the EU. Money lost.				1020342609808691201	1020278135512805381	AuraSalla EdwardGLuce	https://twitter.com/RusiAlpo/status/1020342609808691201	
ReverseVending	2018-07-20 12:13	0	1	Our UK clients have access to 1500 + trained Reverse Vending installation and service engineers. The engineers are trained at working in # DepositReturnschemes , we have parts hubs throughout the UK . We have offices in Norway, Sweden,Finland & London # DepositReturnpic.twitter.com/VEUqonrnSW			# DepositReturnschemes # DepositReturnpic	1020340943877263368			https://twitter.com/ReverseVending/status/1020340943877263368	https://abs.twimg.com/emoji/v2/72x72/ae.png
KofiAnkomah8	2018-07-20 12:06	0	0	Germany, Sweden, Finland, Greece, France, Belgium, the UK, Netherlands etc. also don’t forget that these countries have inheritance, gift, property taxes just to mention a few.				1020339073821659136	1020087001952014336	Citizen_Medin GodfredOT	https://twitter.com/KofiAnkomah8/status/1020339073821659136	
RSlack60	2018-07-20 11:34	0	0	Not totally but it is the best available in the short term. My guess would be that Sweden, Finland and Denmark would join us leading to the break up of the EU				1020331130996736001	1020257499033808897	mwarne	https://twitter.com/RSlack60/status/1020331130996736001	
adamckolasinski	2018-07-20 11:33	0	2	Bullshit. How did South Korea industrialize? Norway? Sweden? Finland? Taiwan? German only acquired colonies AFTER it had industrialized.				1020330891720241152	1020001327496261634	itsbirdemic coldxman	https://twitter.com/adamckolasinski/status/1020330891720241152	
wdevoe	2018-07-20 09:39	0	0	Norway. Sweden. Finland. Denmark. Germany. France. United Kingdom. Ireland. Those are all democratic socialist countries. And there’s one more no one likes to talk about: United States. Pure socialism and pure communism don’t really work, but no one is really trying anymore.				1020302124985417728	1020128662601912321	withrowgw	https://twitter.com/wdevoe/status/1020302124985417728	
IsabellaLovin	2018-07-20 08:32	103	103	Sweden, Finland, Norway. An intense heat dome has swelled over Scandinavia, pushing temperatures more than 20 degrees above normal and spurring some of the region’s hottest weather ever recorded. # climatehttps://www.washingtonpost.com/news/capital-weather-gang/wp/2018/07/17/scorching-scandinavia-record-breaking-heat-hits-norway-finland-and-sweden/ …			# climatehttps	1020285351812911105			https://twitter.com/IsabellaLovin/status/1020285351812911105	
MonsKrabbe	2018-07-20 03:50	4	8	Självklart ska sharialag INTE få något som helst utrymme i rättssystemet i en Europeisk stat! Betänk samtidigt våra egna veka politiker som inte står upp för någonting. Det är så man tänker: Make Sweden Finland again! # MEDval18https://www.alandsnyheter.com/nyheter/justitieministern-slar-tillbaka-mot-kraven-inget-utrymme-i-finland-for-sharialag/ …			# MEDval18https	1020214250172710913			https://twitter.com/MonsKrabbe/status/1020214250172710913	
Viking_Schnack	2018-07-20 03:45	0	1	Denmark, Sweden, Finland, and the Netherlands have the most advanced digital economies in the EU. Digital Economy & Society Index 2018 https://youtu.be/aKbhp8lWpY0 via @ YouTube		@ YouTube		1020212992355586048			https://twitter.com/Viking_Schnack/status/1020212992355586048	
Stacey0891	2018-07-20 03:14	0	0	Except that Norway Denmark Sweden Finland often rank above Canada for happiest citizens... And you're right they have more going for them than just electoral. Social democratic countries consistently rank high.				1020205175124811776	1019426689074413569	SaveRHomes SethDKlein	https://twitter.com/Stacey0891/status/1020205175124811776	
Seropoliev	2018-07-20 01:10	0	0	Uruguay Paraguay Argentina Chile Ecuador US Canada Greenland Iceland Denmark Sweden Finland Russia Georgia Armenia Israel Jordan Libya Kenya South Africa Somalia Ethiopia Democratic republic of Congo Sudan South Sudan Saudi Arabia Oman UAE New Zealand Australia Myanmar Honduras				1020173970253975552	1020173968400166912		https://twitter.com/Seropoliev/status/1020173970253975552	https://pbs.twimg.com/profile_images/1018739068039987202/JftrYKxv_normal.jpg
bankshaft_wt	2018-07-20 00:58	0	0	Abigor is really it for that scene. It didn't develop like Norway, Sweden, Finland and the States.				1020171017526829056	1020147554841837569	borg3412 RAZ0RFIST	https://twitter.com/bankshaft_wt/status/1020171017526829056	
dasiatravels	2018-07-19 23:21	0	0	12 Days Tour to Aurora Sweden, Finland & Norway + Abisko! Grab this opportunity to have a great experience in these most beautiful countries of Europe with affordable prices. Book Now! SPECIAL BONUS : ... https://www.facebook.com/dasiatravel/videos/1872825139449721/ …				1020146690601431040			https://twitter.com/dasiatravels/status/1020146690601431040	https://abs.twimg.com/emoji/v2/72x72/2708.png
dasiatravels	2018-07-19 22:03	0	0	12 Days Tour to Aurora Sweden, Finland & Norway + Abisko! Grab this opportunity to have a great experience in these most beautiful countries of Europe with affordable prices. Book Now! SPECIAL BONUS: * FREE... https://www.facebook.com/dasiatravel/videos/1872733626125539/ …				1020126942111158273			https://twitter.com/dasiatravels/status/1020126942111158273	
dasiatravels	2018-07-19 21:58	0	0	12 Days Tour to Aurora Sweden, Finland & Norway + Abisko! Grab this opportunity to have a great experience in these most beautiful countries of Europe with affordable prices. Book Now! SPECIAL BONUS: * FREE... https://www.facebook.com/dasiatravel/posts/1872729389459296 …				1020125761238458368			https://twitter.com/dasiatravels/status/1020125761238458368	
MartinSA1994	2018-07-19 19:35	0	0	Yes this is why Brazil is super rich and Countries which did not have slaves or colonies like Sweden, Finland and Norway are very poor. Imagine being dumb like you				1020089668665298955	1020053725723815936	jungleeagle1 coldxman MehrsaBaradaran	https://twitter.com/MartinSA1994/status/1020089668665298955	
Brian_Dell	2018-07-19 18:44	0	0	Countries with private schools receiving more than 90% of funding from govt: Sweden, Finland, Hong Kong. Less than 1%: USA, Mexico, Albania				1020077018476449792	1020040546864123904	According2Luke DavidStaplesYEG	https://twitter.com/Brian_Dell/status/1020077018476449792	
friskyness69	2018-07-19 18:00	0	1	I think France,Spain,Germany,Sweden,Finland , Croatia are all nudist friendly				1020065874152173568	1020063101654306820	smdenham3	https://twitter.com/friskyness69/status/1020065874152173568	
DIG_KAY	2018-07-19 17:33	0	0	Germany, Sweden, Finland, Norway, France, England, Belgium, Switzerland, Italy, Cuba,........yawn....it would be easier if you give me a socialist country that DID fail.				1020059196857954304	1020008975922810883	megablaster12 Iamshepoet	https://twitter.com/DIG_KAY/status/1020059196857954304	
DianeFannieann	2018-07-19 14:58	0	1	@ edsheeran I made it Sweden Finland London and I've made it to Berlin thank you you were and are soooo worth it		@ edsheeran		1020020188849287168			https://twitter.com/DianeFannieann/status/1020020188849287168	https://abs.twimg.com/emoji/v2/72x72/2764.png
juniperhearts	2018-07-19 14:33	0	0	cocco and taimou are for sure already back in sweden & finland D: harryhook is back in spain too i think? i cant see effect going to the finals either, i can only rly see myself meeting seagull and chips maybe... and idek where mickie is, i think he was visiting japan for a sec				1020013806620209153	1020013257426337798	KAZUMAJl	https://twitter.com/juniperhearts/status/1020013806620209153	
balticmedia	2018-07-19 14:31	1	0	What are the most common # names in the # Nordic Countries? # Nordics # Sweden # Finland # Denmark # Norway # Iceland http://snip.ly/ixtb98 via @ YouTube		@ YouTube	# names # Nordic # Nordics # Sweden # Finland # Denmark # Norway # Iceland	1020013157425844228			https://twitter.com/balticmedia/status/1020013157425844228	
jezziebezzie	2018-07-19 14:11	0	0	Whitest, Most American. Not gonna hear much about "chew" in Sweden, Finland or even most of Canada!				1020008255282704392	1019998554822266885	ironscxrlet nowthisnews	https://twitter.com/jezziebezzie/status/1020008255282704392	https://abs.twimg.com/emoji/v2/72x72/1f602.png
EuroPopNews	2018-07-19 13:16	0	1	Cooperation between the anti-immigrant Sweden Democrats and the populist Finns Party has intensified during the past year, says Jussi Halla-aho. # Sweden # Finland https://yle.fi/uutiset/osasto/news/finns_party_hails_closer_ties_with_nationalist_sweden_democrats/10313894 …			# Sweden # Finland	1019994353127841792			https://twitter.com/EuroPopNews/status/1019994353127841792	https://abs.twimg.com/emoji/v2/72x72/1f1f8-1f1ea.png
andersr9	2018-07-19 12:28	0	0	@ GameTime1620 Larry Fedora is a crazy person. Do they play football in Norway, Sweden & Finland, etc.? He's watching to much Alex Jones.		@ GameTime1620		1019982242985070593			https://twitter.com/andersr9/status/1019982242985070593	
voyageantiquity	2018-07-19 11:30	0	2	# Baltic Capitals & St Petersburg is another BRAND NEW itinerary for Aegean Odyssey in July 2019. She will visit Denmark, Sweden, Finland, Russia, Estonia, Poland and Germany on this 14-day # cruise. http://ow.ly/4Rsn30jMa33 Flights, transfers and selected shore excursions included			# Baltic # cruise	1019967747336179712			https://twitter.com/voyageantiquity/status/1019967747336179712	
blacknewt61	2018-07-19 11:18	0	0	You mean like Denmark, Sweden, Finland, Norway, Netherlands, Canada, and Ireland? Quality of life in these countries is often at the top of any list-well beyond the US. Your ignorance is astounding, Butthead. pic.twitter.com/jMCvLgs4CK				1019964616401719306	1019919442107564032	DonaldJTrumpJr	https://twitter.com/blacknewt61/status/1019964616401719306	https://pbs.twimg.com/media/DiekaMbW4AI_No4.jpg
es_grimes	2018-07-19 11:13	0	1	I watch him every week. And not only Lester. I watch all the games PL. Serie A. ligue 1, La liga, Bundesliga, Liga Nos & Sweden. Finland, Norway, Jupiter league even arab & africa, South american, MLS, developpment league east, west, north, south, Asia Vent foret,Gufu, Stallion,				1019963411600478209	1019741757855150082	DelaineMoore3 Shmuelius	https://twitter.com/es_grimes/status/1019963411600478209	
fattypotus45	2018-07-19 10:25	0	0	Denmark, Sweden, Finland, Canada, the Netherlands... you are an idiot bro.				1019951471146782720	1019919442107564032	DonaldJTrumpJr	https://twitter.com/fattypotus45/status/1019951471146782720	
mike_krop	2018-07-19 09:59	0	0	Show 'em how it's done, Bernie. They can scream about Venezuela while ignoring Australia, Denmark, Sweden, Finland, Norway, and Italy. They can cry free healthcare is impossible while ignoring Ireland, England, Canada, Austria, Germany, France, and Japan. We're with you.				1019944810193604616	1019942647065083904	SenSanders	https://twitter.com/mike_krop/status/1019944810193604616	
Malcy43	2018-07-19 08:46	0	0	Your messages always sounds Kremlin/ Putin, us we never would or should that be wouldn't do double negative just like Russian agent/ spy Trump, our GRU or FSB wouldn't want a blood bath in Montenegro Parliament, Putin never personally threatened Sweden & Finland if they join NATO				1019926562722938881	1019897892180459520	RussianEmbassy BBCDanielS	https://twitter.com/Malcy43/status/1019926562722938881	
bennel62	2018-07-19 08:35	0	0	# Climatechangeasamatteroffact : # Recordbreakingheat sears # Scandinavia # Sweden # Finland # Norway # climatechange # globalwarning http://paulsnewsline.blogspot.com/2018/07/climate-change-as-matter-of-fact-record.html …pic.twitter.com/0kiK32Fzom			# Climatechangeasamatteroffact # Recordbreakingheat # Scandinavia # Sweden # Finland # Norway # climatechange # globalwarning	1019923692195844097			https://twitter.com/bennel62/status/1019923692195844097	https://pbs.twimg.com/media/Did--dwUwAcsxZ7.jpg
Malcy43	2018-07-19 04:32	0	1	Putin's fuming the planned blood bath attack on Montenegro parliament by Serbian thugs ordered by Russia FSB or GRU was foiled by UK & US intel, Putin doesn't want Montenegro to be a NATO member, he personally threatened Sweden & Finland if they joined, and Putin denies meddling!				1019862649696288768	1019652583529635840	kfhall0852 RepChrisStewart	https://twitter.com/Malcy43/status/1019862649696288768	
brymor78	2018-07-19 03:54	0	1	Arla co-operative is headquartered in Denmark and represents 12,000 farmers across the UK, Denmark, Sweden, Finland, Germany, Belgium and Luxembourg.				1019853053703356417	1019462740459565056	jallisonjones DianeJamesMEP	https://twitter.com/brymor78/status/1019853053703356417	
brymor78	2018-07-19 03:53	0	1	The UK is Arla's biggest market, accounting for 25 per cent of its group revenue. The co-operative is headquartered in Denmark and represents 12,000 farmers across the UK, Denmark, Sweden, Finland, Germany, Belgium and Luxembourg.				1019852654170771459	1019462740459565056	JSinghF KnightsWhoGoNi DianeJamesMEP	https://twitter.com/brymor78/status/1019852654170771459	
brymor78	2018-07-19 03:47	1	2	The UK is Arla's biggest market, accounting for 25 per cent of its group revenue. The co-operative is headquartered in Denmark and represents 12,000 farmers across the UK, Denmark, Sweden, Finland, Germany, Belgium and Luxembourg. No vested interest then for survey				1019851323276132352	1019462740459565056	DianeJamesMEP FATHERofCHAPEL	https://twitter.com/brymor78/status/1019851323276132352	https://abs.twimg.com/emoji/v2/72x72/1f60e.png
NickD350	2018-07-19 02:57	0	0	Retweeted Global Warming Times ( @ globalwarmingt): Global Warming Times: Record heat in Scandinavia leads to bushfire outbreak in Sweden # heat # Sweden # Finland # Norway # bushfires # fire # climatehttps://www.smh.com.au/world/europe/record-breaking-heat-hits-norway-finland-and-sweden-20180718-p4zs3x.html …		@ globalwarmingt	# heat # Sweden # Finland # Norway # bushfires # fire # climatehttps	1019838656675278848			https://twitter.com/NickD350/status/1019838656675278848	
mordu_h	2018-07-19 02:20	0	0	Countries currently or recently on fire: Sweden; Finland; Norway; Russia; Algeria; Australia; USA; Canada; UK; Portugal; Spain; Italy; Ukraine # Wildfires # CombustibleVegetation			# Wildfires # CombustibleVegetation	1019829321974927366			https://twitter.com/mordu_h/status/1019829321974927366	
Kyberneticus	2018-07-19 01:18	0	0	The Swiss are strong national patriots and value their identity. What's not patriotic about that? Or Sweden? Finland? Norway? Germany? In fact, most socialists are far more patriotic since neoliberal globalism which rules RNC and DNC wants to crush any notion of country.				1019813804421664768	1019724022127431681	eugone2 thehill	https://twitter.com/Kyberneticus/status/1019813804421664768	
TheEdRant	2018-07-18 23:57	0	0	Lt's see gun control success- Australia. state provided healthcare-nearly every country in Europe, and Australia,;Free Tertiary Education -Nordic countries Denmark Sweden, Finland etc.. There are some examples for you.				1019793237173661696	1019640302770913280	RealSaavedra	https://twitter.com/TheEdRant/status/1019793237173661696	
Yolimalintzin	2018-07-18 22:27	0	0	Minority? Well, we'll see how the next election goes. I also criticise Trump. There are statements that are way too "undiplomatic". But u should see how things are now in Sweden, Finland, Ger, Fra, Spa to see what the future might bring if those neomarxist policies are applied				1019770670828412928	1017376992302391296	topspin1617 AdFontemVeritas	https://twitter.com/Yolimalintzin/status/1019770670828412928	
antfarmkeybored	2018-07-18 22:27	8	153	Norway. Sweden. Finland. Canada. Australia. England. Ireland. I mean, the list goes on. All countries with socialized medicine and longer life expectancies than the US according to the World Health Organization. Do some of your own research.				1019770563374411777	1019610688283709440	gardenofthegods Ocasio2018	https://twitter.com/antfarmkeybored/status/1019770563374411777	
FrancaRose33	2018-07-18 20:42	0	0	Sweden, Finland, Norway, Switzerland, Netherlands, UK, France, Germany...				1019744206724591617	1019742029251842048	capeandcowell	https://twitter.com/FrancaRose33/status/1019744206724591617	
fedora_fedorov	2018-07-18 20:00	0	0	Que bueno!...Porque mucha gente lo necesita...Recuerden Chilenitos que uds. también fueron extranjeros en Sweden, Finland, Norway y Deutschland, después de 1973 y Europa, los recibió con brazos abiertos, les toca devolver la mano...				1019733586054926337	1019547785253851136	CNNChile	https://twitter.com/fedora_fedorov/status/1019733586054926337	
AdamsOnHockey	2018-07-18 19:51	0	1	As opposed to a European trained spot in the AHL I’ve advocated for some kind of ‘exceptional status’ spot for years. To me there’s no good reason a drafted guy like Bouchard should have to go back to junior simply because he was born here and not in Sweden/Finland etc.				1019731469143379968	1019691463263653888	DirsaMike ryan_batty	https://twitter.com/AdamsOnHockey/status/1019731469143379968	
smythmels	2018-07-18 19:40	1	1	ppl making fun if them calling 31°c extreme heat clearly doesnt know that the av. temp. at the arctic circle in july is 13°c. there's major forest fires all over norway/sweden/ finland, fire fighters are dying. its literally not the time to crack an "if u think that's hot.." joke https://twitter.com/severeweatherEU/status/1019195569120702464 …				1019728718158319621			https://twitter.com/smythmels/status/1019728718158319621	https://pbs.twimg.com/media/DiTo9PkX0AAqWhb.jpg
OACBBallShow	2018-07-18 16:04	0	0	I always like to see the Scandinavian countries do well (Norway, Sweden, Finland, and Denmark). I can't remember the last time all 4 of their champions were still around for Round 2.				1019674387908366341	1019667613440532481	RyanAlanScott valursport	https://twitter.com/OACBBallShow/status/1019674387908366341	
JeffreyRDaniels	2018-07-18 16:04	0	1	So you're saying Denmark, Sweden, Finland are all failed states? That every developed nation has figured out how to provide universal health care and many do it at much lower rates with better results. Yeah, "literally the same thing and always fails".				1019674315095126016	1019610688283709440	ArmyofJ paulsef	https://twitter.com/JeffreyRDaniels/status/1019674315095126016	https://abs.twimg.com/emoji/v2/72x72/1f923.png
_lesbaa_	2018-07-18 15:18	0	4	Norway, Sweden, Finland, Iceland, Ecuador, to name but a few but the kicker is *gasp* the UK! Yes that's right, the left gave you NHS. Don't beal.				1019662634868707328	1019656444369567744	mardibum63 OwenJones84	https://twitter.com/_lesbaa_/status/1019662634868707328	
jedimarkus77	2018-07-18 15:11	0	0	- As in Helsinki, Sweden. - Finland. - https://getyarn.io/yarn-clip/327a30e8-2a27-44a9-97f6-f982ad6332b0#rymgLyZGa7X.twitter … https://twitter.com/share?text=-%20As%20in%20Helsinki%2C%20Sweden.%20-%20Finland.%20-%20https%3A%2F%2Fgetyarn.io%2Fyarn-clip%2F327a30e8-2a27-44a9-97f6-f982ad6332b0%23rymgLyZGa7X.twitter%20 …				1019660971458158592			https://twitter.com/jedimarkus77/status/1019660971458158592	
_StrawBre	2018-07-18 15:01	0	0	I’m a fan of the social conditions, equal rights and living standard prevalent in the Northern European country’s right now. Norway, Sweden, Finland, Holland, Denmark, Germany, Belgium, Switzerland.				1019658524236943362	1019286313873367045	davidandrewt joemuggs	https://twitter.com/_StrawBre/status/1019658524236943362	
OceanaLizard	2018-07-18 12:47	3	7	Twitter friends in Ireland, UK, Netherlands, Germany, Belgium, Denmark, Sweden, Finland, South Korea and Japan! RUSLAN IS COMING. @ AlbertineWestra @ annapip99 @ MissMispeledhttps://twitter.com/ruslanpianonews/status/1019594376329203712 …		@ AlbertineWestra @ annapip99 @ MissMispeledhttps		1019624801139339264			https://twitter.com/OceanaLizard/status/1019624801139339264	https://pbs.twimg.com/media/DiZTrY8XcAcZlr7.jpg
rvilmi	2018-07-18 10:10	0	0	Widespread fires in Northern Europe now, the worst being Sweden. Finland, England and Norway also affected. https://www.theguardian.com/world/2018/jul/18/sweden-calls-for-help-as-arctic-circle-hit-by-wildfires?CMP=Share_AndroidApp_Facebook …				1019585253034381312			https://twitter.com/rvilmi/status/1019585253034381312	
CharliComms	2018-07-18 09:55	5	22	Thinking digitally working with colleagues from Holland, Sweden, Finland, Switzerland & USA to discuss ways of embedding human centred design & agile thinking into government services @ FutureGov # GovDesign # WeAreHomesEnglandpic.twitter.com/RmHCjwwFn8		@ FutureGov	# GovDesign # WeAreHomesEnglandpic	1019581327253831680			https://twitter.com/CharliComms/status/1019581327253831680	https://pbs.twimg.com/media/DiZHz2DW4AAqhww.jpg