username	date	retweets	favorites	text	geo	mentions	hashtags	tweetid	conversationid	replyto	permalink	imagelink
definemebot	2018-01-11 07:01	0	0	The 2016 presidential campaign of Donald Trump was formally launched on June 16, 2015, at Trump Tower in New York City. Trump was the Republican nominee for President of the United States in the 2016 election, having won the most state prim... http://bit.ly/2AOU0R1				951423939384836096	950713096250720257		https://twitter.com/definemebot/status/951423939384836096	https://pbs.twimg.com/profile_images/943855083070132224/roOrcNeC_normal.jpg
MattAtDoyle	2018-01-03 12:25	0	0	If he was just “Crazy Ol’ Trump” sitting in his gaudy golden tower spitting out venom, it would be sadly pathetic. He isn’t - Donald J Trump is The President of the United States of America, and his words represent all of us. That is devastating.				948606234214612992	948375884330819584	PFTompkins	https://twitter.com/MattAtDoyle/status/948606234214612992	
southam1159	2017-11-29 15:29	0	0	Wow, @ realDonaldTrump was just fired as President of the United States for sexual assault and ‘inappropriate sexual behavior’ at Trump Tower, Mar-A-Lago, & Access Hollywood bus, etc. When will @ PressSec & Trump WH staff be fired 4 putting out/enabling so much Fake News? https://twitter.com/realdonaldtrump/status/935844881825763328 …		@ realDonaldTrump @ PressSec		935968995232157696			https://twitter.com/southam1159/status/935968995232157696	
MaximilianRentz	2017-11-20 03:35	0	2	Donald trump: • $3.1B net worth • has a tower • can't make rockets land on boats • America first • President of the United States Elon musk: • $19.7B net worth • has a tunneling machine that races snails • makes rockets that land on boats • Mars first • literally god				932527740342829057			https://twitter.com/MaximilianRentz/status/932527740342829057	
PsychoCit45	2017-11-19 13:20	0	1	Second guessing your own decision for a little publicity @ POTUS What you should have done is stayed in Trump Tower! Can anyone translate why the President of the United States would post such an inane tweet? My guess is Machiavellian narcissism backed by propaganda machines # fact		@ POTUS	# fact	932312575815057409	932303108146892801	realDonaldTrump	https://twitter.com/PsychoCit45/status/932312575815057409	
raorups	2017-09-21 23:38	0	0	He is the President of the United States, personal got left behind at Trump tower. We have rights too by the way.				911072262291255296	910885156373721092	45Cain EdKrassen realDonaldTrump	https://twitter.com/raorups/status/911072262291255296	
emmett_mass	2017-09-19 09:17	0	1	Was the President of the United States Donald Trump right about Barack Obama wiretapping TRUMP TOWER? the American People need answers NOW.				910130780248125440			https://twitter.com/emmett_mass/status/910130780248125440	
LenaBlackburne	2017-08-14 18:34	0	0	You're the president of the United States of America. People are supposed to come to you. Just say it: "I want to go home to Trump Tower."				897224882274148352	897221868784168960	realDonaldTrump	https://twitter.com/LenaBlackburne/status/897224882274148352	
ShaunDrJames	2017-08-03 20:55	0	1	The president of the United States called a whole state a drug den to a foreign leader and has evicted secret service from trump tower				893274204497256449	893083735633129472	realDonaldTrump	https://twitter.com/ShaunDrJames/status/893274204497256449	
AlThomp	2017-06-21 15:59	0	0	It's the White House and President of the United States, not Trump Tower and "the Donald"...Respect				877617105465561088	877615375025790980	SInow	https://twitter.com/AlThomp/status/877617105465561088	
yashar	2017-06-16 11:14	87	246	Two years ago today, Donald J. Trump announced that he was running for President of the United States at Trump Tower. https://twitter.com/realDonaldTrump/status/875701471999864833 …				875733419430338560			https://twitter.com/yashar/status/875733419430338560	
CurtisBender10	2017-05-23 11:56	0	0	You are confused William. You are thinking of Obummer bugging the "current" President of The United States transition team in Trump Tower.				867046700241756160	864207293289771012	williamlegate realDonaldTrump seanspicer	https://twitter.com/CurtisBender10/status/867046700241756160	
GabriSilva	2017-04-27 16:52	0	0	I'd like to have these failures and still have a trump tower and be the president of the United States of America				857698887401865217	857670562478518273	fvgsocial realDonaldTrump	https://twitter.com/GabriSilva/status/857698887401865217	
Rbj39	2017-04-10 19:19	0	1	"What do Trump Tower, the Devos Family and the Russians all have in common? A desire for Donald Trump to be President of the United States. https://twitter.com/teapainusa/status/851487891285037056 …				851575518080225280			https://twitter.com/Rbj39/status/851575518080225280	
neufferceci	2017-04-06 18:18	0	1	"What do Trump Tower, the Devos Family and the Russians all have in common? A desire for Donald Trump to be President of the United States. https://twitter.com/counterchekist/status/849081620183355394 …				850110536670990336			https://twitter.com/neufferceci/status/850110536670990336	
pakopako1955	2017-04-04 12:55	0	2	"What does Trump Tower, Devos Family and the Russians all have in common? A desire for Donald Trump to be President of the United States"				849304539241099266	849294894245871616	RobBurnsIV MSNBC mitchellreports	https://twitter.com/pakopako1955/status/849304539241099266	
pakopako1955	2017-04-04 12:54	0	0	"What does Trump Tower, Devos Family and the Russians all have in common? A desire for Donald Trump to be President of the United States."				849304210311184384	849294894245871616	BornaZorna MSNBC mitchellreports	https://twitter.com/pakopako1955/status/849304210311184384	
mblazoned	2017-04-04 09:30	0	1	"What does Trump Tower, the Devos Family & the Russians all have in common? A desire for Donald Trump to be President of the United States" https://twitter.com/louisemensch/status/849231885528170498 …				849252772935598080			https://twitter.com/mblazoned/status/849252772935598080	
KayZed14	2017-04-03 23:02	4	3	What do Trump Tower, the Devos Family and the Russians all have in common? A desire for Donald Trump to be President of the United States. https://twitter.com/LouiseMensch/status/849083966686715907 …				849094792512499715			https://twitter.com/KayZed14/status/849094792512499715	