username	date	retweets	favorites	text	geo	mentions	hashtags	tweetid	conversationid	replyto	permalink	imagelink
MyAlliesNews	2018-04-15 06:16	0	0	FISH FOOD Brit boy reveals injuries suffered after bull shark attack on Bahamas holiday SHANE McConnell, 12, was walking along a dock in Bimini, with his dad Jim, 56, and mum Debbie, 48... https://goo.gl/5mZYrX				985461972270448640			https://twitter.com/MyAlliesNews/status/985461972270448640	
Del__Jel	2018-04-12 03:05	0	1	This beasty is a Bull shark. They can swim in both salt AND freshwater. It is one of the top three sharks to attack humans. Super aggressive. But still super cool. pic.twitter.com/6qSJQJx8e9				984326585669992448			https://twitter.com/Del__Jel/status/984326585669992448	https://pbs.twimg.com/media/DakHzybUMAAgvhe.jpg
VOHA70	2018-04-10 00:12	0	0	This is nota movie shot. This was taken by somone in Florida who actually saw this big ass bull shark attack this guy. Brutal pic.twitter.com/rg0gCrxIv3				983558407658418176			https://twitter.com/VOHA70/status/983558407658418176	https://pbs.twimg.com/media/DaZNJ5vVAAEzCfb.jpg
ASAP_FRED49	2018-04-07 11:12	0	0	Great whites, Tigers sharks , and bull sharks all are top predators in the ocean... just cause they don't attack as many humans as portrayed doesn't mean they aren't a top predator in their environment pic.twitter.com/YhwoQJCmua				982637164444995584	981977342238175232	prettyambitions SirBricks_Alot	https://twitter.com/ASAP_FRED49/status/982637164444995584	https://abs.twimg.com/emoji/v2/72x72/1f602.png
CMeadowx	2018-04-03 16:11	0	1	I really like and hate Jaws at the same time. It wasn’t a Great White that attacked all those people it was a Bull Shark which have the highest attack count than a Great White. Thanks to that movie everyone hates Great Whites.				981262899292155904			https://twitter.com/CMeadowx/status/981262899292155904	
MermaidMilka	2018-04-01 06:10	0	3	Haha yes we have lots of deadly spiders, snakes, sharks, magpies, spitfire caterpillars, bull ants etc.. everything here wants to attack or seriously maim... it’s surprising I’m still alive . USA good option				980387014842368000	980380428044414977	ali3acoustic HellRazorDlx	https://twitter.com/MermaidMilka/status/980387014842368000	https://abs.twimg.com/emoji/v2/72x72/1f61c.png
WhatIfPod	2018-03-28 09:08	3	23	So, many of you have informed us that bull sharks can live in fresh water. Thanks, but also, screw you guys. Our studio is less than a mile from the Mississippi, which I now have to assume is full of sharks. Which means there’s a non-zero chance of a shark attack at the studio.				978982038979129346			https://twitter.com/WhatIfPod/status/978982038979129346	
tibbyy101	2018-03-26 21:03	0	0	Watch: Massive shark attacks fishing boat seven times (I heard that Bull sharks can be very territorial, and will brazenly charge boats and intruders in their territory. this behavior is often perceived as a "vicious shark attack") @ ocearch https://upi.com/6725804t via @ oddnewsupi		@ ocearch @ oddnewsupi		978437350563889152			https://twitter.com/tibbyy101/status/978437350563889152	
DroneNewsFeed	2018-03-22 12:19	0	1	Video: Drone Captures Crazy Boat Attack By Angry Bull Shark http://bit.ly/2pwUEzX # drone # uav			# drone # uav	976855819970072578			https://twitter.com/DroneNewsFeed/status/976855819970072578	
FreaknHunting	2018-03-21 21:30	0	0	Video: Drone Captures Crazy Boat Attack By Angry Bull Shark hunting http://freaknhunting.com/video-drone-captures-crazy-boat-attack-by-angry-bull-shark/ …pic.twitter.com/mhLiSzpA9I				976632087041249280			https://twitter.com/FreaknHunting/status/976632087041249280	https://pbs.twimg.com/media/DY2xtQWWAAExnHI.jpg
DualFrontier	2018-03-21 17:09	0	0	Video: Drone Captures Crazy Boat Attack by Angry Bull Shark http://dlvr.it/QLvzpf pic.twitter.com/wkJeeleIfz				976566387106697216			https://twitter.com/DualFrontier/status/976566387106697216	https://pbs.twimg.com/media/DY118-uUMAA4LVP.jpg
KairosSpeaks	2018-03-18 13:35	0	0	MIXING THAT AND THE ANDROID ASPECTS IS SUCH A COOL THOUGHT TO ME, SHIT I thought about them too! Tiger sharks are known to act more out of curiosity though, whereas no one really knows what makes a bull shark attack. They'll go on straight up 2 week killing sprees then vanish https://twitter.com/saltyscion/status/975423327190724609 …				975425467225333760			https://twitter.com/KairosSpeaks/status/975425467225333760	
Secret____t	2018-03-08 11:53	0	0	In related news, the White/Tiger/Oceanic/Bull/Oceanic White Tip sharks' sense of smell/lateral lines/ampullae of Lorenzini INVALIDATE the wholly speculative "mistaken identity" shark attack causation theory no more credible than unfounded groupthink.				971790924274483201	971762754414669829	AdrienneLaF TheAtlantic	https://twitter.com/Secret____t/status/971790924274483201	
Mc_Shark_Attack	2018-02-28 00:46	0	0	And here starts to bull shit				968724024888102913			https://twitter.com/Mc_Shark_Attack/status/968724024888102913	
noxxent	2018-02-24 01:55	0	1	WATCH: Diver Impales A Bull Shark With A Spear Gun As It Charges To Attack Him https://fb.me/1Borh1zlv				967291780520701953			https://twitter.com/noxxent/status/967291780520701953	
Tom_Gray_Boxing	2018-02-23 00:39	0	2	Love the guy's composure: speargun to the mouth and then goes into a gentle backstroke. That's a bull shark as well. Could have been a fatal attack				966910442739154945	966908986195787776	Blangaz1	https://twitter.com/Tom_Gray_Boxing/status/966910442739154945	https://abs.twimg.com/emoji/v2/72x72/1f602.png
jigsaw_3West	2018-02-23 00:39	0	0	WATCH: Diver Impales A Bull Shark With A Spear Gun As It Charges To Attack Him https://fb.me/QjeYnDEC				966910358274191360			https://twitter.com/jigsaw_3West/status/966910358274191360	
sylverwulf	2018-02-22 00:53	0	0	@ RiverMonstersUK You know I was watching the episode about the bull shark and remember hearing of an attack in the Ohio River when I was young		@ RiverMonstersUK		966551380176637952			https://twitter.com/sylverwulf/status/966551380176637952	
Bloodwolfing	2018-02-17 09:41	0	0	WATCH: Diver Impales A Bull Shark With A Spear Gun As It Charges To Attack Him https://fb.me/7KjO4qKqJ				964872502005542913			https://twitter.com/Bloodwolfing/status/964872502005542913	
johnnyjohn73	2018-02-08 08:13	0	0	I liked a @ YouTube video http://youtu.be/MlvV8DonGyM?a JOE ROGAN - PIT BULL STORY, SHARK ATTACK, MO'NIQUE, BAD WORDS | "Shark bites feel		@ YouTube		961588778740649985			https://twitter.com/johnnyjohn73/status/961588778740649985	
asim_sp	2018-02-07 06:07	0	0	Bull Shark vs Crocodile Attack - GTINouvelle https://fb.me/IyQpDeRu				961194786354024449			https://twitter.com/asim_sp/status/961194786354024449	
EJ_1892	2018-02-06 11:52	0	0	not gonna lie, still can't believe my brother still does shark research dives after witnessing a legit leg loss from an attack. the other one was a tiny nurse shark, at least, but the bull that attacked his dive partner was like 20 feet long. pic.twitter.com/COkMcXkafO				960919256597659648	960678146780618753	Elwood_17 TheWyenberg iammilkyg	https://twitter.com/EJ_1892/status/960919256597659648	
WoltjesBia	2018-02-04 16:11	0	0	Diver impales a bull shark with a spear gun as it charges to attack him: http://aol.it/2moAc1t via @ AOL		@ AOL		960259658333216768			https://twitter.com/WoltjesBia/status/960259658333216768	
Dany007Martina	2018-02-03 15:55	0	4	Absolutely!! But I always say that Critichs are like sharks, ready for attack, the # Bull pilot ep. receive many negative critics from # RottenTomatoes and # Merachritics...thanks to Michael's talent, and effort (and the rest of the Cast), there is no negative critics now!!			# Bull # RottenTomatoes # Merachritics	959893215729061889	959830296345694209	mariazorrozua	https://twitter.com/Dany007Martina/status/959893215729061889	
questhypno	2018-02-01 13:35	0	0	Didn't survive a shark attack but did video a severely cross Bull shark (Zambezi) on a dive in South Africa - a boat fisherman had caught it inadvertently, the shark coughed out the bait and hook btw so ended well https://www.youtube.com/watch?v=4nBLBjo4aNQ …				959133025907986432	959110477119983616	MollySequin	https://twitter.com/questhypno/status/959133025907986432	
williamgervasio	2018-02-01 07:21	0	0	Shark Attack... # Shakira # Terrie # Bull em Parque Anchieta https://www.instagram.com/p/Bep2KXHHrrZBM_7xJuutoUH8QV8xUaYZa4El380/ …			# Shakira # Terrie # Bull	959039017625976832			https://twitter.com/williamgervasio/status/959039017625976832	https://abs.twimg.com/emoji/v2/72x72/1f436.png
pluckyloser	2018-02-01 04:56	0	2	I'm sorry, but yes. The notable features of bull sharks are that they can survive in freshwater, swim in shallows, are incredibly aggressive and attack in packs.				959002572387307520	958995038121312256	David__Costa	https://twitter.com/pluckyloser/status/959002572387307520	https://abs.twimg.com/emoji/v2/72x72/1f628.png