username	date	retweets	favorites	text	geo	mentions	hashtags	tweetid	conversationid	replyto	permalink	imagelink
countrydudeuk	2018-07-12 20:01	0	1	One of the most amazing aspects of living in Ennerdale, is the wildlife. Barn Owls, bats, Roe Deer, Red Squirrels, Polecats, Buzzards, Peregrine Falcons, all manner of other birds,… https://www.instagram.com/p/BlJqSqulHLI/?utm_source=ig_twitter_share&igshid=1mrf8i7o49lt2 …				1017559572930879491			https://twitter.com/countrydudeuk/status/1017559572930879491	
BarnOwlTrust	2018-06-26 08:52	6	17	The Stock Dove is Amber listed on the UK Red List for Birds and can nest in Barn Owl boxes. They suffered from the effects of organochlorine seed-dressings that were used in the 50’s and 60’s, but now the UK holds over 20% of European breeding population. pic.twitter.com/J1z41Fxisq				1011593030091051009			https://twitter.com/BarnOwlTrust/status/1011593030091051009	https://pbs.twimg.com/media/Dgnmf0HVAAA4Wyq.jpg
econaturehols	2018-06-22 18:00	0	1	# glenwatch today sightings Jay, barn owl, red squirrels, loads of woodland birds, woodpecker and pine marten # wildscotland # cowal # wildaboutargyllpic.twitter.com/Qjr5ecbKNg – bei Eco Nature Holidays			# glenwatch # wildscotland # cowal # wildaboutargyllpic	1010281488443691010			https://twitter.com/econaturehols/status/1010281488443691010	https://pbs.twimg.com/media/DgU9p60WkAcGsmo.jpg
emm33	2018-06-14 18:19	1	0	Terrific evening bird walk with the Windsor @ U3A_UK. Five raptors: Kestrel, Buzzard, Red Kite, Sparrowhawk and Barn Owl. # birds @ BBCSpringwatch		@ U3A_UK @ BBCSpringwatch	# birds	1007387076692725761			https://twitter.com/emm33/status/1007387076692725761	
BankHouseBnB	2018-06-07 09:03	0	0	The Bank House garden is providing a wonderful backdrop to the beautiful birds created by Claudia Petley and Paul Shepherd. An invasion of barn owls and a spiralling red kite. All part of the Bishops Bishop's... https://www.facebook.com/258738677619694/posts/956423817851173/ …				1004710475353948160			https://twitter.com/BankHouseBnB/status/1004710475353948160	
MikeCrawshaw4	2018-05-12 20:33	0	6	Your talking rubbish, several lapwing, curlew a kestrel several buzzard numerous small birds, red kite, havn't seen the cock hen Harrier today but he's about, barn owl etc etc				995462013055913984	994843307644805120	BenGoldsmith	https://twitter.com/MikeCrawshaw4/status/995462013055913984	
DazzleCity	2018-05-11 16:43	0	0	Owl Pin Bird Wise Red Eyes Brooch Barn Night Mid Century 1960's DazzleCity http://dazzlecity.mybigcommerce.com/owl-pin-bird-wise-red-eyes-brooch-barn-night-mid-century-1960s-dazzlecity/#.WvYAdYdb7NQ.twitter …				995041752464613376			https://twitter.com/DazzleCity/status/995041752464613376	
WildCare_Inc	2018-05-10 15:13	0	1	The red band male barn owl was released with his new lady friend last week, and in a few days we'll be releasing an unrelated female with red band's brother blue band! For a species with less than 100 birds left in... https://www.facebook.com/WildCareInc/posts/1921051877907826 …				994656751386492929			https://twitter.com/WildCare_Inc/status/994656751386492929	
exebirding	2018-05-10 14:07	0	0	Very nice Jo you've had some great birds on your trip. I've had Barn Owls Red Kites Sarny Terns and Gannets today. Hope to get a few photos soon just having a look round at the mo				994640129661825026	994309626136092672	JoKingDevon	https://twitter.com/exebirding/status/994640129661825026	
HEBTilbrook	2018-04-29 04:45	0	2	Great sleep (despite my reservations about the weather). Good company and yummy food too, as well as awesome birds. Saw Barn Owl hunting at desk and this morning a red kite grabbing some breakfast.				990512483537440768	990470027215298560	BristowsReclaim WickenFenNT	https://twitter.com/HEBTilbrook/status/990512483537440768	
MikeCrawshaw4	2018-04-19 16:50	0	6	I see lapwing, curlew, buzzard, red kite, ravens, spotted woodpecker,barn owl, tawny owl?,wheatear, hen harrier, red& black grouse occasionally, dipper various duck, alot of small birds around the garden, sparrow hawk, peregrin,skylark & quite a few I don't know, + its keepered				987070857578151936	987055244965228545	essexwindyfarm	https://twitter.com/MikeCrawshaw4/status/987070857578151936	
nicholasriley24	2018-04-05 13:54	2	1	my Birds were harris 2 red kites from chicks barn owl macaw and ancient pereguin hen all blow torched even jess my cross dachshound jack russel decapitated by gangstas working for grimsby police peado Pickerdons & Hendersons https://twitter.com/ChesterFalconry/status/981903154605445120 …				981953209865592832			https://twitter.com/nicholasriley24/status/981953209865592832	https://pbs.twimg.com/tweet_video_thumb/DaBrgJwXcAAWbfG.jpg
MarkyBike	2018-04-02 15:06	1	3	Impromptu visit to Rutland this afternoon with @ therealphil68 to see the @ rutlandospreys. Other birds seen included 2 barn owls, red kites, redpoll, female brambling, little egret, linnets & red legged partridge.		@ therealphil68 @ rutlandospreys		980884307983110145			https://twitter.com/MarkyBike/status/980884307983110145	
TweetsByRuth	2018-04-01 17:42	0	1	Lots of birds of prey around here too. Always have nesting barn owls, few family of buzzards in the woods opposite, Hawks, and plenty of Red Kites. I'm very lucky to be here, surrounded by farms, river, mountains, woods, meadows, and some common land for miles.				980561043104653313	980542360567283713	ZwartblesIE	https://twitter.com/TweetsByRuth/status/980561043104653313	https://abs.twimg.com/emoji/v2/72x72/2764.png
deanoburns	2018-03-21 20:32	0	5	Cracking bird spotting today. Red kite on the way to tennis this morning. Barn owl on the way home from my on-call (which could plausibly called Ghost Bird) # twitcher			# twitcher	976617629979947008			https://twitter.com/deanoburns/status/976617629979947008	
dreaminglucid8	2018-03-01 03:26	0	0	My February harvest from the land. Spiritual alchemy, transforming death to life. Two sets of barn owl and one red hawk. These predatory birds hunt the same territory. One during the day the other at night. Both are birds of spiritual vision. Paired together it invokes the powe… pic.twitter.com/d6ck4ZIqRY				969126636623888385			https://twitter.com/dreaminglucid8/status/969126636623888385	https://pbs.twimg.com/media/DXMHigyXkAExi8I.jpg
AnneDewsnip	2018-02-17 05:09	0	2	Out early this morning, saw a buzzard, a sparrow hawk and a barn owl, as well as the usual red kites. How anyone could harm these beautiful birds is beyond my understanding!				964803970144317440	964781533298135040	NewsdeskHG	https://twitter.com/AnneDewsnip/status/964803970144317440	
InternetEh	2018-02-16 14:59	0	3	Top 5 bird colors 1. The violent on a scrub jay 2. when a black bird is kinda blue black 3. The red throat on a hummingbird 4. The pale green on a mourning dove 5. The pale white on a barn owl’s face				964589954100731904	964579763875594240		https://twitter.com/InternetEh/status/964589954100731904	https://pbs.twimg.com/profile_images/1014153442741239808/kzE3Ah3Q_normal.jpg
NorfolkPuffin	2018-02-15 09:11	0	0	All quiet on the east coast. 120 fieldfares, a barn owl and steady movement of red throated divers the bird highlights. Also muntjac, red deer, and this fossil.. Ideas? pic.twitter.com/7lQulJqgyi				964140180822220800			https://twitter.com/NorfolkPuffin/status/964140180822220800	https://pbs.twimg.com/media/DWFQXwLXcAELZGR.jpg
SmolStevieee	2018-02-11 21:42	0	0	||: I wanna make a bird account as well. Just torn between making it an animal or a shifter. ANd whether to be a red tailed eagle, wedge tailed eagle, barn owl or peregrine falcon				962879543412342784			https://twitter.com/SmolStevieee/status/962879543412342784	
barryjwill	2018-02-05 09:02	9	32	This mornings bird count whilst rolling up sheep fencing. 2 buzzards 1 red kite 2 kestrels 1 sparrow hawk 1 goshawk (probably) Oh and this majestic beauty of a barn owl hunting the hedge row next to me. # wildlife # farmlife # cantmovefordiversitypic.twitter.com/2PeYK4piiE			# wildlife # farmlife # cantmovefordiversitypic	960513898913959936			https://twitter.com/barryjwill/status/960513898913959936	https://pbs.twimg.com/profile_images/850714763709607938/Bw3aRLjI_normal.jpg
tim_j_stowe	2018-01-28 12:12	0	4	19 species recorded in my garden on big garden birdwatch this morning. Best birds: stock dove brambling. Barn owl and red kite flew overhead. # RSPBBigGardenBirdWatch			# RSPBBigGardenBirdWatch	957662703115558914			https://twitter.com/tim_j_stowe/status/957662703115558914	
Bubble_Gumydrop	2018-01-21 04:34	0	0	I wanted to update my harpy oc from before she had red wings, blue eyes, thin, purple-ish hair. No bird type species. Now she’s bigger in weight, has some makeup on, a tail, hair is shaved with one long feather, and has a species which is a Barn Owl WIP: her clothes pic.twitter.com/qW0VRy2PfQ				955010616183291904			https://twitter.com/Bubble_Gumydrop/status/955010616183291904	https://pbs.twimg.com/media/DUDhFdQV4AEnKEs.jpg
MahiquesPaul	2018-01-20 16:10	2	11	A say doing my bird race I struggled today picking up common species but had a great time highlights were tawny and barn owls little egret 4 goldeneye at teifi marshes female merlin Webley Red and black throated diver at Fishguard Fort I saw 79 species				954823569191657472			https://twitter.com/MahiquesPaul/status/954823569191657472	
martinsreader	2018-01-10 04:05	0	15	I was very excited to be sent a video by a teacher of a barn owl quartering the field adjacent to High Upfold - the one bird I was desperate to see make a return to Cranleigh to add to tawny owl, little owl, kestrel, sparrowhawk, buzzard & red kite. @ Hawkandowluk		@ Hawkandowluk		951017142928977920			https://twitter.com/martinsreader/status/951017142928977920	
BenDymond1	2017-12-05 11:45	0	3	Bird of prey sightings today : Sparrowhawk, buzzard, red kite, barn owl and my first GOSHAWK!				938087057792143361			https://twitter.com/BenDymond1/status/938087057792143361	https://abs.twimg.com/emoji/v2/72x72/1f603.png
JeffreyMWard	2017-11-23 21:12	0	29	I am currently at 299 Life Birds ... i wonder who will be my 300th! Northern Saw-Whet? Canvasback? Barn Owl? King Eider? Red or White-Winged Crossbill? Oh!... what about a Evening Grosbeak? We shall see...				933881099415117824			https://twitter.com/JeffreyMWard/status/933881099415117824	https://abs.twimg.com/emoji/v2/72x72/1f914.png
EcoEireann	2017-11-22 07:12	1	1	This Image is for our # Ornithological Services . We undertaken many # bird surveys including: breeding Golden & White-tailed Eagle, # Osprey, # HenHarrier, # Peregrine, # Goshawk, # Merlin, # owls: short-eared, Barn, Tawny & Long-eared, Black & Red Grouse, # Waterbirds # BirdConservationpic.twitter.com/AP5E97AaBL			# Ornithological # bird # Osprey # HenHarrier # Peregrine # Goshawk # Merlin # owls # Waterbirds # BirdConservationpic	933307139858272256			https://twitter.com/EcoEireann/status/933307139858272256	https://pbs.twimg.com/media/DPPFbNvXkAAbVrl.png
MyCaptainSlappy	2017-11-18 20:14	0	2	Possibly. Sometimes true. We had pigeons get picked off by red hawks...sometimes, no blood at all. Remember, hawks ain't people...they don't like BBQ'd wings for their superbowls. Same with hooty barn owls. Other animals are messy with it, birds hunting usually ain't.				932054422720536576	931741882073444352	spaceykcbee MichaelEmerson	https://twitter.com/MyCaptainSlappy/status/932054422720536576	
Skatebutch	2017-10-25 17:40	0	0	Leading on from my encounter with the barn owl, this evening I came across a red kite on the road. That really is a big fucking bird.				923303295812362240			https://twitter.com/Skatebutch/status/923303295812362240	https://pbs.twimg.com/profile_images/909896214094782466/FU5SQPI__normal.jpg
LathamAlec	2017-09-28 13:52	0	0	The bird on the bonnet far left - barn owl, surely?				913461340508958721	913281238177341440	Red_eyed_Video MarkAvery	https://twitter.com/LathamAlec/status/913461340508958721	
NotSoWittyUN	2017-08-16 12:06	0	1	Some of the birds at the Falconry Centre. There's a Harris Hawk, Red Kite, Barn Owl & a couple… https://www.instagram.com/p/BX3Fs3vDsGd/				897852057503186959			https://twitter.com/NotSoWittyUN/status/897852057503186959	
davidcaplin46	2017-08-12 18:17	0	1	Yeah it's a north American lovely looking bird we get on average five red kites a day and there's a pair of buzzards nearby and a barn owl				896495959995273218	896492820755881984	GBH68	https://twitter.com/davidcaplin46/status/896495959995273218	
strouper2	2017-07-23 20:02	0	0	Two transport rescues this weekend. A Barn Owl and a Red Tailed Hawk (images only, not the actual bird). I am... http://fb.me/93fRaBdvV				889274572335456256			https://twitter.com/strouper2/status/889274572335456256	
Lochvisions	2017-07-08 10:30	1	0	Update on our bird of prey tour, we are now going for short eared owl, barn owl, golden eagle, red kites, and sea... http://fb.me/2dJH5CPUP				883694683385409536			https://twitter.com/Lochvisions/status/883694683385409536	
edwindharma_s	2017-06-07 12:05	0	0	RED Eyes # tytoalba # bird # barnowl # barn_owl # kebumen # bv6000 # photooftheday @Pondok Mertuwa Endah https://www.instagram.com/p/BVC1-gUhSfl/			# tytoalba # bird # barnowl # barn_owl # kebumen # bv6000 # photooftheday	872484718586994688			https://twitter.com/edwindharma_s/status/872484718586994688	
DavidWalsh22	2017-06-05 02:54	5	48	An unexpected Red Kite, an awesome Barn Owl and a calling Cuckoo were the highlights of my @ _BTO @ BBS_birds survey this morning # 30dayswildpic.twitter.com/CJbw1lZWbi		@ _BTO @ BBS_birds	# 30dayswildpic	871621224878804992			https://twitter.com/DavidWalsh22/status/871621224878804992	https://pbs.twimg.com/media/DBie3vXXoAYnwp7.jpg
RobPople	2017-05-31 07:38	1	2	2nd Waterways @ BBS_birds visit earlier. Mute Swans w/ cygnets, Common Tern & Kingfisher, but highlights Barn & Little Owls plus a Red Kite!		@ BBS_birds		869880725885112321			https://twitter.com/RobPople/status/869880725885112321	
red_rose68	2017-04-23 15:01	0	0	# Scientists Warn: Birds and Barn Owls Join Bees As # Pesticide Victims: Let's Hold Corporations To Account # EarthDay http://thndr.me/rTIFlS			# Scientists # Pesticide # EarthDay	856221411609849860			https://twitter.com/red_rose68/status/856221411609849860	
WhimsyPhones	2017-03-28 17:04	0	1	herons, red winged song birds, ravens, golden eagles, great horned owls, barn owls, squids				846830270615502848	846824213067411457	Caramiellas	https://twitter.com/WhimsyPhones/status/846830270615502848	
photoDaleMiles	2017-03-27 14:28	3	8	Great day to see the birds fly @ ChesterFalconry today, Gyr Falcon, Red tailed Buzzard, Merlin, and Barn owl @ fm_kieran @ falconrypics mar 27pic.twitter.com/r3kHiufWRO		@ ChesterFalconry @ fm_kieran @ falconrypics		846428790217695232			https://twitter.com/photoDaleMiles/status/846428790217695232	https://pbs.twimg.com/media/C78diAZX0AAZjuI.jpg
Frugaldom	2017-03-06 13:14	0	0	As they fell the nearby forest, we plant native saplings. This may be ideal for barn owls but how can we help other birds & red squirrels? pic.twitter.com/VJMH2NHc68				838815139520475136			https://twitter.com/Frugaldom/status/838815139520475136	https://pbs.twimg.com/media/C6QQlY3XEAIFtW7.jpg
n0o0p3	2017-02-15 08:19	0	0	I really like how my dads spirit animal is a red tailed hawk and mine is a barn owl. They're both birds that's gotta mean somethinggg				831855566268018688			https://twitter.com/n0o0p3/status/831855566268018688	
sedgywarbler	2016-08-09 10:26	2	25	What with Barn Owl, Red Kite, Buzzard & this beaut you could say it was a good morning for Birds of Prey @ Cresswellpic.twitter.com/1FQgTBocMo		@ Cresswellpic		763018598088572929			https://twitter.com/sedgywarbler/status/763018598088572929	https://pbs.twimg.com/media/CpbJAEwWEAEUDVy.jpg
twitchoftheday	2016-05-23 06:56	0	0	thanks for the advice but Red kite is a common bird of Brandenburg. even in the emblem. want puffins peregrine barn owl by day				734699455992193024	734661554705162240	MaliHalls	https://twitter.com/twitchoftheday/status/734699455992193024	
returnofcat	2016-05-02 11:24	0	0	@citrikins YEAH! Like a barn owl is definitely a lunar bird to me but red tailed hawks are the sun and sky				727156763238236160			https://twitter.com/returnofcat/status/727156763238236160	
FreyjasGal	2016-04-12 12:18	0	1	@ SleepyDruid So many wild birds and animals here. It's wonderful! Red tailed kites, buzzards (Saw 4 in a mile), kestrels, tawny, barn owls..		@ SleepyDruid		719922682008104960	719912459075788801	SleepyDruid	https://twitter.com/FreyjasGal/status/719922682008104960	
sara_mindtape	2016-03-22 23:28	0	0	@ msBOHemian blue birds, cardinals, little finches, humming birds, red tailed hawks, barn owls....need I continue?		@ msBOHemian		712481011267809280	712479668218122240	msBOHemian	https://twitter.com/sara_mindtape/status/712481011267809280	
taytanya1	2016-01-20 21:23	0	0	Beaver Dam, Birds of Prey Red Tail Hawk and The Barn Owl				689996786052812801			https://twitter.com/taytanya1/status/689996786052812801	
White1939D	2016-01-16 15:19	0	1	Holkham best birds 4 barn owls 1000s pink feet red kite c20 snow buntings grey partridges gt white egret whitefront 51 species and sunny				688455541010632704			https://twitter.com/White1939D/status/688455541010632704	
SOAR_Birds	2016-01-06 14:46	0	0	Ever wanted to meet and learn about a pied crow, red tail hawk, barn or screech owl? Join us on Saturday at the... http://fb.me/2zWMDHSZz				684823497890123776			https://twitter.com/SOAR_Birds/status/684823497890123776	
Snettisher	2015-12-15 10:00	0	2	@ MaliHalls Lovely Barn Owl pic! Best damp bird of the day here was Red Kite near Walsingham, cruising extra low due to poor visibility.		@ MaliHalls		676778823069732864	676765351913328641	MaliHalls	https://twitter.com/Snettisher/status/676778823069732864	
phil_terry	2015-11-14 08:24	3	1	Top 10 UK National Bird Voting: Barn Owl, Blackbird, Blue Tit, Kingfisher, Hen Harrier, Red Kite, Wren, Mute Swan, Puffin, Robin # TetZooCon			# TetZooCon	665520649872531456			https://twitter.com/phil_terry/status/665520649872531456	
WstLondonGarden	2015-11-13 08:54	1	8	The # Madagascar Red # Owl (Tyto soumagnei) or Grass Owl in the barn owl family is a very special bird indeed. pic.twitter.com/dbcv5FJLW5			# Madagascar # Owl	665165788161155072			https://twitter.com/WstLondonGarden/status/665165788161155072	https://pbs.twimg.com/media/CTskwAdWUAA-GG2.jpg
alex_brookes7	2015-06-11 03:35	0	0	@ birdersagainst @ GeorgiaLocock @ HenryHenHarrier You would think that conservsation bird are more british such as the red kite and barn owl.		@ birdersagainst @ GeorgiaLocock @ HenryHenHarrier		608900284161617921	608899611856646144	birdersagainst	https://twitter.com/alex_brookes7/status/608900284161617921	
onebirdsong	2015-06-11 03:24	0	0	Robin won then :) Brilliant that Barn owl came 2nd,Red Kite 7th+Hen Harrier 9th! :) well done @ bird_vote @ urbanbirder		@ bird_vote @ urbanbirder		608897544559685633			https://twitter.com/onebirdsong/status/608897544559685633	
ge0_ff	2015-05-17 10:32	0	0	Finalists in National British Bird contest are Barn Owl Blackbird Blue Tit Hen Harrier Kingfisher Mute Swan Puffin Red Kite Robin Wren				599945512087855104			https://twitter.com/ge0_ff/status/599945512087855104	
BridgemanImages	2015-05-07 04:41	0	2	A Concert of Birds: a Puffin, Jay, Great Tit, Starling, Magpie, Red Bunting & Barn Owl: http://bit.ly/1zO23wl pic.twitter.com/dhvC9NpMiF				596233389218332673			https://twitter.com/BridgemanImages/status/596233389218332673	https://pbs.twimg.com/media/CEY_G4lWgAATyWd.jpg
FinGlackenSmith	2015-05-07 03:53	0	0	@ Alain_Tolhurst Honestly, they are my most favourite birds. Barn owls are great - not disputing that. But they're no red breast.		@ Alain_Tolhurst		596221293252485121	596220136908005376	Alain_Tolhurst	https://twitter.com/FinGlackenSmith/status/596221293252485121	
wildegeese	2015-05-06 12:37	0	0	Just voted for the wren as Britains favourite # Bird - tempted by Red Kite, Puffin, Barn Owl - hell like 'em all			# Bird	595990752888549376			https://twitter.com/wildegeese/status/595990752888549376	
EdinBirdwatcher	2015-05-06 06:01	0	0	Barn Owl Blackbird Blue Tit Hen Harrier Kingfisher Mute Swan Puffin Red Kite Robin & Wren are your candidates for @ bird_vote		@ bird_vote		595891179234992128			https://twitter.com/EdinBirdwatcher/status/595891179234992128	
sharpeangle	2015-05-05 07:55	1	0	Britain’s National Bird 2015: 2-5 Robin,9-2 Barn Owl, 7 Blackbird,8 Blue Tit, 10 Kingfisher,Mute Swan,Wren,14 Hen Harrier,20 Puffin,Red Kite				595557546116677634			https://twitter.com/sharpeangle/status/595557546116677634	
ThermosView	2015-04-25 15:12	0	0	Fantastic day of wildlife in Sussex! Birds: red kite & barn owl. Butterflies: brimstone & orange tip. Badger setts! pic.twitter.com/xXLrYqofR4				592043607848259585			https://twitter.com/ThermosView/status/592043607848259585	https://pbs.twimg.com/media/CDdcfZJWgAAi3oI.jpg
DawnCansfield	2015-04-25 02:23	0	0	Wren, barn owl, robin, kingfisher, blue tit, hen harrier, blackbird, red kite, mute swan or puffin for national bird? http://www.bbc.com/earth/story/20150417-vote-for-britains-national-bird?utm_content=buffer7c233&utm_medium=social&utm_source=twitter.com&utm_campaign=buffer …				591850019327758336			https://twitter.com/DawnCansfield/status/591850019327758336	
Ewing_birds	2015-04-04 12:33	0	1	Rough-legged Buzzard, Barn Owl x3, Peregrine, Red Kite, Kestrals, Sparrowhawks, Common Buzzards and some Chiffchaffs # norares # whocares			# norares # whocares	584393367913635840			https://twitter.com/Ewing_birds/status/584393367913635840	
sharpeangle	2015-03-19 12:02	0	0	GB’s National Bird:4/7 Robin(from 2/1),4 Barn Owl, 6 B'bird, 8 Hen Harrier, Kingfisher,14 Blue Tit,Red Kite,Wren,20 Mute Swan,22/1 Puffin				578587302810816512			https://twitter.com/sharpeangle/status/578587302810816512	
sharpeangle	2015-03-19 04:03	1	0	Latest 'Britain's National Bird' odds- 2/1 Robin; 4/1 Barn Owl; 6 Hen Harrier/Kingfisher; 10 Blue Tit/Red Kite etc http://sports.williamhill.com/bet/en-gb/betting/e/7353528/Britain%2527s%2bNational%2bBird%2b2015.html …				578466894967136256			https://twitter.com/sharpeangle/status/578466894967136256	
EoinMcDowell	2015-03-18 19:32	0	0	Who will you vote for as Britain's national bird? I'm torn between the Barn Owl and Red Kite http://www.votenationalbird.com # birdvote @ bird_vote		@ bird_vote	# birdvote	578338302526361600			https://twitter.com/EoinMcDowell/status/578338302526361600	
sharpeangle	2015-03-18 07:56	0	0	Britain's National Bird 2015:2/1 Robin,4/1 Barn Owl,6/1 Hen Harrier, 10/1 Kingfisher, Blue Tit,Red Kite, 12/1 Blackbird,14 Mute Swan,Puffin.				578163159862771713			https://twitter.com/sharpeangle/status/578163159862771713	
slough_womble	2015-03-17 13:54	0	0	So the short list for National Bird are Robin, Wren, Blackbird, Blue Tit, Swan, Red Kite, Barn Owl, kingfisher, Puffin & Hen Harrier 1/2				577890806280941569			https://twitter.com/slough_womble/status/577890806280941569	
DCFC_98	2015-03-17 11:06	0	1	@ DCFC_98 how British a heated argument over a national bird me the Barn Owl my boss turns to me you fucking nuts it should be the Red Kite		@ DCFC_98		577848513561780224	577848194811449344	DCFC_98	https://twitter.com/DCFC_98/status/577848513561780224	
katjaphoto	2015-03-16 18:33	0	0	@ paintermann @ LeeWareing http://www.votenationalbird.com/#vote r u voting? Can't decide, Black Bird, Red Kite, Barn Owl is a little too Harry Potter		@ paintermann @ LeeWareing		577598557324238849	577597824193458177	katjaphoto	https://twitter.com/katjaphoto/status/577598557324238849	
BhamDonkeys	2015-03-16 17:23	2	3	Which should be Britain's national bird: Short list of 10, red kite, puffin, barn owl, kingfisher, blue tit, robin? http://ind.pn/1AJQdNw				577580903515463680			https://twitter.com/BhamDonkeys/status/577580903515463680	
nicolawriting	2015-03-16 06:16	0	0	Can't decide which National Bird to vote for out of the shortlist! Narrowed it down to Red Kite, Barn Owl and Blackbird ...				577413182773415936			https://twitter.com/nicolawriting/status/577413182773415936	
ThomsonEcology	2015-03-16 04:43	0	0	You can vote for Britain's national bird here: http://www.votenationalbird.com/ Robin, barn owl, red kite.......what is your favourite?				577389789583794176			https://twitter.com/ThomsonEcology/status/577389789583794176	
SJG99	2015-03-16 04:27	0	0	Can't see the point of choosing birds that nobody sees. Red kites, kingfishers, barn owls, hen harriers etc. It's blackbird for me.				577385802491170818			https://twitter.com/SJG99/status/577385802491170818	
theglas	2015-03-14 05:19	0	0	Birds of Prey by Andrew & Alan Glasby (Peregrine Falcon, Red Kite and Barn Owl) see more at http://ag-sculptures.co.uk pic.twitter.com/Mpt6NFN9xj				576673917173129216			https://twitter.com/theglas/status/576673917173129216	https://pbs.twimg.com/media/CADB3WyWcAATuS2.jpg
Godalming_birds	2015-03-13 14:39	0	1	Thorncombe St: 1 Great Black-backed Gull S over Upper Bonhurst (1st year record), 1 Red Kite & 1 Little Owl hunting at dusk (Rowe Barn Farm)				576452558878830592			https://twitter.com/Godalming_birds/status/576452558878830592	
GusAriss	2015-01-17 14:40	0	0	@ grimsbury_birds Apparently Little, Tawny and Barn Owl breed in the parkland, but birding within the boundary involves red tape & politics		@ grimsbury_birds		556536536637112320	556419312932888578	grimsbury_birds	https://twitter.com/GusAriss/status/556536536637112320	https://abs.twimg.com/emoji/v2/72x72/1f44e.png
Godalming_birds	2015-01-02 13:26	0	3	Today's highlights with @ mostlyscarce: Raven, Red Kite, 4 Goosander, 51 Egyptian Geese, Chiffchaff, Water Rail, Barn Owl & Short-eared Owl!		@ mostlyscarce		551082156009988099			https://twitter.com/Godalming_birds/status/551082156009988099	
