username	date	retweets	favorites	text	geo	mentions	hashtags	tweetid	conversationid	replyto	permalink	imagelink
Russpc76	2014-11-23 12:07	2	8	@ GlosterBirder 5 SEO,2 Barn Owls,3 Red Kites, 2 Kestrels,1 Merlin at Hawling this PM with @ TigerGaret @ Mad_About_Birds @ Ben909 # glosbirds		@ GlosterBirder @ TigerGaret @ Mad_About_Birds @ Ben909	# glosbirds	536566755645456385			https://twitter.com/Russpc76/status/536566755645456385	
musicalcat	2014-10-29 07:46	0	0	# TV I watched "Autumnwatch" (1). Otters. Life in waterways. Starlings. Red deer's throat. Birds, fish and drugs. Barn owls and ivy bees.			# TV	527426344880443392			https://twitter.com/musicalcat/status/527426344880443392	
susanbrack	2014-09-26 11:10	0	0	Relisted as auction # Folkart Country RED BARN # OWL Bird Full Moon Stars SFA Susan Brack Art ACEO EBSQ http://www.ebay.com/itm/Country-RED-BARN-OWL-Bird-Full-Moon-Stars-OOAK-SFA-Susan-Brack-Art-ACEO-EBSQ-/201179660227?roken=cUgayN&soutkn=9gTc58 … via @ eBay		@ eBay	# Folkart # OWL	515518834879365120			https://twitter.com/susanbrack/status/515518834879365120	
amanda_skull	2014-08-23 16:08	0	0	Talgarth @ bird_vote Joint 3rd place (7 votes): Red Kite, Barn Owl, Kingfisher		@ bird_vote		503272627423956992			https://twitter.com/amanda_skull/status/503272627423956992	
solarisfire	2014-08-19 10:06	1	1	@ TatianaUlak @ Natures_Voice @ bird_vote @ urbanbirder I went with: Mute Swan, Mallard, Golden Eagle, Red Kite, Barn Owl, Robin		@ TatianaUlak @ Natures_Voice @ bird_vote @ urbanbirder		501732001842737152	501716632470032384	TatianaUlak	https://twitter.com/solarisfire/status/501732001842737152	
louiseminchin	2014-08-18 02:58	2	7	Barn Owl, Swallow, Red Kite, Robin, Kestrel, Sparrow, or Golden Eagle, what should our national bird be? What are your suggestions and why?				501261861279776768			https://twitter.com/louiseminchin/status/501261861279776768	
neil_lenihan	2014-06-02 15:57	0	0	Nature, red in tooth and claw. Watching Barn Owl chicks chug down small birds... & then SLUGS!!! Bleuuuur! # springwatch			# springwatch	473554023145308160			https://twitter.com/neil_lenihan/status/473554023145308160	
xxroamxx	2014-05-28 00:35	0	0	@ tory_bird_sky @ red_barsha 뜬금없이 난입했습니다. 아마 Barn Owl 헛간 올빼미인 것 같아요! ㅋㅋㅋ		@ tory_bird_sky @ red_barsha		471510146808434688	469743932679524352	tory_bird_sky	https://twitter.com/xxroamxx/status/471510146808434688	
stampbooklet	2014-04-17 11:45	0	0	LITHUANIA, April 5: booklet with 3x 2L (Barn Owl) and 3x 3L (Pygmy Owl). Endangered birds, both included in red book. pic.twitter.com/F98Os3YA3d				456820648082284544			https://twitter.com/stampbooklet/status/456820648082284544	https://pbs.twimg.com/media/Blbz9YeCIAAXuJb.jpg
MalHudson1	2014-04-14 12:21	0	0	Update for bird people- red kite, chiffchaff. Stunning barn owl, swallow, tree creeper all seen on # Clarendon Way. # twitcher			# Clarendon # twitcher	455742661081968640			https://twitter.com/MalHudson1/status/455742661081968640	
escapingirl	2014-03-23 18:11	0	0	@ NeioGeo just love all birds really :3 owls? I love barn owls the most. Big cats - snow leopards. I love red raccoons the most :D		@ NeioGeo		447858245588492288	446626575644360704	NeioGio	https://twitter.com/escapingirl/status/447858245588492288	
benphalan	2014-03-07 07:52	0	0	@ SarahHLuke ...& some easy ones, e.g. common birds (song thrush, robin, chaffinch, chiffchaff, tawny owl, barn owl), humpback whale, red fox		@ SarahHLuke		441919232331481088	441573985676165120	SarahHLuke	https://twitter.com/benphalan/status/441919232331481088	
Lincsbirding	2014-02-27 17:53	0	0	Lincs Bird Reports • Far Ings NNR 26th Feb 2014: A red kite, buzzard and a barn owl today.Statis... http://bit.ly/NAiYLp # Lincsbirding			# Lincsbirding	439171394555748353			https://twitter.com/Lincsbirding/status/439171394555748353	
JohnisJae	2014-02-24 16:34	0	0	Moody # skies at @ EWTFingringhoe in # Essex the other day. Many # birds seen too, Bittern, Barn Owl, Red Breasted Merganser, Marsh Harrier		@ EWTFingringhoe	# skies # Essex # birds	438064374906122241			https://twitter.com/JohnisJae/status/438064374906122241	
nosweetnothings	2013-11-24 16:14	0	0	@ gemmajoobjoob Barn owls are beautiful. Owls are possibly my favourite birds. I love a red kite too. I sound like a geek!		@ gemmajoobjoob		404719632978051072	404717588892368896	gemmajoobjoob	https://twitter.com/nosweetnothings/status/404719632978051072	
sfaucette	2013-11-09 19:46	0	0	carolina raptor center, charlotte, nc a barn owl and a red tail hawk are just two of the birds they take care of... http://fb.me/1jhw1Gcg1				399337284887408640			https://twitter.com/sfaucette/status/399337284887408640	
The_Art_Store	2013-11-06 17:48	0	0	Aceo Original Owl red barn bird art $9.99 http://bit.ly/1bZCYNW # art # Painting			# art # Painting	398220338669944833			https://twitter.com/The_Art_Store/status/398220338669944833	
fadeupyoursmile	2013-10-02 16:17	0	0	@ ievenden Barn owls, red kites (My current favourite bird of prey) time lapse, a Fiennes ... It's good!		@ ievenden		385498727097446400	385496416824467457	ievenden	https://twitter.com/fadeupyoursmile/status/385498727097446400	
TheEnglishExile	2013-07-03 02:47	0	0	@ WildlifeMag Barn Owl, Red Kite, Marsh and Hen Harrier, Blackredstart would be best at work birds do far		@ WildlifeMag		352317664556883970	352097834121703425	WildlifeMag	https://twitter.com/TheEnglishExile/status/352317664556883970	
NickyCockburn	2013-06-29 18:25	0	0	RSPB worship the 3 bladed bird killer. "Rare " that birds are killed. Hen Harriers, Red Kite, Barn Owls & Needle Tail. It's a cult thing				351104152660738048			https://twitter.com/NickyCockburn/status/351104152660738048	
AlicryTrinkets	2018-07-21 15:13	0	0	Red floral porcelain # owl crystal silver # necklace birthday anniversary special keepsake gift # handmade unique bird owl lover gift Summer https://etsy.me/2NBEr5V via @ Etsy		@ Etsy	# owl # necklace # handmade	1020748720999141376			https://twitter.com/AlicryTrinkets/status/1020748720999141376	
PrimeBelize	2018-07-21 04:00	1	0	Birding in Belize ------------------------------ See many of the 500 + species of # birds in # Belize. Highlights for most visitors include the keel-billed # toucan, scarlet # macaw, jabiru # stork, red legged honey creeper, grey # catbird # owl. https://www.kawiiltours.com/belize-adventure-tours/belize-zoo/ …pic.twitter.com/iXJDFr0wfz			# birds # Belize # toucan # macaw # stork # catbird # owl	1020579142423769088			https://twitter.com/PrimeBelize/status/1020579142423769088	https://pbs.twimg.com/media/DinTUiIWAAAF2HZ.jpg
SchwaVintage	2018-07-20 09:00	0	0	1970s, Vintage, Mother-of-Pearl Owl pin, white, costume jewelry, bird, mother of pearl, brooch, shell http://tuppu.net/a12cf9e9 # Red https://www.etsy.com/SchwaVintageDestash/listing/628828041/1970s-vintage-mother-of-pearl-owl-pin?utm_source=etsyfu&utm_medium=api&utm_campaign=api …			# Red	1020292458377302016			https://twitter.com/SchwaVintage/status/1020292458377302016	
RedAporoBird	2018-07-20 03:52	0	1	Listen to Fiji Water by OwlCityOfficial # np on # SoundCloud 最近のOwl Cityの中では一番好き https://soundcloud.com/owlcityofficial/fiji-water …			# np # SoundCloud	1020214806685442048			https://twitter.com/RedAporoBird/status/1020214806685442048	
mariamaclaren	2018-07-19 15:39	0	0	Check out Fryetts Fabric Blue & Red Owl owls Birds Scatter Cushion Cover 16" https://www.ebay.co.uk/ulk/itm/142875048019 … @ eBay		@ eBay		1020030356496543746			https://twitter.com/mariamaclaren/status/1020030356496543746	
thebirdy123	2018-07-19 00:22	0	1	Black an chest nut eagle Red kite Blakiston's fish owl Marsh owl Mottled wood owl My name is birdy yet I barley know that much about birds				1019799530563424256	1019786835168546818	zombiemiki	https://twitter.com/thebirdy123/status/1019799530563424256	
B_M_Finnigan	2018-07-18 09:41	0	1	Mars now rises well before Midnight and is positively blazing before sunrise, so whether you’re a night owl or an early bird, you can get a great view of our red neighbor.				1019577787747745792	1019575358486540288		https://twitter.com/B_M_Finnigan/status/1019577787747745792	https://pbs.twimg.com/profile_images/986361897250254848/yn3u2gvK_normal.jpg
TheRedSorceress	2018-07-18 03:43	0	7	A snowy owl in one of the antique shops ...I know these things divide opinion but I thought what a majestic bird he was ..reminds me of Hedwig from Harry Potter .... pic.twitter.com/qVauUqiH92				1019487824284999682			https://twitter.com/TheRedSorceress/status/1019487824284999682	https://pbs.twimg.com/media/DiXyw27WAAEpsys.jpg
addictionguy	2018-07-16 23:29	1	6	As it happens, the red eyes I saw belong to an owl. Apparently they are one of the few nocturnal birds The scratching was due to a nest a hawk made on the top of my roof, and the banging was a woodpecker				1019061615587520512			https://twitter.com/addictionguy/status/1019061615587520512	
Treestumped	2018-07-15 19:10	0	1	Ya, I think a lot of people see an owl/bird/thing with a bush underneath and assume it's a monster? Like the flatwoods monster was suspiciously green with red eyes lol.				1018633932089241600	1018353478261829632	marissadraws	https://twitter.com/Treestumped/status/1018633932089241600	
OrangeFoto	2018-07-15 15:12	0	0	Spotted Towhee on a tree (автор фото sirotin) # black woodpecker,northern spotted owl,eater,american robin,robin,pine grosbeak,great spotted woodpecker,striated caracara,saw whet owl,great tit,plumage,scops owl,animal,bird,beautiful,white,black,red,orange,tree,brown,canada,wi… pic.twitter.com/0ok45qN4NV			# black	1018574032084635651			https://twitter.com/OrangeFoto/status/1018574032084635651	https://pbs.twimg.com/media/DiKzrxpXUAIRzHA.jpg
radiogrmljavina	2018-07-15 12:10	0	0	Owl oxidant - Birds are Crying, Red Light is Upon Us				1018528238770049026			https://twitter.com/radiogrmljavina/status/1018528238770049026	
chosenhorse2	2018-07-15 00:55	0	0	I've noticed in the last couple months since May that not 1 single bird flying in and out in the trees no sparrows, robins, blackbirds, woodpeckers, kestrels or even a red tailed hawk, which means only 1 thing a great horned owl is living there. pic.twitter.com/I1iMCumMmI				1018358396850921472			https://twitter.com/chosenhorse2/status/1018358396850921472	https://pbs.twimg.com/media/DiHvjw6UEAALMdd.jpg
countrydudeuk	2018-07-12 20:01	0	1	One of the most amazing aspects of living in Ennerdale, is the wildlife. Barn Owls, bats, Roe Deer, Red Squirrels, Polecats, Buzzards, Peregrine Falcons, all manner of other birds,… https://www.instagram.com/p/BlJqSqulHLI/?utm_source=ig_twitter_share&igshid=1mrf8i7o49lt2 …				1017559572930879491			https://twitter.com/countrydudeuk/status/1017559572930879491	
AlsCraftyCorner	2018-07-11 07:02	0	0	Owl bag Small homemade, Snappy Clutch bag, bird Fabric Pouch, Owl lovers gift, Black and red color, gift for a friend, thank you token gifts http://tuppu.net/4917c100 # AlsCraftyCorner # Etsy # HolidayGiftingpic.twitter.com/0Vbxnq1l15			# AlsCraftyCorner # Etsy # HolidayGiftingpic	1017001247054888965			https://twitter.com/AlsCraftyCorner/status/1017001247054888965	https://pbs.twimg.com/media/Dh0dPf2VAAAFOKu.jpg
CostumDezign80	2018-07-10 23:14	0	0	Buy now special for you : https://www.redbubble.com/people/galihart/works/29942305-retro-wood-owl?p=sticker&rel=carousel … Retro wood Owl Stickers # stickers # retro # classic # vintage # coffee # bean # red # orange # hedwig # owl # books # magic # wizard # bird # heart # hoot # indigo # love # pattern # valentinesday # shelter # folk # chic # cute # steampunk			# stickers # retro # classic # vintage # coffee # bean # red # orange # hedwig # owl # books # magic # wizard # bird # heart # hoot # indigo # love # pattern # valentinesday # shelter # folk # chic # cute # steampunk	1016883452518412289			https://twitter.com/CostumDezign80/status/1016883452518412289	
CustomDezign	2018-07-10 23:14	0	0	Buy now special for you : https://www.redbubble.com/people/galihart/works/29942305-retro-wood-owl?p=sticker&rel=carousel … Retro wood Owl Stickers # stickers # retro # classic # vintage # coffee # bean # red # orange # hedwig # owl # books # magic # wizard # bird # heart # hoot # indigo # love # pattern # valentinesday # shelter # folk # chic # cute # steampunk			# stickers # retro # classic # vintage # coffee # bean # red # orange # hedwig # owl # books # magic # wizard # bird # heart # hoot # indigo # love # pattern # valentinesday # shelter # folk # chic # cute # steampunk	1016883365373345792			https://twitter.com/CustomDezign/status/1016883365373345792	
CustomDezign	2018-07-10 23:09	0	0	Buy now special for you : https://www.redbubble.com/people/galihart/works/29942305-retro-wood-owl?p=iphone-case&rel=carousel … Retro wood Owl iPhone Cases & Covers # iphone # retro # classic # vintage # coffee # bean # red # orange # hedwig # owl # books # magic # wizard # bird # heart # hoot # indigo # love # pattern # valentinesday # shelter # folk # chic # cute # steampunk			# iphone # retro # classic # vintage # coffee # bean # red # orange # hedwig # owl # books # magic # wizard # bird # heart # hoot # indigo # love # pattern # valentinesday # shelter # folk # chic # cute # steampunk	1016882165865275392			https://twitter.com/CustomDezign/status/1016882165865275392	
CostumDezign80	2018-07-10 22:50	0	0	Buy now special for you : https://www.redbubble.com/people/galihart/works/29942305-retro-wood-owl?p=throw-pillow … Retro wood Owl Throw Pillows # pillow # vintage # owl # retro # animals # bird # naturnal # classic # red # hedwig # magic # indigo # love # pattern # valentine # shelter # steampunk			# pillow # vintage # owl # retro # animals # bird # naturnal # classic # red # hedwig # magic # indigo # love # pattern # valentine # shelter # steampunk	1016877321859391488			https://twitter.com/CostumDezign80/status/1016877321859391488	
CustomDezign	2018-07-10 22:50	0	0	Buy now special for you : https://www.redbubble.com/people/galihart/works/29942305-retro-wood-owl?p=throw-pillow … Retro wood Owl Throw Pillows # pillow # vintage # owl # retro # animals # bird # naturnal # classic # red # hedwig # magic # indigo # love # pattern # valentine # shelter # steampunk			# pillow # vintage # owl # retro # animals # bird # naturnal # classic # red # hedwig # magic # indigo # love # pattern # valentine # shelter # steampunk	1016877281917014016			https://twitter.com/CustomDezign/status/1016877281917014016	
PrimeBelize	2018-07-07 13:45	0	0	Birding in Belize ------------------------------ See many of the 500 + species of # birds in # Belize. Highlights for most visitors include the keel-billed # toucan, scarlet # macaw, jabiru # stork, red legged honey creeper, grey # catbird # owl. https://www.kawiiltours.com/belize-adventure-tours/belize-zoo/ …pic.twitter.com/pcECpHguzU			# birds # Belize # toucan # macaw # stork # catbird # owl	1015652934682644482			https://twitter.com/PrimeBelize/status/1015652934682644482	https://pbs.twimg.com/media/DhhS9g5WsAELrbr.jpg
_Sound_Around_	2018-07-07 03:01	0	0	Political Harassment Is for the Birds What happened at the Red Hen is reminiscent of the way mobbing crows attack and eagle or an owl. https://www.wsj.com/articles/political-harassment-is-for-the-birds-1530914103?mod=rss_opinion_main … http://bitly.com/2sjBBbW				1015491034090999809			https://twitter.com/_Sound_Around_/status/1015491034090999809	
jimstroup	2018-07-07 03:01	0	0	What happened at the Red Hen is reminiscent of the way mobbing crows attack and eagle or an owl, writes Lance Morrow https://www.wsj.com/articles/political-harassment-is-for-the-birds-1530914103 … via @ WSJOpinion - "The mobbing birds—this is the dangerous part—believe that their righteousness supersedes the Constitution." Read it all		@ WSJOpinion		1015490969968566272			https://twitter.com/jimstroup/status/1015490969968566272	
IndianEditorial	2018-07-07 00:59	0	0	[WSJ] Political Harassment Is for the Birds: What happened at the Red Hen is reminiscent of the way mobbing crows attack and eagle or an owl. http://dlvr.it/QZlCV6 pic.twitter.com/otTpsv5oJ0				1015460177066147840			https://twitter.com/IndianEditorial/status/1015460177066147840	https://pbs.twimg.com/media/DhejpjUUwAE1Two.jpg
AlsCraftyCorner	2018-07-06 16:02	1	0	Owl bag Small homemade, Snappy Clutch bag, bird Fabric Pouch, Owl lovers gift, Black and red color, gift for a friend, thank you token gifts http://tuppu.net/4917c100 # AlsCraftyCorner # Etsy # GiftingGuidepic.twitter.com/lbatVaPG11			# AlsCraftyCorner # Etsy # GiftingGuidepic	1015325201863729154			https://twitter.com/AlsCraftyCorner/status/1015325201863729154	https://pbs.twimg.com/media/Dhco48EVMAEn_9c.jpg
girliegals12	2018-07-06 05:59	2	2	Red Owl Enamel Earrings with Black Faceted Glass Beads https://etsy.me/2KXbujW via @ Etsy # red # owl # earrings # black # redearrings # etsyearrings # owlearrings # blackearrings # etsyhandmade # etsyjewelry # giftsforher # etsyseller # birdearrings # bird # birthday # etsy # giftideas		@ Etsy	# red # owl # earrings # black # redearrings # etsyearrings # owlearrings # blackearrings # etsyhandmade # etsyjewelry # giftsforher # etsyseller # birdearrings # bird # birthday # etsy # giftideas	1015173259489435648			https://twitter.com/girliegals12/status/1015173259489435648	https://pbs.twimg.com/profile_images/1783174651/Girlie_Gals_Avatar_normal.jpg
WilderWildlife	2018-07-05 21:32	0	1	Cutie Eastern Screech Owl Red Morph. . . # ethicalowlphotos # owls # owl2018 # elite_owls # owlsofinstagram # owl # easternscreechowl # redowl # elite_raptors # elite_birds… https://www.instagram.com/p/Bk3zRz1HA4s/?utm_source=ig_twitter_share&igshid=14ulrkr2enmjh …			# ethicalowlphotos # owls # owl2018 # elite_owls # owlsofinstagram # owl # easternscreechowl # redowl # elite_raptors # elite_birds	1015045881563959296			https://twitter.com/WilderWildlife/status/1015045881563959296	https://abs.twimg.com/emoji/v2/72x72/1f989.png
NatureMajesty	2018-07-04 09:45	10	50	Red Shouldered Hawk. By: Cary Maures # hawk # red # owl # eagle # Birds # birdsofinstagram # wow # AnimalKingdom # animalspic.twitter.com/WtIqW8Jiw9			# hawk # red # owl # eagle # Birds # birdsofinstagram # wow # AnimalKingdom # animalspic	1014505357224357889			https://twitter.com/NatureMajesty/status/1014505357224357889	https://pbs.twimg.com/media/DhMAXXaWkAAfonS.jpg
aipics	2018-07-03 23:00	0	0	'a close up of a red and white owl with yellow eyes' — by Pixabay. # animal # bird # owl # looking Provided by Pexels: https://www.pexels.com/photo/416202/ pic.twitter.com/6DzFXcunzk			# animal # bird # owl # looking	1014343078885363712			https://twitter.com/aipics/status/1014343078885363712	https://pbs.twimg.com/media/DhOrp0BXkAA21ae.jpg
somar78	2018-07-01 00:39	0	0	Just Pinned to Displate posters: animals birds owl watercolor red blue colors https://www.pinterest.com/pin/500814421058884034 …pic.twitter.com/G092quIFOo				1013280887411273731			https://twitter.com/somar78/status/1013280887411273731	https://pbs.twimg.com/media/Dg_lmPcXkAAYbkp.jpg
russtamps	2018-06-29 23:17	0	0	Fauna Europe A73 Portugal 1980 s/s CV 5 eur Birds Owl Eagle Animals Wolf Red Fox: $0.99 End… https://goo.gl/fb/cCk7Vv				1012897963633496064			https://twitter.com/russtamps/status/1012897963633496064	
Jake_Gearty	2018-06-29 07:25	8	89	A fantastic 10 days in Sweden, seeing some fantastic species of bird including four lifers; Tawny Pipit, Rosefinch, River Warbler and Eagle Owl. The abundance of Wood Sandpipers was another highlight, as well as this stunning Red Backed Shrike seen feeding young. pic.twitter.com/mCVW5Umrqf				1012658275723202561			https://twitter.com/Jake_Gearty/status/1012658275723202561	https://pbs.twimg.com/media/Dg2upMMXkAESrZN.jpg
AlsCraftyCorner	2018-06-29 07:02	0	0	Owl bag Small homemade, Snappy Clutch bag, bird Fabric Pouch, Owl lovers gift, Black and red color, gift for a friend, thank you token gifts http://tuppu.net/4917c100 # AlsCraftyCorner # Etsy # GiftingGuidepic.twitter.com/xUX3hOZOJ4			# AlsCraftyCorner # Etsy # GiftingGuidepic	1012652591371735040			https://twitter.com/AlsCraftyCorner/status/1012652591371735040	https://pbs.twimg.com/media/Dg2qKiBVAAACfH4.jpg
passthefeather	2018-06-27 19:31	0	0	Today’s orders. Left is Red Tail Hawk next is Barred, great horned and Snow Owl. The small one is ground birds (turkey, grouse and pheasant).... all comforted by our beautiful Canada Goose. gnight, all.				1012116270299443201			https://twitter.com/passthefeather/status/1012116270299443201	https://abs.twimg.com/emoji/v2/72x72/1f49c.png
illahehills	2018-06-27 17:22	0	0	Our first Bird Watch with Salem Audubon Society was a great success! The group was able to identify 40 different bird species including two great horned owls, red tailed hawks, turkey vultures, killdeer, mallards and... https://www.facebook.com/illahe/posts/10155431829090671 …				1012083649045581829			https://twitter.com/illahehills/status/1012083649045581829	
mscrow	2018-06-27 04:58	4	1	Saddleworth Moor forms part of a Special Area of Conservation due to ground nesting birds found there; red grouse, curlew and merlin, plus golden plover, dunline and the short-eared owl. Add in deer, hare and abundant flora. The # SaddleworthFire is truly devastating @ RSPBbirdershttps://twitter.com/mennewsdesk/status/1011891463498723328 …		@ RSPBbirdershttps	# SaddleworthFire	1011896601588224000			https://twitter.com/mscrow/status/1011896601588224000	https://pbs.twimg.com/media/Dgr16J9WkAAuX74.jpg
BarnOwlTrust	2018-06-26 08:52	6	17	The Stock Dove is Amber listed on the UK Red List for Birds and can nest in Barn Owl boxes. They suffered from the effects of organochlorine seed-dressings that were used in the 50’s and 60’s, but now the UK holds over 20% of European breeding population. pic.twitter.com/J1z41Fxisq				1011593030091051009			https://twitter.com/BarnOwlTrust/status/1011593030091051009	https://pbs.twimg.com/media/Dgnmf0HVAAA4Wyq.jpg
trishasnakes	2018-06-25 21:52	0	0	i meam that definitely makes more sense. we have one of those near me but specifically for large birds, there are wild turkeys and great horned owls and red tailed hawks, turkey vultures and so on				1011426920150503424	1011420626463150080	Under_Punches	https://twitter.com/trishasnakes/status/1011426920150503424	
DREAMandDESTROY	2018-06-25 21:15	0	0	Check out RARE SET! TAKAHASHI 5 SET CERAMIC POTTERY STICKER YELLOW GREEN RED OWLS OWL BIRD http://www.ebay.com/itm/-/253711756081?roken=cUgayN&soutkn=rG1475 … via @ eBay		@ eBay		1011417512293031936			https://twitter.com/DREAMandDESTROY/status/1011417512293031936	
DREAMandDESTROY	2018-06-25 21:14	0	0	Check out RARE SET! TAKAHASHI 5 SET CERAMIC POTTERY STICKER YELLOW GREEN RED OWLS OWL BIRD https://www.ebay.com/itm/253711756081?roken=cUgayN&soutkn=2Y2nlo … via @ eBay		@ eBay		1011417482639261696			https://twitter.com/DREAMandDESTROY/status/1011417482639261696	
ShelinaThomas	2018-06-25 07:15	0	0	Really? A red owl! Everyday I am amazed by something new! # MotherMary would love this- she loved beautiful # birds https://twitter.com/zooanimalspics/status/1010872558176985088 …			# MotherMary # birds	1011206132122071040			https://twitter.com/ShelinaThomas/status/1011206132122071040	https://pbs.twimg.com/media/DgdHR6HUcAEzYUN.jpg
PrimeBelize	2018-06-25 00:15	0	1	Birding in Belize ------------------------------ See many of the 500 + species of # birds in # Belize. Highlights for most visitors include the keel-billed # toucan, scarlet # macaw, jabiru # stork, red legged honey creeper, grey # catbird and the ferruginous pigmy # owl. pic.twitter.com/R4cMMgMS2s			# birds # Belize # toucan # macaw # stork # catbird # owl	1011100434902200320			https://twitter.com/PrimeBelize/status/1011100434902200320	https://pbs.twimg.com/media/DggmfKGXkAElPhv.jpg
eyesshare	2018-06-23 13:00	0	0	Little Owl - Birds http://eyesshare.co.uk/ProjectRetail/Default/Translator.php?page=Main.html&subpage=/WebRetail/Pages/Shop/CreatorProducts.html&creator=2&product=254&app=eyes … # click # red-eye pic.twitter.com/KJv3F8iKM8			# click # red	1010568195676213252			https://twitter.com/eyesshare/status/1010568195676213252	https://pbs.twimg.com/media/DgZCavYXcAAEw9U.jpg
econaturehols	2018-06-22 18:00	0	1	# glenwatch today sightings Jay, barn owl, red squirrels, loads of woodland birds, woodpecker and pine marten # wildscotland # cowal # wildaboutargyllpic.twitter.com/Qjr5ecbKNg – bei Eco Nature Holidays			# glenwatch # wildscotland # cowal # wildaboutargyllpic	1010281488443691010			https://twitter.com/econaturehols/status/1010281488443691010	https://pbs.twimg.com/media/DgU9p60WkAcGsmo.jpg
AlsCraftyCorner	2018-06-21 03:02	1	1	Owl bag Small homemade, Snappy Clutch bag, bird Fabric Pouch, Owl lovers gift, Black and red color, gift for a friend, thank you token gifts http://tuppu.net/4917c100 # Etsy # AlsCraftyCorner # HandbagItemspic.twitter.com/bmHoTBEekR			# Etsy # AlsCraftyCorner # HandbagItemspic	1009692979332829184			https://twitter.com/AlsCraftyCorner/status/1009692979332829184	https://pbs.twimg.com/media/DgMmaZKVAAACfC7.jpg
SandyNewhart	2018-06-19 23:19	0	0	# Christmas # Centerpiece # Arrangement # Owl # Bird TableTop # Tree # Winter Red Green White Table # Decor # Shatterproof # Ornaments https://etsy.me/2ljG0ti via @ Etsy # handmade # Customdesigned # holiday		@ Etsy	# Christmas # Centerpiece # Arrangement # Owl # Bird # Tree # Winter # Decor # Shatterproof # Ornaments # handmade # Customdesigned # holiday	1009274562364805120			https://twitter.com/SandyNewhart/status/1009274562364805120	
Northlate	2018-06-19 11:42	0	1	Puppy- pupper Dog- doggo Shiba Inu- Doge Cat- Cate Husky- Moon moon Spider- Nope nope Snake- danger noodle Bird- Birb Owl- Wood Penguin Raccoon- Trash Panda Red Panda- Bear Cate Llama- Giraffe sheep Tiger- Danger zebra Sting Ray- Sea flap flap Seal- sea doggo				1009099214800842752			https://twitter.com/Northlate/status/1009099214800842752	https://abs.twimg.com/emoji/v2/72x72/1f601.png
