id,claim,rating,image_url,permalink,publish_date,keyword,important_tweet_id
151,A real mermaid was discovered in the Oman Gulf in December 2017.,FALSE,"['https://us-east-1.tchyn.io/snopes-production/uploads/2017/12/real-mermaid.jpg?w=1000 1000w', 'https://us-east-1.tchyn.io/snopes-production/uploads/2017/12/mermaid-maker.jpg?w=550 550w']",https://www.snopes.com/fact-check/real-mermaid-found-india/,2017-12-19T13:38:17+00:00,Real Mermaid India,
153,A photograph shows Robert Mueller in Vietnam in 1969.,FALSE,"['https://us-east-1.tchyn.io/snopes-production/uploads/2017/12/mueller-and-trump.jpg?w=586 586w', 'https://us-east-1.tchyn.io/snopes-production/uploads/2017/12/ed-episcopo-gallery.jpg?w=1534 1534w']",https://www.snopes.com/fact-check/is-this-a-real-photograph-of-robert-mueller-in-vietnam/,2017-12-15T13:39:44+00:00,Robert Mueller Vietnam,
154,A photograph shows a dog defecating on the steps of 10 Downing Street.,FALSE,"['https://us-east-1.tchyn.io/snopes-production/uploads/2017/12/10-downing-dog.jpg?w=599 599w', 'https://us-east-1.tchyn.io/snopes-production/uploads/2017/12/dog-or-cat.jpg?w=1000 1000w']",https://www.snopes.com/fact-check/dog-defecate-10-downing-street/,2017-12-13T12:20:17+00:00,dog defecate downing street,
155,A chyron on a network news channel contained a vulgar insult against Senate Majority Leader Mitch McConnell.,FALSE,"['https://us-east-1.tchyn.io/snopes-production/uploads/2017/12/mitch-mcconnell-fake.jpg?w=884 884w', 'https://us-east-1.tchyn.io/snopes-production/uploads/2017/12/mcconnell-fakes.jpg?w=1000 1000w']",https://www.snopes.com/fact-check/did-c-span-insult-mitch-mcconnell/,2017-12-12T14:12:10+00:00,C SPAN Mitch McConnell,9.37541E+17
158,"A photograph shows a protester holding a sign that says ""We must stop the war on Christmas"" next to another man with a sign that reads ""All holidays matter.""",FALSE,"['https://us-east-1.tchyn.io/snopes-production/uploads/2017/12/war-on-christmas.jpg?w=1007 1007w', 'https://us-east-1.tchyn.io/snopes-production/uploads/2017/12/black-lives-matter.jpg?w=600 600w', 'https://us-east-1.tchyn.io/snopes-production/uploads/2017/12/6_is_his_life_worth.jpg?w=750 750w']",https://www.snopes.com/fact-check/protester-holding-holidays-matter-sign/,2017-12-05T16:30:19+00:00,proteste holidays matter sign,
159,A time-traveler using a hula hoop appears in the background of a 1939 photograph.,FALSE,"['https://us-east-1.tchyn.io/snopes-production/uploads/2017/11/michelle-obama.jpg?w=480 480w', 'https://us-east-1.tchyn.io/snopes-production/uploads/2017/11/dorothy-lange-photo.jpg?w=570 570w', 'https://us-east-1.tchyn.io/snopes-production/uploads/2017/11/fake-obama-vacay-photos.jpg?w=1000 1000w']",https://www.snopes.com/fact-check/time-traveling-hula-hooper-photograph/,2017-11-30T15:23:16+00:00,Time Travel Hula Hooper,
161,Photographs show Russian President Vladimir Putin taking a lollipop from a child.,FALSE,"['https://us-east-1.tchyn.io/snopes-production/uploads/2017/11/uncle-putin.jpg?w=768 768w', 'https://us-east-1.tchyn.io/snopes-production/uploads/2017/11/putin-and-child.jpg?w=960 960w']",https://www.snopes.com/fact-check/putin-pictured-taking-lollipop-child/,2017-11-29T08:15:13+00:00,putin ollipop child,
162,A viral November 2017 Facebook post contains photographs that show the slave trade in Libya in 2017.,mostly-false,"['https://us-east-1.tchyn.io/snopes-production/uploads/2017/11/Screen-Shot-2017-11-28-at-17.43.24.png?w=932 932w', 'https://us-east-1.tchyn.io/snopes-production/uploads/2017/11/Screen-Shot-2017-11-28-at-17.39.41.png?w=934 934w', 'https://us-east-1.tchyn.io/snopes-production/uploads/2017/11/Screen-Shot-2017-11-28-at-17.40.33.png?w=933 933w', 'https://us-east-1.tchyn.io/snopes-production/uploads/2017/11/Screen-Shot-2017-11-28-at-17.41.19.png?w=933 933w', 'https://us-east-1.tchyn.io/snopes-production/uploads/2017/11/Screen-Shot-2017-11-28-at-17.42.00.png?w=903 903w', 'https://us-east-1.tchyn.io/snopes-production/uploads/2017/11/Screen-Shot-2017-11-28-at-19.40.44.png?w=925 925w', 'https://us-east-1.tchyn.io/snopes-production/uploads/2017/11/Screen-Shot-2017-11-28-at-21.06.57.png?w=929 929w']",https://www.snopes.com/fact-check/libya-slavery/,2017-11-29T07:43:10+00:00,slave trade libya,
163,A photograph shows a flyer from the Elementary Teachers' Federation of Ontario for a 'LGGBDTTTIQQAAPP' inclusiveness training session.,mostly-true,['https://us-east-1.tchyn.io/snopes-production/uploads/2017/11/LGGBDTTTIQQAAPP.jpg?w=1080 1080w'],https://www.snopes.com/fact-check/lggbdtttiqqaapp-lgbt-inclusiveness-training-flyer/,2017-11-28T13:36:14+00:00,LGGBDTTTIQQAAPP training,
164,Photographs show Niagara Falls frozen in 1911 and 2014.,miscaptioned,"['https://us-east-1.tchyn.io/snopes-production/uploads/2015/02/niagara.jpg?w=694 694w', 'https://us-east-1.tchyn.io/snopes-production/uploads/2015/02/frozen-niagara-falls-.jpg?w=480 480w', 'https://us-east-1.tchyn.io/snopes-production/uploads/2015/02/niagara-frozen.jpg?w=497 497w', 'https://us-east-1.tchyn.io/snopes-production/uploads/2015/02/niagara-frozen-2.jpg?w=502 502w', 'https://us-east-1.tchyn.io/snopes-production/uploads/2015/02/niagara-frozen-3.jpg?w=539 539w', 'https://us-east-1.tchyn.io/snopes-production/uploads/2015/02/niagara-frozen-2017-1.jpg?w=450 450w', 'https://us-east-1.tchyn.io/snopes-production/uploads/2015/02/niagara-frozen-2017-2.jpg?w=691 691w', 'https://us-east-1.tchyn.io/snopes-production/uploads/2015/02/niagara-frozen-2017-3.jpg?w=621 621w']",https://www.snopes.com/fact-check/niagara-falls-frozen/,2017-11-27T08:48:32+00:00,Niagara Falls frozen,
165,Photographs show a small child forced to put down his dog with a handgun.,FALSE,"['https://us-east-1.tchyn.io/snopes-production/uploads/2017/11/childgun.jpg?w=469 469w', 'https://us-east-1.tchyn.io/snopes-production/uploads/2017/11/cryingboy2.jpg?w=735 735w']",https://www.snopes.com/fact-check/child-shooting-dog-photos/,2017-11-24T12:29:17+00:00,Child Shoot Dog,
166,A photograph shows Ryan Zinke posing with a dead elephant.,FALSE,['https://us-east-1.tchyn.io/snopes-production/uploads/2017/11/ryan-zinke-maybe.png?w=827 827w'],https://www.snopes.com/fact-check/ryan-zinke-dead-elephant/,2017-11-20T12:49:08+00:00,ryan zinke elephant,
167,A photograph from the Spanish Civil War shows famed authors George Orwell and Ernest Hemingway in close proximity.,miscaptioned,"['https://us-east-1.tchyn.io/snopes-production/uploads/2017/11/orwell-and-hemingway.jpg?w=740 740w', 'https://us-east-1.tchyn.io/snopes-production/uploads/2017/11/george-orwell-and-not-george-orwell.jpg?w=1002 1002w']",https://www.snopes.com/fact-check/image-shows-george-orwell-and-ernest-hemingway-during-the-spanish-civil-war/,2017-11-20T10:06:53+00:00,george orwell hemingway spanish civil war,
168,A photograph showing President Obama with a man sleeping on the subway is genuine.,FALSE,"['https://us-east-1.tchyn.io/snopes-production/uploads/2017/11/average-rob.jpg?w=925 925w', 'https://us-east-1.tchyn.io/snopes-production/uploads/2017/11/obama-train.jpg?w=1000 1000w']",https://www.snopes.com/fact-check/obama-sleeping-man-subway/,2017-11-17T14:46:54+00:00,obama sleeping man subway,
169,"The photographer of the infamous Al Franken image said that the moment was staged, that Leeann Tweeden ""was playing dead,"" and that ""she wanted him to __evive_ her.""",FALSE,"['https://us-east-1.tchyn.io/snopes-production/uploads/2017/11/aiden-benjamin.jpg?w=588 588w', 'https://us-east-1.tchyn.io/snopes-production/uploads/2017/11/aiden-benjamin-2.jpg?w=609 609w', 'https://us-east-1.tchyn.io/snopes-production/uploads/2017/11/franken.jpg?w=640 640w']",https://www.snopes.com/fact-check/photographer-said-franken-image-was-staged/,2017-11-17T10:55:49+00:00,fanken photo staged,
172,Image depicts Texas church shooting suspect Devin Patrick Kelley at a Bernie Sanders rally.,FALSE,"['https://us-east-1.tchyn.io/snopes-production/uploads/2017/11/giacomo-calabrese-look-familiar-its-the-texas-church-shooter.jpg?w=612 612w', 'https://us-east-1.tchyn.io/snopes-production/uploads/2017/11/not-bernie-shooter-2.jpg?resize=300', 'https://us-east-1.tchyn.io/snopes-production/uploads/2017/11/not-bernie-shooter-2.jpg?resize=300']",https://www.snopes.com/fact-check/image-depict-texas-church-shooter-bernie-sanders-rally/,2017-11-15T11:20:07+00:00,texas church shooter sanders rally,
174,A photograph shows a group of deported veterans in the Mexican border city of Ciudad Juárez.,TRUE,['https://us-east-1.tchyn.io/snopes-production/uploads/2017/11/deported-veterans.jpg?w=583 583w'],https://www.snopes.com/fact-check/image-shows-a-group-of-deported-veterans/,2017-11-14T11:09:08+00:00,Deported Veterans US,8.69387E+17
177,A photograph shows Andre the Giant holding a 12 oz can of beer.,TRUE,"['https://us-east-1.tchyn.io/snopes-production/uploads/2017/11/andre-the-giant.jpg?w=800 800w', 'https://us-east-1.tchyn.io/snopes-production/uploads/2017/11/andre-the-giant-can-pic.jpg?w=1151 1151w', 'https://us-east-1.tchyn.io/snopes-production/uploads/2017/11/andre-the-giant-hands.jpg?w=640 640w']",https://www.snopes.com/fact-check/andre-giant-holding-beer-can/,2017-11-13T10:18:21+00:00,andre giant beer can,
179,A New Jersey man named Michael Lombardi killed a hibernating bear.,FALSE,"['https://us-east-1.tchyn.io/snopes-production/uploads/2017/11/fb-page-screenshot.jpg?w=442 442w', 'https://us-east-1.tchyn.io/snopes-production/uploads/2017/11/december-post.jpg?w=587 587w']",https://www.snopes.com/fact-check/did-michael-lombardi-kill-a-hibernating-bear-in-new-jersey/,2017-11-07T13:18:01+00:00,Michael Lombardi bear.,
180,President Trump ignored instructions from Japan's Prime Minister Shinzo Abe and impatiently dumped fish food into a koi pond.,miscaptioned,['https://us-east-1.tchyn.io/snopes-production/uploads/2017/11/obama-trump.jpg?w=809 809w'],https://www.snopes.com/fact-check/did-trump-impatiently-dump-fish-food-in-japanese-koi-pond/,2017-11-06T13:16:32+00:00,trump feed fish shinzo,9.27382E+17
181,A meme contains accurate information about the founders of Papa John's (John Schnatter) and Little Caesar's (Mike Ilitch) respectively.,mixture,['https://us-east-1.tchyn.io/snopes-production/uploads/2017/11/papa-johns-little-caesar-the-other-90-meme.jpg?w=800 800w'],https://www.snopes.com/fact-check/papa-johns-little-caesars-meme/,2017-11-02T10:28:04+00:00,papa johns little caesars meme,
183,"A picture shows Vice President Joe Biden groping Stephanie Carter, wife of former Defense Secretary Ash Carter, during a government ceremony.",FALSE,"['https://us-east-1.tchyn.io/snopes-production/uploads/2017/10/biden-grope.jpg?w=552 552w', 'https://us-east-1.tchyn.io/snopes-production/uploads/2017/10/Screenshot-2017-11-13-at-10.17.01-AM.png?w=582 582w', 'https://us-east-1.tchyn.io/snopes-production/uploads/2017/10/amie-parnes-and-biden.jpg?w=1002 1002w']",https://www.snopes.com/fact-check/joe-biden-grope-photograph/,2017-10-27T10:27:31+00:00,Joe Biden grope Stephanie Carter,
184,Photograph shows a patient who received a severe penile burn from urinating on an electric fence.,miscaptioned,['https://us-east-1.tchyn.io/snopes-production/uploads/2013/07/fence.jpg?w=800 800w'],https://www.snopes.com/fact-check/dont-whizz-on-the-electric-fence/,2017-10-26T16:44:58+00:00,penile burn electric fence,
185,An unflattering photograph of President Trump is real.,FALSE,"['https://us-east-1.tchyn.io/snopes-production/uploads/2017/10/vic-berger-trump.jpg?w=2048 2048w', 'https://us-east-1.tchyn.io/snopes-production/uploads/2017/10/trump-vic-berger.jpg?w=1000 1000w']",https://www.snopes.com/fact-check/trump-unflattering-image/,2017-10-26T13:04:19+00:00,trump unflattering image,
186,Photographs show a 2011 NFL Veterans Day tribute that ESPN omitted from their pre-game coverage.,TRUE,"['https://us-east-1.tchyn.io/snopes-production/uploads/2013/11/lambeau2.jpg?w=604 604w', 'https://us-east-1.tchyn.io/snopes-production/uploads/2013/11/lambeau3.jpg?w=638 638w', 'https://us-east-1.tchyn.io/snopes-production/uploads/2013/11/lambeau4.jpg?w=644 644w', 'https://us-east-1.tchyn.io/snopes-production/uploads/2013/11/lambeau1.jpg?w=603 603w']",https://www.snopes.com/fact-check/veterans-day-tribute/,2017-10-26T11:23:24+00:00,Veterans Day ESPN 2011,
188,A photograph shows insects embedded in a dog's mouth.,TRUE,"['https://us-east-1.tchyn.io/snopes-production/uploads/2015/11/disgusting.jpg?w=528 528w', 'https://us-east-1.tchyn.io/snopes-production/uploads/2015/11/dog-mouth-beetles.png?w=286 286w']",https://www.snopes.com/fact-check/ladybugs-beetles-dog-mouth/,2017-10-25T14:13:02+00:00,Beetle dog mouth,
189,A photograph shows an owl experiencing an orgasm.,FALSE,"['https://us-east-1.tchyn.io/snopes-production/uploads/2017/10/owl-orgasm.jpg?w=711 711w', 'https://us-east-1.tchyn.io/snopes-production/uploads/2017/10/owl-meme.jpg?w=1000 1000w']",https://www.snopes.com/fact-check/is-this-owl-having-an-orgasm/,2017-10-25T11:51:21+00:00,owl orgasm,
190,An image shows Jimi Hendrix covered in tattoos while riding a dune buggy.,FALSE,"['https://us-east-1.tchyn.io/snopes-production/uploads/2017/10/hendrix.jpg?w=686 686w', 'https://us-east-1.tchyn.io/snopes-production/uploads/2017/10/hendrix-car.jpg?w=1000 1000w']",https://www.snopes.com/fact-check/did-a-tattooed-jimi-hendrix-ride-a-dune-buggy/,2017-10-24T13:27:02+00:00,Jimi Hendrix tattoo,
191,A photograph shows Sarah Huckabee Sanders wearing KKK robes for Halloween in 1993.,FALSE,"['https://us-east-1.tchyn.io/snopes-production/uploads/2017/10/22687658_1969037260032795_622066198185473843_n.jpg?w=300 300w', 'https://us-east-1.tchyn.io/snopes-production/uploads/2017/10/kid-kkk-2.jpg?w=512 512w']",https://www.snopes.com/fact-check/sarah-huckabee-sanders-kkk-robe-halloween/,2017-10-23T09:36:36+00:00,sarah huckabee sanders kkk robe,
192,"Images show a baby half-human, half-lion hybrid that was found in Indonesia.",FALSE,"['https://us-east-1.tchyn.io/snopes-production/uploads/2017/10/hybrid-collage.jpg?w=1000 1000w', 'https://us-east-1.tchyn.io/snopes-production/uploads/2017/10/baby-licantropo.jpg?w=496 496w']",https://www.snopes.com/fact-check/half-human-half-lion-hybrid-creature-indonesia/,2017-10-20T12:01:14+00:00,half human baby indonesia,
193,An image shows a lawmaker's underwear as she leans over a desk.,FALSE,"['https://us-east-1.tchyn.io/snopes-production/uploads/2017/10/not-melania-trump.jpg?w=640 640w', 'https://us-east-1.tchyn.io/snopes-production/uploads/2017/10/Maria-Elena-Boschi.jpg?w=1002 1002w']",https://www.snopes.com/fact-check/lawmakers-thong-shows-during-swearing-in/,2017-10-19T13:58:47+00:00,lawmakers thong swear,
195,"Grisly photograph shows the Buckley family, whose children beheaded their mother with an axe on Halloween.",FALSE,"['https://us-east-1.tchyn.io/snopes-production/uploads/2014/10/buckleybehead.jpg?w=360 360w', 'https://us-east-1.tchyn.io/snopes-production/uploads/2014/10/buckley2.jpg?w=248 248w']",https://www.snopes.com/fact-check/behead-of-the-family/,2017-10-19T06:31:30+00:00,Buckley Family chop head,
196,An image shows President Trump getting a spray tan in the oval office.,FALSE,['https://us-east-1.tchyn.io/snopes-production/uploads/2017/10/trump-tweet-1.jpg?w=589 589w'],https://www.snopes.com/fact-check/trump-spray-tan-oval-office/,2017-10-18T08:29:19+00:00,spray tan trump,
197,"A meme shows President Obama awarding the Presidential Medal of Freedom to Bill Clinton, Anthony Weiner, Bill Cosby, and Harvey Weinstein.",mostly-false,"['https://us-east-1.tchyn.io/snopes-production/uploads/2017/10/obama-awards.jpg?w=1190 1190w', 'https://us-east-1.tchyn.io/snopes-production/uploads/2017/10/weinstein-biden.jpg?w=1000 1000w', 'https://us-east-1.tchyn.io/snopes-production/uploads/2017/10/weiner-hanks.jpg?w=1000 1000w', 'https://us-east-1.tchyn.io/snopes-production/uploads/2017/10/cosby-sprinsteen.jpg?w=1002 1002w', 'https://us-east-1.tchyn.io/snopes-production/uploads/2017/10/cosbymedal.jpg?w=600 600w']",https://www.snopes.com/fact-check/obama-medal-of-freedom-weinstein-clinton-cosby-weiner/,2017-10-17T11:55:42+00:00,obama medal weinstein clinton cosby weiner,
198,A photograph shows a coyote being given a bath after it was mistaken by a dog by an Ohio family in October 2017.,FALSE,['https://us-east-1.tchyn.io/snopes-production/uploads/2017/10/coyote-dog.jpg?w=497 497w'],https://www.snopes.com/fact-check/coyote-given-bath-mistaken-dog/,2017-10-17T11:36:05+00:00,coyote bath mistaken dog,9.20306E+17
199,"""Nightmare on Elm Street"" character Freddy Krueger was based on a real life serial murderer.",FALSE,['https://us-east-1.tchyn.io/snopes-production/uploads/2017/10/5__Lamaur_Foster_-_DID_YOU_KNOW_____The_Freddy_Kruger_character_was____.jpg?w=545 545w'],https://www.snopes.com/fact-check/was-freddy-krueger-real/,2017-10-17T09:32:07+00:00,Freddy Krueger real serial killer,
200,An image shows a house that was saved from a fire by sprinklers.,mixture,"['https://us-east-1.tchyn.io/snopes-production/uploads/2017/10/house-saved-by-fire.jpg?w=600 600w', 'https://us-east-1.tchyn.io/snopes-production/uploads/2017/10/kansas-fire.jpg?w=1080 1080w']",https://www.snopes.com/fact-check/did-sprinklers-save-house-from-massive-wildfire/,2017-10-16T12:40:54+00:00,sprinkler save house fire,
202,A photograph shows a woman who was killed by a frozen shaft of urine that fell from a plane.,FALSE,['https://us-east-1.tchyn.io/snopes-production/uploads/2017/10/frozen-shaft-of-urine.jpg?w=500 500w'],https://www.snopes.com/fact-check/was-a-woman-killed-frozen-urine/,2017-10-16T11:37:13+00:00,frozen urine kill woman,
204,"Image depicts ""attitude adjustment"" and ""smile therapy"" forced upon American housewives in the 1930s institutionalized for ""not taking care of themselves"" and acting ""depressed.""",FALSE,['https://us-east-1.tchyn.io/snopes-production/uploads/2017/10/1930s-woman-smile-pictures-in-history.jpg?w=542 542w'],https://www.snopes.com/fact-check/1930s-housewife-smile-therapy/,2017-10-12T19:29:47+00:00,smile therapy housewives 1930,
206,"An image shows Lebron James wearing a ""we march, y'all mad"" shirt.",FALSE,"['https://us-east-1.tchyn.io/snopes-production/uploads/2017/10/lebron-shirt.jpg?w=581 581w', 'https://us-east-1.tchyn.io/snopes-production/uploads/2017/10/lebron-shirts.jpg?w=1000 1000w']",https://www.snopes.com/fact-check/lebron-james-wore-protest-shirt/,2017-10-10T14:53:25+00:00,Lebron James protest shirt,
207,"A photograph shows a foot after ""Cinderella Surgery.""",FALSE,"['https://us-east-1.tchyn.io/snopes-production/uploads/2017/10/maxresdefault.jpg?w=1280 1280w', 'https://us-east-1.tchyn.io/snopes-production/uploads/2017/10/julie-rapp.jpg?w=440 440w']",https://www.snopes.com/fact-check/does-cinderella-surgery-modifies-feet-to-resemble-high-heels/,2017-10-10T10:13:08+00:00,Cinderella Surgery foot,
208,The man accused of opening fire on hundreds of people in a Las Vegas casino in October 2017 was spotted at an anti-Trump protest two months earlier.,FALSE,"['https://us-east-1.tchyn.io/snopes-production/uploads/2017/10/Screenshot-2017-10-03-at-11.50.13-AM.png?w=596 596w', 'https://us-east-1.tchyn.io/snopes-production/uploads/2017/10/paddock-left-wing-violence.jpg?w=851 851w', 'https://us-east-1.tchyn.io/snopes-production/uploads/2017/10/paddock-not-paddock.jpg?w=1002 1002w', 'https://us-east-1.tchyn.io/snopes-production/uploads/2017/10/still-not-paddock.jpg?w=846 846w']",https://www.snopes.com/fact-check/las-vegas-shooter-trump-protest/,2017-10-03T14:29:39+00:00,lvshooting anti trump,
209,A photograph shows the Army football team kneeling in protest during the national anthem.,FALSE,"['https://us-east-1.tchyn.io/snopes-production/uploads/2017/10/us-navy-kneeling.jpg?w=768 768w', 'https://us-east-1.tchyn.io/snopes-production/uploads/2017/10/golden-hurricane.jpg?w=1002 1002w']",https://www.snopes.com/fact-check/army-football-team-kneel-protest-national-anthem/,2017-10-02T13:42:49+00:00,army football kneel protest,
210,A photograph shows a Seattle Seahawks player burning an American flag.,FALSE,"['https://us-east-1.tchyn.io/snopes-production/uploads/2017/09/nfl-burns-flag.jpg?w=720 720w', 'https://us-east-1.tchyn.io/snopes-production/uploads/2017/09/flag-burning.jpg?w=1002 1002w']",https://www.snopes.com/fact-check/nfl-player-burned-american-flag-in-locker-room/,2017-09-29T08:50:26+00:00,NFL Player Burn American Flag,
212,"A photograph shows Green Bay Packers quarterback Aaron Rodgers holding a ""Stand for the flag, Kneel for the cross"" shirt.",FALSE,"['https://us-east-1.tchyn.io/snopes-production/uploads/2017/09/aaron-rodgers.jpg?w=851 851w', 'https://us-east-1.tchyn.io/snopes-production/uploads/2017/09/t-shirts.jpg?w=1000 1000w', 'https://us-east-1.tchyn.io/snopes-production/uploads/2017/09/shirt-collage.jpg?w=1000 1000w']",https://www.snopes.com/fact-check/aaron-rodgers-stand-for-the-flag-kneel-for-the-cross-t-shirt/,2017-09-25T11:30:50+00:00,aaron rodgers stand for flag kneel for the cross,
214,"Prior to condemning flag burning in November 2016, Donald Trump endorsed the act in February 2011.",FALSE,"['https://us-east-1.tchyn.io/snopes-production/uploads/2016/11/trumpflag.jpg?w=608 608w', 'https://us-east-1.tchyn.io/snopes-production/uploads/2016/11/donald-trump-flag-burning-2011.jpg?w=640 640w']",https://www.snopes.com/fact-check/trumps-flip-flop-on-flag-burning/,2017-09-24T09:17:59+00:00,trump flip burn flag,
216,A photograph shows a 30-foot wave from Hurricane Jose hitting Jennette's Pier in North Carolina.,FALSE,"['https://us-east-1.tchyn.io/snopes-production/uploads/2017/09/hurricane-jose.jpg?w=578 578w', 'https://us-east-1.tchyn.io/snopes-production/uploads/2017/09/big-wave.jpg?w=960 960w', 'https://us-east-1.tchyn.io/snopes-production/uploads/2017/09/big-wave-photo.jpg?w=2000 2000w']",https://www.snopes.com/fact-check/hurricane-jose-30-foot-waves-jennettes-pier/,2017-09-19T10:12:05+00:00,hurricane jose waves jennettes pier,
219,"A photograph shows a boulder containing remarkably well-preserved, larger-than-human seahorse fossil.",FALSE,['https://us-east-1.tchyn.io/snopes-production/uploads/2017/09/Screen-Shot-2017-09-15-at-11.30.50-AM.png?w=425 425w'],https://www.snopes.com/fact-check/giant-fossil-seahorse/,2017-09-15T14:43:58+00:00,giant fossil seahorse,
220,A crude sketch of a phallus could be seen on the inside of a log during an episode of,TRUE,['https://us-east-1.tchyn.io/snopes-production/uploads/2017/09/maya-the-bee.jpg?w=744 744w'],https://www.snopes.com/fact-check/maya-bee-scene/,2017-09-15T11:07:39+00:00,Maya the Bee phallus,
222,A photograph shows a meal served by the Red Cross to victims of Hurricane Harvey in Texas.,FALSE,"['https://us-east-1.tchyn.io/snopes-production/uploads/2017/09/red-cross-meal.jpg?w=527 527w', 'https://us-east-1.tchyn.io/snopes-production/uploads/2017/09/red-cross-meal-2016.jpg?w=720 720w']",https://www.snopes.com/fact-check/red-cross-harvey-meal/,2017-09-13T13:43:08+00:00,red cross harvey meal,
223,A photograph shows actors Heath Ledger and Cillian Murphy posing together.,FALSE,"['https://us-east-1.tchyn.io/snopes-production/uploads/2017/09/twitter-pic.jpg?w=575 575w', 'https://us-east-1.tchyn.io/snopes-production/uploads/2017/09/murphy.jpg?w=1000 1000w']",https://www.snopes.com/fact-check/heath-ledger-cyrian-murphy-photograph-real/,2017-09-13T11:53:22+00:00,Heath Ledger Cillian Murphy,
225,A criminology textbook used an image of Brock Turner to illustrate an entry on rape.,TRUE,['https://us-east-1.tchyn.io/snopes-production/uploads/2017/09/brock-turner-rape.jpg?w=720 720w'],https://www.snopes.com/fact-check/textbook-brock-turner-criminology-example/,2017-09-12T16:05:46+00:00,criminology textbook Brock Turner,
230,A photograph shows a group of people golfing as a forest fire rages in the background.,TRUE,"['https://us-east-1.tchyn.io/snopes-production/uploads/2017/09/golfers.jpg?w=1000 1000w', 'https://us-east-1.tchyn.io/snopes-production/uploads/2017/09/oregon-golf-course.jpg?w=1000 1000w']",https://www.snopes.com/fact-check/people-golfing-right-next-huge-forest-fire/,2017-09-08T09:02:00+00:00,golf forest fire,
231,The National Oceanic and Atmospheric Administration reported that Hurricane Irma had airlifted several sharks.,FALSE,"['https://us-east-1.tchyn.io/snopes-production/uploads/2017/09/hurricane-irma.jpg?w=720 720w', 'https://us-east-1.tchyn.io/snopes-production/uploads/2017/09/noa-hurricane.jpg?w=1024 1024w', 'https://us-east-1.tchyn.io/snopes-production/uploads/2017/09/breaking-news-1.jpg?w=1280 1280w']",https://www.snopes.com/fact-check/hurricane-irma-now-contains-sharks/,2017-09-07T13:31:06+00:00,Hurricane Irma sharks,
232,"An 81-year-old man named Arthur Hickenlooper competed on the show ""American Ninja Warrior.""",FALSE,"['https://us-east-1.tchyn.io/snopes-production/uploads/2017/09/hickenlooper.jpg?w=1002 1002w', 'https://us-east-1.tchyn.io/snopes-production/uploads/2017/09/hickenlooper-2.jpg?w=1000 1000w', 'https://us-east-1.tchyn.io/snopes-production/uploads/2017/09/hickenlooper-1.jpg?w=1000 1000w', 'https://us-east-1.tchyn.io/snopes-production/uploads/2017/09/brent-steffensen.jpg?w=602 602w']",https://www.snopes.com/fact-check/arthur-hickenlooper-81-american-ninjaj-warrior/,2017-09-06T16:02:15+00:00,arthur hickenlooper american ninjaj warrior,
233,An image shows President Trump rescuing two cats from a flooded area in Texas after Hurricane Harvey in August 2017.,FALSE,"['https://us-east-1.tchyn.io/snopes-production/uploads/2017/09/trump-cats.jpg?w=474 474w', 'https://us-east-1.tchyn.io/snopes-production/uploads/2017/09/man-saves-cats.jpg?w=1000 1000w']",https://www.snopes.com/fact-check/trump-saved-two-cats-after-hurricane-harvey/,2017-09-05T10:51:03+00:00,trump cats hurricane harvey,
