username	date	retweets	favorites	text	geo	mentions	hashtags	tweetid	conversationid	replyto	permalink	imagelink
jackgiangi	2017-08-25 05:14	0	1	Just keep in mind no matter how difficult politics get with Donald Trump, Hillary Clinton is not president of the United States.				901009885374164998			https://twitter.com/jackgiangi/status/901009885374164998	
StrawCast	2016-11-05 18:20	0	0	Who will you vote for the new President of the United States? Donald Trump, Hillary Clinton VOTE NOW: https://straw.pl/e77f8db2 # POLITICS pic.twitter.com/lVQqrqKne2			# POLITICS	795027968082882560			https://twitter.com/StrawCast/status/795027968082882560	https://pbs.twimg.com/media/CwiBuPhUsAAiYfC.jpg
StrawCast	2016-11-05 18:19	0	0	Who will you vote for the new President of the United States? Donald Trump, Hillary Clinton VOTE NOW: https://straw.pl/e77f8db2 # POLITICS pic.twitter.com/1GuBCS8rRC			# POLITICS	795027816504930304			https://twitter.com/StrawCast/status/795027816504930304	https://pbs.twimg.com/media/CwiBla-UsAAe73i.jpg
icitizen2371	2016-08-02 07:54	0	0	[ Politics ] Open Question : Will Donald Trump beat Hillary Clinton for President of the United States of Ame... http://yhoo.it/2aOQ1cT				760443570054586368			https://twitter.com/icitizen2371/status/760443570054586368	
StrawCast	2016-05-27 08:13	0	0	Who do you want as the next president of the United States Hillary Clinton , Donald Trump... VOTE NOW: https://strw.pl/ce378bf5 # POLITICS			# POLITICS	736168484527210496			https://twitter.com/StrawCast/status/736168484527210496	