username	date	retweets	favorites	text	geo	mentions	hashtags	tweetid	conversationid	replyto	permalink	imagelink
BroochOpioidEMS	2018-07-20 21:35	0	1	Hospital auxiliary gives more than $2,000 to Marion police to buy OD reversal drug # Naloxone # ILNARCAN http://www.dailyregister.com/article/20180719/news/180719877/ … via @ DailyRegister		@ DailyRegister	# Naloxone # ILNARCAN	1020482270258499585	1020371762322821120	IllinoisDoctors IllinoisAFP	https://twitter.com/BroochOpioidEMS/status/1020482270258499585	
Michaela_Ramm	2018-07-17 11:04	2	1	The Cedar Rapids Police Chief made an initiative known in a city committee meeting yesterday his department is undergoing a formal request to purchase enough Narcan to arm every officer with the opioid overdose-reversal drug, via @ gazettedotcom.https://www.thegazette.com/subject/news/public-safety/cedar-rapids-police-hope-to-arm-officers-with-opioid-overdose-antidote-20180718 …		@ gazettedotcom		1019236290590539776			https://twitter.com/Michaela_Ramm/status/1019236290590539776	
jbjulestx	2018-07-17 10:55	0	0	# drugs # badbehavior Cedar Rapids police hope to arm officers with opioid overdose antidote: CEDAR RAPIDS — Cedar Rapids law enforcement officials are pursuing an initiative to arm their officers with an opioid overdose-reversal d http://tinyurl.com/y9sqbcgd pic.twitter.com/bMkpalJZtP			# drugs # badbehavior	1019234027390324736			https://twitter.com/jbjulestx/status/1019234027390324736	https://pbs.twimg.com/media/DiUL8iQV4AAyiG1.jpg
into_rehab	2018-07-17 10:50	0	0	# drugs # badbehavior Cedar Rapids police hope to arm officers with opioid overdose antidote: CEDAR RAPIDS — Cedar Rapids law enforcement officials are pursuing an initiative to arm their officers with an opioid overdose-reversal d http://tinyurl.com/y9sqbcgd pic.twitter.com/MP6pzqj0Zw			# drugs # badbehavior	1019232782806077442			https://twitter.com/into_rehab/status/1019232782806077442	https://pbs.twimg.com/media/DiUK0FZUEAI1edc.jpg
AnXXopinion	2018-07-13 11:51	9	11	More # NMDEMS slight of hand “opioid overdose deaths and drug overdose deaths drastically increased during her tenure Grisham fought to prevent the Albuquerque Police Department from using a training facility received $65,700 from the pharmaceutical industry” # nmpolhttps://twitter.com/ever_vidana/status/1017796130107789312 …			# NMDEMS # nmpolhttps	1017798751954432000			https://twitter.com/AnXXopinion/status/1017798751954432000	
BroochOpioidEMS	2018-07-12 00:52	0	0	Lifesaver or distraction? Police split on anti-overdose drug Narcan @ ClermontSheriff Ohio OEND Online Proposal # OHNARCAN http://broochopioidems.com/GCOENDOnline/assets/video/GCOENDOnline.m4v …https://www.click2houston.com/news/national/lifesaver-or-distraction-police-split-on-antioverdose-drug_?__vfz=medium%3Dsharebar …		@ ClermontSheriff	# OHNARCAN	1017270453314805760			https://twitter.com/BroochOpioidEMS/status/1017270453314805760	
jbjulestx	2018-07-07 14:55	0	0	# drugs # badbehavior State police now equipped with naloxone for opioid overdose: All sworn Virginia State Police personnel through the rank of first sergeant are now trained and equipped to respond to opioid exposure and overdose . http://tinyurl.com/ybthcdzf pic.twitter.com/8Gj5QzJncc			# drugs # badbehavior	1015670550063144962			https://twitter.com/jbjulestx/status/1015670550063144962	https://pbs.twimg.com/media/Dhhi-3fUYAAvlEJ.jpg
into_rehab	2018-07-07 14:50	0	0	# drugs # badbehavior State police now equipped with naloxone for opioid overdose: All sworn Virginia State Police personnel through the rank of first sergeant are now trained and equipped to respond to opioid exposure and overdose . http://tinyurl.com/ybthcdzf pic.twitter.com/WlB65Dp8QJ			# drugs # badbehavior	1015669296343797761			https://twitter.com/into_rehab/status/1015669296343797761	https://pbs.twimg.com/media/Dhhh15NUEAABxSg.jpg
CapeCodDaily	2018-07-02 07:18	0	0	"Local Communities Receive Naloxone Grant Funding for First Responders" BOSTON – Three local communities will receive state grant funding to help provide the life-saving opioid overdose reversal drug, naloxone, for police and fire departments. Falmouth, … http://capecoddaily.com/news/267570/				1013743624188776448			https://twitter.com/CapeCodDaily/status/1013743624188776448	
Brockton_Fire	2018-06-29 20:08	2	1	Retweeted Charlie Baker ( @ MassGovernor): Thirty-three local police and fire departments across Massachusetts will have access to the lifesaving opioid overdose reversal drug, naloxone, following a third round... https://www.facebook.com/406421832751624/posts/1840791809314612/ …		@ MassGovernor		1012850413912182784			https://twitter.com/Brockton_Fire/status/1012850413912182784	
jbjulestx	2018-06-29 18:55	0	0	# drugs # badbehavior Virginia State Police to be trained on opioid-overdose antidote naloxone: WASHINGTON — By July, all sworn Virginia State Police personnel will have access to a drug that can counteract an opioid overdose. ... http://tinyurl.com/ydfkk6re pic.twitter.com/TyZWaME12B			# drugs # badbehavior	1012831852187537409			https://twitter.com/jbjulestx/status/1012831852187537409	https://pbs.twimg.com/media/Dg5NM5NUEAEzi77.jpg
into_rehab	2018-06-29 18:50	0	0	# drugs # badbehavior Virginia State Police to be trained on opioid-overdose antidote naloxone: WASHINGTON — By July, all sworn Virginia State Police personnel will have access to a drug that can counteract an opioid overdose. ... http://tinyurl.com/ydfkk6re pic.twitter.com/OHWfHbpdHi			# drugs # badbehavior	1012830593263046658			https://twitter.com/into_rehab/status/1012830593263046658	https://pbs.twimg.com/media/Dg5MDnsU0AAmTLA.jpg
MassGovernor	2018-06-29 13:52	38	109	Thirty-three local police and fire departments across Massachusetts will have access to the lifesaving opioid overdose reversal drug, naloxone, following a third round of funding from the Baker-Polito Administration. # OpioidEpidemic : http://ow.ly/ZmJZ30kJlGV pic.twitter.com/PlKc3STdYz			# OpioidEpidemic	1012755799469420544			https://twitter.com/MassGovernor/status/1012755799469420544	https://abs.twimg.com/emoji/v2/72x72/1f517.png
MassGovernor	2018-06-28 16:32	12	34	TODAY Thirty-three local police and fire departments across Massachusetts will have access to the lifesaving opioid overdose reversal drug, naloxone, following a third round of funding from the Baker-Polito Administration. # OpioidEpidemic : http://ow.ly/f4FK30kIqbg pic.twitter.com/qliSLTlqAT			# OpioidEpidemic	1012433591207366656			https://twitter.com/MassGovernor/status/1012433591207366656	https://abs.twimg.com/emoji/v2/72x72/27a1.png
mcclain42	2018-06-12 22:39	1	6	LAX airport police officers use Narcan to save man’s life from opioid overdose – Daily Breeze http://ow.ly/gkRZ30ktiaI @ LAAirportPD # LAXPD # police # drugs # LifeSavingSkills		@ LAAirportPD	# LAXPD # police # drugs # LifeSavingSkills	1006727797002260480			https://twitter.com/mcclain42/status/1006727797002260480	
AirportPoliceLA	2018-06-12 22:37	3	2	LAX airport police officers use Narcan to save man’s life from opioid overdose – Daily Breeze http://ow.ly/gkRZ30ktiaI # LAXPD # police # drugs # lifesaving https://www.dailybreeze.com/2018/06/12/lax-airport-police-officers-use-narcan-to-save-mans-life-from-opioid-overdose/ …			# LAXPD # police # drugs # lifesaving	1006727173288419329			https://twitter.com/AirportPoliceLA/status/1006727173288419329	
AAAPOfficers	2018-06-12 22:37	0	3	LAX airport police officers use Narcan to save man’s life from opioid overdose – Daily Breeze http://ow.ly/gkRZ30ktiaI # LAXPD # police # drugs # lifesaving			# LAXPD # police # drugs # lifesaving	1006727158486708224			https://twitter.com/AAAPOfficers/status/1006727158486708224	
joesonka	2018-06-07 13:23	3	3	There is a nationwide recall of a brand of naloxone -- the drug that can reverse an opioid overdose, is in very high demand -- but Louisville is fine, as the city's police/fire/EMS first responders and @ LouMetroHealth all use a different brand (Narcan)		@ LouMetroHealth		1004775959898263559			https://twitter.com/joesonka/status/1004775959898263559	
BroochOpioidEMS	2018-05-26 12:22	0	0	Black Drug Users Grapple With Surging Opioid Overdose Death Rates concern if blacks aren't seeking help from police, fire and EMTs, they will have less access to naloxone and fewer paths to treatment # MANARCAN https://wbur.fm/2J4Ut9X via @ commonhealth		@ commonhealth	# MANARCAN	1000411985643622401	999711983992745984	EricLesser OPENCambridge	https://twitter.com/BroochOpioidEMS/status/1000411985643622401	
ptuthill	2018-05-23 14:41	1	0	Firefighters in Springfield will carry opioid overdose reversal drug narloxone. Commissioner Calvi said each front line piece of apparatus in the city's 8 firehouse will have a supply. Mayor Sarno said negotiations continue with police unions on cops carrying Narcan pic.twitter.com/wV4SP5qj5j				999359707813904384			https://twitter.com/ptuthill/status/999359707813904384	https://pbs.twimg.com/media/Dd5wWCPU0AAZqSz.jpg