username	date	retweets	favorites	text	geo	mentions	hashtags	tweetid	conversationid	replyto	permalink	imagelink
TalkingScars	2017-11-30 17:48	0	0	2019 Mercedes-Benz CLS-Class video preview: Mercedes-Benz created the four-door "coupe" segment with the CLS-Class more than a decade ago. Now that stylish segment is chock full of competitors including the Audi A7, BMW 6-Series Gran… https://www.motorauthority.com/news/1114055_2019-mercedes-benz-cls-class-video-preview?utm_source=dlvr.it&utm_medium=twitter … # Autos # Car # Trucks pic.twitter.com/WpaVPcebYb			# Autos # Car # Trucks	936366316193177600			https://twitter.com/TalkingScars/status/936366316193177600	https://pbs.twimg.com/media/DP6kM1sVQAITWVb.jpg
andre4atl	2017-11-10 11:38	0	0	These are the cars that need not to leave off the dealer parking lot. Fisher Karma, Cadillac trucks, 550 Mercedes Benz, 550 Mercedes cls 4 doors,BMW 750,760 li ,Range Rover Edmund and velar Audi Q7 ,Audi a8, Audi a7 Mercedes 600. You may need to avoid these companies anyway.				929025538454425601			https://twitter.com/andre4atl/status/929025538454425601	
_OnlyBDrakeford	2017-01-17 10:00	2	4	Starting to switch up my car goals. Not sure if I want my truck. New toys that I want, Mercedes- Benz CLS550 or an Audi A7. pic.twitter.com/SBtHi1z4rg				821371691754520576			https://twitter.com/_OnlyBDrakeford/status/821371691754520576	https://pbs.twimg.com/media/C2YZMVGUoAEgqVg.jpg
Jani_Cinco	2016-11-01 01:06	0	0	European dream car list Truck: Porsche Cayenne Car: Audi A7 Coupe :Mercedes Benz GT coupe Everyday car: BMW M6 4 door				793318346146054144			https://twitter.com/Jani_Cinco/status/793318346146054144	
TalkingScars	2016-07-18 10:53	0	0	Audi A7: Introduced in 2010 as a competitor for the Mercedes-Benz CLS,… http://feedproxy.google.com/%7Er/topspeed/%7E3/AbsoXrN9nTM/2017-audi-a7-ar173089.html?utm_source=dlvr.it&utm_medium=twitter … # Autos # Car # Trucks pic.twitter.com/GcPwpH7MGS			# Autos # Car # Trucks	755052858274263041			https://twitter.com/TalkingScars/status/755052858274263041	https://pbs.twimg.com/media/Cnp8km3VUAAlULg.jpg
TalkingScars	2015-05-15 10:21	0	0	Audi A7 vs. Mercedes-Benz CLS-Class – Which One Wins The U.S. Sales Race? http://dlvr.it/9qXXRf # Autos # Car # Trucks pic.twitter.com/bivIgqA9b4			# Autos # Car # Trucks	599217956250255360			https://twitter.com/TalkingScars/status/599217956250255360	https://pbs.twimg.com/media/CFDZjlCUUAAUA7Z.jpg
TalkingScars	2015-04-21 22:16	0	0	Report: Mercedes-Benz is working on an Audi A7 and Porsche Panamera competitor: German… http://dlvr.it/9VKzfG # Autos # Car # Trucks			# Autos # Car # Trucks	590700598770688000			https://twitter.com/TalkingScars/status/590700598770688000	
TalkingScars	2015-04-21 21:38	0	0	Report: Mercedes-Benz is working on an Audi A7 and… http://dlvr.it/9VJzY6 #2015 # IndustryNews # MercedesBenz # Luxury # Autos # Car # Trucks			# IndustryNews # MercedesBenz # Luxury # Autos # Car # Trucks	590691057848946689			https://twitter.com/TalkingScars/status/590691057848946689	