username	date	retweets	favorites	text	geo	mentions	hashtags	tweetid	conversationid	replyto	permalink	imagelink
Nuoypu_Peufli	2018-07-21 17:17	0	0	12V Ride On Car Kids W/ MP3 Electric Battery Power Remote Control RC Red http://rover.ebay.com/rover/1/711-53200-19255-0/1?ff3=2&toolid=10044&campid=5337506718&customid=&lgeo=1&vectorid=229466&item=253759134547 …				1020779865665130497			https://twitter.com/Nuoypu_Peufli/status/1020779865665130497	
Reosfo_Haadxa	2018-07-21 12:47	0	0	12V Ride On Car Kids W/ MP3 Electric Battery Power Remote Control RC Red http://rover.ebay.com/rover/1/711-53200-19255-0/1?ff3=2&toolid=10044&campid=5337506718&customid=&lgeo=1&vectorid=229466&item=253759134547 …				1020711877469491201			https://twitter.com/Reosfo_Haadxa/status/1020711877469491201	
Joobxa_Dauvqo	2018-07-21 11:29	0	0	12V Ride On Car Kids W/ MP3 Electric Battery Power Remote Control RC Red http://rover.ebay.com/rover/1/711-53200-19255-0/1?ff3=2&toolid=10044&campid=5337506718&customid=&lgeo=1&vectorid=229466&item=253759134547 …				1020692316426850305			https://twitter.com/Joobxa_Dauvqo/status/1020692316426850305	
tusharkdalal	2018-07-21 07:51	0	0	To save forex and for green environment it is necessary to reduce GST on electric/battery/hybrid automobiles in forthcoming # GSTCouncilMeet @ arunjaitley @ PiyushGoyal @ narendramodi @ GST_Council		@ arunjaitley @ PiyushGoyal @ narendramodi @ GST_Council	# GSTCouncilMeet	1020637372592132098			https://twitter.com/tusharkdalal/status/1020637372592132098	
puotdu	2018-07-21 07:12	0	1	12V Ride On Car Kids W/ MP3 Electric Battery Power Remote Control RC Red http://rover.ebay.com/rover/1/711-53200-19255-0/1?ff3=2&toolid=10044&campid=5337506718&customid=&lgeo=1&vectorid=229466&item=253759134547 …				1020627515575078912			https://twitter.com/puotdu/status/1020627515575078912	
Zuovqo_Boecdo	2018-07-21 04:44	0	0	12V Ride On Car Kids W/ MP3 Electric Battery Power Remote Control RC Red http://rover.ebay.com/rover/1/711-53200-19255-0/1?ff3=2&toolid=10044&campid=5337506718&customid=&lgeo=1&vectorid=229466&item=253759134547 …				1020590371825504256			https://twitter.com/Zuovqo_Boecdo/status/1020590371825504256	
DuanePeters	2018-07-21 02:29	0	2	_ ‘o9 - 2 and a Half Months Later after Last pic , They put a STYRAFONE tupe inside the missing meat & Limbs With an electric battery Ran Vacuum Back back that Had tubes sucking Puss out… https://www.instagram.com/p/Ble9MWnl7Qk/?utm_source=ig_twitter_share&igshid=ng5wbl1btlrl …				1020556446273081344			https://twitter.com/DuanePeters/status/1020556446273081344	
on2offline	2018-07-21 00:04	0	0	White 12V Kids Ride on Cars Electric Battery Power Wheels Remote Control 2 Speed https://oc2o.com/en/sales/white-12v-kids-ride-cars-electric-battery-power-wheels-remote-control-speed/152800559611 …				1020519854825197569			https://twitter.com/on2offline/status/1020519854825197569	
Ngwane_SV	2018-07-20 10:11	0	0	Electric battery?				1020310156226310144	1020306188280270849	donovansung	https://twitter.com/Ngwane_SV/status/1020310156226310144	https://abs.twimg.com/emoji/v2/72x72/1f937.png
AlexWitzleben	2018-07-20 03:05	0	0	New technology drives the electric vehicle movement - “Smart” intelligent highways, roads paved with # solar panels, mapping sensors and electric-battery rechargers, and # charging # electriccars from the ground up| ETtech https://tech.economictimes.indiatimes.com/news/technology/new-technology-drives-the-electric-vehicle-movement/65049435 … # tech # EVs # cars # electriccar			# solar # charging # electriccars # tech # EVs # cars # electriccar	1020203009790414849			https://twitter.com/AlexWitzleben/status/1020203009790414849	
terekrutherford	2018-07-19 16:30	0	0	Tesla's battery maker suspends cobalt supplier amid sanctions concern. Electric battery makers may soon ditch cobalt all together. https://uk.reuters.com/article/us-tesla-cuba-cobalt-exclusive/exclusive-teslas-battery-maker-suspends-cobalt-supplier-amid-sanctions-concern-idUKKBN1K92Q9 …				1020043233420890114			https://twitter.com/terekrutherford/status/1020043233420890114	
pieceofshirt	2018-07-19 13:38	0	0	Electric & Battery Operated Pencil Sharpener - for Home Office & School, Sharpens Evenly Every Time, Great for Everyone that Wants the Perfect Point (Black) http://www.amazon.com/dp/B00QOCJYM8/?tag=gorilla02-20 … # OfficeGoods			# OfficeGoods	1019999823817146368			https://twitter.com/pieceofshirt/status/1019999823817146368	
pedegovictoria	2018-07-19 13:26	0	2	Would you like to see more public electric bike charging stations in Victoria? . . . . # yyj # hellofun # electricbike # ebike # electricbicycle # pedegocanada # pedego # bike # pedal # cycling # ride # cyclelife # bicycle # electrictricycle # commuterbike # cargobike # electricbattery pic.twitter.com/YqYHdCCFdt			# yyj # hellofun # electricbike # ebike # electricbicycle # pedegocanada # pedego # bike # pedal # cycling # ride # cyclelife # bicycle # electrictricycle # commuterbike # cargobike # electricbattery	1019997032440885249			https://twitter.com/pedegovictoria/status/1019997032440885249	https://pbs.twimg.com/media/DifB5Q7WsAAesgd.jpg
NiallPresnall	2018-07-19 11:43	0	0	Each nerd fart fills the air with Monster Energy particles, giving the air an electric, battery-like flavor. Real oxygen is on the secret menu.				1019971057837412352	1019789945815281667		https://twitter.com/NiallPresnall/status/1019971057837412352	https://pbs.twimg.com/profile_images/939376304029175809/p7Im7AKj_normal.jpg
sonnigst	2018-07-19 09:03	0	0	Electric Battery/storage training. pic.twitter.com/yr2BsAXi9I				1019930618224939008			https://twitter.com/sonnigst/status/1019930618224939008	https://pbs.twimg.com/media/DieFei7XkAA0qkS.jpg
on2offline	2018-07-18 18:04	0	0	12V Ride On Car Kids W/ MP3 Electric Battery Power Remote Control RC Red https://oc2o.com/en/sales/12v-ride-car-kids-mp3-electric-battery-power-remote-control-red/381028591149 …				1019704551614631936			https://twitter.com/on2offline/status/1019704551614631936	
FortLaudNissan	2018-07-18 11:43	0	0	Designing the most efficient electric battery isn't just useful for EV vehicles, but also to power our cities, businesses, and homes! https://bit.ly/2KOYctR . . . # ElectricVehicle # FTLauderdaleNissan # NissanFtLauderdale # NissanBroward # ElectricBattery pic.twitter.com/2IsGFeC4L9			# ElectricVehicle # FTLauderdaleNissan # NissanFtLauderdale # NissanBroward # ElectricBattery	1019608526086426626			https://twitter.com/FortLaudNissan/status/1019608526086426626	https://pbs.twimg.com/media/DiZgjPzW4AYj4ZJ.jpg
Cyebit	2018-07-18 10:04	0	0	Mistake not using electric/battery powered mining equipment plus your mining old gold, new gold is better # bitcoin https://youtu.be/bhZbp2qpf0c			# bitcoin	1019583735862263810	1019535509633359878	BIUK_Finance	https://twitter.com/Cyebit/status/1019583735862263810	https://abs.twimg.com/emoji/v2/72x72/1f609.png
EpicPlayUK	2018-07-18 08:02	0	0	We love to hear your reviews! Here is our latest EPIC review of the Kids 2 Seater 12v Electric / Battery Ride on Electric Jeep 4x4 Red by Guest. http://reviews.me/twitter_card?domain=https%3A%2F%2Fwww.epicplay.co.uk&image_url=https%3A%2F%2Fddcfq0gxiontw.cloudfront.net%2FProduct%2F7627211%2F7281413%2Ftwitter.jpg%3F1455267891&product_url=https%3A%2F%2Fyotpo.com%2Fgo%2F6ehLPVdL&review=Guest%3A+Absolutely+brilliant+service+from+epic+play%2C+I+purchased+a+child%E2%80%99s+jeep+had+it+on+next+day+delivery+everything+was+1st+class%2Cmy+boy+lives+his+new+jeep+too+would+highly+recommend&social_title=%E2%98%85%E2%98%85%E2%98%85%E2%98%85%E2%98%85+%22Brilliant+service%22&store_name=www.epicplay.co.uk … via @ yotpo		@ yotpo		1019552910043213825			https://twitter.com/EpicPlayUK/status/1019552910043213825	
TeJay29	2018-07-18 02:46	2	2	Real destruction is if they don't explore the electric battery aspect with so much going on in the battery front. I hope they do it.				1019473525164216321	1019452588410847232	sanjeevsanyal	https://twitter.com/TeJay29/status/1019473525164216321	