username	date	retweets	favorites	text	geo	mentions	hashtags	tweetid	conversationid	replyto	permalink	imagelink
mmafightcoach	2018-06-10 05:38	0	0	A 96 year old veteran of the second world war marching to stop # Brexithttps://www.independent.co.uk/voices/brexit-peoples-vote-march-british-army-second-world-war-eu-second-referendum-a8390116.html?amp …			# Brexithttps	1005745954744651781			https://twitter.com/mmafightcoach/status/1005745954744651781	
Open_Britain	2018-06-09 12:37	35	67	Retired Brigadier and patriot Stephen Goodall, 96, is a veteran of the second World War. He'll be marching for a # PeoplesVote on the final Brexit deal on June 23rd. https://www.independent.co.uk/voices/brexit-peoples-vote-march-british-army-second-world-war-eu-second-referendum-a8390116.html …			# PeoplesVote	1005489074734555136			https://twitter.com/Open_Britain/status/1005489074734555136	
DVAAus	2018-04-24 01:35	6	11	This is Thea Commins, a 95-year-old veteran of the Second World War with a message about marching tomorrow for Anzac Day… pic.twitter.com/ntsorSoca7				988652618552504320			https://twitter.com/DVAAus/status/988652618552504320	
Maddelan	2015-11-08 06:29	0	0	Those Second World War veterans marching by the cenotaph... # emotional # humbling # LestWeForget # RemembranceSunday			# emotional # humbling # LestWeForget # RemembranceSunday	663317529507569664			https://twitter.com/Maddelan/status/663317529507569664	https://abs.twimg.com/emoji/v2/72x72/2764.png
GregCameron2	2014-08-05 14:14	0	0	...militarism and nationalism. WW1 set the seeds for Hitler, Stalin and the Second World war. Veterans marching for promised pensions...				496720870165856256			https://twitter.com/GregCameron2/status/496720870165856256	