username	date	retweets	favorites	text	geo	mentions	hashtags	tweetid	conversationid	replyto	permalink	imagelink
echidnasarfofu	2018-07-19 12:03	0	0	Gotto give credit where credit is due. Seriously though dude, there's still hope for you. Just stay away from any media owned by Rupert Murdoch (national geographic might still be ok), and anybody who still thinks Trump is a viable leader. Pretty straight forward.				1019976133004017664	1019259276735311877	Ricey709 M_A_D_Caaaat RubinReport	https://twitter.com/echidnasarfofu/status/1019976133004017664	
SwankeySwann	2018-07-18 08:08	0	0	Climate change denier Rupert Murdoch just bought National Geographic, which gives grants to scientists http://flip.it/JYeXJR				1019554548539691009			https://twitter.com/SwankeySwann/status/1019554548539691009	
OK_Dumbass	2018-07-17 23:21	0	0	It can't be healthy for Tucker to get this wound up over politics. Maybe the Murdochs can re-assign him to their National Geographic subsidiary. He seems to have an affinity for pandas. pic.twitter.com/7AhdakLZjw				1019421932872138757	1019420977292292096	HelenKennedy rupertmurdoch	https://twitter.com/OK_Dumbass/status/1019421932872138757	https://pbs.twimg.com/media/DiW20ulVAAA6xEL.jpg
MatthewJRossEsq	2018-07-14 08:03	1	0	A Rupert Murdoch property touting Russia. Shocking				1018103706565447680	1018102855927062528	NatGeo	https://twitter.com/MatthewJRossEsq/status/1018103706565447680	
reddit_tweeters	2018-07-12 13:01	0	0	Ocasio-Cortez is scaring Rupert Murdoch, now he's praising Russian Tzar, lol. Rupert Murdoch is owner of Fox News and National Geographic https://www.youtube.com/watch?v=IrqZ93r7lzk …				1017453993918951425			https://twitter.com/reddit_tweeters/status/1017453993918951425	
katabatic1	2018-07-12 12:46	0	0	. @ Ocasio2018 is now scaring Rupert Murdoch. He just released a video praising Russian Tzar, lol. Rupert Murdoch is owner of Fox News and National Geographic. https://www.youtube.com/watch?v=IrqZ93r7lzk …		@ Ocasio2018		1017450198027644929			https://twitter.com/katabatic1/status/1017450198027644929	
TDPS_subreddit	2018-07-12 12:18	0	0	Ocasio-Cortez is scaring Rupert Murdoch, now he's praising Russian Tzar, lol. Rupert Murdoch is owner of Fox News and National Geographic https://ift.tt/2JgVVlD				1017443055350243328			https://twitter.com/TDPS_subreddit/status/1017443055350243328	
jonalisag	2018-07-09 18:40	0	3	SIDE NOTE* A few years back National Geographic magazine was bought by Rupert Murdoch so I no longer trust their publication. https://boingboing.net/2015/11/05/shortly-after-rupert-murdoch-b.html …				1016451970989723650	1016449889868410885	RepBarbaraLee SecretaryZinke	https://twitter.com/jonalisag/status/1016451970989723650	
Biggy1883	2018-07-03 19:30	1	2	Nat Geo is owner by Rupert Murdoch=all trust gone				1014290271603908608	1012909355031846913	NatGeo ItheMissingLink	https://twitter.com/Biggy1883/status/1014290271603908608	
Lary9	2018-07-03 01:59	0	1	# verizon & # RupertMurdoch... Perfect together.			# verizon # RupertMurdoch	1014025796095299584	1012795561114783744	NatGeo verizon	https://twitter.com/Lary9/status/1014025796095299584	
Beatles0223	2018-06-30 01:48	0	0	https://articles.pennlive.com/sports/index.ssf/2018/06/fox_sports_stalin_world_cup.amp …. https://articles.pennlive.com/sports/index.ssf/2018/06/fox_sports_stalin_world_cup.amp …. Ah, yes, Rupert Murdoch acquires National Geographic in order to rewrite history. Sorry to see @ NatGeo means nothing anymore. PS Wouldn't surprise me if Putin worships Stalin. He acts just like him.		@ NatGeo		1012935817214484481			https://twitter.com/Beatles0223/status/1012935817214484481	
markitgeek	2018-06-27 12:20	1	9	I think @ NatGeo is owned by Rupert Murdoch of Fox News fame.		@ NatGeo		1012007692733419520	1011996840399654913	swagschal_ hansalexrazo	https://twitter.com/markitgeek/status/1012007692733419520	
vtblr	2018-06-26 10:54	0	0	National Geographic is ook niet helemaal neutraal. Amerikaans, eigendom van Rupert Murdoch				1011623800616706050	1011544359257497601	janssensnuf Carla63365130	https://twitter.com/vtblr/status/1011623800616706050	
CapsOffside	2018-06-25 18:12	0	0	And it should be noted, Fox's Rupert Murdoch bought National Geographic (they produced this odd Stalin-was-just-a-guy piece) a few years ago. https://twitter.com/MC_of_A/status/1011304978126909440 …				1011371629249609728			https://twitter.com/CapsOffside/status/1011371629249609728	
KrisWD40	2018-06-25 13:24	0	0	Yeah they bought National Geographic up in 2015. I remember some minor uproar at the time but I'm not an avid reader of theirs, mostly just might check one out in a doctor or dentist waiting room, so unsure how different they are now than before.				1011299132886134789	1010684816730279936	apoxalyps1 dkbruni	https://twitter.com/KrisWD40/status/1011299132886134789	
yondermeister	2018-06-25 12:47	0	0	Rupert Murdoch’s conscience				1011289848911712257	1010976868491825152	NatGeo	https://twitter.com/yondermeister/status/1011289848911712257	
KrisWD40	2018-06-25 09:56	1	1	Fox news is under the Fox Entertainment Group banner, which includes all the entertainment stuff Disney plans to buy, National Geographic, and the various Fox Sports networks. Taking away viewers will hurt ad rates which will at least be felt some by Murdoch.				1011246695924097025	1010684816730279936	dkbruni DesignationSix	https://twitter.com/KrisWD40/status/1011246695924097025	
web_rant	2018-06-24 16:55	0	0	Rupert Murdoch, your owner. https://twitter.com/NatGeo/status/1010976868491825152 …				1010989759441727488	1010976868491825152	NatGeo	https://twitter.com/web_rant/status/1010989759441727488	
morphizm	2018-06-22 16:00	0	1	Your daily reminder that @ NatGeo is owned by noted dissembler @ rupertmurdoch https://twitter.com/natgeo/status/1010206547161636864 …		@ NatGeo @ rupertmurdoch		1010251320660393984			https://twitter.com/morphizm/status/1010251320660393984	
KenThomasRoss	2018-06-20 09:28	0	0	But yes, as of now, Fox (and Rupert Murdoch) own the movie studio, the entertainment channels, 73% of National Geographic,& 30% of Hulu. 20th Century Fox owns X-Men and Ice Age movies, most of the Star Wars movies, plus Avatar, Titanic, Lincoln, Bridge of Spies, Joy, & The Post.				1009427812699209728	1009269783735353344	KenThomasRoss ealdrid1	https://twitter.com/KenThomasRoss/status/1009427812699209728	