username	date	retweets	favorites	text	geo	mentions	hashtags	tweetid	conversationid	replyto	permalink	imagelink
jolytore1976	2018-07-21 19:02	0	0	elephant sex pictures trinidad grils fat pussy getting fuck porno vedete hardcore female bodybuilding 16yr pic.twitter.com/QS1s3a8VlS				1020806372047323137			https://twitter.com/jolytore1976/status/1020806372047323137	
tieneuvaso1989	2018-07-21 18:17	0	0	cartoons mickie james nude sex lesbian 3d sex free sex videoclips sex nj elf anal female bodybuilding porn pic.twitter.com/EBg5Gzj9DF				1020795048722665474			https://twitter.com/tieneuvaso1989/status/1020795048722665474	
OliviaW67350760	2018-07-21 16:53	0	0	female bodybuilding new zealand nude german teen models eropa naked gils all male anal solo pussy tube mom pic.twitter.com/4JcctpW7iY				1020773784331202566			https://twitter.com/OliviaW67350760/status/1020773784331202566	
Elizabe90787238	2018-07-21 16:14	0	0	pandora peaks porn jennifer aniston free nude wife flash pussy most watched porno female bodybuilding fuck pic.twitter.com/fltKenwB4Z				1020764094297669632			https://twitter.com/Elizabe90787238/status/1020764094297669632	
Britney04184463	2018-07-21 16:01	0	0	female bodybuilding new zealand nude german teen models eropa naked gils all male anal solo pussy tube mom pic.twitter.com/4h0VZmjJcz				1020760715551027202			https://twitter.com/Britney04184463/status/1020760715551027202	
ipgejade1983	2018-07-21 15:43	0	0	srilanka female bodybuilding porn videos adult world website converse nude http://erotica sexandteen pic.twitter.com/Ds9SZzjFsc				1020756285871075328			https://twitter.com/ipgejade1983/status/1020756285871075328	
GloriaL07078580	2018-07-21 14:03	0	0	scenes manga pornografico female bodybuilding nudes miss teen porn nude amature sex best quality sexy pic.twitter.com/N6zl8ZzFef				1020730908209500161			https://twitter.com/GloriaL07078580/status/1020730908209500161	
Gabriel05618023	2018-07-21 11:35	0	0	sex with my teacher latina porn site audrey holland porn sexe forum female bodybuilding fucking free pic.twitter.com/1qmgKT4b0o				1020693634155507712			https://twitter.com/Gabriel05618023/status/1020693634155507712	
oltaberna1984	2018-07-21 11:22	0	0	scenes manga pornografico female bodybuilding nudes miss teen porn nude amature sex best quality sexy pic.twitter.com/zn7RWYRNBE				1020690390566006784			https://twitter.com/oltaberna1984/status/1020690390566006784	
1bodybuilders1	2018-07-21 07:39	1	16	Female bodybuilding build muscle fast ! : http://www.femalebodybuilders24.com/2017/10/female-bodybuilding-build-muscle-fast.html …pic.twitter.com/7XqezbNRXx				1020634292446285831			https://twitter.com/1bodybuilders1/status/1020634292446285831	https://pbs.twimg.com/media/DioFDQUU0AE7Pbl.jpg
Daniell20231517	2018-07-21 07:34	0	0	elephant sex pictures trinidad grils fat pussy getting fuck porno vedete hardcore female bodybuilding 16yr pic.twitter.com/HPtC4ek0KS				1020633180158783488			https://twitter.com/Daniell20231517/status/1020633180158783488	
usotdige1972	2018-07-21 06:45	0	0	websites of free porn adult church groups free porno fisting nude female bodybuilding pics alex housewives pic.twitter.com/08tCoI8T73				1020620811584122881			https://twitter.com/usotdige1972/status/1020620811584122881	
Isabell69386455	2018-07-21 04:32	0	0	in law farm story girl sex hot anime sex movies game free porn adult heelys size 12 female bodybuilding pic.twitter.com/N8tZ0u4q8D				1020587281701310466			https://twitter.com/Isabell69386455/status/1020587281701310466	
AmandaL46705123	2018-07-21 03:56	0	1	elephant sex pictures trinidad grils fat pussy getting fuck porno vedete hardcore female bodybuilding 16yr pic.twitter.com/kAPOs3zcxy				1020578223804043264			https://twitter.com/AmandaL46705123/status/1020578223804043264	
BrookeC07073530	2018-07-21 03:01	0	0	pandora peaks porn jennifer aniston free nude wife flash pussy most watched porno female bodybuilding fuck pic.twitter.com/Hf8Dzh9cvu				1020564397654183936			https://twitter.com/BrookeC07073530/status/1020564397654183936	
DeniseW93256843	2018-07-20 23:36	0	0	female bodybuilding porn videos sexy 80 s chicks movie porn teen virgin girl sex porn tube big cook pic.twitter.com/x3S5zbn1ip				1020512742116126720			https://twitter.com/DeniseW93256843/status/1020512742116126720	
GloriaD13996617	2018-07-20 21:30	0	0	female bodybuilding new zealand nude german teen models eropa naked gils all male anal solo pussy tube mom pic.twitter.com/CdiHSGEGrT				1020481015024791553			https://twitter.com/GloriaD13996617/status/1020481015024791553	
EricaLanding	2018-07-20 19:27	0	0	# fitness SUPER STRONG GIRLS | Female Bodybuilding Motivation: SUPER STRONG GIRLS | Female… https://goo.gl/fb/DAzCJG			# fitness	1020450166325825536			https://twitter.com/EricaLanding/status/1020450166325825536	https://abs.twimg.com/emoji/v2/72x72/1f4aa.png
OliviaB25642828	2018-07-20 14:51	0	0	free hentai mp4 porn sexy naked girls game female bodybuilding porn lazytown adult daniel craig naked pic pic.twitter.com/Ilg37RjIUi				1020380598706352129			https://twitter.com/OliviaB25642828/status/1020380598706352129	
PiotrPiobus	2018-07-20 14:32	0	0	Mam nowy film na playliście w @ YouTube: FUTURE OF FEMALE BODYBUILDING – http://youtu.be/4wz0uHVt0Rs?a		@ YouTube		1020375805980012544			https://twitter.com/PiotrPiobus/status/1020375805980012544	