username,date,retweets,favorites,comments,text,geo,mentions,hashtags,tweetid,conversationid,replyto,permalink,imagelink
"ABARefugee","2018-07-30-14:50",1,0,0,"40 migrants were stranded in the Mediterranean Sea for 5 days before a Maltese ship picked them up and transferred them to a Tunisian commercial boat. Italy, Malta and France all refused to let the vessel into their ports. https://www.nytimes.com/aponline/2018/07/29/world/middleeast/ap-ml-tunisia-migrant-boat.html …","","","","1024004252094615552","","","https://twitter.com/ABARefugee/status/1024004252094615552",""
"mhouseto","2018-07-27-14:19",1,1,0,"While we usually end the week on a happy note, we would be remiss not to mention the migrant boat that has been helplessly stranded in the Mediterranean. Every life is important. Refugee lives are important. # RefugeesWelcome # HumanRights # refugeeshttps://edition.cnn.com/2018/07/27/europe/tunisian-migrant-boat-stranded-intl/index.html …","","","# RefugeesWelcome # HumanRights # refugeeshttps","1022909345233686528","","","https://twitter.com/mhouseto/status/1022909345233686528",""
"FinancialTimes","2018-07-24-12:11",31,12,12,"For every migrant rescued from boats stranded in the Mediterranean, the EU will offer €6,000 to the government. https://on.ft.com/2LEbYPA","","","","1021790101825888256","","","https://twitter.com/FinancialTimes/status/1021790101825888256",""
"KaiTab","2018-07-24-08:02",0,0,0,"Brussels to offer EU governments €6,000 for every migrant they take in from boats stranded in the Mediterranean, under new plans https://www.ft.com/content/38874b4a-8eaa-11e8-b639-7680cedcc421 …","","","","1021727329788329984","","","https://twitter.com/KaiTab/status/1021727329788329984",""
"JMGlachant","2018-07-24-07:42",1,1,1,"Carrot vs stick in humanitarian affairs: EU Commission will offer EU countries €6,000 for every migrant they take in from boats stranded in the Mediterranean in new plans designed to help ease pressure on Italy & Italians. https://www.ft.com/content/38874b4a-8eaa-11e8-b639-7680cedcc421 …","","","","1021722363463970817","","","https://twitter.com/JMGlachant/status/1021722363463970817",""
"AlexWitzleben","2018-07-24-03:52",1,0,3,"EU to pay member states to take in rescued migrants. Brussels will offer EU governments €6,000 for every migrant they take in from boats stranded in the Mediterranean https://www.ft.com/content/38874b4a-8eaa-11e8-b639-7680cedcc421?desktop=true&segmentId=7c8f09b9-9b61-4fbb-9430-9208a9e233c8 … via @ financialtimes # migrationEU # Salvini # Seehofer # migrants # Futureofeurope # Macron","","@ financialtimes","# migrationEU # Salvini # Seehofer # migrants # Futureofeurope # Macron","1021664333158395904","","","https://twitter.com/AlexWitzleben/status/1021664333158395904",""
"PeterNHerold","2018-07-24-03:13",0,0,1,"”Brussels will offer EU governments €6,000 for every migrant they take in from boats stranded in the Mediterranean, in plans designed to help ease pressure on Italy’s new anti-immigration government.” # migration # Mediterranean # Italy https://www.ft.com/content/38874b4a-8eaa-11e8-b639-7680cedcc421 …","","","# migration # Mediterranean # Italy","1021654703946559488","","","https://twitter.com/PeterNHerold/status/1021654703946559488",""
"NiklasNovaky","2018-07-24-01:35",1,0,1,"“Brussels will offer EU governments €6,000 for every migrant they take in from boats stranded in the Mediterranean, in plans designed to help ease pressure on Italy’s new anti-immigration government.” # migration # Mediterranean https://www.ft.com/content/38874b4a-8eaa-11e8-b639-7680cedcc421 …","","","# migration # Mediterranean","1021630009524592642","","","https://twitter.com/NiklasNovaky/status/1021630009524592642",""
"warofoneman","2018-07-24-01:34",0,1,0,"［每人六皮嘢］EU to pay for migrants Brussels will offer EU countries €6,000 for every migrant they take in from boats stranded in the Mediterranean","","","","1021629616417644544","","","https://twitter.com/warofoneman/status/1021629616417644544",""
"dipu412","2018-07-23-18:16",1,0,0,"EU to pay member states to take in migrants. Brussels will offer EU Govts. €6,000 for every migrant they take in from boats stranded in the Mediterranean, in plans designed to help ease pressure on Italy’s new anti-immigration government. https://www.ft.com/content/38874b4a-8eaa-11e8-b639-7680cedcc421 … via @ FT","","@ FT","","1021519424334061575","","","https://twitter.com/dipu412/status/1021519424334061575",""
"PBI_Gestion","2018-07-23-17:04",0,0,0,"Brussels will offer EU governments €6,000 for every migrant they take in from boats stranded in the Mediterranean, in plans designed to help ease pressure on Italy’s new anti-immigration government https://www.ft.com/content/38874b4a-8eaa-11e8-b639-7680cedcc421 …","","","","1021501358787252224","","","https://twitter.com/PBI_Gestion/status/1021501358787252224",""
"hannabogorowski","2018-07-23-16:58",40,78,14,"Tunisia, joining Italy, Malta, and France, refuses to allow migrant boat carrying 40 Africans from docking on their shores, leaving them stranded in the Mediterranean Sea. http://dailycaller.com/2018/07/23/tunisia-migrant-boat-africans/ …","","","","1021499758874161152","","","https://twitter.com/hannabogorowski/status/1021499758874161152",""
"KwakuAdinkra","2018-07-23-16:42",0,1,0,"Retweeted Financial Times ( @ FinancialTimes): The EU now plans to offer member states €6,000 for every migrant they take in from boats stranded in the Mediterranean. The proposals will be published on Tuesday. https://on.ft.com/2uPUSVF","","@ FinancialTimes","","1021495846259630082","","","https://twitter.com/KwakuAdinkra/status/1021495846259630082",""
"FinancialTimes","2018-07-23-16:15",55,34,6,"The EU now plans to offer member states €6,000 for every migrant they take in from boats stranded in the Mediterranean. The proposals will be published on Tuesday. https://on.ft.com/2uPUSVF","","","","1021488907970592768","","","https://twitter.com/FinancialTimes/status/1021488907970592768",""
"banglanews_eng","2018-07-22-10:34",0,0,0,"Health condition of Bangladeshis stranded at Med deteriorated The head of Tunisia’s Red Crescent aid group has warned the condition of Bangladeshi nationals among 40 migrants stranded on a boat stuck in the Mediterranean Sea has deteriorated as the ves… http://bit.ly/2JJtgGf pic.twitter.com/0eAkbcITZD","","","","1021040852125323264","","","https://twitter.com/banglanews_eng/status/1021040852125323264","https://pbs.twimg.com/media/Dit3Pm4X4AYEJ1V.jpg"
"tlesam","2018-07-21-14:59",0,1,0,"“The head of Tunisia's Red Crescent aid group has warned the condition of 40 migrants stranded on a boat stuck in the Mediterranean Sea has deteriorated as the vessel has been refused docking access for days.” https://ravallirepublic.com/news/world/article_ad726ed6-89a1-58c6-b496-237eec2a6bca.html?utm_medium=social&utm_source=twitter&utm_campaign=user-share …","","","","1020745014861869056","","","https://twitter.com/tlesam/status/1020745014861869056",""
"IgnitionUK","2018-07-20-06:18",1,0,0,"'Four humanitarian groups say a commercial boat carrying 40 migrants who had been stranded in the Mediterranean Sea has been waiting to get a green light to dock in the Tunisian port of Zarzis for more than 48 hours.' # Tunisiahttps://abcnews.go.com/International/wireStory/boat-migrants-denied-entry-pointed-tunisia-56698888 …","","","# Tunisiahttps","1020251716678242305","","","https://twitter.com/IgnitionUK/status/1020251716678242305",""
"sigikusa","2018-07-20-00:52",0,1,0,"Four humanitarian groups say a commercial boat carrying 40 migrants who had been stranded in the Mediterranean Sea has been waiting to get a green light to dock in the Tunisian port of Zarzis for more than 48 hours https://wtop.com/europe/2018/07/the-latest-turkish-authorities-interview-rescued-migrants/ … via @ WTOP","","@ WTOP","","1020169672644333568","","","https://twitter.com/sigikusa/status/1020169672644333568",""
"HeadlinesCenter","2018-07-14-12:12",0,0,0,"Fate of 450 migrants in balance amid new Italy-Malta standoff: Some 450 migrants were rescued and moved from a fishing boat onto two patrol vessels in the Mediterranean. But they remain stranded with Italy and Malta at odds over… http://dlvr.it/QbY8Gc http://newssyndicators.com pic.twitter.com/CGBAbKFO62","","","","1018166238680264704","","","https://twitter.com/HeadlinesCenter/status/1018166238680264704","https://pbs.twimg.com/media/DiFAzD7VQAAZGM7.jpg"
"EUwatchers","2018-07-14-10:37",2,4,0,"Some 450 migrants were rescued and moved from a fishing boat onto two patrol vessels in the Mediterranean. But they remain stranded with Italy and Malta at odds over whose responsibility they are. http://www.dw.com/en/fate-of-450-migrants-in-balance-amid-new-italy-malta-standoff/a-44674260?maca=en-rss-en-eu-2092-rdf … # EU # EUpolpic.twitter.com/fQi8wqd4vN","","","# EU # EUpolpic","1018142438144331776","","","https://twitter.com/EUwatchers/status/1018142438144331776","https://pbs.twimg.com/media/DiErJh-U0AArLzm.jpg"
"maksphoria","2018-07-09-05:00",0,0,0,"What’s AU’s position on African migrants stranded, drowning, being ping-poned all around the Mediterranean&essentially being treated worse than garbage? What’s AU’s strategy? Saw a stranded boat in Pozzallo Italy last week,heartbreaking. @ AUC_DPA @ EUCouncil @ africasacountry","","@ AUC_DPA @ EUCouncil @ africasacountry","","1016245748705439744","1012770988579225600","","https://twitter.com/maksphoria/status/1016245748705439744","https://pbs.twimg.com/profile_images/925366405805101057/44uGXfrd_normal.jpg"
"InfoMigrants","2018-07-03-06:40",6,3,0,"The # Mediterranean is currently without # NGO -operated migrant-rescue vessels with the # Aquarius in Marseilles, the @ openarms_fund bound for Spain and three other boats stranded in # Malta. # Refugees http://infomi.gr/11xr.T pic.twitter.com/P4ZDNuH2ZB","","@ openarms_fund","# Mediterranean # NGO # Aquarius # Malta # Refugees","1014096569149378560","","","https://twitter.com/InfoMigrants/status/1014096569149378560","https://pbs.twimg.com/media/DhLLX9_WsAEQ0E9.jpg"
"maksphoria","2018-06-29-14:53",0,0,1,"What is the AU’s position on all these African migrants stranded, drowning, being ping-poned all around the Mediterranean and essentially being treated worse than garbage? What is the AU’s strategy? Saw a stranded boat in Pozzallo Italy last week and it’s just heartbreaking.","","","","1012770988579225600","","","https://twitter.com/maksphoria/status/1012770988579225600","https://pbs.twimg.com/profile_images/925366405805101057/44uGXfrd_normal.jpg"
"Smth_Banal","2018-06-29-11:55",0,0,0,"Almost 350 migrants are stranded on two boats in the Mediterranean","","","","1012726326552350722","","","https://twitter.com/Smth_Banal/status/1012726326552350722",""
"InlawkerMark","2018-06-28-16:07",0,0,0,"A rescue boat stranded for nearly a week in the Mediterranean with over 200 migrants docked in Malta Wednesday, after a deal was struck between a group of EU states to take them in. http://www.dailymail.co.uk/news/article-5893387/Rescue-ship-Lifeline-carrying-230-migrants-docks-Malta.html …","","","","1012427300695150593","","","https://twitter.com/InlawkerMark/status/1012427300695150593",""
"HelenArmstrong5","2018-06-28-13:35",0,1,0,"A rescue boat stranded for nearly a week in the Mediterranean with over 200 migrants docked in Malta Wednesday, after a deal was struck between a group of EU states to take in some of those on board.","","","","1012388956778819584","","","https://twitter.com/HelenArmstrong5/status/1012388956778819584",""
"dfutoryan","2018-06-28-09:39",0,0,0,"A rescue boat stranded for nearly a week in the Mediterranean with over 200 migrants docked in Malta Wednesday, after a deal was struck between a group of EU states to take in some of those on board. http://click1.crm.foreignpolicy.com/ofjwwvnqnfwdtttkdkfvmdcnpzdvvcqkmktqzmlmwtqk_ehrthqhpfrbydrpqbbp.html?a=Morning+Brief+6%2F28%2F18+-+FP+Guide&b=Morning+Brief+OC …","","","","1012329553308672000","","","https://twitter.com/dfutoryan/status/1012329553308672000",""
"Kogonuso","2018-06-28-06:28",0,0,0,"Migrant rescue ship docks in Malta as EU nations reach deal A rescue boat stranded for nearly a week in the Mediterranean with...https://www.geezgo.com/sps/28382 pic.twitter.com/afpLCqk5Uo","","","","1012281550245773312","","","https://twitter.com/Kogonuso/status/1012281550245773312","https://pbs.twimg.com/media/DgxYqe_VQAES-b4.jpg"
"Geezgo","2018-06-28-06:27",0,0,0,"Migrant rescue ship docks in Malta as EU nations reach deal A rescue boat stranded for nearly a week in the Mediterranean with...https://www.geezgo.com/sps/28382 pic.twitter.com/6QjtSXws8k","","","","1012281442309582848","","","https://twitter.com/Geezgo/status/1012281442309582848","https://pbs.twimg.com/media/DgxYjZvUwAAaQ5A.jpg"
"banglanews_eng","2018-06-28-03:09",0,0,0,"Migrant rescue ship docks in Malta A rescue boat stranded for nearly a week in the Mediterranean with over 200 migrants docked in Malta Wednesday, after a deal was struck between a group of EU states to take them in. Lifeline, a vessel for the German c… http://bit.ly/2tLlaqD pic.twitter.com/kA3e7y2sXV","","","","1012231547989176320","","","https://twitter.com/banglanews_eng/status/1012231547989176320","https://pbs.twimg.com/media/DgwrOpOW4AAXE_x.jpg"
"mhh_heron","2018-06-28-03:02",0,0,0,"MailOnline : Lifeline rescue boat stranded in the Mediterranean carrying 230 migrants docks in Malta - after deal is struck with EU states https://dailym.ai/2KgvPVl (via Twitter https://twitter.com/MailOnline/status/1012168978649796608 …)pic.twitter.com/0W3uEBHfAU","","","","1012229700947709952","","","https://twitter.com/mhh_heron/status/1012229700947709952","https://pbs.twimg.com/media/DgwpjIOWAAEck6C.jpg"
"NewsInTheWorld","2018-06-28-03:01",0,0,0,"Lifeline rescue boat stranded in the Mediterranean carrying 230 migrants docks in Malta - after deal is struck with EU states https://dailym.ai/2KgvPVl","","","","1012229396579700742","","","https://twitter.com/NewsInTheWorld/status/1012229396579700742",""
"MailOnline","2018-06-27-23:01",7,7,2,"Lifeline rescue boat stranded in the Mediterranean carrying 230 migrants docks in Malta - after deal is struck with EU states https://dailym.ai/2KgvPVl","","","","1012168978649796608","","","https://twitter.com/MailOnline/status/1012168978649796608",""
"Ion_Banal","2018-06-27-21:30",0,0,2,"Almost 350 migrants are stranded on two boats in the Mediterranean","","","","1012146144581996544","","","https://twitter.com/Ion_Banal/status/1012146144581996544",""
"AFP","2018-06-27-16:52",35,18,2,"# UPDATE A rescue boat stranded for nearly a week in the Mediterranean with over 200 migrants docked in Malta Wednesday, after a deal was struck between a group of EU states to take them in http://u.afp.com/odts pic.twitter.com/CDzjOM7vsu","","","# UPDATE","1012076106269130752","1011934671142256640","","https://twitter.com/AFP/status/1012076106269130752","https://pbs.twimg.com/media/DgudkUyW0AEX37v.jpg"
"GNewsViews","2018-06-27-16:19",0,0,0,"The Lifeline, a rescue boat stranded in the Mediterranean Sea with over 200 migrants docks in Senglea, Malta. A deal was struck between a group of EU states to take them in after the ship... http://global-news-views.news/lifeline-rescue-ship-docks-in-malta-after-six-days-at-sea/ …","","","","1012068015649804289","","","https://twitter.com/GNewsViews/status/1012068015649804289",""
"cfbenninghoff","2018-06-27-15:41",0,0,0,"MIGRANT RESCUE SHIP DOCKS IN MALTA AS EU NATIONS REACH DEAL Valletta (AFP) – A rescue boat stranded for nearly a week in the Mediterranean with over 200 migrants docked in Malta Wednesday, after a deal was struck between a group of EU states to take ... http://zenith.news/migrant-rescue-ship-docks-in-malta-as-eu-nations-reach-deal/?tw=1 …","","","","1012058333988044800","","","https://twitter.com/cfbenninghoff/status/1012058333988044800",""
"davesnewscom","2018-06-27-14:43",0,0,0,"Migrant rescue ship Lifeline enters Malta port http://davesnews.co.uk/media/migrant-rescue-ship-lifeline-enters-malta-port/ … A rescue boat stranded for nearly a week in the Mediterranean w... pic.twitter.com/IFgPWbTiVU","","","","1012043834765795328","","","https://twitter.com/davesnewscom/status/1012043834765795328","https://pbs.twimg.com/media/DguAgQfUEAAkA-L.jpg"
"The_NewArab","2018-06-27-12:51",1,0,0,"Stranded Mediterranean migrant rescue boat to dock in Malta https://trib.al/Ut2Qunr","","","","1012015606017773569","","","https://twitter.com/The_NewArab/status/1012015606017773569",""
"DelanoMagazine","2018-06-27-10:52",0,0,2,"# Luxembourg is to welcome 15 out of the 230 migrants from the # lifeline ship, which was stranded in the Mediterranean for five days after Italy refused to let the boat dock http://delano.lu/d/detail/news/lux-welcome-15-stranded-lifeline-passengers/183506 … @ Xavier_Bettel # lifeline maltapic.twitter.com/8xVOOZBpAk","","@ Xavier_Bettel","# Luxembourg # lifeline # lifeline","1011985536398000128","","","https://twitter.com/DelanoMagazine/status/1011985536398000128","https://pbs.twimg.com/media/DgtLTxxXcAIchpW.jpg"
"pronewsnetasia","2018-06-27-09:33",0,0,0,"A rescue boat stranded for days in the Mediterranean carrying over 200 migrants will dock in Malta on Wednesday evening https://pronewsnetasia.wordpress.com/2018/06/27/a-rescue-boat-stranded-for-days-in-the-mediterranean-carrying-over-200-migrants-will-dock-in-malta-on-wednesday-evening/ …","","","","1011965768915980289","","","https://twitter.com/pronewsnetasia/status/1011965768915980289",""
"PNN_pronews","2018-06-27-09:30",0,0,0,"A rescue boat stranded for days in the Mediterranean carrying over 200 migrants will dock in Malta on Wednesday evening, https://pronewsnet.wordpress.com/2018/06/27/a-rescue-boat-stranded-for-days-in-the-mediterranean-carrying-over-200-migrants-will-dock-in-malta-on-wednesday-evening/ …","","","","1011965026532577281","","","https://twitter.com/PNN_pronews/status/1011965026532577281",""
"AFP","2018-06-27-09:15",22,28,3,"# UPDATE A rescue boat stranded for days in the Mediterranean carrying over 200 migrants will dock in Malta on Wednesday evening, the country's prime minister says http://u.afp.com/odj7","","","# UPDATE","1011961094699651072","1011934671142256640","","https://twitter.com/AFP/status/1011961094699651072","https://pbs.twimg.com/profile_images/697343883630481408/c08JBfBB_normal.jpg"
"aleksandra_sgk","2018-06-27-08:30",0,0,0,"Almost 350 migrants are stranded on two boats in the Mediterranean @ CNNIhttps://cnn.it/2txTi9m","","@ CNNIhttps","","1011949840694116352","","","https://twitter.com/aleksandra_sgk/status/1011949840694116352",""
"Brought_to_You","2018-06-27-03:01",0,0,1,"The MV Lifeline, the latest migrant boat stranded in the Mediterranean, has reportedly been refused entry into Malta. Will Europe be able to resolve its refugee crisis? http://p.dw.com/p/30JaE pic.twitter.com/uXUPee8O3b","","","","1011867156013879296","","","https://twitter.com/Brought_to_You/status/1011867156013879296",""
"behappynewsman","2018-06-27-01:08",0,0,0,"Beachgoers in Italy frolic in the waters of the Mediterranean while a boat full of stranded migrants looms in the background.","","","","1011838538265120768","","","https://twitter.com/behappynewsman/status/1011838538265120768",""
"dwnews","2018-06-26-23:40",4,7,9,"The MV Lifeline, the latest migrant boat stranded in the Mediterranean, has reportedly been refused entry into Malta. Will Europe be able to resolve its refugee crisis? http://p.dw.com/p/30JaE pic.twitter.com/OngWVeCWPs","","","","1011816394680233985","","","https://twitter.com/dwnews/status/1011816394680233985",""
"Moonzara","2018-06-26-20:09",0,1,0,"Government to ‘offer refuge’ to migrants stranded on boat in Mediterranean https://www.irishtimes.com/news/ireland/irish-news/government-to-offer-refuge-to-migrants-stranded-on-boat-in-mediterranean-1.3544881#.WzLVzmqi1fI.twitter … via @ IrishTimes","","@ IrishTimes","","1011763519069573120","","","https://twitter.com/Moonzara/status/1011763519069573120",""
"FionacFinn","2018-06-26-18:41",0,1,0,"Government to ‘offer refuge’ to migrants stranded on boat in Mediterranean https://www.irishtimes.com/news/ireland/irish-news/government-to-offer-refuge-to-migrants-stranded-on-boat-in-mediterranean-1.3544881 …","","","","1011741148212334592","","","https://twitter.com/FionacFinn/status/1011741148212334592",""
"IrishRefugeeCo","2018-06-26-18:17",12,36,1,"We welcome and commend this decision. A small number of people but an important example of leadership against the backdrop of the EU's crumbling asylum policies. Government to ‘offer refuge’ to migrants stranded on boat in Mediterranean https://www.irishtimes.com/news/ireland/irish-news/government-to-offer-refuge-to-migrants-stranded-on-boat-in-mediterranean-1.3544881#.WzK2oFcV-NI.twitter … via @ IrishTimes","","@ IrishTimes","","1011735268360097792","","","https://twitter.com/IrishRefugeeCo/status/1011735268360097792",""
"Rosemary_Henn","2018-06-26-17:13",0,3,0,"It’s heartening to see this example of leadership and solidarity in the face of human crisis: Government to ‘offer refuge’ to migrants stranded on boat in Mediterranean via @ IrishTimes https://www.irishtimes.com/news/ireland/irish-news/government-to-offer-refuge-to-migrants-stranded-on-boat-in-mediterranean-1.3544881 …","","@ IrishTimes","","1011719122651107337","","","https://twitter.com/Rosemary_Henn/status/1011719122651107337",""
"irish_quill","2018-06-26-17:03",0,0,0,"Government to ‘offer refuge’ to migrants stranded on boat in Mediterranean http://dlvr.it/QYcWsS @ IlReporter 6pic.twitter.com/ghT3kZOyyd","","@ IlReporter","","1011716493086609408","","","https://twitter.com/irish_quill/status/1011716493086609408","https://pbs.twimg.com/media/DgpWydVVAAAvV7E.jpg"
"247CasinoBonus_","2018-06-26-16:38",0,0,0,"£1500 http://bit.ly/cas1no- Government to ‘offer refuge’ to migrants stranded on boat in Mediterranean http://dlvr.it/QYcQwV BONUS http://bit.ly/cas1no- pic.twitter.com/ppMv4E2NTQ","","","","1011710414638362625","","","https://twitter.com/247CasinoBonus_/status/1011710414638362625","https://pbs.twimg.com/media/DgpRQpXUEAARztf.jpg"
"MiddleEastEye","2018-06-26-16:35",9,5,1,"230 migrants remained stranded on a rescue boat in the Mediterranean Sea http://ow.ly/n0IS30kFTqf","","","","1011709449176862722","","","https://twitter.com/MiddleEastEye/status/1011709449176862722",""
"Watersun555","2018-06-26-16:28",0,0,0,"Government to ‘offer refuge’ to migrants stranded on boat in Mediterranean via @ IrishTimes https://www.irishtimes.com/news/ireland/irish-news/government-to-offer-refuge-to-migrants-stranded-on-boat-in-mediterranean-1.3544881 …","","@ IrishTimes","","1011707793219387392","","","https://twitter.com/Watersun555/status/1011707793219387392",""
"dwnews","2018-06-26-16:04",6,6,4,"The MV Lifeline, the latest migrant boat stranded in the Mediterranean, has reportedly been refused entry into Malta. Will Europe be able to resolve its refugee crisis? http://p.dw.com/p/30JaE pic.twitter.com/LQUssjVAv7","","","","1011701634559340545","","","https://twitter.com/dwnews/status/1011701634559340545",""
"RealNewsLine","2018-06-26-09:41",5,5,2,"Yet another migrant boat stranded in the Mediterranean has reportedly been granted entry into Malta. Will # Europe be able to resolve its # refugeecrisis? pic.twitter.com/mxSEeNSbgO via @ dwnews","","@ dwnews","# Europe # refugeecrisis","1011605349739237377","","","https://twitter.com/RealNewsLine/status/1011605349739237377",""
"dwnews","2018-06-26-09:32",17,7,8,"Yet another migrant boat stranded in the Mediterranean has reportedly been granted entry into Malta. Will Europe be able to resolve its refugee crisis? pic.twitter.com/Zna3lWb1mr","","","","1011602984176742401","","","https://twitter.com/dwnews/status/1011602984176742401",""
"Scumezza","2018-06-26-08:50",0,0,0,"European standoff leaves hundreds of people at sea. Almost 350 refugees and # migrants remained stranded on two boats in the # Mediterranean over the weekend as a standoff between nearby European countries deepened. http://ow.ly/lL0n30kEfBe","","","# migrants # Mediterranean","1011592462677233669","","","https://twitter.com/Scumezza/status/1011592462677233669",""
"shaistaAziz","2018-06-26-06:00",2,1,0,"Almost 350 migrants are stranded on two boats in the Mediterranean Sea after Italy and Malta said they will not take them in. https://www.cnn.com/videos/world/2018/06/25/migrants-stranded-in-mediterranean-bell-pkg.cnn … # migrants # refugees","","","# migrants # refugees","1011549715467526144","","","https://twitter.com/shaistaAziz/status/1011549715467526144",""
"leloveluck","2018-06-26-03:25",34,16,3,"Almost 350 migrants are stranded on two boats in the Mediterranean after Italy and Malta said they will not take them in. https://edition.cnn.com/videos/world/2018/06/25/migrants-stranded-in-mediterranean-bell-pkg.cnn …","","","","1011510836383412224","","","https://twitter.com/leloveluck/status/1011510836383412224",""
"RNBreakfast","2018-06-25-21:30",2,0,1,"Hundreds of migrants are stranded on two boats in the Mediterranean as a standoff between European countries deepens with both boats barred from docking at nearby Italy and Malta. http://www.abc.net.au/radionational/programs/breakfast/italy-and-malta-block-more-rescue-ship-carrying-migrants/9909500 …","","","","1011421286503940097","","","https://twitter.com/RNBreakfast/status/1011421286503940097",""
